prefecture,city,number,address,name,lat,long,note
愛知県,新城市,1_1,字井道42-1,東新町公民館南側畑,34.8988961,137.5111659,
愛知県,新城市,1_2,字二本松45-3,菅沼建具店東側駐車場,34.9014779,137.5098298,
愛知県,新城市,1_3,字東沖野20-12,新城市社会福祉協議会駐車場北側,34.9025046,137.5085428,緯度経度は怪しい
愛知県,新城市,1_4,字中野17,（一社）新城建設業協会事務所フェンス（北側）,34.9006827,137.5062375,
愛知県,新城市,1_5,字石名号20-1,新城設楽総合庁舎ネットフェンス（西側）,34.9017405,137.5044055,
愛知県,新城市,1_6,字桜渕中野合併地,新城有教館高校体育館北側ネットフェンス,34.896237,137.5060649,
愛知県,新城市,1_7,字札木40-4,小西測量事務所西側ライオンズクラブ啓発塔横,34.8994869,137.5005718,
愛知県,新城市,2_1,字東入船124-1,市役所本庁舎前交差点北東,34.8995745,137.497849,
愛知県,新城市,2_2,字八幡11-2,名古屋法務局新城支局ネットフェンス(南側),34.8977226,137.4932086,
愛知県,新城市,2_3,字裏野1-1,新城税務署駐輪場前ネットフェンス(西側),34.9025218,137.4975854,
愛知県,新城市,2_4,城北2丁目7-1,城北東部公園ネットフェンス（西側）,34.9063375,137.4973033,
愛知県,新城市,2_5,字町並52,愛知銀行新城支店駐車場ネットフェンス,34.899257,137.4952263,
愛知県,新城市,2_6,字宮ノ西29-2,JR新城駅舎南東側コンクリート柵,34.9010921,137.4932787,
愛知県,新城市,2_7,字宮ノ後68-3,ピアゴ新城店ネットフェンス（東側）,34.9034856,137.4950996,
愛知県,新城市,3_1,片山390-1,masked,34.9203347,137.4870496,
愛知県,新城市,3_2,徳定383,masked,34.9127147,137.4882954,
愛知県,新城市,3_3,豊栄813-1,山公民館敷地,34.9061957,137.4772571,
愛知県,新城市,3_4,豊栄1232,臼子公民館前敷地,34.9098543,137.4660296,
愛知県,新城市,3_5,杉山字荒井19-1,萬福寺駐車場（南側道沿い）,34.9032612,137.4856234,
愛知県,新城市,3_6,杉山字大東56-3,masked,34.900199,137.4886738,
愛知県,新城市,3_7,杉山字前野4-1,千郷小学校ネットフェンス（東側：正門南バス停付近）,34.89661410000001,137.483319,
愛知県,新城市,3_8,石田字池田309-2,石田公民館敷地(南側),34.8939098,137.4901161,緯度経度は怪しい
愛知県,新城市,3_9,豊栄411-1,masked,34.9159659,137.4637499,緯度経度は怪しい
愛知県,新城市,4_1,豊栄226,旧諏訪公民館横駐車場,34.8953181,137.4738849,緯度経度は怪しい
愛知県,新城市,4_2,豊栄253-3,諏訪神社下駐車場土手,34.9159659,137.4637499,緯度経度は怪しい
愛知県,新城市,4_3,稲木33,稲木公民館ネットフェンス（西側）,34.9014776,137.4563943,緯度経度は怪しい
愛知県,新城市,4_4,野田字西町屋敷128-3,野田忠魂碑前公園ネットフェンス（東側）,34.8920071,137.4765108,
愛知県,新城市,4_5,野田字東浄悦1-1,JR野田城駅舎西側コンクリート柵,34.889672,137.4778535,
愛知県,新城市,4_6,野田字上市場26-2,市営上市場東住宅ネットフェンス（南側）,34.8885252,137.4721236,
愛知県,新城市,4_7,野田字西町屋敷98,masked,34.8909745,137.4762886,緯度経度は怪しい
愛知県,新城市,4_8,野田字西郷31-1,津島神社境内地信号側,34.8834986,137.4790775,
愛知県,新城市,5_1,豊島字北88-1,鈴木氏敷地,34.8782222,137.4668151,
愛知県,新城市,5_2,豊島字馬渡11-2,千郷西こども園ネットフェンス（北側）,34.8808271,137.4667002,
愛知県,新城市,5_3,川田字下側100,川田公民館ネットフェンス,34.8771738,137.4578413,
愛知県,新城市,5_4,川田字山田平22-3,川田山田平交差点（南西側）,34.882983,137.459459,
愛知県,新城市,5_5,川田字本宮道109-1,㈱新城家具販売ネットフェンス(西側),34.8866298,137.4540465,
愛知県,新城市,5_6,市場台3丁目4-21,市場台北公園西側空地北側,34.8867913,137.4689247,
愛知県,新城市,5_7,野田字専徳48,masked,34.885977,137.473316,緯度経度は怪しい
愛知県,新城市,5_8,野田字上市場26-2,西部福祉会館北側ネットフェンス,34.8885252,137.4721236,
愛知県,新城市,6_1,平井字中田6-1,JA愛知東やすらぎホールしんしろネットフェンス（西側）,34.9062979,137.5019028,
愛知県,新城市,6_2,上平井１,上平井公民館前敷地,34.9115278,137.5013057,
愛知県,新城市,6_3,平井字東原30,市営東原住宅ネットフェンス（西側）,34.9073838,137.5078607,
愛知県,新城市,6_4,平井字新栄43,平井公民館フェンス(南東側),34.9082361,137.5042923,
愛知県,新城市,6_5,矢部字広見100,旧新城東高校正門西側ネットフェンス（R１５１沿）,34.9138746,137.5080036,
愛知県,新城市,6_6,富沢字安楽寺251-1,富沢公民館広場(北側),34.9070282,137.5140412,
愛知県,新城市,6_7,矢部字上ノ川15-2,矢部公民館ネットフェンス（東側）,34.9170005,137.5075987,
愛知県,新城市,6_8,富永字安京25,川上公会堂西側,34.9212984,137.5149616,
愛知県,新城市,7_1,竹広字宮川162-2,東郷中学校正門南側土手,34.9168335,137.5263146,緯度経度は怪しい
愛知県,新城市,7_2,大宮字大ノ木6-10,大宮構造改善センター敷地,34.9232011,137.5197173,
愛知県,新城市,7_3,牛倉字北下67,masked,34.9243548,137.5168024,
愛知県,新城市,7_4,須長字石岸32-1,須長公民館ネットフェンス（西側）,34.9289021,137.5262821,緯度経度は怪しい
愛知県,新城市,7_5,八束穂字甲田912-1,八束穂公民館敷地（東側植栽前）,34.9216582,137.5349078,
愛知県,新城市,7_6,八束穂字天王1041-2,東郷中こども園ネットフェンス（南東側）,34.9216582,137.5349078,
愛知県,新城市,7_7,竹広492-2,竹広交差点南西角,34.9168335,137.5263146,緯度経度は怪しい
愛知県,新城市,7_8,川路字連吾25,川路公民館ネットフェンス,34.9117679,137.5237776,
愛知県,新城市,7_9,八束穂175-1,masked,34.9216582,137.5349078,
愛知県,新城市,8_1,浅谷字又谷8番地1,浅谷区民広場（浅谷公民館東隣）,34.9378181,137.534294,緯度経度は怪しい
愛知県,新城市,8_2,横川字宮ノ前432,滝川氏所有山林市道沿い,34.9373467,137.5536335,緯度経度は怪しい
愛知県,新城市,8_3,横川字入り124-2,横川公民館ネットフェンス（西側）,34.9506408,137.5496422,緯度経度は怪しい
愛知県,新城市,8_4,出沢字的場田45-2,消防詰所横駐車場,34.9413282,137.5352147,
愛知県,新城市,8_5,大海字黒瀬1-1,大海交差点ネットフェンス,34.9310039,137.5527124,緯度経度は怪しい
愛知県,新城市,8_6,大海字黒瀬23-7,東郷東こども園ネットフェンス（西側）,34.93198880000001,137.5537106,
愛知県,新城市,8_7,有海字作神54,向和リース㈱新城営業所ネットフェンス,34.924882,137.5515792,
愛知県,新城市,8_8,有海字稲場5-4,有海ふれあい広場ネットフェンス（西側）,34.9197869,137.5536335,
愛知県,新城市,8_9,緑が丘4丁目104,緑が丘第４公園ネットフェンス（北側）,34.9281378,137.5493352,
愛知県,新城市,9_1,市川字西ノ久保34-1,市川公民館南東側駐車場用地,34.9079558,137.5603887,
愛知県,新城市,9_2,市川字宮ノ前27,旧市川小学校跡地ネットフェンス（北側）,34.906783,137.561617,
愛知県,新城市,9_3,日吉字中貝津29-1,舟渡公会堂前（県道沿）,34.9042213,137.5266215,
愛知県,新城市,9_4,日吉字原57-9,塩沢構造改善センター前(県道沿い）,34.90289730000001,137.5326284,
愛知県,新城市,9_5,日吉字小袋13,舟着小学校ネットフェンス(郵便局前),34.9026533,137.5235668,
愛知県,新城市,9_6,日吉字下畑81,鳥原児童館前角ネットフェンス（交差点付近）,34.8991773,137.5220156,
愛知県,新城市,9_7,日吉字青木林54-1,農業集落排水吉川処理場フェンス（東側）,34.8909706,137.5402203,
愛知県,新城市,9_8,吉川字津舞羅47-1,朝日屋道路向かい側空地（三角地県道沿い）,34.883412,137.5527124,
愛知県,新城市,9_9,吉川字広正27-1,吉川上組公会堂フェンス,34.8822404,137.5556626,
愛知県,新城市,10_1,小畑字宮ノ前5-1,果樹農協出荷所前,34.8649907,137.5416485,
愛知県,新城市,10_2,中宇利字坂44-11,中宇利集落センター南西側土手,34.8600018,137.5345834,緯度経度は怪しい
愛知県,新城市,10_3,中宇利字曽根川北7-2,masked,34.8547864,137.5274534,
愛知県,新城市,10_4,富岡字凡38-1,中村バス停横畑（県道南側）,34.8583752,137.5207912,
愛知県,新城市,10_5,富岡字不動平19-4,不動平集会所前,34.8538485,137.5161888,
愛知県,新城市,10_6,富岡字大廻り8-2,富岡ふるさと会館（富岡公民館）ネットフェンス（県道沿）,34.8512984,137.5029975,緯度経度は怪しい
愛知県,新城市,10_7,富岡字屋敷64-2,masked,34.8540925,137.5081069,
愛知県,新城市,10_8,富岡字フケ9-1,元富岡西部公民館東側敷地,34.8453253,137.4924353,
愛知県,新城市,10_9,富岡字半ノ木15-1,八名小学校ブロック塀（R３０１沿）,34.8618422,137.5056846,
愛知県,新城市,11_1,一鍬田字清水野11-65,東清水野公園ネットフェンス,34.8676239,137.5012035,緯度経度は怪しい
愛知県,新城市,11_2,黒田字萩平野108-1,JA愛知東農協緑茶加工用施設北側畑,34.8673869,137.5048379,緯度経度は怪しい
愛知県,新城市,11_3,黒田字頼実2-5,黒田区民広場ネットフェンス（南側）,34.8715262,137.5171093,
愛知県,新城市,11_4,黒田字草場48-14,新城南部工業用地,34.8752397,137.507292,緯度経度は怪しい
愛知県,新城市,11_5,一鍬田字北畑21,masked,34.8798296,137.4845774,
愛知県,新城市,11_6,一鍬田字仮塚1-18,masked,34.8738106,137.4885253,
愛知県,新城市,11_7,一鍬田字九五41-2,一鍬田公民館ネットフェンス,34.8746075,137.4837431,
愛知県,新城市,11_8,八名井字中上屋敷2-2,八名井多目的集会施設ネットフェンス（北側）,34.8675195,137.4636159,
愛知県,新城市,11_9,八名井字下タ屋敷15-1,八名井下組倉庫横空地,34.8677688,137.4616045,
愛知県,新城市,12_1,庭野字切場18,大脇集会所敷地,34.8829139,137.5064273,
愛知県,新城市,12_2,庭野字原川27-1,masked,34.8916252,137.500896,
愛知県,新城市,12_3,庭野字川大田33,庭野小学校ネットフェンス（正門右側）,34.8896705,137.4974503,
愛知県,新城市,12_4,庭野字八名井田19-1,桜淵いこいの広場（県道沿）,34.8939043,137.5050081,
愛知県,新城市,12_5,庭野字萩野30-1,masked,34.891602,137.495943,
愛知県,新城市,12_6,庭野字香ヶ崎40,庭野神社ブロック塀（バス待合所横）,34.8890708,137.4976299,
愛知県,新城市,12_7,庭野字上ノ平57-1,三河建設工業(株)入口右側雑地,34.8842461,137.4897771,
愛知県,新城市,13_1,長篠字内貝津14,西公会堂前道路向かい側の畑,34.9270334,137.557318,緯度経度は怪しい
愛知県,新城市,13_2,長篠字久保畑7-2,masked,34.9293441,137.5669912,緯度経度は怪しい
愛知県,新城市,13_3,長篠字向林3-6,ローソン長篠店東空地（市有地職員駐車場）,34.9333598,137.5720587,緯度経度は怪しい
愛知県,新城市,13_4,長篠字下り筬63-1,味工房津つ井亭駐車場,34.933377,137.5751755,緯度経度は怪しい
愛知県,新城市,13_5,長篠字日焼9-2,児童館たんぽぽ道路側フェンス,34.9376704,137.5761961,緯度経度は怪しい
愛知県,新城市,13_6,富保字広畑6-1,吉村老人憩の家前の畑,34.9426198,137.5659163,緯度経度は怪しい
愛知県,新城市,13_7,乗本字長筋79-4,元法務局鳳来出張所前,34.9305914,137.574376,緯度経度は怪しい
愛知県,新城市,13_8,乗本字新井貝津69-1,消防詰所横の空地,34.9228713,137.5634595,緯度経度は怪しい
愛知県,新城市,13_9,乗本字板屋草蓮10-4,masked,34.9212969,137.581581,緯度経度は怪しい
愛知県,新城市,14_1,豊岡字中杉上30-1,湯谷駐車場（湯谷大橋付近、県道439号標識東側）,34.9669202,137.6120023,緯度経度は怪しい
愛知県,新城市,14_2,豊岡字滝上12-1,湯谷温泉駅前,34.9713887,137.6138097,緯度経度は怪しい
愛知県,新城市,14_3,豊岡字田ノ嶋31-1,ゆ～ゆ～ありいな第2駐車場ネットフェンス,34.9798771,137.6098507,緯度経度は怪しい
愛知県,新城市,14_4,能登瀬字大道西92,能登瀬公民館前,34.9779759,137.6157593,緯度経度は怪しい
愛知県,新城市,14_5,能登瀬壱輪8-1,東部高齢者生きがいセンター前（ゆ～ゆ～ありいな駐車場フェンス）,34.976197,137.6162741,緯度経度は怪しい
愛知県,新城市,14_6,能登瀬字上ノ段55-19,美谷野原駐車場（入口向かって右側国道沿い）,34.9861663,137.616033,緯度経度は怪しい
愛知県,新城市,14_7,豊岡字ドウデイ2-441,JR三河槙原駅東広場東屋横,34.9892903,137.6208944,緯度経度は怪しい
愛知県,新城市,14_8,名越字広貝津1,名越公民館前,34.98718400000001,137.6249137,緯度経度は怪しい
愛知県,新城市,15_1,富栄字上貝津33,寺林公民館前ガードレール,34.9455779,137.5981915,緯度経度は怪しい
愛知県,新城市,15_2,富栄字上ノ田5-1,masked,34.938389,137.5885702,緯度経度は怪しい
愛知県,新城市,15_3,下吉田字小河内96-1,阿寺公民館道路向かい側の畑,34.9344979,137.6375206,緯度経度は怪しい
愛知県,新城市,15_4,大野字久羅下42-1,中央集会所前(バス停留所）,34.9493301,137.6040112,緯度経度は怪しい
愛知県,新城市,15_5,大野字上野52-5,ＮＴＴ中継所フェンス,34.9510822,137.6058358,緯度経度は怪しい
愛知県,新城市,15_6,大野字柿田13-1,菅原神社麓敷地,34.9545672,137.6129245,緯度経度は怪しい
愛知県,新城市,15_7,井代字大貝津51-4,井代公民館国道側横空地,34.9627943,137.6125766,緯度経度は怪しい
愛知県,新城市,15_8,睦平字田口28-1,睦平老人憩の家前,34.9482734,137.6148304,緯度経度は怪しい
愛知県,新城市,15_9,細川字大沢31,細川会館敷地,34.95618109999999,137.6281804,緯度経度は怪しい
愛知県,新城市,16_1,巣山字ハマイバ53-14,巣山老人憩の家敷地生垣,34.9536725,137.6492079,緯度経度は怪しい
愛知県,新城市,16_2,巣山字西山61-13,巣山農業集落排水施設フェンス,34.9617509,137.6535143,緯度経度は怪しい
愛知県,新城市,16_3,七郷一色字西六田沢58-13,桐山橋市道入口,34.9588384,137.6732055,緯度経度は怪しい
愛知県,新城市,16_4,七郷一色字西貝津38-4,七郷一色コミュニティプラザの道路向かい側,34.9654186,137.6713592,緯度経度は怪しい
愛知県,新城市,17_1,玖老勢字小屋上66,吉村住設第２倉庫前廃物置場,34.9699281,137.5530194,緯度経度は怪しい
愛知県,新城市,17_2,玖老勢字追分下4-2,JA愛知東農協鳳来寺支店駐車場門谷側空地,34.9822302,137.5586715,緯度経度は怪しい
愛知県,新城市,17_3,玖老勢字野林13,玖老勢コミュニティプラザ向かって左側フェンス,34.9872477,137.5603887,
愛知県,新城市,17_4,玖老勢字前9-1,masked,34.9891728,137.5599281,緯度経度は怪しい
愛知県,新城市,17_5,門谷字万寿3-20,新城市消防署鳳来出張所左側フェンス,34.9623805,137.5724698,緯度経度は怪しい
愛知県,新城市,17_6,門谷字宮ノ前14-3,masked,34.9010864,137.4949043,緯度経度は怪しい
愛知県,新城市,17_7,門谷字笠川16-12,笠川駐車場トイレ横休憩所南東,34.9663248,137.5729802,緯度経度は怪しい
愛知県,新城市,18_1,副川字萩平3－1,masked,35.0097028,137.557318,緯度経度は怪しい
愛知県,新城市,18_2,副川字千部平35番地2,NTT鉄塔前,35.0175881,137.5585463,緯度経度は怪しい
愛知県,新城市,18_3,海老字野辺38-11,旧海老保育園敷地内（木柵内側）,35.0239679,137.5571857,緯度経度は怪しい
愛知県,新城市,18_4,海老字千原田5-1,海老構造改善センター横フェンス,35.0203342,137.555607,緯度経度は怪しい
愛知県,新城市,18_5,連合字栗ノ木7-11,市道須山線入口右側残地,35.0344143,137.5404327,緯度経度は怪しい
愛知県,新城市,18_6,海老字紙屋22-1-1,川売公会堂向かい畑法面,35.0235834,137.5751725,緯度経度は怪しい
愛知県,新城市,19_1,連合字真菰25-1,丸地商店敷地内フェンス,35.04305009999999,137.5605777,緯度経度は怪しい
愛知県,新城市,19_2,四谷字前田3-2,旧連合小学校裏口入口フェンス,35.0517637,137.5742088,緯度経度は怪しい
愛知県,新城市,19_3,四谷字久保貝津564-5,大代旧バス転換所,34.9049637,137.4998535,緯度経度は怪しい
愛知県,新城市,19_4,連合字仲曽根14-1,方瀬登り口土手,35.0436553,137.557318,緯度経度は怪しい
愛知県,新城市,20_1,只持字小松ノ12-3,masked,34.9857859,137.5349069,緯度経度は怪しい
愛知県,新城市,20_2,布里字小松ヶ根35-1,masked,34.9877352,137.5198289,緯度経度は怪しい
愛知県,新城市,20_3,只持字中貝津11-1,旧JA愛知東農協布里出張所駐車場敷地フェンス,34.992891,137.5184863,緯度経度は怪しい
愛知県,新城市,20_4,只持字中貝津76-1,masked,34.9946957,137.5210981,緯度経度は怪しい
愛知県,新城市,20_5,愛郷字久保貝津20-13,源氏増圧ポンプ場北側水路フェンス,35.0099538,137.5194105,緯度経度は怪しい
愛知県,新城市,20_6,一色字棒川21-1,masked,34.9934515,137.5109732,緯度経度は怪しい
愛知県,新城市,20_7,塩瀬字中平18-5,塩瀬公民館道路向かい側休耕田,34.9813809,137.4987033,緯度経度は怪しい
愛知県,新城市,21_1,愛郷字山ノ神戸9-1,masked,35.0159265,137.4974765,緯度経度は怪しい
愛知県,新城市,21_2,愛郷字小貝津11-3,masked,35.027692,137.5011571,緯度経度は怪しい
愛知県,新城市,21_3,愛郷字中嶋15-8先,愛郷公民館入口三差路突き当たり,35.0302983,137.5131208,緯度経度は怪しい
愛知県,新城市,21_4,愛郷字川元8-1,大輪バス停横の空地,35.0358451,137.5260078,緯度経度は怪しい
愛知県,新城市,22_1,下吉田字明双73-7,高野明双側下り口の市道脇,34.9153589,137.6073919,緯度経度は怪しい
愛知県,新城市,22_2,下吉田字紺屋平144,masked,34.9071194,137.6080066,緯度経度は怪しい
愛知県,新城市,22_3,下吉田字北新戸131-1,masked,34.9011275,137.6178428,緯度経度は怪しい
愛知県,新城市,22_4,下吉田字南山王42-3,「山王」下道路端,34.896135,137.623184,緯度経度は怪しい
愛知県,新城市,22_5,上吉田字山本1-1,上吉田消防詰所左横,34.9016731,137.6011144,緯度経度は怪しい
愛知県,新城市,22_6,下吉田字五反田148-1,五反田地内信号南東側空地,34.9037985,137.6055478,緯度経度は怪しい
愛知県,新城市,22_7,竹ノ輪字浜井場650-3,東竹ノ輪集会所敷地(水道管注意）,34.8936302,137.5871108,緯度経度は怪しい
愛知県,新城市,22_8,竹ノ輪字橋本337-1,竹ノ輪公民館前,34.8896968,137.5827205,
愛知県,新城市,23_1,黄柳野字登ノ元1038-1,多利野橋南西側空地（旧道寄り）,34.8799443,137.5895687,緯度経度は怪しい
愛知県,新城市,23_2,黄柳野字向ヒ田773-3,多利野ポンプ場道路側フェンス,34.87735560000001,137.5893575,緯度経度は怪しい
愛知県,新城市,23_3,黄柳野字池田684-15,旧黄柳野小学校前駐車場（避難所看板横）,34.8746859,137.579271,緯度経度は怪しい
愛知県,新城市,23_4,黄柳野字丸渕322-2,masked,34.8674282,137.5735945,緯度経度は怪しい
愛知県,新城市,24_1,名号字丹野204,消防団詰所横空地東側畑,34.9977816,137.6608977,緯度経度は怪しい
愛知県,新城市,24_2,名号字ハマイバ63-1,石雲寺前駐車場フェンス,34.9934872,137.6535143,緯度経度は怪しい
愛知県,新城市,24_3,川合字小西14-7,masked,35.0002745,137.6632374,緯度経度は怪しい
愛知県,新城市,24_4,川合字コシ75-1,鳳来東小学校南側フェンス,35.0029997,137.665115,緯度経度は怪しい
愛知県,新城市,24_5,川合字中貝津72-3先,masked,35.003664,137.6673589,緯度経度は怪しい
愛知県,新城市,24_6,川合字上貝津3-2,浅井平防火水槽横の空地,35.0097055,137.6688975,緯度経度は怪しい
愛知県,新城市,24_7,池場字上貝津3-1,消防倉庫右側畑,35.0226196,137.6944434,緯度経度は怪しい
愛知県,新城市,25_1,作手守義字小滝25-5,masked,35.0531326,137.4980157,緯度経度は怪しい
愛知県,新城市,25_2,作手守義字前田107,小田防火水槽横,35.05675799999999,137.4805339,緯度経度は怪しい
愛知県,新城市,25_3,作手守義字郷下2-1,旧市営バス車庫横,35.0510128,137.4824502,緯度経度は怪しい
愛知県,新城市,25_4,作手菅沼字落合17-1,河合氏畑,35.0483087,137.4545556,緯度経度は怪しい
愛知県,新城市,25_5,作手菅沼字経蔵130,愛知東農協北部支所横,35.0349399,137.4622174,緯度経度は怪しい
愛知県,新城市,25_6,作手木和田字ハマイバ15-2,上木和田市道辻,35.0249262,137.4768547,緯度経度は怪しい
愛知県,新城市,25_7,作手善夫字カイツダ35,善夫バス停横農業用貯水槽前,35.0260735,137.4514912,緯度経度は怪しい
愛知県,新城市,26_1,作手黒瀬字井戸上3-1,masked,35.0104394,137.4378566,緯度経度は怪しい
愛知県,新城市,26_2,作手中河内字日面53-1,中河内老人憩の家横,34.9967759,137.400648,緯度経度は怪しい
愛知県,新城市,26_3,作手田原字朴橋15-54,旧作手小学校北校舎入口横,34.9903231,137.4275948,緯度経度は怪しい
愛知県,新城市,26_4,作手岩波字上貝津8-5,吉祥院前,34.986723,137.4533298,緯度経度は怪しい
愛知県,新城市,26_5,作手高里字縄手下24-4,新城市商工会作手支所建物横（R301沿）,34.9757696,137.4252675,緯度経度は怪しい
愛知県,新城市,26_6,作手鴨ヶ谷字前仏方17-2,原田商店前辻,34.9715568,137.4358654,緯度経度は怪しい
愛知県,新城市,26_7,作手清岳字ムカイ田15-5,丸利建設（株）倉庫前,34.96093949999999,137.4195017,緯度経度は怪しい
愛知県,新城市,26_8,作手白鳥字八名川8-4,masked,34.961067,137.4291646,緯度経度は怪しい
愛知県,新城市,26_9,作手白鳥字宮前22-2,masked,34.9550342,137.4195,緯度経度は怪しい
愛知県,新城市,27_1,作手保永字桑原14-1,戸津呂法輪寺入口左側,34.9280402,137.4392352,緯度経度は怪しい
愛知県,新城市,27_2,作手保永字水上48,和田児童遊園前,34.9260034,137.4410734,緯度経度は怪しい
愛知県,新城市,27_3,作手保永字東当8－5,見代公民館横の畑,34.9373957,137.4478141,緯度経度は怪しい
愛知県,新城市,27_4,作手高松字柿平8-1,作手農村環境改善センター入口,34.950824,137.4527169,緯度経度は怪しい
愛知県,新城市,27_5,作手高松字小林平1-1,masked,34.9565965,137.4628304,緯度経度は怪しい
愛知県,新城市,27_6,作手高松字東畑38-3,新島川橋横,34.963273,137.4665086,緯度経度は怪しい
愛知県,新城市,27_7,作手大和田字溝下33-1,大和田集会所前,34.9786554,137.47674,緯度経度は怪しい
愛知県,新城市,27_8,作手田代字田代貝津　赤道,田代消防詰所横,34.946601,137.4704935,緯度経度は怪しい
