prefecture,city,number,address,name,lat,long,note
愛媛県,今治市,1-1,北宝来町1-1-11地先,今治駅前バス停留所,34.06458,132.99402,
愛媛県,今治市,1-2,別宮町1-4-1,市役所第2別館前植込,34.06634,132.99683,
愛媛県,今治市,1-3,別宮町1-4-1,公会堂東側植込,34.06706,132.99793,
愛媛県,今治市,1-4,別宮町2-3-2,森見公園大正町側,34.06927,132.99752,
愛媛県,今治市,1-5,共栄町4-6-3先,旧ユーアイマート共栄店前ガードパイプ,34.07076,132.99682,
愛媛県,今治市,2-1,別宮町6-2-1,今治中央体育館前,34.07196,132.99264,
愛媛県,今治市,2-2,別宮町5-1-7,別宮小学校南門横,34.07024,132.9919,
愛媛県,今治市,2-3,別宮町9-6-50,コンドー装飾横ガードパイプ,34.07172,132.99011,
愛媛県,今治市,2-4,高地町1-甲1740-1,元苅山縫製前ガードパイプ,34.0726,132.98499,
愛媛県,今治市,2-5,別宮町9-7-28地先,八幡地橋北角ガードレール,34.06904,132.99067,
愛媛県,今治市,3-1,室屋町6-3-21,北乳児保育所横,34.07515,132.99468,
愛媛県,今治市,3-2,共栄町5-2-1先,四国ガス工場前ガードパイプ,34.07188,132.99711,
愛媛県,今治市,3-3,美保町2-1-22,美保公園入口フェンス,34.07412,132.99909,
愛媛県,今治市,3-4,本町5-2-24,慶応公園西角,34.07387,132.99706,
愛媛県,今治市,3-5,本町6-4-30先,masked,34.07663,132.99626,
愛媛県,今治市,4-1,片原町3丁目2番地先,みなと交流センター駐車場1付近植込,34.07109,133.00351,
愛媛県,今治市,4-2,通町1-1-4,辰之口公園入口フェンス,34.06727,133.00372,
愛媛県,今治市,4-3,黄金町1-9-1,旧美須賀小学校裏門横,34.06612,133.00339,
愛媛県,今治市,4-4,黄金町1-9-1,旧美須賀小学校裏門横ブロック塀,34.0654,133.00348,
愛媛県,今治市,4-5,黄金町3-3-3,吹揚小学校正門横,34.06253,133.00554,
愛媛県,今治市,4-6,通町3-1-1地先,吹揚駐車場横,34.06392,133.00875,
愛媛県,今治市,5-1,旭町5-1-2地先,東洋繊維協同組合横,34.05724,133.00615,
愛媛県,今治市,5-2,旭町5-2-2地先,ハリソン電気横ガードパイプ,34.05782,133.00513,
愛媛県,今治市,5-3,蔵敷町2-12-2,蔵敷公園入口,34.05702,133.00171,
愛媛県,今治市,5-4,南宝来町1-6-1,旧日吉小学校正門横,34.06141,132.99843,
愛媛県,今治市,5-5,南宝来町1-6-1,旧日吉小学校裏門横（向って右）,34.0623,132.99913,
愛媛県,今治市,6-1,中日吉町2-6-55,常盤小学校正門横（向って右）,34.05995,132.99015,
愛媛県,今治市,6-2,北日吉町1-10,北高線北桜橋南角ガードパイプ（向かって右）,34.06488,132.98928,
愛媛県,今治市,6-3,常盤町5-7-6地先,鷲之町公園（電話BOX横）,34.06153,132.99482,
愛媛県,今治市,6-4,中日吉町1-3-70,日吉中学校正門横（向って右）,34.06211,132.99272,
愛媛県,今治市,6-5,中日吉町1-3-70,日吉中学校裏門横（向って左）,34.06077,132.99228,
愛媛県,今治市,6-6,南日吉町2-1-5,市営南日吉団地フェンス,34.05841,132.99394,
愛媛県,今治市,7-1,常盤町7-2-1,南高等学校北角ガードパイプ,34.05644,132.98954,
愛媛県,今治市,7-2,鯉池町2-408,市営鯉池住宅入口,34.05224,132.988,
愛媛県,今治市,7-3,鯉池町3-2-16地先,masked,34.05108,132.99051,
愛媛県,今治市,7-4,南日吉町2-1-29地先,三木病院駐車場前ガードパイプ,34.05734,132.99485,
愛媛県,今治市,45-1,吉海町仁江15番地,元関西酒造㈱吉海工場西側,34.14849,133.04335,
愛媛県,今治市,45-2,吉海町八幡137番地,吉海支所正門前,34.14509,133.04337,
愛媛県,今治市,45-3,吉海町仁江2033番地,masked,34.13578,133.06321,
愛媛県,今治市,45-4,吉海町仁江2453番地地先,仁江バス停前三叉路,34.14873,133.05497,
愛媛県,今治市,45-5,吉海町本庄601番地,津倉消防ポンプ小屋横,34.15556,133.02986,
愛媛県,今治市,45-6,吉海町幸新田461番地地先,水門バス停前,34.14752,133.03471,
愛媛県,今治市,45-7,吉海町福田324番地地先,名切川、北谷川間,34.15669,133.04284,
愛媛県,今治市,45-8,吉海町津島219番地,津島公民館,34.15357,133.00629,
愛媛県,今治市,46-1,吉海町泊2118番地1先,相田南マンホールポンプ操作盤横,34.16615,133.03641,
愛媛県,今治市,46-2,吉海町泊498番地,泊小学校跡,34.1725,133.03192,
愛媛県,今治市,46-3,吉海町田浦908番地,masked,34.18184,133.0296,
愛媛県,今治市,46-4,吉海町田浦378番地,masked,34.18526,133.02913,
愛媛県,今治市,47-1,吉海町椋名185番地,恵比寿神社,34.13923,133.01908,
愛媛県,今治市,47-2,吉海町椋名619番地,masked,34.13683,133.01942,
愛媛県,今治市,48-1,吉海町名駒362番地,masked,34.11067,133.02815,
愛媛県,今治市,48-2,吉海町名5584番地,masked,34.11945,133.02114,
愛媛県,今治市,48-3,吉海町臥間2番地1,下田水駐輪場,34.12832,133.01988,
愛媛県,今治市,48-4,吉海町名1161番地,元ごはん処あかしや前,34.1351,133.04374,
愛媛県,今治市,48-5,吉海町名3029番地,亀山バス停横,34.13265,133.03816,
愛媛県,今治市,48-6,吉海町名2833番地,masked,34.12711,133.04003,
愛媛県,今治市,48-7,吉海町南浦374番地1,南浦バス停横,34.11408,133.03929,
愛媛県,今治市,49-1,宮窪町宮窪6107番地先,県道大島環状線江口バス停横緑地帯,34.17772,133.07591,
愛媛県,今治市,49-2,宮窪町宮窪1897番地3,県道大島環状線ガードパイプ,34.17097,133.08052,
愛媛県,今治市,49-3,宮窪町宮窪2886番地,宮窪中学校跡体育館裏ブロック塀,34.17298,133.07517,
愛媛県,今治市,49-4,宮窪町宮窪2909番地,宮窪認定こども園金網フェンス,34.1711,133.07529,
愛媛県,今治市,49-5,宮窪町宮窪4162番地先,市道宮窪中央線GR,34.16792,133.06895,
愛媛県,今治市,49-6,宮窪町宮窪4753番地1先,国道317号ガードパイプ,34.17176,133.07063,
愛媛県,今治市,49-7,宮窪町宮窪1121番地,市道宮窪戸代線ストーンガード,34.17034,133.09081,
愛媛県,今治市,49-8,宮窪町宮窪6700番地2,鵜島集会所前石垣,34.18333,133.08699,
愛媛県,今治市,50-1,宮窪町友浦3225番地2,市道久米線ストーンガード,34.15893,133.09788,
愛媛県,今治市,50-2,宮窪町友浦2575番地1,友浦農村環境改善センター跡入口,34.15909,133.08805,
愛媛県,今治市,50-3,宮窪町友浦1152番地5,友浦フェリー待合所前,34.15268,133.08218,
愛媛県,今治市,50-4,宮窪町友浦477番地1,県道大島環状線GR,34.14801,133.0799,
愛媛県,今治市,51-1,宮窪町余所国1372番地1,余所国農村環境改善センター入口,34.19173,133.05783,
愛媛県,今治市,51-2,宮窪町余所国585番地先,県道大島環状線GR,34.19082,133.06202,
愛媛県,今治市,51-3,宮窪町余所国647番地2,市道余所国山手線GR,34.18802,133.06218,
愛媛県,今治市,51-4,宮窪町早川502番地,県道大島環状線GR,34.19395,133.04091,
愛媛県,今治市,8-1,天保山町2-3-1,有津屋公園神殿石油跡地前フェンス,34.06651,133.00982,
愛媛県,今治市,8-2,天保山町2-3-1,せとうち整備有津屋公園フェンス,34.0648,133.01191,
愛媛県,今治市,8-3,東門町2-1-1地先,御厩公園,34.06126,133.0119,
愛媛県,今治市,8-4,東門町4-3-16,旧城東小学校正門横（向かって右）,34.06045,133.0134,
愛媛県,今治市,8-5,東鳥生町1-2-23,市営東鳥生住宅フェンス,34.05806,133.01684,
愛媛県,今治市,8-6,東鳥生町5-17,立花中継ポンプ場フェンス,34.05625,133.02127,
愛媛県,今治市,9-1,立花町2-8-7,立花中学校体育館横,34.05067,132.99805,
愛媛県,今治市,9-2,立花町2-8-7,立花中学校南角フェンス,34.04926,132.99739,
愛媛県,今治市,9-3,河南町3-2-2,河南公民館横フェンス,34.05008,132.99307,
愛媛県,今治市,9-4,郷本町3-5-2,三島神社,34.04601,132.99437,
愛媛県,今治市,9-5,八町西1-2-58地先,郷橋南土手公園,34.04899,132.98976,
愛媛県,今治市,10-1,立花町4-3-1,立花小学校正門横,34.0484,133.00168,
愛媛県,今治市,10-2,郷六ヶ内町2-4-49,河合石油前ガードパイプ,34.04374,132.99773,
愛媛県,今治市,10-3,辻堂4-73-5,辻堂バス停付近ガードパイプ,34.03906,133.00355,
愛媛県,今治市,10-4,立花町4-3-1,立花小学校体育館裏フェンス,34.04719,133.00136,
愛媛県,今治市,10-5,八町東4-3-34地先,八町畑地広場,34.03794,132.99958,
愛媛県,今治市,11-1,北鳥生町4-7-7地先,ふれあい農園ガードパイプ,34.05129,133.00487,
愛媛県,今治市,11-2,祇園町3-1-24地先,masked,34.05509,133.00283,
愛媛県,今治市,11-3,北鳥生町5-3-17,立花中学校第2運動場金網,34.04917,133.00338,
愛媛県,今治市,11-4,祇園町3-2-36,masked,34.05311,133.00268,
愛媛県,今治市,11-5,南鳥生町1-5-3,南鳥生団地前ガードパイプ,34.05437,133.01108,
愛媛県,今治市,11-6,北鳥生町1-2-33地先,城東橋南側公園,34.05746,133.01348,
愛媛県,今治市,12-1,衣干町4-6-31地先,コインランドリーデポ前ガードパイプ,34.04577,133.01243,
愛媛県,今治市,12-2,南高下町3-4-46,晴心幼稚園前ガードパイプ,34.04956,133.01074,
愛媛県,今治市,12-3,南高下町2-2-65,masked,34.05018,133.01553,
愛媛県,今治市,12-4,横田町1-1-4地先,長野研設横ガードパイプ,34.04817,133.00928,
愛媛県,今治市,12-5,南高下町3-3-71,鳥生小学校正門横,34.04921,133.01273,
愛媛県,今治市,12-6,南高下町3-3-71,鳥生小学校東門横ガードレール,34.04826,133.01411,
愛媛県,今治市,13-1,大新田町2-4-5,四国電力資材置場フェンス,34.07914,132.99422,
愛媛県,今治市,13-2,大新田町5-1-11地先,市営球場入口ガードパイプ,34.07844,132.99131,
愛媛県,今治市,13-3,大新田町3-7,北部共同調理場フェンス,34.0809,132.99361,
愛媛県,今治市,13-4,近見町2丁目102-2,矢野酒店横ガードパイプ,34.08767,132.98658,
愛媛県,今治市,13-5,大新田町1-3-27,中土堤バス停横ガードレール,34.08569,132.99259,
愛媛県,今治市,13-6,湊町2-3-56地先,ゲートボール場フェンス,34.09077,132.99178,
愛媛県,今治市,14-1,石井町1-3-1,出雲大社今治分院前ガードレール,34.07492,132.98867,
愛媛県,今治市,14-2,石井町2-7-54先,市営石井住宅入口ガードパイプ,34.08174,132.98896,
愛媛県,今治市,14-3,石井町3-3-5地先,河原川近見電気上ガードパイプ,34.08091,132.98552,
愛媛県,今治市,14-4,石井町5-417,石井公民館横ガードパイプ,34.07933,132.98476,
愛媛県,今治市,14-5,石井町4-5-5,県立今治病院入口ガードパイプ,34.08559,132.98833,
愛媛県,今治市,65-1,関前岡村甲1524番地第3,白潟物揚場,34.18619,132.8702,
愛媛県,今治市,65-2,関前岡村甲984番地,姫子島神社北側,34.18254,132.88212,
愛媛県,今治市,65-3,関前岡村甲697番地第1,岡村へき地集会室横フェンス,34.18483,132.88383,
愛媛県,今治市,65-4,関前岡村甲2番地第5,関前開発総合センター裏フェンス,34.18442,132.88613,
愛媛県,今治市,65-5,関前小大下乙1352番地第2,小大下地区住民センター前,34.19028,132.90014,
愛媛県,今治市,65-6,関前大下甲1856番地2,大下集会所前,34.18895,132.92305,
愛媛県,今治市,41-1,菊間町浜812番地付近,菊間コミュニティホール付近フェンス,34.03373,132.84123,
愛媛県,今治市,41-2,菊間町浜400番地2付近,浄水場向側ガードレール,34.03641,132.84322,
愛媛県,今治市,41-3,菊間町浜89番地付近,遍照院向い菊間港側ガードパイプ,34.03376,132.83787,
愛媛県,今治市,41-4,菊間町浜312番地付近,八幡橋横ガードレール,34.038,132.84223,
愛媛県,今治市,41-5,菊間町浜3067番地付近,かわら館前メインアプローチ,34.03298,132.84048,
愛媛県,今治市,41-6,菊間町田之尻359番地付近,masked,34.02005,132.81596,
愛媛県,今治市,42-1,菊間町長坂342番地付近,明田集会所前ガードレール,34.02827,132.8351,
愛媛県,今治市,42-2,菊間町長坂135番地1付近,みどり町田窪橋付近ガードレール,34.03045,132.84399,
愛媛県,今治市,42-3,菊間町長坂2002番地付近,菊間小学校横フェンス,34.0329,132.84678,
愛媛県,今治市,42-4,菊間町浜2392番地付近,masked,34.03523,132.84687,
愛媛県,今治市,42-5,菊間町浜1123番地付近,北浜地区児童遊園地前フェンス,34.0398,132.84335,
愛媛県,今治市,42-6,菊間町西山1461番地付近,masked,34.01273,132.83138,
愛媛県,今治市,43-1,菊間町高田27番地付近,旧歌仙地域住民学習センター前ガードレール,34.02937,132.85533,
愛媛県,今治市,43-2,菊間町池原34番地付近,今治市社協菊間支部前ガードレール,34.02578,132.85717,
愛媛県,今治市,43-3,菊間町池原275番地付近,池原橋付近ガードレール,34.03225,132.85364,
愛媛県,今治市,43-4,菊間町松尾688番地付近,masked,34.02452,132.86383,
愛媛県,今治市,43-5,菊間町河之内170番地付近,河之内集会所前ガードレール,34.01383,132.87993,
愛媛県,今治市,43-6,菊間町川上892番地付近,川上大門橋付近ガードレール,34.017,132.86126,
愛媛県,今治市,44-1,菊間町種4432番地1付近,葉山集会所入口フェンス,34.04652,132.86189,
愛媛県,今治市,44-2,菊間町種4070番地2付近,太陽石油㈱四国事業所南側ガードパイプ,34.04785,132.85911,
愛媛県,今治市,44-3,菊間町種386番地付近,種公民館跡公園前ガードレール,34.04484,132.87129,
愛媛県,今治市,44-4,菊間町種3701番地付近,泊山バス停前ガードパイプ,34.05288,132.86807,
愛媛県,今治市,44-5,菊間町種3859番地付近,円福寺橋下手ガードレール,34.05451,132.87143,
愛媛県,今治市,44-6,菊間町種52番地付近,亀岡小学校植え込み（垣根）,34.05486,132.87399,
愛媛県,今治市,44-7,菊間町佐方2097番地付近,越智工業所前ガードレール,34.05273,132.87799,
愛媛県,今治市,44-8,菊間町佐方111番地付近,市道高城線国道入口ガードレール,34.05741,132.88533,
愛媛県,今治市,31-1,玉川町法界寺甲30-7先,オリエント八勝亭向側,34.02849,132.96223,
愛媛県,今治市,31-2,玉川町大野甲56-5先,旧越智今治農協Aコープ跡地向側,34.02274,132.94388,
愛媛県,今治市,31-3,玉川町三反地甲21-5,玉川支所前バス停,34.01908,132.94111,
愛媛県,今治市,31-4,玉川町鍋地甲652-1先,桂・鍋地三叉路桂橋横,34.01858,132.93564,
愛媛県,今治市,31-5,玉川町長谷甲961-8先,大河石油スタンド上側,34.01181,132.93782,
愛媛県,今治市,31-6,玉川町長谷甲227-1先,玉川駐在所前三叉路,34.00211,132.93775,
愛媛県,今治市,31-7,玉川町中村甲552-3先,中村集会所前,34.02258,132.95565,
愛媛県,今治市,31-8,玉川町高野甲21先,玉川中学校前三叉路,34.01916,132.94409,
愛媛県,今治市,31-9,玉川町畑寺甲472-8,畑寺集会所向側,34.00244,132.94957,
愛媛県,今治市,32-1,玉川町小鴨部甲108先,小鴨部消防車庫の下側,34.02654,132.97031,
愛媛県,今治市,32-2,玉川町別所甲91-4先,masked,34.02857,132.9724,
愛媛県,今治市,32-3,玉川町別所乙1-1先,別所大山積神社下三叉路,34.02407,132.97336,
愛媛県,今治市,32-4,玉川町小鴨部甲209-5先,日の出保育所下側,34.02634,132.96552,
愛媛県,今治市,32-5,玉川町八幡甲303-2,森越建設倉庫の上側,34.03133,132.97477,
愛媛県,今治市,32-6,玉川町別所甲3-36先,masked,34.03172,132.96956,
愛媛県,今治市,33-1,玉川町鈍川甲190-3,玉川バス停上側三叉路,33.98897,132.93867,
愛媛県,今治市,33-2,玉川町鈍川甲268-9,鉱泉スタンドの下側,33.98268,132.93817,
愛媛県,今治市,33-3,玉川町鈍川乙85-3,masked,33.98555,132.94555,
愛媛県,今治市,33-4,玉川町鈍川丙184-1先,新大坪橋横の水道施設前,33.98606,132.95871,
愛媛県,今治市,33-5,玉川町鈍川丁518-5,オソゴエ線との三叉路,33.99044,132.96428,
愛媛県,今治市,33-6,玉川町鈍川戊95-3先,古屋之谷消防車庫下側,33.98045,132.96512,
愛媛県,今治市,33-7,玉川町鈍川戊382-3先,神子之森集会所向側,33.98028,132.96967,
愛媛県,今治市,34-1,玉川町龍岡下甲227先,masked,33.9936,132.91393,
愛媛県,今治市,34-2,玉川町葛谷甲777先,葛谷集会所向側,34.00761,132.9011,
愛媛県,今治市,34-3,玉川町龍岡下乙17-1先,今治市営玉川艇庫上側,33.99209,132.91433,
愛媛県,今治市,34-4,玉川町龍岡上甲353-3先,寺前バス停上側,33.97734,132.90402,
愛媛県,今治市,34-5,玉川町龍岡上甲675-1,力石バス停前,33.96925,132.90342,
愛媛県,今治市,22-1,松木349-1,南中学校正門横ガードパイプ,34.03136,133.00185,
愛媛県,今治市,22-2,松木264-4地先,松木団地前ガードパイプ,34.03395,133.00815,
愛媛県,今治市,22-3,松木110-1地先,松木集会所前ガードレール,34.02898,133.00229,
愛媛県,今治市,22-4,町谷甲301,町谷公園入口前ガードパイプ,34.02363,133.00099,
愛媛県,今治市,22-5,町谷甲346地先,平山バス停留所ガードレール,34.02325,133.00323,
愛媛県,今治市,23-1,中寺1081付近,メゾンドール中寺前ガードパイプ,34.04423,132.98446,
愛媛県,今治市,23-2,新谷甲1303-5,masked,34.03127,132.99078,
愛媛県,今治市,23-3,新谷甲1335-6地先,五十嵐団地入口フェンス,34.02941,132.98798,
愛媛県,今治市,23-4,五十嵐甲13-3,清水小学校正門横,34.03322,132.9847,
愛媛県,今治市,23-5,四村93-2,清水公民館前,34.03363,132.98649,
愛媛県,今治市,23-6,五十嵐甲148-6,第1五十嵐台団地集会所跡地横ガードレール,34.02617,132.98509,
愛媛県,今治市,24-1,片山4-14-2地先,郷橋上側水源地横ガードパイプ,34.04965,132.98854,
愛媛県,今治市,24-2,片山3-10-33,ハードオフ今治片山店横ガードパイプ,34.05066,132.9829,
愛媛県,今治市,24-3,小泉4-11-28,日高公民館前フェンス,34.04749,132.9794,
愛媛県,今治市,24-4,別名409-5,別名大坪広場フェンス,34.04343,132.97491,
愛媛県,今治市,24-5,高橋甲177-2,大須木児童公園フェンス,34.03355,132.9687,
愛媛県,今治市,24-6,高橋甲1001-5,masked,34.03687,132.96492,
愛媛県,今治市,24-7,高橋甲1239-7地先,天満宮横,34.04392,132.96916,
愛媛県,今治市,24-8,小泉4-5-1,フジ今治店横ガードパイプ,34.04783,132.98065,
愛媛県,今治市,25-1,馬越町1-4-1,馬越公園金網フェンス,34.0562,132.98278,
愛媛県,今治市,25-2,山路548,西中第2グラウンドフェンス,34.05884,132.97744,
愛媛県,今治市,25-3,片山1-6地先,masked,34.05548,132.97815,
愛媛県,今治市,25-4,山路464-2地先,masked,34.06124,132.97472,
愛媛県,今治市,25-5,矢田甲150-23地先,矢田団地神宮側入口ガードレール,34.05467,132.96422,
愛媛県,今治市,25-6,矢田甲360,矢田団地集会所,34.05698,132.96537,
愛媛県,今治市,26-1,阿方甲250-4地先,リバーサイド藤原前ガードレール,34.06356,132.96694,
愛媛県,今治市,26-2,masked,masked,34.07261,132.94605,
愛媛県,今治市,26-3,神宮甲700-1地先,神宮野間神社横ガードレール,34.05227,132.95716,
愛媛県,今治市,26-4,延喜甲237-5,乃万公民館前ガードレール,34.06506,132.95838,
愛媛県,今治市,26-5,野間甲858-3,野間健康広場前ガードレール,34.06043,132.94696,
愛媛県,今治市,26-6,延喜甲244-2,乃万小学校正門横フェンス,34.06483,132.95745,
愛媛県,今治市,26-7,masked,吉田橋手前ガードパイプ,34.06842,132.94495,
愛媛県,今治市,26-8,しまなみヒルズ12-1地先,しまなみヒルズ南側入口横断歩道付近緑地,34.06803,132.97348,
愛媛県,今治市,27-1,波止浜1-2-13地先,龍神社裏ガードレール,34.10618,132.96684,
愛媛県,今治市,27-2,高部甲150,旭方公民館横フェンス,34.10151,132.97377,
愛媛県,今治市,27-3,内堀2-184-1,フジ波止浜店前ガードパイプ,34.10307,132.96717,
愛媛県,今治市,27-4,地堀3-8,波止浜地堀公園,34.10657,132.96414,
愛媛県,今治市,27-5,波方町郷甲1307-4地先,小林団地前県道ガードパイプ,34.11084,132.9579,
愛媛県,今治市,27-6,波方町大浦甲1554-1地先,浅海木工所前県道ガードレール,34.11479,132.96573,
愛媛県,今治市,28-1,波止浜95-1,元真鍋造機独身寮横ガードレール,34.10041,132.9713,
愛媛県,今治市,28-2,高部甲713-1地先,打越池ガードレール,34.0958,132.96916,
愛媛県,今治市,28-3,高部甲349-1地先,masked,34.09679,132.97418,
愛媛県,今治市,28-4,高部甲1622-2地先,masked,34.09881,132.95888,
愛媛県,今治市,28-5,波止浜820,高部集会所入口横フェンス前,34.09832,132.96852,
愛媛県,今治市,28-6,波止浜171地先,masked,34.10036,132.96795,
愛媛県,今治市,15-1,大浜町3丁目24,小糸池ガードレール,34.10171,132.97986,
愛媛県,今治市,15-2,大浜町1-4-1地先,コスモ石油大浜SS横,34.09787,132.98431,
愛媛県,今治市,15-3,大浜町2-3-28地先,八幡前バス停付近,34.09954,132.98362,
愛媛県,今治市,15-4,砂場町1-4-8地先,砂場埋立地,34.10293,132.98046,
愛媛県,今治市,16-1,旦甲349地先,masked,34.01633,133.02581,
愛媛県,今治市,16-2,桜井1-8-26,桜井小学校正門横,34.01704,133.03476,
愛媛県,今治市,16-3,桜井3-6-8,桜井公民館集会所,34.01872,133.03603,
愛媛県,今治市,16-4,長沢甲971-2,渡部弘幸氏管理地,34.00415,133.03856,
愛媛県,今治市,16-5,長沢甲689,長沢公民館前ガードレール,33.99917,133.03847,
愛媛県,今治市,16-6,孫兵衛作甲237,孫兵衛作バス停付近ガードレール ,33.98862,133.05234,
愛媛県,今治市,17-1,国分2-5-26地先,ビレッジハウス（旧雇用促進住宅）入口ガードパイプ,34.03032,133.01991,
愛媛県,今治市,17-2,国分3-1-46地先,ひまわり幼稚園進入路横ガードパイプ,34.02853,133.01811,
愛媛県,今治市,17-3,桜井団地4-3-2,桜井団地バス停前フェンス,34.02427,133.01507,
愛媛県,今治市,17-4,国分6-2-2地先,masked,34.02531,133.02455,
愛媛県,今治市,17-5,登畑甲41,桜井保育所フェンス,34.02183,133.02182,
愛媛県,今治市,17-6,宮ｹ崎甲853地先,厳島神社公園ガードパイプ,34.01171,133.01259,
愛媛県,今治市,18-1,桜井1-甲83-1,古国分公園緑地金網,34.02654,133.03972,
愛媛県,今治市,18-2,桜井甲1074-5,沖浦テニスコート入口ガードレール,34.01041,133.04821,
愛媛県,今治市,18-3,桜井4-13-7,JA越智桜井支店横フェンス,34.02006,133.03808,
愛媛県,今治市,18-4,郷桜井4-5-74地先,明神橋横ガードレール,34.01634,133.04279,
愛媛県,今治市,18-5,桜井5-11-44,志々満集会所前ガードパイプ,34.02056,133.04259,
愛媛県,今治市,19-1,唐子台東3-23-6,唐子台東入口ガードパイプ,34.03346,133.0291,19-2と住所入替
愛媛県,今治市,19-2,古国分2-乙181-2,国分公民館横フェンス,34.0284,133.03035,19-1と住所入替
愛媛県,今治市,19-3,唐子台東2-8-3,唐子台中央公園,34.03022,133.02897,
愛媛県,今治市,19-4,唐子台西3-3,県営唐子台住宅５号棟下土手,34.03143,133.02551,
愛媛県,今治市,19-5,唐子台西1-3-1,masked,34.03455,133.02458,
愛媛県,今治市,20-1,喜田村7-1-6,済生会病院東側ガードパイプ,34.04335,133.02008,
愛媛県,今治市,20-2,拝志8-37,拝志美保神社前公園,34.03899,133.02705,
愛媛県,今治市,20-3,喜田村5-4-39,喜田村公園,34.04612,133.02391,
愛媛県,今治市,20-4,喜田村3-4-30,銅川橋北側木材団地入口ガードパイプ,34.04689,133.02169,
愛媛県,今治市,20-5,喜田村1-8-11,丸正タオル横寺ヶ内公園前ガードパイプ,34.04395,133.01756,
愛媛県,今治市,20-6,喜田村2-1-10先,サン・アビ前竜登川沿いガードレール,34.04875,133.01817,
愛媛県,今治市,21-1,上徳甲61-1地先,唐子大橋上側土手,34.03628,133.02302,
愛媛県,今治市,21-2,上徳甲394-4,富田小学校裏門横フェンス,34.03351,133.01387,
愛媛県,今治市,21-3,上徳乙290-1,富田レクレーション広場フェンス右側,34.03357,133.01239,
愛媛県,今治市,21-4,上徳甲238-2,近藤木工横ガードレール,34.03056,133.01576,
愛媛県,今治市,21-5,高市甲5942-2地先,正光会今治病院前ガードレール,34.0281,133.01433,
愛媛県,今治市,29-1,朝倉北甲397番地,朝倉支所前,33.99587,133.02161,
愛媛県,今治市,29-2,朝倉南甲170番地1前,上天皇橋上ガードレール,33.98836,133.0197,
愛媛県,今治市,29-3,朝倉北甲633番地49前,緑ヶ丘団地入口,34.00112,133.02704,
愛媛県,今治市,29-4,朝倉下甲529番地,朝倉福祉センター前,33.99925,133.01653,
愛媛県,今治市,29-5,朝倉下甲977番地7横,臼坂ふるさと交流館横,34.00177,133.00892,
愛媛県,今治市,29-6,山口甲240番地,根上がり松跡前ガードレール,34.00618,133.00698,
愛媛県,今治市,29-7,古谷甲1194番地前,牛神古墳公園前,34.01299,132.99761,
愛媛県,今治市,30-1,朝倉上甲1256番地1,高大寺集会所前,33.98968,133.0087,
愛媛県,今治市,30-2,朝倉上甲1142番地4,平林農協集荷場下,33.98275,133.01419,
愛媛県,今治市,30-3,朝倉上甲798番地1,JA上朝倉支店前,33.97714,133.00682,
愛媛県,今治市,30-4,朝倉上甲330番地5,白地集会所前,33.97337,132.99741,
愛媛県,今治市,30-5,朝倉上甲232番地,峠地区入口,33.9737,132.98884,
愛媛県,今治市,30-6,朝倉上甲2385番地3,太之原公民館前,33.97845,133.01723,
愛媛県,今治市,30-7,朝倉上甲2462番地2,清水交差点団地入口,33.97805,133.02222,
