prefecture,city,number,address,name,lat,long,note
愛媛県,今治市,30-8,朝倉上甲2755番地3,山越集会所前,33.97499,133.0281,
愛媛県,今治市,30-9,朝倉上甲494番地,浅地バス停留所前,33.97202,133.00472,
愛媛県,今治市,52-1,伯方町木浦甲4524番地15先,バイオ愛媛横市道沿いガードレール,34.21308,133.12197,
愛媛県,今治市,52-2,伯方町木浦甲870番地30,古江集会所フェンス,34.21415,133.11552,
愛媛県,今治市,52-3,伯方町木浦甲1213番地1先,元伯方支所駐車場ガードパイプ,34.20412,133.11261,
愛媛県,今治市,52-4,伯方町木浦甲1463番地1,みんなの広場（新波止）フェンス,34.20568,133.11904,
愛媛県,今治市,52-5,伯方町木浦甲3136番地1先,久保の池県道沿いガードパイプ,34.20228,133.10889,
愛媛県,今治市,52-6,伯方町木浦甲3930番地1先,伯方福祉センター前ガードパイプ,34.2119,133.11361,
愛媛県,今治市,53-1,伯方町有津甲2320番地先,mac駐車場前ガードパイプ,34.20277,133.10145,
愛媛県,今治市,53-2,伯方町有津甲2341番地,みんなの広場（有津）擬木柵,34.20439,133.09501,
愛媛県,今治市,53-3,伯方町有津甲921番地1,元有津小学校フェンス,34.20505,133.0933,
愛媛県,今治市,53-4,伯方町有津甲1550番地1,カットハウスニコル横果樹園フェンス,34.20191,133.09122,
愛媛県,今治市,54-1,伯方町有津甲1666番地28先,（有）大喜前歩道側ガードパイプ,34.20756,133.0738,
愛媛県,今治市,54-2,伯方町有津甲1668番地1先,マリオアシスはかた前歩道側ガードパイプ,34.20284,133.07588,
愛媛県,今治市,54-3,伯方町伊方甲133番地1先,村上歯科医院裏県道沿いガードレール,34.22812,133.07745,
愛媛県,今治市,54-4,伯方町伊方甲1630番地先,夫婦池県道沿いガードパイプ,34.22499,133.07274,
愛媛県,今治市,54-5,伯方町伊方甲1937番地1,ハス池歩道側ガードパイプ,34.21381,133.06866,
愛媛県,今治市,55-1,伯方町北浦乙161番地1先,masked,34.22132,133.10723,
愛媛県,今治市,55-2,伯方町北浦甲2178番地,伯方農村環境改善センターフェンス,34.22611,133.09489,
愛媛県,今治市,55-3,伯方町北浦甲1270番地1先,masked,34.23074,133.10156,
愛媛県,今治市,55-4,伯方町北浦甲1351番地18先,北浦御旅所前ガードレール,34.23128,133.09914,
愛媛県,今治市,55-5,伯方町北浦甲2727番地1先,元西伯方中学校前県道沿いガードパイプ,34.22973,133.09082,
愛媛県,今治市,56-1,上浦町瀬戸5416番地5,出走集会所前,34.21443,133.04422,
愛媛県,今治市,56-2,上浦町瀬戸2755番地地先,masked,34.22488,133.05064,
愛媛県,今治市,56-3,上浦町瀬戸2537番地,曽我写真店下,34.22688,133.05267,
愛媛県,今治市,56-4,上浦町瀬戸1399番地1,瀬戸神社前,34.22921,133.05091,
愛媛県,今治市,57-1,上浦町甘崎2194番地3,masked,34.23921,133.05172,
愛媛県,今治市,57-2,上浦町甘崎3723番地2,大原老人憩の家,34.23843,133.04237,
愛媛県,今治市,57-3,上浦町甘崎871番地,水場集会所,34.24604,133.05095,
愛媛県,今治市,57-4,上浦町甘崎377番地2,水場川尻,34.24738,133.05415,
愛媛県,今治市,58-1,上浦町井口7334番地2,旧菅医院横,34.25832,133.04925,
愛媛県,今治市,58-2,上浦町井口6554番地2地先,井ノ口橋横,34.2626,133.0382,
愛媛県,今治市,58-3,上浦町井口4166番地地先,ひまわり美容院横,34.26469,133.03309,
愛媛県,今治市,58-4,上浦町井口5284番地3,井口港,34.26587,133.04271,
愛媛県,今治市,58-5,上浦町井口3826番地2地先,明代駅前（藤田豆腐店前）,34.26679,133.03545,
愛媛県,今治市,58-6,上浦町井口3865番地5,上浦ふれあい広場フェンス,34.26793,133.03248,
愛媛県,今治市,59-1,上浦町盛2815番地地先,masked,34.2903,133.02816,
愛媛県,今治市,59-2,上浦町盛2643番地,旧上浦盛研修センター,34.29111,133.02595,
愛媛県,今治市,59-3,上浦町盛3852番地13,盛港公園フェンス,34.29251,133.02851,
愛媛県,今治市,59-4,上浦町盛2177番地3,徳永商店横,34.29426,133.0237,
愛媛県,今治市,60-1,大三島町肥海1036番地1地先,masked,34.2795,132.98604,
愛媛県,今治市,60-2,大三島町肥海1501番地1地先,防火水槽横フェンス,34.27605,132.997,
愛媛県,今治市,60-3,大三島町肥海3780番地,肥海集会所,34.27473,132.99914,
愛媛県,今治市,60-4,大三島町肥海1265番地1,旧肥海保育園横フェンス,34.2737,132.9953,
愛媛県,今治市,61-1,大三島町大見3283番地2,旧JA大見支店横ガードパイプ,34.25929,132.99244,
愛媛県,今治市,61-2,大三島町明日199番地先,masked,34.25293,132.99707,
愛媛県,今治市,61-3,大三島町宮浦5653番地先,本川橋横ガードパイプ,34.24902,132.99771,
愛媛県,今治市,61-4,大三島町宮浦3299番地2,大三島ショッパーズ駐車場前ガードパイプ,34.25034,133.00659,
愛媛県,今治市,61-5,大三島町宮浦5402番地先,伊予銀行横植込み,34.24735,132.99815,
愛媛県,今治市,61-6,大三島町宮浦5101番地,大三島小学校フェンス,34.24656,133.00176,
愛媛県,今治市,61-7,大三島町台378番地1,菅千里氏管理地,34.2417,132.99965,
愛媛県,今治市,61-8,大三島町宮浦6956番地1地先,西林寺（深山地区）横ガードレール,34.22681,133.01954,
愛媛県,今治市,62-1,大三島町野々江2418番地2地先,市道六ノ坂線ガードパイプ,34.22152,132.98921,
愛媛県,今治市,62-2,大三島町野々江666番地,ゲートボール場横ガードパイプ,34.21711,132.98684,
愛媛県,今治市,62-3,大三島町野々江8096番地先,坂集会所裏県道ガードレール,34.20455,132.99537,
愛媛県,今治市,62-4,大三島町野々江5504番地先,甲口集会所前ガードレール,34.19774,132.97696,
愛媛県,今治市,63-1,大三島町口総1647番地先,市道長瀬線,34.22278,132.96839,
愛媛県,今治市,63-2,大三島町口総1401番地1地先,市道下ノ浜谷条線ガードレール,34.21746,132.97028,
愛媛県,今治市,63-3,大三島町浦戸873番地先,浦戸集会所前ガードパイプ,34.21878,132.96185,
愛媛県,今治市,63-4,大三島町浦戸1019番地先,masked,34.21848,132.95957,
愛媛県,今治市,64-1,大三島町宗方2732番地先,masked,34.20604,132.95721,
愛媛県,今治市,64-2,大三島町宗方3276番地先,マルダイ下ガードレール,34.20441,132.95521,
愛媛県,今治市,64-3,大三島町宗方1211番地,宗方バス停前ガードレール,34.20484,132.95079,
愛媛県,今治市,64-4,大三島町宗方4386番地2地先,masked,34.20025,132.95359,
愛媛県,今治市,35-1,波方町樋口甲1237地先,沢バス停横県道,34.09881,132.93709,
愛媛県,今治市,35-2,波方町樋口甲250地先,今治市波方支所前県道,34.09796,132.95133,
愛媛県,今治市,35-3,波方町樋口甲2034の1地先,門樋バス停付近県道,34.09957,132.95552,
愛媛県,今治市,35-4,波方町養老甲803の1地先,波方小学校前市道,34.10432,132.94569,
愛媛県,今治市,35-5,杣田甲153番地,masked,34.09369,132.95614,
愛媛県,今治市,36-1,波方町波方甲1614の1地先,玉生八幡神社前県道,34.12111,132.95532,
愛媛県,今治市,36-2,波方町波方甲2622の28,波方港湾埋立地入口,34.12524,132.95223,
愛媛県,今治市,36-3,波方町波方甲2003の3地先,波方消防詰所前市道,34.11828,132.95255,
愛媛県,今治市,37-1,波方町小部甲832の2,小部老人福祉センター,34.10667,132.92918,
愛媛県,今治市,37-2,波方町小部甲491の3地先,小部公民館前県道,34.10458,132.93062,
愛媛県,今治市,37-3,波方町小部甲153の10,小部グラウンド,34.10265,132.9289,
愛媛県,今治市,37-4,波方町岡甲277の1地先,小部バイパス道路県道,34.11091,132.92758,
愛媛県,今治市,37-5,波方町馬刀潟甲62の2地先,masked,34.11462,132.92542,
愛媛県,今治市,37-6,波方町宮崎甲363の1地先,しんたく屋酒店横県道,34.11397,132.90785,
愛媛県,今治市,38-1,波方町西浦甲3298の1地先,masked,34.1262,132.93608,
愛媛県,今治市,38-2,波方町森上甲580の2地先,masked,34.12429,132.93364,
愛媛県,今治市,39-1,大西町宮脇甲506-1地先,大西支所前ガードレール,34.06086,132.92588,
愛媛県,今治市,39-2,大西町新町甲795-2,大西体育館前ガードパイプ,34.06477,132.92595,
愛媛県,今治市,39-3,大西町新町甲447-1,元大西町役場庁舎敷地,34.06526,132.93049,
愛媛県,今治市,39-4,大西町宮脇甲73-174先,衣黒運動場入口前ガードパイプ,34.0565,132.92317,
愛媛県,今治市,39-5,大西町脇甲844-3先,越智商会横ガードレール,34.06235,132.92131,
愛媛県,今治市,39-6,大西町脇甲23-3地先,masked,34.04952,132.92017,
愛媛県,今治市,39-7,大西町星浦甲82-2先,星浦団地前ガードレール,34.06058,132.90758,
愛媛県,今治市,39-8,大西町別府398-1,別府農村公園,34.06128,132.89818,
愛媛県,今治市,40-1,大西町九王甲833-1先,masked,34.08613,132.92969,
愛媛県,今治市,40-2,大西町九王甲1480先,無人朝市横,34.0772,132.92994,
愛媛県,今治市,40-3,大西町新町甲1051-3,鳥越住宅前ガードパイプ,34.07044,132.93045,
愛媛県,今治市,40-4,大西町九王甲2390-1先,どっく駐車場ガードパイプ,34.06914,132.92715,
