prefecture,city,number,address,name,lat,long,note
愛媛県,四国中央市,31-6,土居町北野1783,masked,33.954853,133.3933629,
愛媛県,四国中央市,31-7,土居町北野21付近,市道 大谷橋 西ガードレール,33.96194,133.4119247,緯度経度は怪しい
愛媛県,四国中央市,32-1,土居町中村892,土居高校正門フェンス,33.9645057,133.4310056,
愛媛県,四国中央市,32-2,土居町土居1837,土居総合体育館入口,33.9659198,133.4268627,緯度経度は怪しい
愛媛県,四国中央市,32-3,土居町土居83-2,土居駅前広場フェンス,33.9590274,133.4282962,緯度経度は怪しい
愛媛県,四国中央市,32-4,土居町入野859-4,ケーオー醸酵㈱,33.9570666,133.4247473,
愛媛県,四国中央市,32-5,土居町入野943,土居文化会館駐車場ガードパイプ,33.9558803,133.4235533,
愛媛県,四国中央市,32-6,土居町土居892付近,土居公民館駐車場入口ガードレール,33.9568464,133.4208706,
愛媛県,四国中央市,32-7,土居町土居521-1,土居小学校前橋南添谷川ガードレール,33.9596148,133.4217992,
愛媛県,四国中央市,32-8,土居町土居171-1付近,土居中学校付近（三好克彦邸前）,33.9607182,133.4270527,
愛媛県,四国中央市,33-1,土居町土居1173,常盤橋南ガードレール（ひらく焼肉店前）,33.9551751,133.4139,
愛媛県,四国中央市,33-2,土居町入野86-2,土居西幼稚園,33.9555387,133.4179974,
愛媛県,四国中央市,33-3,土居町入野993-5,ハローズ土居店入口ガードパイプ,33.954964,133.4219322,
愛媛県,四国中央市,33-4,土居町入野174-2,土居老人憩いの家,33.950072,133.416077,
愛媛県,四国中央市,33-5,土居町入野841-1,ドラッグストアモリ土居店北側フェンス,33.9555491,133.4256959,緯度経度は怪しい
愛媛県,四国中央市,33-6,土居町入野668-1,コープ土居店,33.9567019,133.4284881,
愛媛県,四国中央市,33-7,土居町畑野899,masked,33.950262,133.4094531,
愛媛県,四国中央市,33-8,土居町入野178-1,土居窓口センター入口,33.951571,133.418767,
愛媛県,四国中央市,34-1,土居町中村1111,飯武踏切北県道ガードバイブ,33.9595835,133.4304158,
愛媛県,四国中央市,34-2,土居町小林932,masked,33.9582722,133.4336784,
愛媛県,四国中央市,34-3,土居町小林667,小富士小学校,33.9623029,133.4366831,
愛媛県,四国中央市,34-4,土居町小林518,小林集会所,33.9592955,133.4375362,
愛媛県,四国中央市,34-5,土居町中村1869,masked,33.9597469,133.4457576,緯度経度は怪しい
愛媛県,四国中央市,34-6,土居町中村1325-2付近,エリエールプロダクト㈱,33.9615541,133.4319656,
愛媛県,四国中央市,34-7,土居町小林1325-2,梅ヶ町集会所,33.9564482,133.4327938,
愛媛県,四国中央市,35-1,土居町藤原4-390,masked,33.9685739,133.4407906,緯度経度は怪しい
愛媛県,四国中央市,35-2,土居町藤原4-135,masked,33.9696955,133.4406596,緯度経度は怪しい
愛媛県,四国中央市,35-3,土居町藤原2-122,masked,33.9667629,133.4467143,緯度経度は怪しい
愛媛県,四国中央市,35-4,土居町藤原6-10,masked,33.9740601,133.4415756,緯度経度は怪しい
愛媛県,四国中央市,36-1,土居町津根1656,土居東こども園フェンス,33.9639993,133.4532165,
愛媛県,四国中央市,36-2,土居町津根2215-2,旧長津保育園,33.9632343,133.4599467,
愛媛県,四国中央市,36-3,土居町津根3464,樋の口住宅ガードパイプ,33.965055,133.447782,緯度経度は怪しい
愛媛県,四国中央市,36-4,土居町津根2441-4付近,グリーンハイツ公園フェンス,33.9658501,133.4598715,
愛媛県,四国中央市,36-5,土居町津根2773-1,八日市集合所前広場,33.9710937,133.456509,
愛媛県,四国中央市,36-6,土居町津根3668,ファミリーマート土居町津根店前交差点ガードパイプ,33.97372259999999,133.452444,緯度経度は怪しい
愛媛県,四国中央市,36-7,土居町津根25-2,合田製材所,33.9613431,133.460508,
愛媛県,四国中央市,36-8,土居町津根454,村山神社南側玉垣,33.9596672,133.4558602,
愛媛県,四国中央市,36-9,土居町津根2974,トキワ工業東側ガードパイプ,33.9670549,133.4557068,緯度経度は怪しい
愛媛県,四国中央市,37-1,土居町野田乙8,上市集会所南ガードレール,33.9700037,133.4668878,緯度経度は怪しい
愛媛県,四国中央市,37-2,土居町野田乙744-2付近,大和国道線ガードパイプ（福助工場前）,33.9637057,133.4632051,
愛媛県,四国中央市,37-3,土居町野田956,馬場集会所,33.9709451,133.4652418,緯度経度は怪しい
愛媛県,四国中央市,37-4,土居町野田甲1244-1,野田中央会館,33.96635759999999,133.4663649,緯度経度は怪しい
愛媛県,四国中央市,37-5,土居町野田甲,三英商会敷地フェンス（県道南側）,33.9700037,133.4668878,緯度経度は怪しい
愛媛県,四国中央市,37-6,土居町野田352付近,ファミリーマート土居中央野田店前交差点,33.9724677,133.4692868,緯度経度は怪しい
愛媛県,四国中央市,38-1,土居町天満433-1,旧出店集会所フェンス,33.9702542,133.4223589,緯度経度は怪しい
愛媛県,四国中央市,38-2,土居町天満1537,山中横方前交差点ガードレール,33.9768133,133.4182978,緯度経度は怪しい
愛媛県,四国中央市,38-3,土居町天満2011-1付近,天満公民館,33.9779798,133.4205391,緯度経度は怪しい
愛媛県,四国中央市,38-4,土居町土居天王橋北川付近,天王橋北側ガードレール,33.9659988,133.4208426,緯度経度は怪しい
愛媛県,四国中央市,38-5,土居町天満2730-2,天満神社東側千歳橋南側欄干,33.9813765,133.4191643,
愛媛県,四国中央市,38-6,土居町薮崎638-4付近,天満駐在所西ガードレール,33.961855,133.4235324,緯度経度は怪しい
愛媛県,四国中央市,39-1,土居町蕪崎805-1,西法寺東塁,33.976948,133.4290364,
愛媛県,四国中央市,39-2,土居町蕪崎920-2,masked,33.9795439,133.4303657,
愛媛県,四国中央市,39-3,土居町蕪崎2507-1,蕪崎公民館,33.978802,133.4314151,緯度経度は怪しい
愛媛県,四国中央市,39-4,土居町蕪崎253-1付近,恵康病院北側ガードバイブ,33.9721551,133.428725,
愛媛県,四国中央市,39-5,土居町蕪崎644-1付近,高石組北側ガードバイブ,33.976234,133.4258103,
愛媛県,四国中央市,40-1,新宮町新瀬川794,林道山王線入口,33.913857,133.6628111,緯度経度は怪しい
愛媛県,四国中央市,40-2,新宮町新瀬川500付近,少年自然の家入口,33.9163558,133.6517189,緯度経度は怪しい
愛媛県,四国中央市,40-3,新宮町馬立4491-1,霧の森駐車場前,33.9242016,133.6415929,緯度経度は怪しい
愛媛県,四国中央市,40-4,新宮町馬立277付近,四社神社入口,33.9189098,133.639537,緯度経度は怪しい
愛媛県,四国中央市,41-1,新宮町馬立83,県道大谷口,33.9353783,133.6340392,緯度経度は怪しい
愛媛県,四国中央市,41-2,新宮町新宮470付近,新宮停留所横,33.9462591,133.6404353,緯度経度は怪しい
愛媛県,四国中央市,41-3,新宮町新宮1040付近,清水橋横,33.9507876,133.6433454,緯度経度は怪しい
愛媛県,四国中央市,41-4,新宮町新宮1147-4,銅山川端中西側,33.9473488,133.6391101,緯度経度は怪しい
愛媛県,四国中央市,42-1,新宮町馬立,堀切トンネル口手前,33.9194571,133.6279334,緯度経度は怪しい
愛媛県,四国中央市,42-2,新宮町馬立990,福祉バス市仲停留所,33.9552902,133.6134484,緯度経度は怪しい
愛媛県,四国中央市,42-3,新宮町馬立1474,福祉バス日浦停留所,33.9462636,133.6009001,緯度経度は怪しい
愛媛県,四国中央市,43-1,新宮町上山,旧西庄小学校プールフェンス,33.9567525,133.6663143,緯度経度は怪しい
愛媛県,四国中央市,43-2,新宮町上山163,市道新宮中央線、大窪農道入口,33.9506009,133.6463679,緯度経度は怪しい
愛媛県,四国中央市,43-3,新宮町上山3175付近,市道嶽峠野線、新宮中央線分岐点,33.950549,133.6647702,緯度経度は怪しい
愛媛県,四国中央市,44-1,新宮町上山1672,中村集会所,33.9564283,133.6603125,緯度経度は怪しい
愛媛県,四国中央市,44-2,新宮町上山2703,市道新宮中央線、中野線分岐点,33.9526449,133.6601353,緯度経度は怪しい
愛媛県,四国中央市,44-3,新宮町上山3321-1,消防第五分団詰所横,33.9573687,133.6704152,緯度経度は怪しい
愛媛県,四国中央市,45-1,新宮町上山6194,少年自然の家寺内分館駐車場フェンス,33.9497245,133.6825391,緯度経度は怪しい
愛媛県,四国中央市,45-2,新宮町上山7043付近,天日橋,33.9610939,133.6835741,緯度経度は怪しい
愛媛県,四国中央市,45-3,新宮町上山6590,応神橋横,33.9510758,133.6786173,緯度経度は怪しい
