prefecture,city,number,address,name,lat,long,note
愛媛県,四国中央市,1-1,川之江町余木688-3付近,masked,34.0365308,133.5946444,
愛媛県,四国中央市,1-2,川之江町余木1238-1,二名ふれあい館前ガードパイプ,34.0333592,133.5898923,緯度経度は怪しい
愛媛県,四国中央市,1-3,川之江町長須329-3付近,長須集会所横ガードレール,34.0310613,133.5868261,
愛媛県,四国中央市,1-4,川之江町3959-2付近,masked,34.0293372,133.5838258,
愛媛県,四国中央市,2-1,川之江町3815付近,宮ノ谷長須線ガードレール,34.0244034,133.5813225,
愛媛県,四国中央市,2-2,川之江町3575-1付近,篠原芳通横西ガードレール,34.0195467,133.5788829,
愛媛県,四国中央市,2-3,川之江町1516-1,消防署東分署西側ブロック塀,34.017132,133.5739136,
愛媛県,四国中央市,2-4,川之江町2379-3,masked,34.0149433,133.5778695,
愛媛県,四国中央市,2-5,川之江町2233付近,四国中央病院駐車場フェンス,34.0163191,133.5775129,緯度経度は怪しい
愛媛県,四国中央市,2-6,川之江町2962-5付近,バリュー前ガードパイプ（大門ハイツ南）,34.011205,133.5858803,
愛媛県,四国中央市,2-7,川之江町3132-2,天生津集会所フェンス,34.009831,133.586876,
愛媛県,四国中央市,3-1,川之江町2524-1付近,㈱マサノ本社工場付近ガードバイプ,34.0169672,133.5761241,緯度経度は怪しい
愛媛県,四国中央市,3-2,川之江町1706-1,川之江信用金庫本店 擁壁,34.0148704,133.5720701,
愛媛県,四国中央市,3-3,川之江町1918-3,フジ川之江店南側駐車場フェンス,34.0119489,133.5730237,
愛媛県,四国中央市,3-4,川之江町1819付近,にぎわい広場駐輪場ガードパーブ,34.0128574,133.5750631,
愛媛県,四国中央市,3-5,川之江町1961,山下公園入口柵,34.0110478,133.5728937,
愛媛県,四国中央市,3-6,川之江町2093-1付近,川之江ふれあい交流センター付帯駐車場ガードパイブ,34.0090366,133.574672,緯度経度は怪しい
愛媛県,四国中央市,3-7,川之江町2255,川之江高等学校コンクリート塀,34.0107053,133.577588,緯度経度は怪しい
愛媛県,四国中央市,3-8,川之江町826番地付近,丸住製紙㈱駐車場前ガードパイブ,34.0039564,133.5696245,
愛媛県,四国中央市,3-9,川之江町193番地,ハローズ川之江店入口ガードパイブ,34.0001292,133.5663264,緯度経度は怪しい
愛媛県,四国中央市,3-10,川之江町5-1,masked,34.0007734,133.5714298,
愛媛県,四国中央市,4-1,川之江町５９９－２３付近,川之江運動公園前フェンス,34.0106079,133.5666054,
愛媛県,四国中央市,4-2,川之江町１０２７－２１,川之江こども園フェンス,34.0107787,133.5694271,
愛媛県,四国中央市,4-3,川之江町１１４３－３,仏法寺駐車場フェンス,34.0132381,133.5704653,
愛媛県,四国中央市,4-4,川之江町１２７５－２,masked,34.0163191,133.5775129,緯度経度は怪しい
愛媛県,四国中央市,4-5,川之江町１３４５,masked,34.0160684,133.5694142,
愛媛県,四国中央市,4-6,川之江町４０５８－１２,今治ヤンマー西三角緑地ガードレール,34.0161261,133.57171,
愛媛県,四国中央市,4-7,川之江町１０１２付近,川之江体育館前表示板西側,34.0097608,133.5715379,
愛媛県,四国中央市,4-8,川之江町４０１７－２,浜公園多目的グラウンド東側フェンス,34.0189139,133.5657668,緯度経度は怪しい
愛媛県,四国中央市,5-1,金生町下分254,masked,34.00696569999999,133.5771032,
愛媛県,四国中央市,5-2,金生町下分285,寺尾製紙前ガードパイプ,34.0060549,133.5786014,
愛媛県,四国中央市,5-3,金生町下分1665,金生第一小学校フェンス,34.0024258,133.5834242,
愛媛県,四国中央市,5-4,金生町下分791-2,川之江窓口センター駐車場フェンス,34.0020379,133.5783387,
愛媛県,四国中央市,5-5,金生町下分1234,イトマン㈱住吉倉庫フェンス,33.997569,133.5793919,
愛媛県,四国中央市,5-6,金生町下分987,建設会館コンクリート塀,33.9991929,133.5757422,
愛媛県,四国中央市,5-7,金生町下分1405,masked,34.0014158,133.5809097,
愛媛県,四国中央市,5-8,金生町下分1550,高尾酒店向ブロック塀,33.9987357,133.5841355,
愛媛県,四国中央市,5-9,金生町下分2010-2付近,川原田橋北側欄干,33.9976047,133.5853556,
愛媛県,四国中央市,5-10,金生町下分2205付近,市営川原田住宅内三角緑地,33.9990921,133.5898466,
愛媛県,四国中央市,6-1,金生町下分2516-1,山田井橋北側ガードレール,34.00511,133.5858261,
愛媛県,四国中央市,6-2,金生町山田井34-1付近,金生川ガードレール,34.00562,133.5892809,
愛媛県,四国中央市,6-3,金生町山田井361-1,井原鉄工所駐車場向かいガードパイプ,34.0025038,133.5924118,
愛媛県,四国中央市,6-4,金生町山田井982,masked,34.0077809,133.5932186,
愛媛県,四国中央市,6-5,金生町山田井882,生きがい研修センターフェンス,34.0112156,133.594438,
愛媛県,四国中央市,6-6,金生町山田井657,城ヶ谷団地入口荒神橋上流側欄干,34.0152334,133.599203,
愛媛県,四国中央市,6-7,金生町山田井1498,かわのえテニスセンター入口西ガードレール,34.018964,133.6048229,
愛媛県,四国中央市,7-1,金生町山田井乙261-4付近,切山集会所付近ガードレール,34.021563,133.6364772,緯度経度は怪しい
愛媛県,四国中央市,7-2,金生町山田井2050付近,真鍋家住宅看板付近ガードレール,34.0255504,133.6231337,緯度経度は怪しい
愛媛県,四国中央市,8-1,上分町1208-5付近,本町金沢線川沿いガードレール(金沢橋付近),33.9927082,133.5909022,
愛媛県,四国中央市,8-2,上分町837-32付近,平尾山付近ガードレール,33.9890512,133.5862764,
愛媛県,四国中央市,8-3,上分町626付近,金生川ダム放流注意看板付近ガードレール,33.9938896,133.589241,
愛媛県,四国中央市,8-4,上分町795-1,上分小学校体育館東フェンス,33.9925632,133.5866037,
愛媛県,四国中央市,8-5,上分町337-6,井川自動車工業前ゴミステーション付近ガードレール,33.9920978,133.5829739,
愛媛県,四国中央市,8-6,上分町819-2,クックババ前ガードパイプ,33.9911223,133.5844844,
愛媛県,四国中央市,8-7,上分町585-1付近,安藤薬品前ガードレール,33.9945366,133.5874497,
愛媛県,四国中央市,8-8,上分町455-1,石丸製紙前交差点ガードパイプ,33.9962526,133.5829385,
愛媛県,四国中央市,8-9,上分町231付近,西川原公園南側フェンス,33.9952328,133.5790706,
愛媛県,四国中央市,9-1,妻鳥町2097,さおの森歯科東側ガードレール,33.9858718,133.5754765,
愛媛県,四国中央市,9-2,妻鳥町上樋ノ上1795-1,イオンタウン川之江ガードレール,33.9938068,133.5698964,緯度経度は怪しい
愛媛県,四国中央市,9-3,妻鳥町2047-1サンハイツ付近,土居橋西側欄干,33.9875079,133.5776818,
愛媛県,四国中央市,9-4,妻鳥町1375付近,妻鳥バス停県道ガードレール,33.9902927,133.5742005,
愛媛県,四国中央市,9-5,妻鳥町1121-1,川之江育苗センター前フェンス,33.9913533,133.5766629,
愛媛県,四国中央市,9-6,妻鳥町1379,中上集会所フェンス,33.98975230000001,133.5748523,
愛媛県,四国中央市,9-7,妻鳥町1480-2,妻鳥公民館北側フェンス,33.9922275,133.5714326,
愛媛県,四国中央市,9-8,妻鳥町1083,松木児童公園前フェンス,33.9951557,133.575143,
愛媛県,四国中央市,10-1,妻鳥町794,自治会 中之町公会堂,33.9988909,133.5722878,
愛媛県,四国中央市,10-2,妻鳥町976-1,市道 綿市交差点ガードパイプ,33.9956863,133.571995,
愛媛県,四国中央市,10-3,妻鳥町947,自治会 綿市集会所横フェンス,33.9952704,133.5701744,
愛媛県,四国中央市,10-4,妻鳥町1656付近,県道 はるやま前交差点ガードパイプ,33.9913901,133.5667655,
愛媛県,四国中央市,10-5,妻鳥町312-1,masked,33.996021,133.5649835,
愛媛県,四国中央市,10-6,妻鳥町185-1,法人 ㈱四国眞永フェンス,33.9986498,133.5624587,
愛媛県,四国中央市,10-7,妻鳥町41,市道 大王製紙パルプヤード東ガードレール,33.9999673,133.5607534,
愛媛県,四国中央市,10-8,川之江町414,自治会 浜田公会堂ブロック塀,34.0040127,133.5607108,
愛媛県,四国中央市,11-1,金田町三角寺42-3,三角寺入口ガードレール,33.9678592,133.5875213,緯度経度は怪しい
愛媛県,四国中央市,11-2,金田町半田丙92付近,JR平山バス停前ガードレール,33.97859680000001,133.6123707,
愛媛県,四国中央市,11-3,金田町金川1115付近,三角寺川橋南ガードレール,33.9782078,133.5926108,緯度経度は怪しい
愛媛県,四国中央市,11-4,金田町金川1592-1付近,東金川バス停横ガードレール,33.9810654,133.595922,
愛媛県,四国中央市,11-5,金田町金川924-2,東金川集会所フェンス,33.9788173,133.6006171,
愛媛県,四国中央市,11-6,金田町金川330,金田公民館フェンス,33.9859046,133.5962789,
愛媛県,四国中央市,11-7,金田町金川44付近,市道本町金沢線西側ガードレール,33.9902763,133.5952087,
愛媛県,四国中央市,11-8,金田町金川1-5付近,轡橋ガードレール,33.9897489,133.593181,
愛媛県,四国中央市,11-9,金田町金川174-1,市営南部団地3棟前フェンス,33.9890311,133.5977616,
愛媛県,四国中央市,12-1,金田町半田甲479,飼谷入口ガードレール,33.9928115,133.6028207,
愛媛県,四国中央市,12-2,金田町半田乙362-3,熊野神社コンクリート塀,33.9915913,133.603011,
愛媛県,四国中央市,12-3,金田町半田282-1付近,県道5号川之江大豊線起点ガードパイプ,33.9923648,133.6066767,緯度経度は怪しい
愛媛県,四国中央市,12-4,金田町半田丙254-1付近,masked,33.9818884,133.6195093,
愛媛県,四国中央市,13-1,柴生町664付近,高速高架下ガードレール,33.9959207,133.620926,
愛媛県,四国中央市,13-2,柴生町442-1付近,市道柴生下川線ガードレール,33.9940341,133.6131952,
愛媛県,四国中央市,13-3,川滝町下山2110-5,石川自治会館フェンス,33.9912537,133.6260356,
愛媛県,四国中央市,13-4,川滝町下山2302付近,喜井酒店西側ガードパイプ,33.9916749,133.6241038,
愛媛県,四国中央市,13-5,川滝町下山1882-1付近,川滝公民館前ガードレール,33.9907813,133.6357101,
愛媛県,四国中央市,13-6,川滝町領家1153-5,古下田ゴミ収集所前ガードレール,33.9855044,133.6271273,
愛媛県,四国中央市,14-1,川滝町下山１５３６－６付近,R192平木バス停ガードパイプ,33.9930641,133.6438573,緯度経度は怪しい
愛媛県,四国中央市,14-2,川滝町下山１０７４－３付近,masked,33.9928279,133.6569987,緯度経度は怪しい
愛媛県,四国中央市,14-3,川滝町下山１３５１－７,masked,33.9966111,133.6542767,緯度経度は怪しい
愛媛県,四国中央市,14-4,川滝町下山８３６－４付近,上惣尾バス停（徳島方面）ガードパイプ,33.9965819,133.6586062,緯度経度は怪しい
愛媛県,四国中央市,14-5,川滝町下山３５５付近,七田バス停（徳島方面）付近フェンス,33.9972099,133.6718102,緯度経度は怪しい
愛媛県,四国中央市,14-6,川滝町下山７４付近,泉中尾集落入口,33.9949122,133.677014,緯度経度は怪しい
愛媛県,四国中央市,15-1,下川町615-1,masked,34.0033538,133.6444827,緯度経度は怪しい
愛媛県,四国中央市,15-2,下川町883-5,大西酒店前ガードレール,33.999018,133.6322122,
愛媛県,四国中央市,15-3,下川町776,下川集会所奥ガードレール,34.0005005,133.6372541,緯度経度は怪しい
愛媛県,四国中央市,15-4,下川町487-1付近,吉祥寺手前ガードレール,34.0049183,133.6543548,緯度経度は怪しい
愛媛県,四国中央市,16-1,上柏町6-1付近,上柏6-1矢野静男前交差点ガードパイプ,33.9830731,133.5564048,
愛媛県,四国中央市,16-2,上柏町235,岩本伸二横方ブロック塀,33.9816166,133.5607509,
愛媛県,四国中央市,16-3,中曽根町204-10,井垣第2橋先東中敷地フェンス,33.9790538,133.5576038,
愛媛県,四国中央市,16-4,上柏町940-2付近,富郷清水井東側フェンス,33.9757211,133.5645055,
愛媛県,四国中央市,16-5,上柏町1584付近,山上集会所東側フェンス,33.9722798,133.5702682,緯度経度は怪しい
愛媛県,四国中央市,16-6,上柏町998-1付近,御所橋ガードレール,33.9794566,133.5635669,
愛媛県,四国中央市,16-7,下柏町459-1,松柏小学校南側フェンス,33.9837284,133.5646181,
愛媛県,四国中央市,16-8,下柏町545付近,平田橋欄干,33.9842039,133.5670695,
愛媛県,四国中央市,16-9,下柏町1154,市道村松一貫田線ガードレール,33.9830961,133.5713531,
愛媛県,四国中央市,16-10,下柏町387-1,松柏公民館前,33.9849231,133.5629099,
愛媛県,四国中央市,16-11,下柏町215,本郷集会所西側フェンス,33.9839254,133.561515,
愛媛県,四国中央市,16-12,下柏町289-1付近,auショップ三島前交差点ガードパイプ,33.9855665,133.5597588,
愛媛県,四国中央市,16-13,下柏町688,本郷平木線ガードパイプ(夕仏南側),33.9888296,133.5632558,
愛媛県,四国中央市,16-14,下柏町871付近,masked,33.9861676,133.5682223,
愛媛県,四国中央市,17-1,村松町544-3,㈱丸和入口フェンス,33.9878766,133.5603379,
愛媛県,四国中央市,17-2,村松町510,大富士製紙 東側ガードレール,33.9896697,133.5615207,
愛媛県,四国中央市,17-3,村松町601-1,masked,33.9893774,133.5582787,
愛媛県,四国中央市,17-4,村松町158,川之江造機㈱三島工場前,33.9924711,133.5605163,緯度経度は怪しい
愛媛県,四国中央市,17-5,村松町625地先,赤之井川 松島橋付近ガードパイプ,33.9901288,133.5573528,
愛媛県,四国中央市,17-6,村松町370付近,八網浦橋 北側ガードレール,33.9966887,133.5563389,
愛媛県,四国中央市,17-7,村松町181-1,天満宮（村松旧大師）ブロック塀,33.9946518,133.5583886,
愛媛県,四国中央市,17-8,村松町236,旧水道局前,33.9945493,133.562234,
愛媛県,四国中央市,17-9,村松町882,大王製紙第2グラウンドフェンス,33.9943481,133.5557569,
愛媛県,四国中央市,18-1,三島中央2丁目8,NTT西局前フェンス,33.9827581,133.5454481,
愛媛県,四国中央市,18-2,三島中央5丁目8-74,JAえひめエネルギー㈱うま店,33.9788018,133.5423123,
愛媛県,四国中央市,18-3,三島金子2丁目1,井関橋西側柵下,33.9802028,133.5392129,
愛媛県,四国中央市,18-4,三島中央4丁目3-5,駅前モータープールフェンス,33.9800082,133.5408084,
愛媛県,四国中央市,18-5,三島中央5丁目11-30付近,三島高校東側ガードパイプ,33.9787013,133.5458215,
愛媛県,四国中央市,18-6,三島中央1丁目1-27,フジ三島店ガードパイプ（ほかほか弁当前）,33.9821777,133.5394349,
愛媛県,四国中央市,18-7,三島中央1丁目1番15号,浜集会所前ガードレール,33.9827022,133.5405203,
愛媛県,四国中央市,18-8,三島中央1丁目5-16,伊予銀行駐車場フェンス,33.9836193,133.5429316,
愛媛県,四国中央市,18-9,三島金子2丁目7-22,メディカルフィットネスピタ・シオカフェンス,33.9793069,133.5376037,
愛媛県,四国中央市,18-10,三島中央3丁目2-23,三島小学校公民館前フェンス,33.9805622,133.5448121,
愛媛県,四国中央市,18-11,三島中央2丁目1-18,児童センター前フェンス,33.980874,133.5455053,
愛媛県,四国中央市,19-1,三島朝日2丁目10,朝日児童公園西側フェンス,33.9882331,133.5583666,
愛媛県,四国中央市,19-2,三島朝日1丁目11,立石児童公園前大王製紙ブロック塀,33.9867766,133.5557381,
愛媛県,四国中央市,19-3,三島宮川1丁目8番25号,三島工業㈱東側ブロック塀,33.9858888,133.5481808,
愛媛県,四国中央市,19-4,三島朝日1丁目9-2地先,エリエール平和寮北側駐車場ブロック塀,33.9871223,133.5539906,
愛媛県,四国中央市,19-5,三島朝日1丁目3-5,大塚団地2棟西側緑地,33.9857752,133.5521669,
愛媛県,四国中央市,19-6,三島宮川1丁目6-4,三島神社東ガードパイプ,33.9858603,133.5452354,
愛媛県,四国中央市,19-7,三島宮川3丁目12-11,中通り橋南側欄干,33.9831524,133.5457767,
愛媛県,四国中央市,19-8,三島宮川3丁目4-14,上町公民館緑地,33.9815515,133.5473448,
愛媛県,四国中央市,19-9,三島宮川4丁目6-55,四国中央市役所東駐車場フェンス,33.9807358,133.5492115,
愛媛県,四国中央市,19-10,三島宮川4丁目6-55,四国中央市役所北駐車場フェンス,33.9807358,133.5492115,
愛媛県,四国中央市,19-11,三島宮川4丁目9-53,カクケイ（株）前ブロック塀,33.9819591,133.5514243,
愛媛県,四国中央市,20-1,中曽根町5010-2付近,下秋別交差点ガードパイプ,33.97868320000001,133.5512881,
愛媛県,四国中央市,20-2,中曽根町238-5付近,masked,33.9779874,133.5552538,
愛媛県,四国中央市,20-3,中曽根町392地先,コロンボ交差点付近ガードパイプ,33.9799803,133.5531585,
愛媛県,四国中央市,20-4,中曽根町1523,中曽根公民館前入口付近,33.9753224,133.5488987,
愛媛県,四国中央市,20-5,中曽根町858付近,野々首集会所前ガードレール,33.9718964,133.5536165,
愛媛県,四国中央市,20-6,中曽根町1141,（有）石井自動車北側ガードパイプ,33.9708955,133.5467949,
愛媛県,四国中央市,20-7,中曽根町1432-1,masked,33.9750675,133.5460772,
愛媛県,四国中央市,20-8,中曽根町1632-7,西村英夫南ガードレール,33.9764324,133.5455668,
愛媛県,四国中央市,20-9,中曽根町1814-3,masked,33.9724233,133.543518,
愛媛県,四国中央市,20-10,中曽根町1720-4,りょう花前交差点ガードパイプ,33.9750007,133.5426677,
愛媛県,四国中央市,20-11,中曽根町2543-2,石床集会所西側フェンス,33.9744582,133.5380849,
愛媛県,四国中央市,20-12,中曽根町2630,みずまる産業（株）前ガードレール,33.9763711,133.538874,
愛媛県,四国中央市,21-1,中之庄町542,みしま乳児保育園東フェンス,33.9768832,133.5348158,
愛媛県,四国中央市,21-2,中之庄町221付近,中之庄青空すいは歩道橋下ガードパイプ,33.9734043,133.5332587,
愛媛県,四国中央市,21-3,中之庄町134,中之庄公民館市道側ガードパイプ,33.97309389999999,133.5305913,
愛媛県,四国中央市,21-4,中之庄町1411-2付近,大谷橋西側付近北側ガードレール,33.969189,133.5318593,
愛媛県,四国中央市,21-5,具定町336-3付近,masked,33.9685579,133.5294962,
愛媛県,四国中央市,21-6,中之庄町1380,山田団地入口東,33.966435,133.5323665,
愛媛県,四国中央市,21-7,中之庄町757-1,高橋マイカーセンター南,33.9730319,133.5373123,
愛媛県,四国中央市,21-8,具定町387付近,幸橋北ガードレール,33.9706949,133.5291631,
愛媛県,四国中央市,21-9,中之庄町86地先,コーナン前ガードパイプ,33.9732216,133.5284543,
愛媛県,四国中央市,21-10,中之庄町303-2,公園通り3丁目市役所住宅管理作業所東,33.9758582,133.5293828,
愛媛県,四国中央市,21-11,中之庄町506-2,キャッスル三島前R11進入路ガードレール,33.9792162,133.5341052,
愛媛県,四国中央市,21-12,中之庄町1684-2付近,（旧）三島病院南ガードパイプ,33.9805587,133.5335687,緯度経度は怪しい
愛媛県,四国中央市,22-1,寒川町677,樋之尾谷川県道南側欄干,33.9661891,133.5212635,
愛媛県,四国中央市,22-2,寒川町426-1地先,ドン・キホーテ前北側ガードパイプ,33.9702832,133.5228607,
愛媛県,四国中央市,22-3,寒川町1388-3付近,寒川公民館入口ガードパイプ,33.966392,133.516605,
愛媛県,四国中央市,22-4,寒川町1179,江之元信号南歩道ガードフェンス,33.9677995,133.5152157,
愛媛県,四国中央市,22-5,寒川町1836付近,寒川高井電機付近ガードフェンス,33.9642138,133.5146966,
愛媛県,四国中央市,22-6,寒川町2519付近,天地親神神社東側ガードレール,33.9668754,133.5110555,
愛媛県,四国中央市,22-7,寒川町3517付近,西寒川集会所前よう壁,33.9638602,133.503733,
愛媛県,四国中央市,22-8,寒川町3752-3付近,masked,33.9673312,133.5050371,
愛媛県,四国中央市,22-9,寒川町4089,栗田電機四国中央市店前市道ガードレール,33.9668729,133.5021047,
愛媛県,四国中央市,22-10,寒川町4775-14,江之元大橋東交差点北側フェンス,33.9710996,133.5133718,
愛媛県,四国中央市,22-11,寒川町980,北寒川江之元踏切東ガードレール,33.9692747,133.5161642,
愛媛県,四国中央市,23-1,豊岡町大町136-1,NTT豊岡電話交換所,33.9659617,133.4946801,緯度経度は怪しい
愛媛県,四国中央市,23-2,豊岡町大町577,masked,33.96522910000001,133.4927717,
愛媛県,四国中央市,23-3,豊岡町長田603-1付近,丸福豊岡倉庫北病院側ガードパイプ,33.9719686,133.4752153,緯度経度は怪しい
愛媛県,四国中央市,23-4,豊岡町大町2043-5地先,市道大町西通り線高塚入口三叉路ガードレール,33.9625907,133.4848474,
愛媛県,四国中央市,23-5,豊岡町大町2091-1付近,豊岡町大町2091-1付近ガードレール,33.9651922,133.4870013,
愛媛県,四国中央市,23-6,豊岡町五良野1-3付近,五良野豊岡上橋南側橋千,33.9638614,133.4811134,
愛媛県,四国中央市,23-7,豊岡町豊田5,豊岡小学校プール北側（公民館東側）,33.9661439,133.481209,緯度経度は怪しい
愛媛県,四国中央市,23-8,豊岡町大町1753-1付近,とよた薬局前交差点ガードパイプ,33.9672582,133.4830785,
愛媛県,四国中央市,23-9,豊岡町長田1079,雅前ガードレール,33.9654314,133.4761035,
愛媛県,四国中央市,23-10,豊岡町長田1657,豊岡マンション・コンクリート塀,33.9645964,133.4713454,
愛媛県,四国中央市,23-11,豊岡町長田1626-8付近,楠木団地児童遊園フェンス,33.9611984,133.4695775,
愛媛県,四国中央市,23-12,豊岡町大町2540-175,恵之久保団地公園フェンス,33.9584456,133.4920082,緯度経度は怪しい
愛媛県,四国中央市,24-1,富郷町寒川山226,自治会寒川山集会所前,33.9154192,133.5119793,緯度経度は怪しい
愛媛県,四国中央市,24-2,富郷町寒川山439,杉成橋南側欄干,33.9133004,133.5105614,緯度経度は怪しい
愛媛県,四国中央市,24-3,富郷町寒川山665,自治会猿田集会所前（旧26-1）,33.88763770000001,133.498966,緯度経度は怪しい
愛媛県,四国中央市,24-4,富郷町寒川山1010-2,自治会上猿田集会所前（旧26-2）前回改選（令和3年）と場所が変更,33.8742321,133.5087302,緯度経度は怪しい
愛媛県,四国中央市,25-1,富郷町豊坂299-1付近,富郷橋欄干,33.9077905,133.500299,緯度経度は怪しい
愛媛県,四国中央市,25-2,富郷町豊坂179-2,自治会 豊坂公民館前,33.9120552,133.4975222,緯度経度は怪しい
愛媛県,四国中央市,27-1,富郷町津根山,藤原大橋前渓流亭前ガードレール,33.8784973,133.47411,緯度経度は怪しい
愛媛県,四国中央市,27-2,富郷町津根山137,藤原公会堂前,33.8870216,133.4830844,緯度経度は怪しい
愛媛県,四国中央市,27-3,富郷町津根山352-9,保存民家細川家横,33.8732879,133.4710719,
愛媛県,四国中央市,27-4,富郷町津根山乙286-21,masked,33.866671,133.4608097,緯度経度は怪しい
愛媛県,四国中央市,28-1,金砂町小川山2263-1,上小川集会所前 ガードレール,33.9231338,133.5439667,緯度経度は怪しい
愛媛県,四国中央市,29-1,金沙町平野山乙610,長野集会所西市道東長野線入口,33.9165416,133.5193775,緯度経度は怪しい
愛媛県,四国中央市,29-2,金沙町平野山232付近,嶺南公民館駐車場,33.9322425,133.5270408,緯度経度は怪しい
愛媛県,四国中央市,29-3,金沙町平野山乙201付近,金沙郵便局前ガードレール,33.9322425,133.5270408,緯度経度は怪しい
愛媛県,四国中央市,30-1,土居町上野72,木の川集会所前,33.9505299,133.4042936,緯度経度は怪しい
愛媛県,四国中央市,30-2,土居町上野911-1,関川公民館,33.9449902,133.3911229,
愛媛県,四国中央市,30-3,土居町上野1697-1,masked,33.9431869,133.3863835,
愛媛県,四国中央市,30-4,土居町上野2090-2,亀井商店,33.9421561,133.3811755,
愛媛県,四国中央市,30-5,土居町上野3190,井上精米所前,33.9393041,133.3739908,緯度経度は怪しい
愛媛県,四国中央市,30-6,土居町上野1467-1,市道名西内東本郷線入口ガードパイプ 前回改選（令和3年）と場所が変更,33.9453574,133.3865639,
愛媛県,四国中央市,30-7,土居町上野659,深川横方西ガードレール,33.94808039999999,133.3934819,
愛媛県,四国中央市,31-1,土居町北野2812,自治会 大境入口,33.9610703,133.3789931,緯度経度は怪しい
愛媛県,四国中央市,31-2,土居町北野2465,市道 三吉末一郎前ガードレール,33.9510024,133.3845312,
愛媛県,四国中央市,31-3,土居町北野2208-2,市道 ディプロ事務所前ガードレール,33.9522387,133.3890985,緯度経度は怪しい
愛媛県,四国中央市,31-4,土居町北野1094-1地先,市道 旧うま農協北野出張所前市道添,33.95441,133.4000136,
愛媛県,四国中央市,31-5,土居町北野449-1付近,masked,33.9570959,133.4048927,緯度経度は怪しい
