prefecture,city,number,address,name,lat,long,note
北海道,室蘭市,1-1,絵鞆町1丁目8番,のり面,42.3353064,140.9413041,
北海道,室蘭市,1-2,絵鞆町2丁目33-1,空き地左側,42.335037,140.935333,緯度経度は怪しい
北海道,室蘭市,1-3,絵鞆町1丁目14番,絵鞆２丁目バス停付近,42.3342757,140.9413354,
北海道,室蘭市,1-4,絵鞆町1丁目11番,港南絵鞆通、測量山通交差点付近,42.3370367,140.9386336,
北海道,室蘭市,2-1,祝津町4丁目4番地,祝津町会館側祝津臨海公園フェンス,42.340984,140.947372,緯度経度は怪しい
北海道,室蘭市,2-2,祝津町2丁目7番,旧絵鞆小学校フール跡地付近,42.3392612,140.9508965,
北海道,室蘭市,2-3,祝津町3丁目4番,祝津公園_水族館前バス停側,42.3377467,140.9431725,
北海道,室蘭市,3-1,増市町1丁目12番,吉沢商事倉庫の横,42.326012,140.951355,緯度経度は怪しい
北海道,室蘭市,3-2,港南町2丁目10番1号,みなと小学校正門フェンス,42.3319271,140.9528061,
北海道,室蘭市,3-3,小橋内町1丁目18番,小橋内１丁目公園,42.3318766,140.9608293,
北海道,室蘭市,3-4,築地町89-2,エネオス向側空地,42.3318294,140.9644817,
北海道,室蘭市,4-1,海岸町1丁目20番地30,港湾部庁舎正門前花壇,42.3230553,140.971512,
北海道,室蘭市,4-2,海岸町2丁目1番,旧室蘭駅舎公園 横緑地,42.3218357,140.9700021,
北海道,室蘭市,4-3,緑町3番,オーレスト室蘭緑町前　緑地,42.3283317,140.967352,
北海道,室蘭市,4-4,海岸町3丁目7番,海岸町３丁目公園,42.32556779999999,140.9676593,
北海道,室蘭市,5-1,入江町1番地,室蘭駅前ロータリー緑地帯,42.322205,140.975067,緯度経度は怪しい
北海道,室蘭市,5-2,中央町3丁目8番,中央町小公園,42.31660220000001,140.972076,
北海道,室蘭市,5-3,幸町1番2号,市役所正面左側,42.31519429999999,140.9737454,
北海道,室蘭市,5-4,幸町6番23号,文化センター正面土手,42.3158811,140.9704494,
北海道,室蘭市,5-5,常盤町2番9号,道営常盤団地Ｂ棟,42.3177153,140.9694407,
北海道,室蘭市,5-6,常盤町16番,常盤公園階段横フェンス,42.316801,140.965613,
北海道,室蘭市,5-7,栄町2丁目3番3号,武揚体育館正門フェンス,42.3119488,140.9730209,
北海道,室蘭市,5-8,舟見町1丁目5番,市営アパート08-F-2前駐車場緑地,42.310408,140.9712328,
北海道,室蘭市,5-9,幸町1番,開運公園 市立病院側,42.3151622,140.9742709,
北海道,室蘭市,6-1,新富町1丁目2番,母恋バス停横,42.3162424,140.988081,
北海道,室蘭市,6-2,母恋北町1丁目9番,日鋼ｱﾊﾟｰﾄ3号館横富士下通入口,42.316621,140.9912068,
北海道,室蘭市,6-3,母恋北町1丁目6番,室蘭すみれ幼稚園駐車場フェンス,42.3138099,140.9921892,
北海道,室蘭市,6-4,母恋北町2丁目6番,母恋公園横,42.3126209,140.9908314,
北海道,室蘭市,6-5,母恋南町1丁目9番,土手,42.3103811,140.9934285,
北海道,室蘭市,6-6,母恋南町2丁目10番,ゴミステーション横空地,42.3121758,140.9946983,
北海道,室蘭市,7-1,母恋南町5丁目32-591,空き地,42.307327,140.996231,緯度経度は怪しい
北海道,室蘭市,7-2,母恋南町2丁目22番,子ども発達支援センター上通り,42.3131978,140.9996196,
北海道,室蘭市,7-3,母恋南町3丁目24番,空地,42.3124128,141.0034399,
北海道,室蘭市,7-4,母恋南町4丁目8番,母恋南町公園フェンス,42.307064,141.000412,緯度経度は怪しい
北海道,室蘭市,8-1,御前水町1丁目1番,白ばらクリーニング向側フェンス,42.3249168,140.9962687,
北海道,室蘭市,8-2,御前水町1丁目13番,モンパリ横土手,42.3231355,140.9972209,
北海道,室蘭市,8-3,御前水町2丁目8番,日鋼御前水クラブ階段左側,42.3204216,140.9992412,
北海道,室蘭市,8-4,御前水町2丁目15番,パークゴルフ場前,42.3197408,140.9967569,
北海道,室蘭市,9-1,御前水町1丁目2番,のり面,42.3260212,140.9976154,
北海道,室蘭市,9-2,御崎町2丁目15番,母恋東町通線のり面,42.3276449,140.9964708,
北海道,室蘭市,9-3,御崎町2丁目2番,御崎鉄工場向土手,42.3331215,140.9917522,
北海道,室蘭市,10-1,大沢町1丁目2番,電材重機,42.3340004,140.9987064,
北海道,室蘭市,10-2,大沢町1丁目21番,道路のり面,42.3307635,140.9996305,
北海道,室蘭市,10-3,大沢町2丁目17番,旧大沢クラブ前,42.3308536,141.0068182,
北海道,室蘭市,10-4,輪西町1丁目20番,輪西駅前広場駅側,42.3337414,141.0073417,
北海道,室蘭市,10-5,輪西町1丁目37番,日本製鉄正門前,42.3350637,141.0102992,
北海道,室蘭市,10-6,輪西町1丁目34番,輪西公園　市民会館バス停付近,42.333393,141.01207,緯度経度は怪しい
北海道,室蘭市,10-7,輪西町3丁目2番,日本製鉄体育館入口付近,42.3369959,141.0168859,
北海道,室蘭市,10-8,輪西町2丁目17番,エネオス向側道路,42.3367391,141.0132626,
北海道,室蘭市,11-1,輪西町3丁目8番,日本製鉄球場バス停付近,42.3394213,141.0165351,
北海道,室蘭市,11-2,東町4丁目3番,旧生協末広ストア横,42.3408077,141.0235604,
北海道,室蘭市,11-3,東町5丁目8番,東町西公園,42.340202,141.021469,緯度経度は怪しい
北海道,室蘭市,11-4,東町5丁目1番,masked,42.3413881,141.0202225,
北海道,室蘭市,11-5,東町5丁目22番,東町５丁目公園,42.3367926,141.0221548,
北海道,室蘭市,12-1,東町3丁目18番,海陽小学校国道側,42.3423382,141.0285553,
北海道,室蘭市,12-2,東町4丁目22番,東町中央公園,42.340576,141.026062,緯度経度は怪しい
北海道,室蘭市,12-3,東町1丁目24番,masked,42.3455254,141.0223283,
北海道,室蘭市,12-4,東町1丁目26番,弥生集会所前,42.3443371,141.0233614,
北海道,室蘭市,12-5,東町2丁目27番,東大通　緑地帯,42.3482812,141.0269793,
北海道,室蘭市,13-1,日の出町1丁目17番,日の出町公園,42.352493,141.039261,緯度経度は怪しい
北海道,室蘭市,13-2,寿町2丁目14番,寿大通線緑地帯,42.3501042,141.0350918,
北海道,室蘭市,13-3,日の出町2丁目3番,丸三市場向側フェンス,42.3568037,141.0421673,
北海道,室蘭市,13-4,日の出町2丁目29番,日の出町２号公園,42.354366,141.045044,緯度経度は怪しい
北海道,室蘭市,13-5,寿町1丁目9番,寿公園入口・いな川こどもクリニック側,42.347698,141.031403,緯度経度は怪しい
北海道,室蘭市,13-6,寿町1丁目8番1号,市営アパート12-K-3フェンス,42.347502,141.0322833,
北海道,室蘭市,13-7,寿町2丁目12番,寿２丁目公園角,42.350578,141.033829,緯度経度は怪しい
北海道,室蘭市,13-8,寿町2丁目4番,寿大通線　緑地帯,42.3524572,141.0333645,
北海道,室蘭市,14-1,中島本町1丁目7番,中島スポーツセンター入口前,42.35326999999999,141.0098884,
北海道,室蘭市,14-2,中島本町2丁目9番,日本製鉄アパート３２号館横,42.3558197,141.0126308,
北海道,室蘭市,14-3,中島本町2丁目8番,日本製鉄アパート１４号館横,42.3543644,141.0137988,
北海道,室蘭市,14-4,中島本町2丁目5番,日本製鉄アパート２号館横,42.3555309,141.0166937,
北海道,室蘭市,15-1,中島町2丁目4番,潮止公園,42.35004,141.015625,緯度経度は怪しい
北海道,室蘭市,15-2,中島町2丁目28番,アパホテル室蘭　知利別川側入口向,42.3532637,141.0196304,
北海道,室蘭市,15-3,中島町3丁目9番,中島小公園,42.35033,141.02153,緯度経度は怪しい
北海道,室蘭市,15-4,中島町2丁目22番,きらん入口通路横,42.3519409,141.0189361,
北海道,室蘭市,15-5,中島町2丁目18番,太平橋下駅西口に至る分岐点,42.3494907,141.0196254,
北海道,室蘭市,16-1,宮の森町1丁目5番,旭ヶ丘小学校正門前,42.3561167,141.0229278,
北海道,室蘭市,16-2,宮の森町1丁目1番,中嶋神社　１丁目９条通線側,42.35429200000001,141.023359,
北海道,室蘭市,16-3,宮の森町1丁目1番,弓道場前,42.35429200000001,141.023359,
北海道,室蘭市,16-4,宮の森町4丁目1番,中島公園　体育館前,42.3531577,141.0259401,
北海道,室蘭市,16-5,宮の森町4丁目9番,カトリック東室蘭教会正面,42.3542137,141.0267689,
北海道,室蘭市,16-6,宮の森町4丁目1番,中島公園　三村病院側のり面,42.3531577,141.0259401,
北海道,室蘭市,16-7,宮の森町2丁目104番地,大和田ハイツ前土手,42.361046,141.02951,緯度経度は怪しい
北海道,室蘭市,16-8,宮の森町3丁目1-74,旧知利別小中島公園通側,42.3556828,141.0290219,
北海道,室蘭市,16-9,高砂町1丁目4番,高砂１丁目公園斎藤医院側,42.3581596,141.0327812,
北海道,室蘭市,17-1,知利別町1丁目6番,バラ公園角,42.35687859999999,141.0182461,
北海道,室蘭市,17-2,中島本町3丁目12番,リビオ中島ビュータワー横フェンス,42.3603955,141.0146257,
北海道,室蘭市,17-3,知利別町1丁目11番,桜蘭中学校テニスコート前角地,42.3583481,141.0204991,
北海道,室蘭市,17-4,知利別町2丁目16番,楽山公園前,42.359245,141.023972,緯度経度は怪しい
北海道,室蘭市,17-5,知利別町2丁目27番,知利別町２丁目バス停付近,42.361813,141.023254,緯度経度は怪しい
北海道,室蘭市,17-6,知利別町4丁目16番,知利別会館前バス停付近,42.366055,141.026291,緯度経度は怪しい
北海道,室蘭市,18-1,高砂町5丁目5番,高砂５丁目公園,42.375584,141.034088,緯度経度は怪しい
北海道,室蘭市,18-2,高砂町5丁目10-1,パークゴルフ場,42.37228,141.03447,緯度経度は怪しい
北海道,室蘭市,18-3,水元町5番1号,天神小学校正門付近,42.3750534,141.0333415,
北海道,室蘭市,18-4,水元町16番,masked,42.3778937,141.0303652,
北海道,室蘭市,18-5,水元町27番,室蘭工業大学正門付近,42.3783563,141.0335072,
北海道,室蘭市,18-6,水元町57番8,明徳寮フェンス,42.3844279,141.0326476,
北海道,室蘭市,19-1,天神町8番,天神町２号公園,42.3696383,141.0282045,
北海道,室蘭市,19-2,天神町15番,高砂北公園入口横,42.3713261,141.0298044,
北海道,室蘭市,19-3,高砂町4丁目9番,東明中学校グランド側,42.3699068,141.0316612,
北海道,室蘭市,20-1,高砂町1丁目30番,緑ヶ丘公園,42.361256,141.037445,緯度経度は怪しい
北海道,室蘭市,20-2,高砂町2丁目23番,高砂東公園,42.363201,141.037399,緯度経度は怪しい
北海道,室蘭市,20-3,高砂町2丁目7番,高砂交番向側バス停付近,42.3609512,141.0345328,
北海道,室蘭市,20-4,高砂町2丁目1番,ハシモト理容院横空地,42.3592513,141.0319057,
北海道,室蘭市,20-5,高砂町3丁目7番,海星学院グランド横,42.365692,141.031433,緯度経度は怪しい
北海道,室蘭市,20-6,高砂町3丁目11番,看護学院正門横付近,42.3666066,141.0346269,
北海道,室蘭市,21-1,八丁平3丁目43-1,道道室蘭環状線法面,42.370598,141.01741,緯度経度は怪しい
北海道,室蘭市,21-2,八丁平4丁目42番,八丁平小学校グラウンドバックネット裏,42.3721317,141.0148671,
北海道,室蘭市,21-3,八丁平4丁目17番,室蘭中央自動車学園南側土手付近,42.367081,141.010727,緯度経度は怪しい
北海道,室蘭市,21-4,八丁平1丁目49-5,空き地,42.3667868,141.0079789,
北海道,室蘭市,21-5,八丁平5丁目48番,八丁平２号公園入口付近,42.363876,141.009506,緯度経度は怪しい
北海道,室蘭市,21-6,八丁平1丁目14番,masked,42.359001,141.002106,緯度経度は怪しい
北海道,室蘭市,21-7,八丁平1丁目31番1号,八丁平南公園入口付近,42.36404,141.004181,緯度経度は怪しい
北海道,室蘭市,22-1,高平町27番地,事業団アパート上り口付近,42.356701,140.992599,緯度経度は怪しい
北海道,室蘭市,22-2,港北町1丁目6番1号,室蘭市サンライフ駐車場フェンス,42.360496,140.9838581,
北海道,室蘭市,22-3,港北町1丁目8番,ﾊﾝﾏｰﾂﾁﾀﾞ向側緑地帯,42.3617914,140.9840438,
北海道,室蘭市,22-4,本輪西町2丁目2番,本輪西駅向側緑地帯,42.3597584,140.977612,
北海道,室蘭市,22-5,本輪西町3丁目4番,本輪西公園,42.36414,140.981277,緯度経度は怪しい
北海道,室蘭市,22-6,本輪西町4丁目21番,伊能橋付近,42.3681985,140.983208,
北海道,室蘭市,22-7,本輪西町4丁目16番,旧本輪西小学校前川フェンス,42.37210959999999,140.9861355,
北海道,室蘭市,22-8,本輪西町5丁目40番,鈴かけ団地バス停付近,42.3827923,140.985541,
北海道,室蘭市,22-9,香川町114番地,香川町入口バス停付近,42.410389,140.992828,緯度経度は怪しい
北海道,室蘭市,23-1,港北町3丁目2番,本輪西電話局前,42.359814,140.987701,緯度経度は怪しい
北海道,室蘭市,23-2,港北町3丁目12番,郵便局横川のフェンス,42.3618819,140.9900399,
北海道,室蘭市,23-3,港北町4丁目13番1号,蘭北小学校サブアリーナ土留角,42.3647943,140.9960798,
北海道,室蘭市,23-4,港北町5丁目86番,港北２号橋フェンス,42.36887,140.998154,緯度経度は怪しい
北海道,室蘭市,23-5,港北町2丁目33番,港北公園前,42.366083,140.9924944,
北海道,室蘭市,23-6,柏木町418番地,柏木公園,42.373871,140.994812,緯度経度は怪しい
北海道,室蘭市,24-1,幌萌町40番地,ひまわり公園,42.3659499,140.9655525,
北海道,室蘭市,24-2,幌萌町18番地,土手,42.36269,140.960251,緯度経度は怪しい
北海道,室蘭市,24-3,幌萌町165番地,幌萌町バス停付近,42.361286,140.953827,緯度経度は怪しい
北海道,室蘭市,25-1,陣屋町3丁目17番,空地,42.3705451,140.9547998,
北海道,室蘭市,25-2,陣屋町3丁目16番,陣屋町会館横,42.3694269,140.9536221,
北海道,室蘭市,25-3,陣屋町4丁目8番,ゴミステーション横,42.3727816,140.9571556,
北海道,室蘭市,25-4,陣屋町2丁目4番,民俗資料館前緑地,42.3689853,140.9501422,
北海道,室蘭市,26-1,白鳥台1丁目18番,白鳥台１丁目公園付近,42.370426,140.934448,緯度経度は怪しい
北海道,室蘭市,26-2,白鳥台2丁目8番,白鳥保育所前,42.3778795,140.9393638,
北海道,室蘭市,26-3,白鳥台2丁目12番,masked,42.37709599999999,140.9348235,
北海道,室蘭市,26-4,白鳥台3丁目18番,白鳥台北公園角,42.381458,140.938339,緯度経度は怪しい
北海道,室蘭市,26-5,白鳥台3丁目4番,白鳥台３丁目公園,42.383453,140.934479,緯度経度は怪しい
北海道,室蘭市,26-6,白鳥台3丁目33番,masked,42.3821558,140.9409818,
北海道,室蘭市,26-7,白鳥台4丁目23番,白鳥台東公園,42.379284,140.946213,緯度経度は怪しい
北海道,室蘭市,26-8,白鳥台5丁目21,白鳥台4丁目バス停付近,42.378735,140.943085,緯度経度は怪しい
北海道,室蘭市,26-9,白鳥台5丁目2番,白鳥台集会所前,42.3784394,140.9401364,
北海道,室蘭市,26-10,白鳥台5丁目36,白鳥台5丁目バス停付近,42.377357,140.942307,緯度経度は怪しい
北海道,室蘭市,26-11,白鳥台2丁目2番,白蘭学園正門付近,42.374535,140.934219,緯度経度は怪しい
北海道,室蘭市,26-12,石川町156番地,地域交流センター前,42.385502,140.936264,緯度経度は怪しい
