prefecture,city,number,address,name,lat,long
北海道,登別市,幌別小学校,登別市役所前,中央町6丁目11番地,42.4126702,141.1065876
北海道,登別市,幌別小学校,幌別児童館横,中央町6丁目19番地1,42.416405,141.1191914
北海道,登別市,幌別小学校,幌別駅西口階段横,中央町2丁目20番地7,42.4095249,141.1060775
北海道,登別市,幌別小学校,らいば公園前,登別市中央町４丁目,42.4127914,141.1066064
北海道,登別市,鉄南ふれあいセンター,鉄南ふれあいセンター前,幌別町3丁目17番地1,42.4115206,141.1107349
北海道,登別市,鉄南ふれあいセンター,旧幌別東小学校校門横,幌別町8丁目16番地1,42.4158067,141.1178427
北海道,登別市,緑寿の家,桜木の家入口,桜木町2丁目15番地18,42.4099876,141.0857799
北海道,登別市,緑寿の家,緑寿の家前,緑町1丁目2番地4,42.3992776,141.0920253
北海道,登別市,ねむの木の家,ねむの木の家,新川町3丁目6番地2,42.4127914,141.1066064
北海道,登別市,ねむの木の家,道営新川団地入口,新川町4丁目47番地１地先,42.4093046,141.0952688
北海道,登別市,ねむの木の家,かえで公園前,新川町4丁目1番地4地先,42.409857,141.0909834
北海道,登別市,富士会館,富士3丁目広場前,富士町3丁目17番地1,42.40935169999999,141.0993827
北海道,登別市,富士会館,富士会館前,富士町7丁目2番地1,42.4146727,141.0983821
北海道,登別市,富士会館,老人福祉センター横,富士町7丁目11番地1,42.413623,141.096724
北海道,登別市,富士会館,市民会館駐車場前,富士町7丁目33番地1,42.4137977,141.0938385
北海道,登別市,幌別中学校,旧労働福祉センター駐車場前,千歳町3丁目1番地8,42.41607459999999,141.1106445
北海道,登別市,幌別中学校,ニナルカの里向,千歳町4丁目10番地7,42.419359,141.1156929
北海道,登別市,幌別中学校,岡志別の森運動公園前,千歳町97番地25,42.4251865,141.1176156
北海道,登別市,幌別中学校,日本工学院北海道専門学校前,札内町184番地3,42.4505132,141.1111844
北海道,登別市,幌別中学校,緑ヶ丘団地２号棟前,常盤町3丁目26番地1,42.37146,141.0535151
北海道,登別市,富浦会館,富浦会館前,富浦町1丁目46番地3,42.443834,141.1593342
北海道,登別市,登別中学校,旧登別公民館前,登別東町2丁目5番地52,42.4127914,141.1066064
北海道,登別市,登別中学校,登別中学校プール横,登別本町1丁目1番地1,42.4217352,141.1060904
北海道,登別市,登別中学校,登別小学校前,登別本町3丁目25番地2,42.447387,141.173111
北海道,登別市,登別中学校,旧登別市婦人センター前,登別東町3丁目6番地7,42.4555871,141.1794798
北海道,登別市,登別中学校,登別児童館前,登別東町4丁目19番地2,42.4532821,141.17453
北海道,登別市,登別中学校,翠の家前,登別東町5丁目13番地6,42.4542478,141.1717719
北海道,登別市,登別中学校,道営登別東町団地前,登別東町5丁目37番地1,42.4569951,141.1772799
北海道,登別市,白樺の家,登別石水亭社員住宅横,中登別町170番地35,42.4997478,141.1418298
北海道,登別市,白樺の家,白樺の家横,中登別町152番地3,42.4127914,141.1066064
北海道,登別市,白樺の家,三愛病院バス停横,中登別町141番地43,42.46456209999999,141.1684109
北海道,登別市,泉和園,ポロシリバス停横,上登別町42番地1021,42.3658252,141.0408573
北海道,登別市,泉和園,紅葉谷入口バス停横,中登別町無番地,42.4759315,141.147166
北海道,登別市,泉和園,泉和園向,登別温泉町17番地2,42.491178,141.143878
北海道,登別市,泉和園,登別温泉交番向,登別温泉町無番地,42.4948191,141.1425587
北海道,登別市,泉和園,カルルス温泉,カルルス町11番地1,42.5187891,141.1070976
北海道,登別市,富岸小学校,若山町3丁目バス停横,富岸町1丁目1番地6,42.3854045,141.0741599
北海道,登別市,富岸小学校,富岸小学校前,富岸町2丁目17番地4,42.3838777,141.0697616
北海道,登別市,富岸小学校,あおぞら公園前,新生町4丁目20番地1,42.382462,141.0642317
北海道,登別市,富岸小学校,なかよし公園前,新生町4丁目3番地,42.378919,141.063954
北海道,登別市,富岸小学校,いなほ公園前,富岸町2丁目34番地1,42.387309,141.066753
北海道,登別市,富浜児童館,栄楽園横,栄町4丁目24番地3,42.4127914,141.1066064
北海道,登別市,富浜児童館,富浜児童館前,栄町2丁目18番地4,42.37174,141.06523
北海道,登別市,富浜児童館,富浜ひろば前,栄町4丁目8番地1,42.37174,141.06523
北海道,登別市,鷲別コミュニティセンター,恵愛病院向,鷲別町2丁目32番地7,42.3563473,141.0480181
北海道,登別市,鷲別コミュニティセンター,鉄原アパート前,鷲別町3丁目12番地13,42.4127914,141.1066064
北海道,登別市,鷲別コミュニティセンター,鷲別支所前,鷲別町3丁目3番地4,42.3610811,141.0485225
北海道,登別市,鷲別コミュニティセンター,道営鷲別団地前,鷲別町3丁目45番地5,42.3581678,141.0509878
北海道,登別市,旭ケ丘三恵園,旭ケ丘三恵園前,美園町4丁目8番地8,42.4127914,141.1066064
北海道,登別市,旭ケ丘三恵園,光和園入口,美園町3丁目無番地,42.4127914,141.1066064
北海道,登別市,新生集会所,新生集会所前,新生町2丁目17番地3,42.37923259999999,141.0697182
北海道,登別市,新生集会所,ひまわり公園前,若山町2丁目39番地1,42.382316,141.070126
北海道,登別市,幌別西小学校,片倉町4丁目広場,片倉町4丁目,42.41296759999999,141.0889856
北海道,登別市,幌別西小学校,幌別西小学校屋外運動場角,片倉町5丁目35番地1,42.4147429,141.0855489
北海道,登別市,常盤会館,常盤会館向,常盤町2丁目35番地1,42.316792,140.969944
北海道,登別市,常盤会館,masked,常盤町5丁目38番地2,42.4127914,141.1066064
北海道,登別市,鷲別小学校,恵和園横,鷲別町4丁目36番地37,42.4127914,141.1066064
北海道,登別市,鷲別小学校,鷲別小学校前,鷲別町4丁目36番地21,42.362543,141.0556024
北海道,登別市,鷲別小学校,楡の木公園横,栄町1丁目4番地1,42.3659413,141.0585415
北海道,登別市,鷲別小学校,旧栄町保育所前,栄町2丁目6番地6,42.367477,141.061233
北海道,登別市,若草小学校,若草1号公園,若草町3丁目,42.36727399999999,141.0509816
北海道,登別市,若草小学校,みその園前,美園町2丁目4番地13,42.3649104,141.0439679
北海道,登別市,若草小学校,若草小学校前,若草町1丁目1番地2,42.3653097,141.0500864
北海道,登別市,こぶしの家,こぶしの家前,柏木町4丁目24番地42,42.4211896,141.0970524
北海道,登別市,こぶしの家,柏木団地5号棟横,柏木町1丁目22番地1,42.4180463,141.1016705
北海道,登別市,こぶしの家,もみじ公園前,柏木町1丁目36番地41,42.4127914,141.1066064
北海道,登別市,若草つどいセンター,めばえ公園前,若草町4丁目4番地,42.369985,141.0535916
北海道,登別市,若草つどいセンター,若草つどいセンター前,若草町4丁目21番地1,42.3719464,141.0571636
北海道,登別市,若草つどいセンター,めぐみ公園横,若草町2丁目32番地,42.37211629999999,141.0608193
北海道,登別市,美園児童センター,美園児童センター横,美園町5丁目36番地4,42.3686458,141.0387251
北海道,登別市,美園児童センター,美園5丁目広場,美園町5丁目10番地6,42.3679193,141.040279
北海道,登別市,千代の台集会所,新生虹の家前,新生町1丁目13番地21,42.3740539,141.064488
北海道,登別市,千代の台集会所,ことぶき公園前,新生町1丁目24番地,42.37578200000001,141.0644514
北海道,登別市,千代の台集会所,もみの木こども園前,新生町3丁目13番地1,42.3764326,141.0610829
北海道,登別市,千代の台集会所,希望の家下,新生町5丁目23番地21,42.3767307,141.0582388
北海道,登別市,すずらんの家,すずらんの家,幸町5丁目27番地4,42.4127914,141.1066064
北海道,登別市,若山の家,若山営業所駐車場横,若山町2丁目38番地3,42.3898663,141.0767198
北海道,登別市,若山の家,アカシヤ団地入口,若山町1丁目15番地1,42.3897413,141.0828244
北海道,登別市,若山の家,和幸園前,大和町2丁目27番地17,42.4127914,141.1066064
北海道,登別市,桜木集会所,桜木公園前,桜木町4丁目1番地1,42.4050446,141.0872135
北海道,登別市,桜木集会所,桜木団地6号棟横,桜木町4丁目1番地1,42.4047549,141.0882114
