prefecture,city,number,address,name,lat,long,note
兵庫県,南あわじ市,1-1,山添338付近,山添公会堂前フェンス,34.3312483,134.8375189,
兵庫県,南あわじ市,1-2,広田広田602-4,masked,34.3297102,134.8357127,
兵庫県,南あわじ市,1-3,広田広田1051-1,広田地区公民館前,34.324413,134.828964,緯度経度は怪しい
兵庫県,南あわじ市,1-4,広田広田321付近,あわじ島農協広田支所（県道広田洲本線沿）,34.3228209,134.8308323,
兵庫県,南あわじ市,1-5,広田中筋77,広田蛭子神社（県道広田洲本線沿）,34.32137660000001,134.8338574,
兵庫県,南あわじ市,1-6,広田中筋107,広田中学校連絡沿いフェンス,34.3227936,134.8341847,
兵庫県,南あわじ市,1-7,広田中筋239-7,ベーシック緑東側 空き地フェンス,34.3213649,134.834704,
兵庫県,南あわじ市,1-8,広田中筋444,集田池堤の下（県道広田洲本線沿）擁壁,34.3198941,134.8432726,
兵庫県,南あわじ市,1-9,広田広田206-1,緑老人福祉センター駐車場南東側フェンス,34.3204365,134.8319437,
兵庫県,南あわじ市,1-10,広田広田117-1,Joshin淡路店横 市道沿いガードパイプ,34.3199639,134.8293055,
兵庫県,南あわじ市,1-11,中条広田480付近,中山陸橋下 市道交差点付近ガードレール,34.318127,134.813217,緯度経度は怪しい
兵庫県,南あわじ市,1-12,中条徳原316-1,徳原公会堂横,34.305774,134.8198313,
兵庫県,南あわじ市,1-13,中条中筋783付近,masked,34.3110481,134.829293,
兵庫県,南あわじ市,1-14,中条中筋2548-2付近,久次米交差点南東 市道ガードレール,34.3142612,134.8249783,
兵庫県,南あわじ市,1-15,中条中筋679-1,masked,34.3060888,134.8300974,
兵庫県,南あわじ市,1-16,中条中筋512-1,中筋縦道線高見交差点（旧山岡電機㈱ 本社工場前）,34.296432,134.829453,緯度経度は怪しい
兵庫県,南あわじ市,1-17,中条中筋1122付近,masked,34.299316,134.821228,緯度経度は怪しい
兵庫県,南あわじ市,1-18,倭文長田9,ウツロ谷県道端ガードパイプ,34.322823,134.797775,緯度経度は怪しい
兵庫県,南あわじ市,1-19,倭文長田1515,長田NTTドコモアンテナ付近（県道洲本西淡線長田交差点南）,34.322823,134.797775,緯度経度は怪しい
兵庫県,南あわじ市,1-20,倭文庄田322-29,庄田団地内 しずおり公園北側フェンス,34.3316934,134.7930952,
兵庫県,南あわじ市,1-21,倭文庄田220-1,倭文公民館前,34.331238,134.789993,緯度経度は怪しい
兵庫県,南あわじ市,1-22,倭文神道5付近,山野モータース北側県道沿い駐車場,34.33582450000001,134.7796687,
兵庫県,南あわじ市,1-23,倭文神道161-2,神道公会堂横（県道五色三原線沿）,34.343334,134.77829,緯度経度は怪しい
兵庫県,南あわじ市,1-24,倭文土井1913,土井集落センター（公会堂）西側ガードレール,34.337971,134.810898,緯度経度は怪しい
兵庫県,南あわじ市,1-25,倭文安住寺404付近,masked,34.348503,134.808685,緯度経度は怪しい
兵庫県,南あわじ市,2-1,松帆古津路162付近,淡路交通㈱湊出張所フェンス,34.3270248,134.7351024,
兵庫県,南あわじ市,2-2,松帆古津路624付近,古津路消防団松原機具庫横,34.3313103,134.7330506,
兵庫県,南あわじ市,2-3,松帆古津路736付近,西淡中学校南交差点県道信号付近フェンス,34.3327199,134.736452,
兵庫県,南あわじ市,2-4,松帆古津路245,古津路消防団機具庫横,34.3311495,134.7403137,
兵庫県,南あわじ市,2-5,松帆慶野745,慶野公会堂敷地内,34.3429883,134.7418913,
兵庫県,南あわじ市,2-6,松帆樽田550付近,市道優文線より室明寺入口（ゴミステーション付近）,34.327438,134.750443,緯度経度は怪しい
兵庫県,南あわじ市,2-7,松帆樽田103-1付近,産宮神社東側 空き地,34.327438,134.750443,緯度経度は怪しい
兵庫県,南あわじ市,2-8,松帆樽田198,「認定こども園松帆北」北側ブロック塀,34.327438,134.750443,緯度経度は怪しい
兵庫県,南あわじ市,2-9,松帆北浜340付近,古津路八幡神社ブロック塀,34.3332184,134.7439494,
兵庫県,南あわじ市,2-10,松帆江尻478付近,江尻公会堂前,34.3283227,134.7460909,
兵庫県,南あわじ市,2-11,松帆塩浜8付近,松帆橋詰,34.3271211,134.74706,
兵庫県,南あわじ市,2-12,松帆北方237付近,北方消防団屯所近く ガードレール,34.3302781,134.7532901,
兵庫県,南あわじ市,2-13,松帆高屋乙98-1,松帆活性化センター前,34.325375,134.743622,緯度経度は怪しい
兵庫県,南あわじ市,2-14,松帆脇田783付近,脇田公会堂前ブロック塀,34.3233589,134.7531794,
兵庫県,南あわじ市,2-15,松帆戒旦寺47付近,高田八幡神社鳥居前,34.3218167,134.7629201,
兵庫県,南あわじ市,2-16,松帆志知川561-1付近,山王橋詰,34.3169955,134.746585,
兵庫県,南あわじ市,2-17,松帆志知川601-1付近,仁平橋付近歩道フェンス,34.3175678,134.7455154,
兵庫県,南あわじ市,2-18,松帆西路74-1,西路コミュニティプラザ（公会堂）前フェンス,34.3177254,134.7419897,
兵庫県,南あわじ市,2-19,湊90-1,湊地区公民館駐車場内フェンス,34.3252225,134.7342597,
兵庫県,南あわじ市,2-20,湊110,ショッピングセンター シーパ駐車場内フェンス,34.3244815,134.7358299,
兵庫県,南あわじ市,2-21,湊1126付近,masked,34.3287665,134.7301238,
兵庫県,南あわじ市,2-22,湊里1484付近,masked,34.32601,134.7287453,
兵庫県,南あわじ市,2-23,湊1093付近,三社神社フェンス,34.3277679,134.725255,
兵庫県,南あわじ市,2-24,湊里1297-2付近,智積寺前北側駐車場,34.3234421,134.7285132,
兵庫県,南あわじ市,2-25,湊里329,空所隣保所有地,34.30695,134.71698,緯度経度は怪しい
兵庫県,南あわじ市,2-26,湊1153付近,登立公会堂前フェンス,34.326088,134.72168,緯度経度は怪しい
兵庫県,南あわじ市,2-27,津井2354-1,中津浦公会堂東ゴミステーション横,34.3192811,134.697793,
兵庫県,南あわじ市,2-28,津井1998,中津浦消防屯所跡付近ガードレール,34.313534,134.691788,緯度経度は怪しい
兵庫県,南あわじ市,2-29,津井1814-2,淡路信用金庫津井支店フェンス付き駐車場の一段下,34.313534,134.691788,緯度経度は怪しい
兵庫県,南あわじ市,2-30,津井2281,南あわじ市西淡グラウンド入口フェンス,34.3191959,134.6911341,
兵庫県,南あわじ市,2-31,津井1250付近,masked,34.3213064,134.685964,
兵庫県,南あわじ市,2-32,津井1557-3付近,津井港湾付近（八大龍王宮）,34.3267818,134.6912051,
兵庫県,南あわじ市,2-33,津井1676-2,雁来公会堂前空地,34.3248431,134.6892146,
兵庫県,南あわじ市,2-34,津井229-2,津井郵便局前フェンス,34.3114757,134.6862608,
兵庫県,南あわじ市,2-35,津井146付近,津井橋詰,34.311005,134.680344,緯度経度は怪しい
兵庫県,南あわじ市,2-36,阿那賀西路31付近,芦谷橋（下川に架けられた橋）欄干,34.3097971,134.6705941,
兵庫県,南あわじ市,2-37,阿那賀志知川17付近,ヘアーサロンみき横,34.2943151,134.6591679,
兵庫県,南あわじ市,2-38,阿那賀1506-1,丸山漁民住宅前フェンス,34.2929674,134.6562468,
兵庫県,南あわじ市,2-39,阿那賀1463-6,南あわじ漁業組合事務所横空地,34.292431,134.66095,緯度経度は怪しい
兵庫県,南あわじ市,2-40,阿那賀1428付近,柴田石油店付近フェンス,34.29079000000001,134.6621918,
兵庫県,南あわじ市,2-41,阿那賀1405-7,masked,34.2889673,134.6632437,
兵庫県,南あわじ市,2-42,阿那賀1279,旧阿那賀診療所駐車場フェンス,34.280205,134.668793,緯度経度は怪しい
兵庫県,南あわじ市,2-43,阿那賀1639-5付近,旅館若潮入口付近ガードレール,34.280205,134.668793,緯度経度は怪しい
兵庫県,南あわじ市,2-44,阿那賀20,「山口屋」駐車場入口フェンス,34.271021,134.6712545,
兵庫県,南あわじ市,2-45,阿那賀25,阿那賀地区公民館グラウンド倉庫裏,34.271416,134.671707,緯度経度は怪しい
兵庫県,南あわじ市,2-46,阿那賀303付近,県道福良阿那賀西淡線三叉路付近,34.2717292,134.6741619,
兵庫県,南あわじ市,2-47,阿那賀836付近,しら波荘前,34.2577153,134.6751629,
兵庫県,南あわじ市,2-48,伊加利2490,市営伊加利住宅入口フェンス,34.2845512,134.6828996,
兵庫県,南あわじ市,2-49,伊加利2250-1,仲野公会堂前ガードレール,34.297394,134.688431,緯度経度は怪しい
兵庫県,南あわじ市,2-50,伊加利236-1付近,masked,34.283138,134.693665,緯度経度は怪しい
兵庫県,南あわじ市,2-51,伊加利614-2,伊加利地区公民館入口ガードレール,34.275711,134.688522,緯度経度は怪しい
兵庫県,南あわじ市,2-52,伊加利569-21付近,あわじ島農協伊加利支所付近ガードパイプ,34.2842824,134.6889383,
兵庫県,南あわじ市,2-53,伊加利1184-1付近,湯の川荘敷地内フェンス,34.277164,134.694382,緯度経度は怪しい
兵庫県,南あわじ市,2-54,伊加利1486付近,伊加利消防団機具庫横 橋の欄干,34.2802569,134.6967638,
兵庫県,南あわじ市,2-55,志知奥213付近,奥公会堂前ガードレール,34.288671,134.7186605,
兵庫県,南あわじ市,2-56,志知口167付近,口公会堂前市道沿い,34.2951035,134.7282873,
兵庫県,南あわじ市,2-57,志知飯山寺14付近,飯山寺公会堂付近,34.2981794,134.7363663,
兵庫県,南あわじ市,2-58,志知鉢443-1付近,陸の港西淡入口付近歩道フェンス,34.3064968,134.7463487,
兵庫県,南あわじ市,2-59,志知鉢107-1付近,あわじ島農協志知支所前歩道フェンス,34.3064968,134.7463487,
兵庫県,南あわじ市,2-60,志知南289付近,masked,34.304317,134.7382539,
兵庫県,南あわじ市,2-61,志知北700付近,masked,34.3086572,134.738125,
兵庫県,南あわじ市,2-62,志知472付近,志知消防団機具庫付近,34.3045222,134.744904,
兵庫県,南あわじ市,3-1,複列大楠列1177,あわじ島農協複列集荷場フェンス,34.2944897,134.7797816,
兵庫県,南あわじ市,3-2,複列大楠列876付近,大楠列公会堂南向かい　三角地,34.2944897,134.7797816,
兵庫県,南あわじ市,3-3,複列小楠列283付近,県道阿那賀・三原線（うずしおライン）小楠列交差点ガードパイプ,34.2944897,134.7797816,
兵庫県,南あわじ市,3-4,複列西川106付近,西川バス停留所前花壇（うずしおライン沿）ガードパイプ,34.2944897,134.7797816,
兵庫県,南あわじ市,3-5,複列上幡多690付近,小川原橋市道側道ガードパイプ,34.294399,134.779938,緯度経度は怪しい
兵庫県,南あわじ市,3-6,複列山所1190-4,山所公会堂敷地内ガードパイプ,34.2944897,134.7797816,
兵庫県,南あわじ市,3-7,複列下幡多432,複列保育所前歩道沿ガードパイプ,34.294399,134.779938,緯度経度は怪しい
兵庫県,南あわじ市,3-8,複列掃守261-1,掃守公会堂敷地内フェンス,34.294399,134.779938,緯度経度は怪しい
兵庫県,南あわじ市,3-9,複列掃守19-1付近,複列バスストップ側道フェンス（高速道路高架下）,34.294399,134.779938,緯度経度は怪しい
兵庫県,南あわじ市,3-10,複列松田8-10付近,松田信号横（三原川・松田橋）ガードパイプ,34.2944897,134.7797816,
兵庫県,南あわじ市,3-11,複列山所871-3付近,長田川二宮橋入口（子育て学習・支援センター近く県道沿）（原田商店前）,34.2944897,134.7797816,
兵庫県,南あわじ市,3-12,八木馬回322付近,成相橋欄干,34.2820368,134.8101787,
兵庫県,南あわじ市,3-13,八木寺内162-1,寺内公会堂北側フェンス,34.284538,134.789825,緯度経度は怪しい
兵庫県,南あわじ市,3-14,八木大久保590,八木小学校校庭南側フェンス,34.2937022,134.7940838,
兵庫県,南あわじ市,3-15,八木寺内1216付近,南あわじ市温水プール駐車場,34.27954810000001,134.7841431,
兵庫県,南あわじ市,3-16,八木鳥井388,八木コミュニティパークガードパイプ,34.2970665,134.7908676,
兵庫県,南あわじ市,3-17,八木立石51付近,真野印刷横　駐車場フェンス,34.293034,134.782928,緯度経度は怪しい
兵庫県,南あわじ市,3-18,八木国分18-2付近,矢の池市道ガードパイプ,34.2956409,134.7821758,
兵庫県,南あわじ市,3-19,八木新庄42付近,新庄消防屯所前（藤本衣料品店近く）,34.3018905,134.7779911,
兵庫県,南あわじ市,3-20,八木野原432-2付近,野原消防屯所（蔵本石油近く）フェンス,34.30233,134.784073,緯度経度は怪しい
兵庫県,南あわじ市,3-21,八木徳野175付近,成相川堤防ガードレール,34.3043859,134.7889098,
兵庫県,南あわじ市,3-22,八木入田239,入田公会堂（門柱付近）,34.312077,134.791306,緯度経度は怪しい
兵庫県,南あわじ市,3-23,八木養宜中184-1付近,中八木バス停留所ガードパイプ（千博屋前）,34.307419,134.796524,緯度経度は怪しい
兵庫県,南あわじ市,3-24,八木養宜中353付近,県道から技術センターへの市道沿いガードレール,34.3051517,134.7971063,
兵庫県,南あわじ市,3-25,八木養宜上915付近,養宜上会館（旧八木文化創造館）フェンス,34.3000924,134.8034294,
兵庫県,南あわじ市,3-26,八木養宜上250付近,うずしおライン　イングランドの丘入口交差点ガードパイプ,34.3044927,134.8060879,
兵庫県,南あわじ市,3-27,八木養宜上1114-5,橋本製瓦所入口,34.305902,134.8082645,
兵庫県,南あわじ市,3-28,市青木198-2,青木公会堂（健康広場下　市道沿）フェンス,34.281925,134.777817,緯度経度は怪しい
兵庫県,南あわじ市,3-29,市善光寺262-1付近,淡路マルキ㈱専用駐車場敷地内,34.2951017,134.7702426,
兵庫県,南あわじ市,3-30,市福永418,福永公会堂横ガードパイプ,34.2870425,134.7722347,
兵庫県,南あわじ市,3-31,市福永358-1,旧市役所三原庁舎跡地前,34.2897454,134.7687262,
兵庫県,南あわじ市,3-32,市市70-5付近,戎神社前（市コミュニティセンター向かい）,34.293617,134.766953,緯度経度は怪しい
兵庫県,南あわじ市,3-33,市円行寺150,パルティ入口（三原川沿い市道ガードパイプ）,34.289604,134.779051,
兵庫県,南あわじ市,3-34,市十一ケ所398-1,野辺宮神社敷地内,34.297771,134.768997,緯度経度は怪しい
兵庫県,南あわじ市,3-35,市小井296付近,masked,34.2910085,134.7764072,
兵庫県,南あわじ市,3-36,市徳長187付近,丸田池フェンス（徳長公会堂横）,34.29895,134.755936,緯度経度は怪しい
兵庫県,南あわじ市,3-37,市新340,新公会堂前ブロック塀,34.2925992,134.754162,
兵庫県,南あわじ市,3-38,市三條886,市こども園西側鉄塔向ガードレール,34.2885761,134.7686056,
兵庫県,南あわじ市,3-39,市三條1139,三條市営住宅フェンス,34.2819721,134.7701433,
兵庫県,南あわじ市,3-40,市善光寺22-1,南あわじ市市役所駐車場向　三原川ガードレール,34.294712,134.774277,緯度経度は怪しい
兵庫県,南あわじ市,3-41,神代社家858付近,落合橋手前ガードレール,34.2740632,134.7905878,
兵庫県,南あわじ市,3-42,神代社家771,段公会堂敷地内フェンス,34.2766735,134.786804,
兵庫県,南あわじ市,3-43,神代社家934付近,中原橋ガードレール,34.267357,134.794159,緯度経度は怪しい
兵庫県,南あわじ市,3-44,神代浦壁198-1,浦壁大池沿い市道カ－ドレ－ル,34.2701453,134.7871798,
兵庫県,南あわじ市,3-45,神代浦壁469-1付近,オニオンロード浦壁集落入口,34.2751394,134.7839489,
兵庫県,南あわじ市,3-46,神代社家375付近,社家ごみステーション（社家公会堂に隣接）向かい,34.2772673,134.7967711,
兵庫県,南あわじ市,3-47,神代富田37-4付近,masked,34.2757725,134.7779996,
兵庫県,南あわじ市,3-48,神代地頭方1496-1,神代保育所フェンス,34.2779754,134.7707149,
兵庫県,南あわじ市,3-49,神代喜来1付近,masked,34.274269,134.771698,緯度経度は怪しい
兵庫県,南あわじ市,3-50,神代地頭方711付近,地頭方八幡神社前 市道ガードレール,34.2790984,134.7589106,
兵庫県,南あわじ市,3-51,神代地頭方1598付近,セリア横 国道沿ブロック塀,34.27946170000001,134.763927,
兵庫県,南あわじ市,3-52,神代国衙1548-1,masked,34.2696026,134.7632346,
兵庫県,南あわじ市,3-53,神代国衙918,鎮守神社敷地内,34.272427,134.7572535,
兵庫県,南あわじ市,3-54,倭文流111付近,倭文川小石橋横（県道ガードパイプ）,34.3285301,134.7740173,
兵庫県,南あわじ市,3-55,倭文委文284付近,やましん呉服店近く（県道ガードパイプ）,34.333988,134.7787536,
兵庫県,南あわじ市,3-56,倭文高305付近,倭文野菜集荷場前（西より）市道沿（高畠産団地前）,34.3331333,134.7714929,
兵庫県,南あわじ市,3-57,志知松本388付近,市道志知纏貫線沿空き地（松本ゲートボール場）,34.2997387,134.7475741,
兵庫県,南あわじ市,3-58,志知佐礼田22-1付近,佐礼尾ごみステーション擁壁,34.29427,134.740219,緯度経度は怪しい
兵庫県,南あわじ市,3-59,志知難波376-2付近,市道三条佐礼尾線・市道志知纏貫線交差点（河内工務店西）ガードレール,34.2937517,134.7466051,
兵庫県,南あわじ市,3-60,志知中島822-3付近,山路川新宮下橋横（県道沿）ガードレール,34.2903235,134.7423966,
兵庫県,南あわじ市,3-61,志知中島233付近,大炊神社敷地内東側道路沿,34.2884386,134.7482064,
兵庫県,南あわじ市,3-62,志知中島518,あわじ島農協志知ライス予冷センターフェンス,34.28272,134.7484093,
兵庫県,南あわじ市,4-1,賀集1151-1,賀集支所購買店舗サプライ・倉庫 フェンス,34.264919,134.746796,緯度経度は怪しい
兵庫県,南あわじ市,4-2,賀集1053,賀集地区公民館前ガードレール,34.26247790000001,134.7526247,
兵庫県,南あわじ市,4-3,賀集野田348-3付近,masked,34.2678385,134.7565852,
兵庫県,南あわじ市,4-4,賀集福井233-13付近,当麻陵前バス停 ガードパイプ,34.2557172,134.7530083,
兵庫県,南あわじ市,4-5,賀集福井1810-2,福井北集会所 フェンス,34.255383,134.758041,緯度経度は怪しい
兵庫県,南あわじ市,4-6,賀集福井1145,masked,34.2519521,134.7633991,
兵庫県,南あわじ市,4-7,賀集生子1,生子神社前 ガードレール,34.2538635,134.7655472,
兵庫県,南あわじ市,4-8,賀集中内359付近,牛内公会堂前 ガードパイプ,34.264919,134.746796,緯度経度は怪しい
兵庫県,南あわじ市,4-9,賀集内ヶ原129,masked,34.2560879,134.7709435,
兵庫県,南あわじ市,4-10,賀集八幡290-5,賀集八幡西交差点付近ちらウォーク駐車場手前,34.268517,134.7369708,
兵庫県,南あわじ市,4-11,賀集八幡163付近,八幡南公会堂横 県道ガードパイプ,34.268517,134.7369708,
兵庫県,南あわじ市,4-12,賀集八幡中310,山本隆商店倉庫前 県道ガードパイプ,34.276562,134.740768,緯度経度は怪しい
兵庫県,南あわじ市,4-13,賀集八幡北374-2,八幡北公会堂前フェンス,34.282505,134.742569,緯度経度は怪しい
兵庫県,南あわじ市,4-14,賀集立川瀬4-1,masked,34.270455,134.7481984,
兵庫県,南あわじ市,4-15,賀集八幡83-1付近,賀集交差点北側市道ガードレール,34.2696532,134.7489634,
兵庫県,南あわじ市,4-16,福良甲644-1,福良口交差点 潮美台側市道端ガードパイプ,34.260643,134.729385,緯度経度は怪しい
兵庫県,南あわじ市,4-17,福良甲897-1付近,masked,34.265987,134.719849,緯度経度は怪しい
兵庫県,南あわじ市,4-18,福良甲512,旧市役所南淡庁舎跡地北東側 道路柵,34.2577945,134.721233,
兵庫県,南あわじ市,4-19,福良512-2付近,福良地区公民館前 国道端駐車場フェンス,34.261902,134.708878,緯度経度は怪しい
兵庫県,南あわじ市,4-20,福良乙757付近,ふくら荘進入路入口,34.2583764,134.7182662,
兵庫県,南あわじ市,4-21,福良甲1207付近,B&Gラウンド進入路入口ガードレール,34.2608134,134.7197865,
兵庫県,南あわじ市,4-22,福良乙89付近,なると薬局前駐車場ブロック塀,34.2578604,134.7168715,
兵庫県,南あわじ市,4-23,福良乙125付近,古波止橋手前道路北側ガードパイプ,34.2557484,134.7175278,
兵庫県,南あわじ市,4-24,福良乙1047付近,福良小学校北信号付近ガードパイプ,34.265881,134.709183,緯度経度は怪しい
兵庫県,南あわじ市,4-25,福良乙275付近,古城医院跡地,34.2576467,134.7156612,
兵庫県,南あわじ市,4-26,福良乙280,旧浦瀬医院塀,34.2566275,134.7142416,
兵庫県,南あわじ市,4-27,福良乙1205,福良小学校南側入口フェンス,34.2581251,134.7123842,
兵庫県,南あわじ市,4-28,福良乙1658-13付近,masked,34.2549891,134.7132263,
兵庫県,南あわじ市,4-29,福良乙1260付近,原田造成地 沢田設備前擁壁,34.259701,134.70723,緯度経度は怪しい
兵庫県,南あわじ市,4-30,福良乙1652付近,波止の浜公園フェンス,34.2545562,134.7121722,
兵庫県,南あわじ市,4-31,福良丙28,市営福良住宅 南側フェンス,34.25185,134.70871,緯度経度は怪しい
兵庫県,南あわじ市,4-32,福良丙82-2,masked,34.2507367,134.7060215,
兵庫県,南あわじ市,4-33,福良丙795付近,仁尾バス停北側ガードレール,34.257835,134.698975,緯度経度は怪しい
兵庫県,南あわじ市,4-34,福良丙501付近,サンビーチかるも前フェンス,34.2481149,134.690207,
兵庫県,南あわじ市,4-35,北阿万筒井1228-7,北阿万地区公民館前フェンス,34.2484686,134.7504875,
兵庫県,南あわじ市,4-36,北阿万筒井991,masked,34.249611,134.741135,緯度経度は怪しい
兵庫県,南あわじ市,4-37,北阿万筒井1967地先,高原公会堂東側県道バイパス交差点付近ガードパイプ,34.244003,134.742416,緯度経度は怪しい
兵庫県,南あわじ市,4-38,北阿万新田20-2,masked,34.246559,134.756653,緯度経度は怪しい
兵庫県,南あわじ市,4-39,北阿万新田北242,masked,34.2510523,134.7567918,
兵庫県,南あわじ市,4-40,北阿万稲田南655-1,masked,34.24148479999999,134.7594328,
兵庫県,南あわじ市,4-41,北阿万新田中66-1付近,あわじ島農協共同出荷センター前,34.2445316,134.7495536,
兵庫県,南あわじ市,4-42,北阿万伊賀野575,伊賀野会館前駐車場フェンス,34.23719,134.744934,緯度経度は怪しい
兵庫県,南あわじ市,4-43,北阿万伊賀野1290,ダントー㈱駐車場ブロック塀,34.2375043,134.7490795,
兵庫県,南あわじ市,4-44,潮美台1-17付近,潮美台西公園ガードパイプ,34.2519997,134.7305225,
兵庫県,南あわじ市,4-45,潮美台1-26,さゆり幼稚園　西側道路ガードレール,34.2519997,134.7305225,
兵庫県,南あわじ市,4-46,潮美台2-23,潮美台東公園フェンス,34.2542603,134.7328674,
兵庫県,南あわじ市,4-47,潮美台2-22,潮美台北側入口　道路沿い,34.2542603,134.7328674,
兵庫県,南あわじ市,4-48,潮美台3-1,南淡中学校フェンス,34.2511371,134.7342426,
兵庫県,南あわじ市,4-49,阿万上町393付近,亀岡八幡神社（旧県道端石積）,34.2238057,134.7394825,
兵庫県,南あわじ市,4-50,阿万上町1600付近,県道バイパス付近平万上町交差点ガードパイプ,34.2334593,134.7366209,
兵庫県,南あわじ市,4-51,阿万上町507付近,大歳神社フェンス,34.22179,134.745148,緯度経度は怪しい
兵庫県,南あわじ市,4-52,阿万塩屋町2299,谷川茂廣橋所有倉庫,34.235933,134.7328308,
兵庫県,南あわじ市,4-53,阿万下町424,阿万地区公民館講堂前,34.218552,134.732178,緯度経度は怪しい
兵庫県,南あわじ市,4-54,阿万下町420,阿万小学校北側フェンス,34.2225454,134.736348,
兵庫県,南あわじ市,4-55,阿万下町458,masked,34.21983,134.739441,緯度経度は怪しい
兵庫県,南あわじ市,4-56,阿万塩屋町97,塩屋川沿い市道ガードレール（中村橋東側）,34.229141,134.722336,緯度経度は怪しい
兵庫県,南あわじ市,4-57,阿万塩屋町853-1,四季の丘団地駐車場（市道沿いフェンス）,34.229141,134.722336,緯度経度は怪しい
兵庫県,南あわじ市,4-58,阿万塩屋町670付近,中西橋北詰　道路沿いガードレール,34.2201914,134.7246412,
兵庫県,南あわじ市,4-59,阿万塩屋町537-2付近,黒田木材手前県道　擁壁,34.216518,134.725662,緯度経度は怪しい
兵庫県,南あわじ市,4-60,阿万吹上町27-1付近,吹上馬場三角地ガードレール,34.222304,134.7172728,
兵庫県,南あわじ市,4-61,阿万西町285-3付近,新川橋南詰ガードパイプ,34.2155804,134.7332155,
兵庫県,南あわじ市,4-62,阿万西町342-1,西町構造改善センター前ガードレール,34.2123762,134.7313652,
兵庫県,南あわじ市,4-63,阿万西町744付近,汐後橋東側市道石積,34.203274,134.734207,緯度経度は怪しい
兵庫県,南あわじ市,4-64,阿万西町851付近,丸田公会堂前ガードレール,34.2026435,134.7388688,
兵庫県,南あわじ市,4-65,阿万東町306-2,ヘアーサロンキダ向い　敷地フェンス,34.2085388,134.732391,
兵庫県,南あわじ市,4-66,阿万東町1005付近,masked,34.207855,134.736237,緯度経度は怪しい
兵庫県,南あわじ市,4-67,阿万東町14-1付近,丸山洋服店横ガードパイプ,34.2109134,134.7384886,
