prefecture,city,number,address,name,lat,long,note
兵庫県,南あわじ市,4-68,灘城方2,城方集落進入口石垣（バス停付近）,34.21056,134.808334,緯度経度は怪しい
兵庫県,南あわじ市,4-69,灘油谷159-2付近,払川及び油谷集落進入三叉路の市道擁壁,34.207222,134.803802,緯度経度は怪しい
兵庫県,南あわじ市,4-70,灘円実128-1-2,あわじ島農協灘支所,34.20528,134.79306,緯度経度は怪しい
兵庫県,南あわじ市,4-71,灘土生1,灘地区公民館前,34.206985,134.781174,緯度経度は怪しい
兵庫県,南あわじ市,4-72,灘土生426付近,大川公会堂前フェンス,34.206985,134.781174,緯度経度は怪しい
兵庫県,南あわじ市,4-73,灘黒岩359付近,黒岩集落倉庫北側　ガードレール,34.229599,134.825699,緯度経度は怪しい
兵庫県,南あわじ市,4-74,灘惣川358-3付近,惣川集落進入口　擁壁,34.21891,134.824051,緯度経度は怪しい
兵庫県,南あわじ市,4-75,灘吉野511付近,吉野会館横ガードパイプ,34.217236,134.820175,緯度経度は怪しい
兵庫県,南あわじ市,4-76,灘山本326付近,県道灘三原線入口　長田橋横ガードレール,34.216129,134.811935,緯度経度は怪しい
兵庫県,南あわじ市,4-77,灘白崎4,白崎会館前ガードレール,34.238609,134.847168,緯度経度は怪しい
兵庫県,南あわじ市,4-78,灘地野151,地野公会堂前ブロック,34.2005567,134.7612632,
兵庫県,南あわじ市,4-79,灘仁頃136付近,市道東町地野線　仁頃集落進入口三叉路擁壁,34.192894,134.744781,緯度経度は怪しい
兵庫県,南あわじ市,4-80,灘来川33付近,来川集落進入口ガードレール,34.24369,134.862244,緯度経度は怪しい
兵庫県,南あわじ市,4-81,沼島2368,沼島総合センター前,34.167973,134.82518,緯度経度は怪しい
兵庫県,南あわじ市,4-82,沼島899付近,木村屋旅館前　河川ガードパイプ,34.167973,134.82518,緯度経度は怪しい
兵庫県,南あわじ市,4-83,沼島233-2付近,masked,34.167973,134.82518,緯度経度は怪しい
兵庫県,南あわじ市,4-84,沼島2157,魚谷商店前ガードパイプ,34.167973,134.82518,緯度経度は怪しい
兵庫県,南あわじ市,4-85,沼島2141,masked,34.167973,134.82518,緯度経度は怪しい
