prefecture,city,number,address,name,lat,long
大阪府,松原市,1-1,松原市上田1丁目7番,上田1丁目7番地内駐車場北側植栽部,34.576911839301,135.55453598499
大阪府,松原市,1-2,松原市上田3丁目5番,吉田印刷南側近鉄南大阪線ブロック塀,34.575666271301,135.55770635605
大阪府,松原市,1-3,松原市上田3丁目5番,河内松原駅前交番横,34.575418922244,135.55629014969
大阪府,松原市,1-4,松原市上田7丁目12番,柴垣神社東側ガードレール（電柱より南側）,34.571889701062,135.56012570858
大阪府,松原市,1-5,松原市新堂1丁目589番,総合福祉会館駐車場西側車止め,34.572008963798,135.55099546909
大阪府,松原市,1-6,松原市新堂1丁目,生野高校グラウンド南側道路防護柵,34.570856083517,135.55442869663
大阪府,松原市,1-7,松原市上田5丁目1番,松原中学校北側道路防護柵,34.573484273867,135.55443406105
大阪府,松原市,2-1,松原市岡2丁目616番,三輪龍教会駐車場北側フェンス,34.565294647204,135.55609703064
大阪府,松原市,2-2,松原市新堂3丁目9番,新堂公民館前道路防護柵,34.568324991426,135.55488467216
大阪府,松原市,2-3,松原市新堂4丁目,新堂公園調整池フェンス,34.566204645555,135.55292129517
大阪府,松原市,2-4,松原市新堂4丁目,宮ノ池北側歩道防護柵,34.565250472274,135.55336117744
大阪府,松原市,2-5,松原市柴垣1丁目7番,masked,34.56740618152,135.55727720261
大阪府,松原市,2-6,松原市新堂2丁目683番,松原小学校側フェン,34.571938289605,135.55579662323
大阪府,松原市,2-7,松原市柴垣1丁目,鯉野池オアシス広場北側フェンス,34.569932884334,135.55869340897
大阪府,松原市,3-1,松原市岡3丁目8番,松永歯科医院東側畑北側フェンス,34.56548901662,135.55852174759
大阪府,松原市,3-2,松原市岡2丁目5番,masked,34.56445531951,135.55616140366
大阪府,松原市,3-3,松原市岡4丁目1番,松原南小学校北側ブロック塀,34.563651323986,135.55854320526
大阪府,松原市,3-4,松原市岡3丁目8番,わかばこども園西側フェンス,34.564592263028,135.55404782295
大阪府,松原市,3-5,松原市岡5丁目7番,正寺西側ブロック塀,34.561963791619,135.55567860603
大阪府,松原市,3-6,松原市岡5丁目4番,岡公園南側道路防護柵,34.560806354337,135.55485248566
大阪府,松原市,3-7,松原市岡6丁目6番,masked,34.560793101145,135.5565905571
大阪府,松原市,4-1,松原市立部1丁目6番,新田米穀店南西側アパートフェンス,34.564274200317,135.56167602539
大阪府,松原市,4-2,松原市立部2丁目,田駐車場南向かい水路防護柵,34.56236579851,135.56337118149
大阪府,松原市,4-3,松原市立部5丁目9番,masked,34.560748923824,135.56458890438
大阪府,松原市,4-4,松原市立部1丁目,岡沢モータープール西側道路防護柵,34.561212784531,135.5608767271
大阪府,松原市,4-5,松原市立部5丁目4番,masked,34.560881455718,135.56053340435
大阪府,松原市,4-6,松原市立部5丁目6番,立部5丁目児童遊園南東側防護柵,34.560709164214,135.56287229061
大阪府,松原市,4-7,松原市立部5丁目4番,masked,34.559909550254,135.56102156639
大阪府,松原市,5-1,松原市西大塚1丁目,大塚御陵北側道路ガードレール,34.573952480571,135.56588172913
大阪府,松原市,5-2,松原市西大塚1丁目8番,大阪ガス整圧器東側フェンス,34.573819969507,135.56490004063
大阪府,松原市,5-3,松原市西大塚1丁目12番,masked,34.573307591406,135.56518435478
大阪府,松原市,5-4,松原市西大塚1丁目松原市西大塚1丁目8番松原市西大塚1丁目12番松原市西大塚1丁目,大塚御陵西側道路フェンス,34.572724536622,135.56604266167
大阪府,松原市,5-5,松原市西大塚1丁目,大塚御陵フェンス南角道路ガードレール,34.571134366428,135.56705117226
大阪府,松原市,5-6,松原市立部3丁目,大塚青少年運動広場駐車場植栽部,34.567644719683,135.5677485466
大阪府,松原市,5-7,松原市西大塚2丁目,南口第2駐車場前倉庫東側畑,34.568192471393,135.56528091431
大阪府,松原市,6-1,松原市阿保5丁目20番,阿保浄水場南側ブロック塀,34.58430094224,135.55650472641
大阪府,松原市,6-2,松原市阿保2丁目,内松寿苑横駐車場西側水路フェンス,34.582874406292,135.5534952879
大阪府,松原市,6-3,松原市阿保6丁目10番,阿保東部第1公園東側フェンス,34.582609412398,135.5595356226
大阪府,松原市,6-4,松原市阿保5丁目3番,阿保公民館北側道路防護柵,34.581174014119,135.55613994598
大阪府,松原市,6-5,松原市阿保6丁目1番,阿保6丁目1番地内南西部水路防護柵,34.581421346052,135.55697143078
大阪府,松原市,6-6,松原市松ヶ丘2丁目20番,阿保東部第二公園北側フェンス,34.582556413518,135.56314587593
大阪府,松原市,6-7,松原市松ヶ丘2丁目15番,松ヶ丘2丁目児童遊園南側,34.580966431393,135.5609947443
大阪府,松原市,7-1,松原市阿保3丁目14番,大阪老人ホーム南隣の駐車場の東側フェンス,34.579036328886,135.55448770523
大阪府,松原市,7-2,松原市阿保3丁目6番,コーマ(株)南側ブロック塀,34.577861461939,135.55506706238
大阪府,松原市,7-3,松原市阿保1丁目1番,松原市役所前,34.578179472677,135.55100619793
大阪府,松原市,7-4,松原市阿保1丁目16番,松原北小学校東側道路防護柵,34.57928366718,135.5525135994
大阪府,松原市,7-5,松原市阿保3丁目8番,阿保公園(西側),34.578011633828,135.55320560932
大阪府,松原市,7-6,松原市阿保3丁目8番,阿保公園(南側),34.577896796525,135.5533772707
大阪府,松原市,7-7,松原市阿保4丁目,海泉池西側歩道防護柵,34.580401097085,135.5554318428
大阪府,松原市,8-1,松原市高見の里1丁目3番,3番地内近鉄南大阪線線路ブロック塀,34.573546112639,135.54867267609
大阪府,松原市,8-2,松原市高見の里1丁目9番,9番地内近鉄南大阪線線路ブロック塀,34.575348250949,135.54783582687
大阪府,松原市,8-3,松原市高見の里3丁目,高見の里3丁目3番地内鉄塔西側フェンス,34.57488888607,135.54392516613
大阪府,松原市,8-4,松原市高見の里2丁目,masked,34.576001958131,135.54503560066
大阪府,松原市,8-5,松原市高見の里4丁目13番,高見の里4丁目13番地内南東部道路防護柵,34.573245752456,135.5488550663
大阪府,松原市,8-6,松原市高見の里3丁目12番,スーパーマーケット南向かい道路ガードレール,34.573192747605,135.54527163506
大阪府,松原市,8-7,松原市高見の里3丁目12番,西田耳鼻咽喉科駐車場南側フェンス(目かくし部分),34.572486013032,135.54512143135
大阪府,松原市,9-1,松原市田井城2丁目2番,サンシティ松原の公園南側フェンス,34.580984098028,135.54881751537
大阪府,松原市,9-2,松原市田井城4丁目25番,セブンイレブン松原高見の里2丁目店北道路防護柵,34.577958632016,135.5451053381
大阪府,松原市,9-3,松原市田井城5丁目5番,田神社東側フェンス,34.581982256815,135.54636597633
大阪府,松原市,9-4,松原市田井城5丁目15番,田井城公民館北側フェンス,34.581271180323,135.54492294788
大阪府,松原市,9-5,松原市田井城3丁目,西モータープール北向かい道路ガードレール,34.579968260406,135.54664492607
大阪府,松原市,9-6,松原市田井城4丁目9番,マンション田井城駐車場北側フェンス,34.580246512816,135.54446697235
大阪府,松原市,9-7,松原市田井城3丁目1番,松原市民図書館南側転落防止柵,34.577039928569,135.54812014103
大阪府,松原市,10-1,松原市東新町4丁目1番,駅前プラザ町会公園西側,34.576434815464,135.54359793663
大阪府,松原市,10-2,松原市東新町3丁目1番,松原第三中学校グランド西側通用門南側フェンス,34.578002800195,135.54158627987
大阪府,松原市,10-3,松原市東新町3丁目5番,アーバンコンフォート南側道路防護柵,34.576903005551,135.54241776466
大阪府,松原市,10-4,松原市東新町4丁目16番,布忍駅南側近鉄南大阪線線路沿いの防護柵,34.576487818247,135.53999304771
大阪府,松原市,10-5,松原市東新町4丁目13番,(株)匠工房東側駐車場南側フェンス,34.574963974733,135.54126441479
大阪府,松原市,10-6,松原市東新町5丁目10番,東新町公園西側,34.574031987108,135.5419832468
大阪府,松原市,10-7,松原市東新町4丁目16番,東新町四丁目児童遊園北側フェンス,34.576848,135.53948
大阪府,松原市,11-1,松原市南新町2丁目141番,人権交流センター北側フェンス,34.572503681469,135.53881287575
大阪府,松原市,11-2,松原市南新町2丁目141番,人権交流センター東側フェンス,34.572119392105,135.53917229176
大阪府,松原市,11-3,松原市南新町2丁目141番,人権交流センター側フェンス,34.571955958159,135.53774535656
大阪府,松原市,11-4,松原市南新町3丁目6番,市営更池第一団地北側植栽部,34.573766965022,135.53613066673
大阪府,松原市,11-5,松原市南新町3丁目9番,フレッシュミート岡田向かい道路防護柵,34.572759873392,135.5373108387
大阪府,松原市,11-6,松原市南新町3丁目11番,新町南公園南側出入口北側植栽部,34.571346390878,135.53550302982
大阪府,松原市,11-7,松原市河合5丁目,更池第二団地児童遊園北側受水槽前フェンス,34.570485038187,135.53626477718
大阪府,松原市,12-1,松原市北新町4丁目10番,西除川フェンス,34.585113570965,135.53080379963
大阪府,松原市,12-2,松原市北新町4丁目,masked,34.58391229091,135.52995622158
大阪府,松原市,12-3,松原市北新町4丁目,masked,34.582914155304,135.53080916405
大阪府,松原市,12-4,松原市北新町5丁目,masked,34.581840925326,135.53199470043
大阪府,松原市,12-5,松原市北新町3丁目,北新町大池公園西側道路防護柵,34.581081264454,135.53214490414
大阪府,松原市,12-6,松原市北新町3丁目6番,高木共同墓地東側西除川フェンス,34.581249097105,135.53452134132
大阪府,松原市,12-7,松原市北新町3丁目5番,布忍寺東側道路防護柵,34.579840175651,135.5343067646
大阪府,松原市,13-1,松原市天美西1丁目18番,masked,34.588562738139,135.52954852581
大阪府,松原市,13-2,松原市天美西1丁目18番,masked,34.588023953214,135.52897453308
大阪府,松原市,13-3,松原市天美西1丁目18番,masked,34.588386087729,135.52847027779
大阪府,松原市,13-4,松原市天美南6丁目,西除川河川敷河川防護柵(橋の東側),34.585745119324,135.52961289883
大阪府,松原市,13-5,松原市天美南6丁目,西除川河川敷河川防護柵(高木駐車場南側),34.585219565431,135.53151190281
大阪府,松原市,13-6,松原市天美東8丁目1番,河内天美駅北線路西側ブロック塀,34.587564658389,135.53471446037
大阪府,松原市,13-7,松原市天美東8丁目12番,天美小学校南側フェンス,34.587507246357,135.53238093853
大阪府,松原市,14-1,松原市天美我堂3丁目,天美我堂浄水場北側フェンス,34.582812574459,135.52481710911
大阪府,松原市,14-2,松原市天美我堂3丁目,松原第五中学校南側フェンス,34.581456679125,135.52544474602
大阪府,松原市,14-3,松原市天美我堂4丁目,我堂南第一公園東側フェンス,34.582216,135.525421
大阪府,松原市,14-4,松原市天美我堂2丁目,我堂南第三公園北側防護柵,34.578528399725,135.52283227444
大阪府,松原市,14-5,松原市天美我堂3丁目,我堂北第二公園西側フェンス,34.585352058322,135.52372813225
大阪府,松原市,14-6,松原市天美我堂3丁目,我堂北第二公園北側フェンス,34.585630292707,135.52418410778
大阪府,松原市,14-7,松原市天美我堂6丁目,我堂北第一公園南側柵,34.585753952134,135.52712917328
大阪府,松原市,14-8,松原市天美我堂2丁目,我堂南第二公園北側フェンス,34.578978910963,135.52524089813
大阪府,松原市,15-1,松原市天美南4丁目5番,消防署分署西側白色フェンス,34.580524764293,135.53587317467
大阪府,松原市,15-2,松原市天美南5丁目6番,楠本駐車場北側ブロック塀,34.584777920933,135.53509533405
大阪府,松原市,15-3,松原市天美南5丁目2番,高架下歩道フェンス,34.584172864162,135.53559422493
大阪府,松原市,15-4,松原市天美南4丁目9番,芝野敬二氏東側ブロック塀,34.583161482058,135.53564786911
大阪府,松原市,15-5,松原市天美南4丁目,西除川河川防護柵(13番地西側),34.582812574459,135.53388297558
大阪府,松原市,15-6,松原市天美南5丁目3番,堀櫻橋交差点北東側防護柵,34.583907874408,135.53316414356
大阪府,松原市,15-7,松原市天美南5丁目,西除川河川防護柵(高木橋北側信号機手前),34.584667509442,135.53262233734
大阪府,松原市,16-1,松原市天美東4丁目240番,天美北小学校北側フェンス,34.591790958235,135.53964972496
大阪府,松原市,16-2,松原市天美東4丁目240番,天美北小学校西側フェンス,34.591155039709,135.5390381813
大阪府,松原市,16-3,松原市天美東4丁目,大阪狭山線道路防護柵,34.590969562556,135.54077625275
大阪府,松原市,16-4,松原市天美東5丁目4番,阪南大学南東側白色フェンス(給湯器前フェンス),34.591141791355,135.53661346436
大阪府,松原市,16-5,松原市天美東6丁目16番,阪南大学来客用駐車場植栽部,34.591146207473,135.53440332413
大阪府,松原市,16-6,松原市天美東2丁目,天美東2丁目歩道防護柵,34.588801215596,135.53827106953
大阪府,松原市,16-7,松原市天美東6丁目11番,矢田第7号踏切東側府道大堀堺線道路防護柵,34.588946951484,135.53494513035
大阪府,松原市,17-1,松原市天美北3丁目2番,masked,34.596370311094,135.54047584534
大阪府,松原市,17-2,松原市天美北3丁目2番,masked,34.595257511824,135.5392742157
大阪府,松原市,17-3,松原市天美北3丁目19番,水路防護柵,34.595760922864,135.53592681885
大阪府,松原市,17-4,松原市天美北4丁目2番,ぐるりん号バス停(天美北2丁目)前道路防護柵,34.59662642945,135.54284691811
大阪府,松原市,17-5,松原市天美北5丁目3番,防災倉庫南向かい河川沿い道路防護柵,34.596423301163,135.53445696831
大阪府,松原市,17-6,松原市天美北8丁目1番,masked,34.594736434025,135.53202152252
大阪府,松原市,17-7,松原市天美北5丁目6番,天美北第一公園南側防護柵,34.594709938456,135.53387761116
大阪府,松原市,18-1,松原市天美西3丁目3番,天美ランド児童公園,34.593879739693,135.52844882011
大阪府,松原市,18-2,松原市天美西4丁目,天美西防災備蓄センター東側道路防護柵,34.592970044287,135.52693068981
大阪府,松原市,18-3,松原市天美西4丁目,天美西小学校北東側フェンス,34.589622632712,135.52595973015
大阪府,松原市,18-4,松原市天美西5丁目,masked,34.590753172021,135.5268073082
大阪府,松原市,18-5,松原市天美西2丁目4番,犬印本舗西側ブロック塀,34.590033338224,135.52805185318
大阪府,松原市,18-6,松原市天美西2丁目8番,masked,34.590788501126,135.52906572819
大阪府,松原市,18-7,松原市天美西3丁目1番,土橋氏駐車場南側フェンス,34.591773293897,135.52926421165
大阪府,松原市,19-1,松原市三宅東2丁目,masked,34.588668728204,135.55969119072
大阪府,松原市,19-2,松原市三宅中4丁目6番,masked,34.590143742586,135.55576980114
大阪府,松原市,19-3,松原市三宅中4丁目1番,屯倉神社南側道路防護柵,34.588417001578,135.55512607098
大阪府,松原市,19-4,松原市三宅中2丁目14番,masked,34.587666233425,135.55470228195
大阪府,松原市,19-5,松原市三宅中3丁目8番,白石マンション駐車場南側フェンス,34.585926191744,135.55677831173
大阪府,松原市,19-6,松原市三宅中2丁目11番,masked,34.586672559263,135.55227220058
大阪府,松原市,19-7,松原市三宅中2丁目5番,白石児童公園東側フェンス,34.585131236719,135.55475056171
大阪府,松原市,20-1,松原市三宅中6丁目,masked,34.592841979571,135.5534362793
大阪府,松原市,20-2,松原市三宅中6丁目6番,masked,34.59178654215,135.5532592535
大阪府,松原市,20-3,松原市三宅中6丁目64番,masked,34.590386631664,135.55344164371
大阪府,松原市,20-4,松原市三宅中6丁目7番,masked,34.589004362521,135.55309295654
大阪府,松原市,20-5,松原市三宅中5丁目12番,309号線東側公園,34.588935,135.550802
大阪府,松原市,20-6,松原市三宅中4丁目,屯倉神社西側道路防護柵,34.588651063203,135.55459499359
大阪府,松原市,20-7,松原市三宅中7丁目5番,masked,34.594807088833,135.55356502533
大阪府,松原市,21-1,松原市若林1丁目1番,本了寺駐車場,34.589008778752,135.57949125767
大阪府,松原市,21-2,松原市大堀3丁目4番,恵我小学校北側ブロック塀,34.590519116317,135.57186841965
大阪府,松原市,21-3,松原市大堀3丁目4番,恵我小学校東側フェンス(プール横),34.589786031922,135.57284474373
大阪府,松原市,21-4,松原市大堀3丁目4番,東除川沿い防護柵(大堀町交番前),34.590519116317,135.57275354862
大阪府,松原市,21-5,松原市大堀2丁目7番,大堀上ノ池公園北側フェンス,34.586482655737,135.57112276554
大阪府,松原市,21-6,松原市小川5丁目26番,深居神社東側の公園南端,34.58713627535,135.57708799839
大阪府,松原市,21-7,松原市小川4丁目17番,奥地建産(株)南向いガードレール,34.586884544081,135.57876169682
大阪府,松原市,22-1,松原市別所8丁目12番,masked,34.590351302388,135.56786119938
大阪府,松原市,22-2,松原市別所6丁目6番,masked,34.589556389697,135.56473374367
大阪府,松原市,22-3,松原市別所6丁目5番,別所町公民館北側フェンス,34.589242838711,135.56427240372
大阪府,松原市,22-4,松原市別所6丁目12番,今池の北側フェンス,34.587343842666,135.56462109089
大阪府,松原市,22-5,松原市別所3丁目9番,第四中学校北側フェンス,34.585771617752,135.56611776352
大阪府,松原市,22-6,松原市別所3丁目19番,四中学校東側フェンス,34.585268146182,135.56788265705
大阪府,松原市,22-7,松原市別所5丁目12番,(株)石中鉄工第二工場西向い道路防護柵,34.587847301659,135.56802749634
大阪府,松原市,23-1,松原市一津屋4丁目7番,-津屋荘園会館北側フェンス,34.579645839783,135.57355821133
大阪府,松原市,23-2,松原市一津屋4丁目7番,一津屋荘園会館西側フェンス,34.579495670847,135.57345628738
大阪府,松原市,23-3,松原市一津屋4丁目5番,masked,34.57870065431,135.57335436344
大阪府,松原市,23-4,松原市一津屋4丁目18番,一津屋東公園北側植栽部,34.581240263816,135.57397127151
大阪府,松原市,23-5,松原市小川1丁目9番,masked,34.583784212233,135.57560741901
大阪府,松原市,23-6,松原市小川1丁目14番,三ツ池西側防護柵,34.583236563248,135.57740986347
大阪府,松原市,23-7,松原市小川1丁目4番,masked,34.582737492886,135.57743132114
大阪府,松原市,24-1,松原市丹南3丁目6番,丹南公民館北側玉垣,34.557952451613,135.55603265762
大阪府,松原市,24-2,松原市丹南3丁目6番,丹南公民館南側,34.557793407714,135.55530846119
大阪府,松原市,24-3,松原市丹南2丁目,masked,34.557788989824,135.5540317297
大阪府,松原市,24-4,松原市丹南4丁目,介護老人福祉施設寿里苑サラ植栽部,34.558332388585,135.56061387062
大阪府,松原市,24-5,松原市丹南4丁目,丹南公園南側,34.557965705258,135.55892944336
大阪府,松原市,24-6,松原市丹南4丁目,丹南町会総合会館北東側植栽部,34.555924619124,135.55964827538
大阪府,松原市,24-7,松原市丹南4丁目,丹南町会総合会館北西側道路防護柵,34.556039486773,135.55884361267
大阪府,松原市,25-1,松原市河合4丁目,河合小学校南側道路防護柵,34.568033447075,135.54213881493
大阪府,松原市,25-2,松原市河合2丁目,松原西幼稚園跡東側コンクリート塀,34.569544165821,135.54402172565
大阪府,松原市,25-3,松原市河合1丁目,西除川遊歩道河川防護柵,34.570887003887,135.54570615292
大阪府,松原市,25-4,松原市河合4丁目,阪南大学高等学校高見の里グラウンド東側ブロック塀,34.570595468518,135.54196715355
大阪府,松原市,25-5,松原市河合1丁目,聖堂橋西側歩道植栽部,34.56642993487,135.54737985134
大阪府,松原市,25-6,松原市河合1丁目12番,河合公園東側フェンス,34.567247155698,135.54644107819
大阪府,松原市,25-7,松原市河合1丁目7番,河合公園北道路植栽フェンス,34.56851935376,135.54633378983
大阪府,松原市,26-1,松原市天美東7丁目,河内天美駅前自転車置場鉄柵,34.58689337677,135.53531527519
大阪府,松原市,26-2,松原市天美東7丁目,天美駅前公園敷地西側,34.588112278851,135.53739666939
大阪府,松原市,26-3,松原市天美東7丁目,天美駅前公園敷地南側,34.587993039219,135.53771317005
大阪府,松原市,26-4,松原市天美東7丁目8番,りそな銀行天美支店前歩道防護柵,34.586871295046,135.53615748882
大阪府,松原市,26-5,松原市天美南3丁目15番,masked,34.584667509442,135.53674757481
大阪府,松原市,26-6,松原市天美南3丁目2番地内,堀町駐車場の南向い道路防護柵,34.583863709366,135.53706943989
大阪府,松原市,26-7,松原市天美南2丁目197番地内,青い鳥学園西側畑南側フェンス,34.584212612552,135.54013252258
大阪府,松原市,27-1,松原市高見の里6丁目2番,masked,34.571602586367,135.54673612118
大阪府,松原市,27-2,松原市高見の里6丁目,河合橋北東側河川防護柵,34.56951766222,135.5470687151
大阪府,松原市,27-3,松原市新堂5丁目,尻池道路防護柵,34.56528581222,135.55035710335
大阪府,松原市,27-4,松原市新堂5丁目,松原西小学校進入路大阪ガス整圧器フェンス,34.56637250824,135.55045366287
大阪府,松原市,27-5,松原市新堂5丁目,松原市民運動広場北側西除川遊歩道防護柵,34.564419979211,135.54968118668
大阪府,松原市,27-6,松原市高見の里6丁目,23番地南側ガードレール,34.568925746261,135.54959535599
大阪府,松原市,27-7,松原市高見の里6丁目,大阪ガス整圧器フェンス,34.570538044765,135.55066823959
大阪府,松原市,28-1,松原市北新町6丁目145番,木下ガレージ西向いガードレール,34.578064635606,135.53201079369
大阪府,松原市,28-2,松原市北新町6丁目144番,masked,34.576982509266,135.53199470043
大阪府,松原市,28-3,松原市南新町5丁目13,masked,34.576589406822,135.5320161581
大阪府,松原市,28-4,松原市南新町6丁目4番,清水町児童公園北東寄りフェンス,34.577428612035,135.53256869316
大阪府,松原市,28-5,松原市南新町5丁目12番,デイリーショップ・ホリカワ(パン屋)の北の水路沿いガードレール,34.575524929073,135.53193032742
大阪府,松原市,28-6,松原市北新町6丁目19番,清水ヶ丘公民館横公園南側道路防護柵,34.576876504296,135.52901744843
大阪府,松原市,28-7,松原市南新町5丁目3番,布忍小学校グラウンドの南側フェンス,34.574791712405,135.53461790085
大阪府,松原市,29-1,松原市天美東1丁目82番,五百橋の南側河川沿道路防護柵,34.588439082891,135.54260015488
大阪府,松原市,29-2,松原市三宅西2丁目,松原第二中学校正門ブロック塀,34.587847301659,135.54463863373
大阪府,松原市,29-3,松原市三宅西2丁目,松原第二中学校西側フェンス,34.587502830046,135.54388225079
大阪府,松原市,29-4,松原市三宅西2丁目,松原第二中学校南西側フェンス,34.586116096542,135.54389834404
大阪府,松原市,29-5,松原市天美東1丁目6番,masked,34.586880127736,135.54030954838
大阪府,松原市,29-6,松原市天美東1丁目,椿原商会北向いガードレール,34.586906625802,135.54224610329
大阪府,松原市,29-7,松原市天美南1丁目,masked,34.583717964564,135.54151117802
大阪府,松原市,30-1,松原市松ヶ丘1丁目,松原スイミングスクール向かい側道路防護柵,34.576960424908,135.55866658688
大阪府,松原市,30-2,松原市松ヶ丘1丁目,ちびっこ広場西側フェンス,34.57720335252,135.56120932102
大阪府,松原市,30-3,松原市松ヶ丘1丁目,松ヶ丘1丁目第2児童遊園植込み部,34.579266000184,135.56006669998
大阪府,松原市,30-4,松原市松ヶ丘4丁目402番,内芝池氏駐車場南フェンス,34.577101764696,135.56221783161
大阪府,松原市,30-5,松原市西野々2丁目,内富士通ゼネラル南側ガードレール,34.5768941718,135.56466937065
大阪府,松原市,30-6,松原市西野々2丁目,西野々会館東側,34.577053179171,135.5659031868
大阪府,松原市,30-7,松原市西野々1丁目,ニューハイツ松原の西側フェンス,34.575441007011,135.56455135345
大阪府,松原市,31-1,松原市北新町2丁目6番,西除川公園東側フェンス,34.580061011313,135.53558886051
大阪府,松原市,31-2,松原市北新町1丁目5番,西除川フェンス(向井公民館前),34.57830314319,135.53733229637
大阪府,松原市,31-3,松原市南新町1丁目6番,布忍小学校南側フェンス,34.57478287843,135.53593218327
大阪府,松原市,31-4,松原市南新町1丁目6番,布忍小学校東側フェンス,34.575025812405,135.53531527519
大阪府,松原市,31-5,松原市南新町1丁15番,新町公民館東側河川防護柵,34.577062012905,135.53785264492
