prefecture,city,number,address,name,lat,long,note
宮城県,登米市,1,迫町佐沼字新大東54番地,大東公園フェンス,38.683811,141.196487,緯度経度は怪しい
宮城県,登米市,2,迫町佐沼字下田中25番地,登米市民病院東側花壇,38.687202,141.192307,緯度経度は怪しい
宮城県,登米市,3,迫町佐沼字上舟丁20番地1,登米市迫図書館,38.689743,141.195801,緯度経度は怪しい
宮城県,登米市,4,迫町佐沼字中江二丁目3番地1,東北労働金庫向い市道敷,38.689991,141.190155,緯度経度は怪しい
宮城県,登米市,5,迫町佐沼字内町63番地20,登米市歴史博物館南側歩道,38.69482,141.194748,緯度経度は怪しい
宮城県,登米市,6,迫町佐沼字中江二丁目6番地3,登米市役所前,38.691887,141.1875,緯度経度は怪しい
宮城県,登米市,7,迫町佐沼字萩洗一丁目14番地7,萩洗ふれあい公園,38.687489,141.181671,緯度経度は怪しい
宮城県,登米市,8,迫町佐沼字大網199番地1,迫大網住宅北側,38.679501,141.193436,緯度経度は怪しい
宮城県,登米市,9,迫町佐沼字江合3丁目5番地,江合集会所前フェンス,38.680772,141.1866437,
宮城県,登米市,10,迫町佐沼字駒木袋55番地,斉藤建業南側個人所有空地,38.683994,141.207809,緯度経度は怪しい
宮城県,登米市,11,迫町佐沼字光ヶ丘100番地1,光文堂倉庫脇,38.685585,141.205276,緯度経度は怪しい
宮城県,登米市,12,迫町佐沼字錦108番地,登米市立佐沼小学校西側入口,38.687615,141.2023319,
宮城県,登米市,13,迫町佐沼字末広59番地1,みやぎ登米農協デイサービスセンター西側フェンス,38.689735,141.204895,緯度経度は怪しい
宮城県,登米市,14,迫町佐沼字的場42番地3,masked,38.691833,141.202209,緯度経度は怪しい
宮城県,登米市,15,迫町佐沼字八幡一丁目3番地17,登米市迫武道館南側花壇,38.695049,141.199539,緯度経度は怪しい
宮城県,登米市,16,迫町佐沼字梅ノ木二丁目4番地1,迫梅ノ木公園多目的広場南側,38.696262,141.205658,緯度経度は怪しい
宮城県,登米市,17,迫町森字吐出地内,首無バス停付近市道敷,38.672749,141.218857,緯度経度は怪しい
宮城県,登米市,18,迫町森字西表195番地,登米市森公民館前,38.671677,141.215393,緯度経度は怪しい
宮城県,登米市,19,迫町森字平柳288番地,masked,38.679512,141.214096,緯度経度は怪しい
宮城県,登米市,20,迫町森字赤沼146番地,鈴木酒店北側ゲートボール場,38.684284,141.221939,緯度経度は怪しい
宮城県,登米市,21,迫町北方字舟橋前37番地1,宮城西濃運輸㈱跡地前国道敷,38.70565,141.182816,緯度経度は怪しい
宮城県,登米市,22,迫町北方字富永109番地2,北方公民館西側駐車場フェンス,38.703506,141.166428,緯度経度は怪しい
宮城県,登米市,23,迫町北方字土手の内地内,泥内生活センター向い市道敷,38.703506,141.166428,緯度経度は怪しい
宮城県,登米市,24,迫町北方字新下谷地114番地,迫新下谷地住宅駐車場フェンス,38.7147688,141.1718745,緯度経度は怪しい
宮城県,登米市,25,迫町北方字二番江地内,新大瀬・新一番江線市道敷,38.693714,141.166031,緯度経度は怪しい
宮城県,登米市,26,迫町北方字飯土井地内,飯土井公民館向い歩道フェンス,38.703506,141.166428,緯度経度は怪しい
宮城県,登米市,27,迫町北方字天形161番地84,長沼フートピア公園駐車場,38.703506,141.166428,緯度経度は怪しい
宮城県,登米市,28,迫町北方字金ヶ森11番地6,消防団第５分団ポンプ倉庫脇,38.694084,141.164978,緯度経度は怪しい
宮城県,登米市,29,迫町北方字日向前地内,市道石打坂・西舘線福祉ゾーン入口フェンス,38.691261,141.174576,緯度経度は怪しい
宮城県,登米市,30,迫町新田字東坂戸地内,新田バイパス丁字路,38.686924,141.095215,緯度経度は怪しい
宮城県,登米市,31,迫町新田字狼ノ欠地内,JAみやぎ登米新田支店前丁字路,38.686924,141.095215,緯度経度は怪しい
宮城県,登米市,32,迫町新田字倉崎177番地,倉崎集落センター前,38.686924,141.095215,緯度経度は怪しい
宮城県,登米市,33,迫町新田字山ノ神270番地12,市道新田駅前山ノ神線山ノ神神社前丁字路,38.686924,141.095215,緯度経度は怪しい
宮城県,登米市,34,迫町新田字大形71番地,masked,38.686924,141.095215,緯度経度は怪しい
宮城県,登米市,35,迫町新田字山居37番地1,登米市立新田中学校フェンス,38.686924,141.095215,緯度経度は怪しい
宮城県,登米市,36,迫町新田字品の浦地内,品の浦生活センター前市道敷,38.7103973,141.1103088,緯度経度は怪しい
宮城県,登米市,37,迫町新田字飯島53番地1,消防団第10分団ポンプ倉庫脇,38.686924,141.095215,緯度経度は怪しい
宮城県,登米市,38,迫町新田字駒林41番地3,消防団第９分団ポンプ倉庫,38.686924,141.095215,緯度経度は怪しい
宮城県,登米市,39,迫町新田字畑中地内,masked,38.686924,141.095215,緯度経度は怪しい
宮城県,登米市,40,迫町新田字日向地内,㈱登米精巧東側市道敷,38.686924,141.095215,緯度経度は怪しい
宮城県,登米市,41,迫町新田字上立戸地内,立戸集落センター向い県道敷,38.686924,141.095215,緯度経度は怪しい
宮城県,登米市,42,迫町新田字上葉ノ木沢1番地,東北新生園職員更衣棟（現場）北側,38.6808668,141.0644101,緯度経度は怪しい
宮城県,登米市,43,登米町寺池桜小路6番地,教育資料館敷地内（秋山写真店向い）,38.65612,141.280167,緯度経度は怪しい
宮城県,登米市,44,登米町寺池前舟橋10番地1,masked,38.653114,141.276932,緯度経度は怪しい
宮城県,登米市,45,登米町寺池前舟橋118番地1,masked,38.6562854,141.2735852,
宮城県,登米市,46,登米町寺池桜小路117番地1,旧アトリエ・エダ敷地内,38.6576247,141.2840491,
宮城県,登米市,47,登米町日野渡蛭沢123番地4付近,蛭沢遊園地付近,38.664024,141.27887,緯度経度は怪しい
宮城県,登米市,48,登米町寺池上町56番地,登米遠見台住宅掲示板脇市道敷,38.66089,141.2780748,
宮城県,登米市,49,登米町日野渡内ノ目289番地3付近,旧割烹若鮨とよま館向い県道敷,38.662521,141.270599,緯度経度は怪しい
宮城県,登米市,50,登米町寺池目子待井552番地2付近,masked,38.65839,141.278122,緯度経度は怪しい
宮城県,登米市,51,登米町寺池鉄砲町75番地付近,masked,38.651375,141.267548,緯度経度は怪しい
宮城県,登米市,52,登米町寺池金沢山60番地,特別養護老人ホーム東側市道敷,38.646496,141.272629,緯度経度は怪しい
宮城県,登米市,53,登米町寺池鉄砲町33番地,masked,38.650532,141.273331,緯度経度は怪しい
宮城県,登米市,54,登米町寺池金谷12番地1,登米老人福祉センター前,38.6508925,141.2784733,
宮城県,登米市,55,登米町寺池道場地内,masked,38.644955,141.277527,緯度経度は怪しい
宮城県,登米市,56,登米町寺池中町3番地,警察資料館東側塀,38.65155,141.280655,緯度経度は怪しい
宮城県,登米市,57,登米町小島葛籠淵37番地,とよまつづら淵地区多目的センター,38.647675,141.256866,緯度経度は怪しい
宮城県,登米市,58,登米町小島大谷地172番地2付近,masked,38.6607628,141.2491614,緯度経度は怪しい
宮城県,登米市,59,登米町小島木戸崎地内,旧小島会館前ロータリー県道敷,38.652714,141.251312,緯度経度は怪しい
宮城県,登米市,60,登米町小島西針田95番地,masked,38.661701,141.257095,緯度経度は怪しい
宮城県,登米市,61,登米町小島西針田65番地付近,子持杉神社社務所前,38.6457232,141.2542125,緯度経度は怪しい
宮城県,登米市,62,登米町大字日根牛浦小路16番地3,市道新中通線交差点脇雑種地,38.6519135,141.2903885,
宮城県,登米市,63,登米町大字日根牛小池前158番地1,masked,38.64901,141.289124,緯度経度は怪しい
宮城県,登米市,64,登米町大字日根牛峯畑地内,masked,38.634739,141.289352,緯度経度は怪しい
宮城県,登米市,65,登米町大字日根牛北沢地内,斥候川管理橋前市道敷,38.668022,141.286163,緯度経度は怪しい
宮城県,登米市,66,登米町大字日根牛入谷地内,平杉橋向い歩道フェンス,38.668022,141.286163,緯度経度は怪しい
宮城県,登米市,67,登米町大字日根牛上羽沢122番地4,登米林業活動センター前県道敷,38.668022,141.286163,緯度経度は怪しい
宮城県,登米市,68,東和町米谷字根郭116番地3,登米市東和城内住宅フェンス,38.71241,141.291275,緯度経度は怪しい
宮城県,登米市,69,東和町米谷字元町地内,登米市米谷病院前堤防敷,38.705063,141.2883,緯度経度は怪しい
宮城県,登米市,70,東和町米谷字秈荷75番地,登米市米谷公民館フェンス,38.7085359,141.2907282,
宮城県,登米市,71,東和町米谷字宮ノ前413番地,東和楼台コミュニティセンター,38.689268,141.2984811,
宮城県,登米市,72,東和町米谷字山崎地内,masked,38.6965336,141.3095829,
宮城県,登米市,73,東和町米谷字平倉地内,佐藤商店付近国道敷,38.7149747,141.3197814,
宮城県,登米市,74,東和町米谷字南沢54番地1,東和相川平倉地区多目的集会施設,38.7157145,141.3291049,
宮城県,登米市,75,東和町米谷字根廻一号110番地,東和根廻地区多目的集会施設,38.7236177,141.3034112,
宮城県,登米市,76,東和町米谷字中渡戸188番地1,東和細野集会所フェンス,38.7355418,141.3062203,
宮城県,登米市,77,東和町米谷字新大沢94番地1,東和大沢農村公園フェンス市道敷,38.7363087,141.2951651,
宮城県,登米市,78,東和町米川字六反57番地1,東和総合支所敷地北側,38.7426807,141.3160709,
宮城県,登米市,79,東和町米川字小山下14番地,東和鱒渕生活改善センターフェンス,38.7492158,141.3332634,
宮城県,登米市,80,東和町米川字町裏84番地,旧米川公民館跡地,38.7726047,141.3287545,
宮城県,登米市,81,東和町米川字町下7番地１,消防団米川地区本部敷地フェンス,38.7650171,141.3271116,
宮城県,登米市,82,東和町米川字四十田地内,米川公民館フェンス前市道敷,38.771453,141.3606639,
宮城県,登米市,83,東和町米川字東綱木地内,東和綱木公園前,38.7933275,141.33359,
宮城県,登米市,84,東和町米川字西上沢地内,西上沢バス停前国道敷,38.771453,141.3606639,
宮城県,登米市,85,東和町米川字北上沢176番地2,旧登米市東和国際交流センター,38.7833157,141.3690755,
宮城県,登米市,86,東和町米川字東上沢53番地2,masked,38.7821271,141.3818203,
宮城県,登米市,87,東和町米川字寺内地内,鱒渕簡易郵便局前県道敷,38.7531117,141.3403815,
宮城県,登米市,88,東和町米川字馬ノ足26番地3,東和馬の足農村公園内,38.7633445,141.3695634,
宮城県,登米市,89,東和町錦織字山居沢83番地,消防団錦織地区本部敷地,38.7278323,141.2756918,
宮城県,登米市,90,東和町錦織字小童子98番地19,登米市消防署東出張所敷地,38.7295604,141.2816137,
宮城県,登米市,91,東和町錦織字石倉地内,masked,38.7222034,141.2805612,
宮城県,登米市,92,東和町錦織字水溜149番地1,東和機織沼多目的共同利用施設,38.7569805,141.2880565,
宮城県,登米市,93,東和町錦織字大木沢69番地1,masked,38.7587538,141.2851212,
宮城県,登米市,94,東和町錦織字川端地内,旧旭屋前市道敷,38.7569805,141.2880565,
宮城県,登米市,95,中田町石森字町77番地,masked,38.7209618,141.2118869,
宮城県,登米市,96,中田町石森白地104番地3,masked,38.7356095,141.210987,
宮城県,登米市,97,中田町石森字二ツ木292番地1,二ツ木遊園地フェンス,38.7268672,141.2197267,
宮城県,登米市,98,中田町石森字小塚1番地2,石森・金谷線市道敷,38.7254195,141.2281727,
宮城県,登米市,99,中田町石森字脇谷3番地2,masked,38.7342985,141.2168465,
宮城県,登米市,100,中田町石森字長根89番地1,阿部建設前道路敷地空地区画,38.7405493,141.2179677,
宮城県,登米市,101,中田町石森字牡丹埣103番地1,細谷ふれあいセンター前,38.7099769,141.2020821,
宮城県,登米市,102,中田町石森字牡丹埣349番地１,個人所有農地,38.7099769,141.2020821,
宮城県,登米市,103,中田町石森字室木121番地1,masked,38.7150408,141.2090879,
宮城県,登米市,104,中田町石森字野元186番地3,masked,38.7008044,141.2260571,
宮城県,登米市,105,中田町石森字駒牽378番地,masked,38.7078629,141.2200552,
宮城県,登米市,106,中田町石森字本町95番地1,愛菜館入り口,38.699339,141.2179705,
宮城県,登米市,107,中田町石森字古舘98番地,masked,38.7087584,141.2161514,
宮城県,登米市,108,中田町石森字加賀野一丁目65番地,中田かがの公園西側,38.7029687,141.214569,
宮城県,登米市,109,中田町石森字表81番地,masked,38.6975237,141.2142281,
宮城県,登米市,110,中田町石森字加賀野二丁目87番地,中田なかよし公園東側フェンス,38.7011969,141.2121608,
宮城県,登米市,111,中田町石森字蓬田2番地2,みやぎ登米農協なかだ支店倉庫南側,38.7135439,141.2201096,
宮城県,登米市,112,中田町宝江黒沼字新西野70番地,登米市立中田中学校北側フェンス(蓬原会館向かい),38.7051498,141.2370964,
宮城県,登米市,113,中田町宝江黒沼字鶴ヶ埣182番地,masked,38.7086411,141.2459183,
宮城県,登米市,114,中田町上沼字舘32番地1,個人所有空地,38.7192894,141.2451924,
宮城県,登米市,115,中田町上沼字新田67番地1,masked,38.7110651,141.2354933,
宮城県,登米市,116,中田町上沼字大柳119番地5,中田大柳住宅前(3.4号室道路側),38.7140363,141.2321127,
宮城県,登米市,117,中田町上沼字谷地前86番地,個人所有作業場脇,38.7187156,141.2519281,
宮城県,登米市,118,中田町宝江黒沼字東220番地,masked,38.7007706,141.2479782,
宮城県,登米市,119,中田町宝江黒沼字町2番地,masked,38.6941812,141.2428665,
宮城県,登米市,120,中田町宝江黒沼字浦38番地3,登米市宝江ふれあいセンター,38.6975163,141.2435497,
宮城県,登米市,121,中田町宝江新井田字細谷19番地1,masked,38.6758154,141.2462772,
宮城県,登米市,122,中田町宝江新井田字神畑102番地2,masked,38.6948753,141.2378693,
宮城県,登米市,123,中田町宝江森字六丁目25番地2,森六ふれあいセンター脇市道敷,38.679785,141.234272,
宮城県,登米市,124,中田町宝江新井田字柴垣21番地の先,masked,38.6806255,141.2479455,
宮城県,登米市,125,中田町宝江新井田字大江渕54番地,masked,38.6758154,141.2462772,
宮城県,登米市,126,中田町宝江新井田字上待井89番地7,菊澤商店向い畑,38.6763909,141.250904,
宮城県,登米市,127,中田町宝江新井田字芝尻85番地,masked,38.6741119,141.2502914,
宮城県,登米市,128,中田町上沼字弥勒寺中下126番地３,ＪＡみやぎ登米水稲種子温湯消毒センターフェンス,38.7324103,141.2618398,
宮城県,登米市,129,中田町上沼字弥勒寺大下91番地2,登米市立上沼小学校フェンス,38.7309284,141.2583047,
宮城県,登米市,130,中田町上沼字弥勒寺宿29番地2,弥勒寺北区集会所フェンス,38.7365686,141.2643855,
宮城県,登米市,131,中田町上沼字金谷地内,金谷集会所フェンス,38.7386817,141.2501936,
宮城県,登米市,132,中田町上沼字弥勒寺寺山地内,寺山集会所向い市道敷,38.7342392,141.2558539,
宮城県,登米市,133,中田町上沼字長根79番地,masked,38.7440123,141.2576544,
宮城県,登米市,134,中田町上沼字境前地内,神ノ木転作研修センター南側畑,38.7259612,141.2546745,
宮城県,登米市,135,中田町上沼字要害23番地,masked,38.7236521,141.2536054,
宮城県,登米市,136,中田町上沼字長崎184番地1,長崎集落センター,38.752293,141.2551146,
宮城県,登米市,137,中田町上沼字冠木45番地10,冠木ゲートボール場前,38.7418371,141.2672623,
宮城県,登米市,138,中田町上沼字八幡山80番地5,masked,38.7486689,141.2663808,
宮城県,登米市,139,中田町上沼字新茶畑下157番地1,masked,38.7560827,141.2665222,
宮城県,登米市,140,中田町上沼字大泉門畑42番地,masked,38.7629677,141.2689669,
宮城県,登米市,141,中田町浅水字中川面62番地2,川面構造改善センター,38.7201017,141.2585578,
宮城県,登米市,142,中田町浅水字中川面5番地4,masked,38.7219042,141.2582813,
宮城県,登米市,143,中田町浅水字下川面180番地,masked,38.7077802,141.265076,
宮城県,登米市,144,中田町浅水字荒神堂143番地1,中田浅水農村公園市道敷,38.7059638,141.2669754,
宮城県,登米市,145,中田町浅水字小島4番地,小島構造改善センター前,38.6903544,141.2668197,
宮城県,登米市,146,中田町浅水字浅部玉山350番地,masked,38.6761856,141.2716572,
宮城県,登米市,147,中田町浅水字江ノ尻76番地1,masked,38.6939523,141.2689766,
宮城県,登米市,148,中田町浅水字鮎川田312番地5,沼畑公民館前駐車場フェンス,38.6997446,141.2735585,
宮城県,登米市,149,中田町浅水字長谷山337番地6,中田長谷山公園前市道敷,38.6993467,141.2798072,
宮城県,登米市,150,中田町浅水字長谷山433番地4,韓国家庭料理　サラン北側道路敷,38.7048431,141.2847357,
宮城県,登米市,151,豊里町沢尻166番地,豊里山根農村公園,38.6189856,141.2796181,
宮城県,登米市,152,豊里町白鳥23番地３,masked,38.6063099,141.2840791,
宮城県,登米市,153,豊里町佐野62番地付近,masked,38.6155671,141.2917309,
宮城県,登米市,154,豊里町上町裏100番地,登米市立豊里小中学校南側フェンス,38.5825509,141.2515186,
宮城県,登米市,155,豊里町上町裏100番地,登米市立豊里小中学校北側フェンス,38.5825509,141.2515186,
宮城県,登米市,156,豊里町横町2番地3付近,masked,38.5847966,141.2479827,
宮城県,登米市,157,豊里町小口前185番地4,定住促進住宅駐車場フェンス,38.5907492,141.2500665,
宮城県,登米市,158,豊里町杢沢83番地,個人所有畑,38.6019418,141.2605484,
宮城県,登米市,159,豊里町加々巻33番地付近,masked,38.5916012,141.2629806,
宮城県,登米市,160,豊里町浦軒100番地1,登米みなみ商工会豊里支所駐車場,38.5822273,141.2445926,
宮城県,登米市,161,豊里町新田町53番地4,仲の松公園,38.5794722,141.2464502,
宮城県,登米市,162,豊里町七ツ塚地内,市道川前四号線地内,38.5733784,141.2367324,
宮城県,登米市,163,豊里町下屋浦305番地,豊里下屋浦公園,38.5800014,141.2389277,
宮城県,登米市,164,豊里町新田町139番地2,masked,38.5801587,141.2452208,
宮城県,登米市,165,豊里町十五貫45番地先,masked,38.5984068,141.2064135,
宮城県,登米市,166,豊里町前田183番地,大曲地区集落センター,38.6005968,141.227211,
宮城県,登米市,167,豊里町大曲98番地先,masked,38.6012115,141.2291844,
宮城県,登米市,168,豊里町寿崎地内道路敷,masked,38.5977981,141.2402034,
宮城県,登米市,169,豊里町久寿田106番地2付近,masked,38.6060471,141.2381607,
宮城県,登米市,170,豊里町中沼田185番地,我妻工務店植栽センター脇道路敷,38.6007159,141.2425004,
宮城県,登米市,171,豊里町保手53番地4先,保手地区集落センター先,38.6004781,141.2526625,
宮城県,登米市,172,豊里町平林11番地4,市道金山線・県道小島豊里線交差点南側,38.6074559,141.251616,
宮城県,登米市,173,豊里町東二ツ屋154番地脇,masked,38.574314,141.2270686,
宮城県,登米市,174,豊里町新田鏡形4番地1,二ツ屋生活センター,38.5706066,141.2198394,
宮城県,登米市,175,豊里町丸木43番地1,上谷地集会所,38.5787938,141.2015004,
宮城県,登米市,176,米山町字善王寺永沢50番地1,masked,38.6321069,141.2448296,
宮城県,登米市,177,米山町字善王寺新沼田87番地1,森腰農地水看板設置場,38.6401023,141.2358599,
宮城県,登米市,178,米山町字善王寺石神52番地1,masked,38.6419596,141.2358098,
宮城県,登米市,179,米山町字善王寺稲生荷45番地5,masked,38.6398294,141.2141574,
宮城県,登米市,180,米山町字桜岡鈴根17番地1付近,鈴根バス停付近県道敷(菅原直行氏所有田法面),38.6211964,141.2163991,
宮城県,登米市,181,米山町字桜岡江浪41番地2,登米市吉田体育館脇,38.6278865,141.2140864,
宮城県,登米市,182,米山町字桜岡大又20番地1,登米リサイクル事業協同組合資源化共同施設フェンス,38.6326131,141.2127279,
宮城県,登米市,183,米山町字桜岡貝待井8番地付近,masked,38.63138,141.2225852,
宮城県,登米市,184,米山町字桜岡今泉68番地,登米市吉田運動場(正面入り口側),38.6306532,141.2179071,
宮城県,登米市,185,米山町字桜岡今泉256番地2他,今泉生活センターフェンス,38.6240319,141.2224942,
宮城県,登米市,186,米山町字桜岡貝待井581番地3,平筒沼ふれあい公園バス停付近駐車場,38.6143214,141.2374198,
宮城県,登米市,187,米山町字田畑西42番地,山吉田集会所前,38.6477259,141.216296,
宮城県,登米市,188,米山町字内35番地,masked,38.6544377,141.2150734,
宮城県,登米市,189,米山町字桜岡新楠田46番地,登米羽黒児童遊園フェンス(狐崎集落センター脇),38.6098808,141.2282291,
宮城県,登米市,190,米山町字桜岡畑崎38番地1,masked,38.6058905,141.2271633,
宮城県,登米市,191,米山町字桜岡新東新田25番地1,新田集落センター裏市道敷,38.6038319,141.2199596,
宮城県,登米市,192,米山町字桜岡新中埣前154番地,中埣生活センター前水路敷,38.6040638,141.2134878,
宮城県,登米市,193,米山町西野字中島134番地1,米山後小路農村公園,38.6357576,141.2007093,
宮城県,登米市,194,米山町西野字上小路前103番地1,masked,38.630722,141.1992131,
宮城県,登米市,195,米山町西野字立野144番地1内,平埣生活センターフェンス,38.6044268,141.2005199,
宮城県,登米市,196,米山町西野字十日町12番地2,masked,38.626508,141.2044027,
宮城県,登米市,197,米山町西野字中町5番地,masked,38.6302027,141.1957672,
宮城県,登米市,198,米山町西野字的場195番地1,登米市米山体育館南側歩道境敷地,38.6289633,141.1893908,
宮城県,登米市,199,米山町西野字西小路2番地,登米市立米山中学校体育館フェンス,38.6318244,141.1919918,
宮城県,登米市,200,米山町西野字砥落181番地他,砥落農事集会所,38.6436748,141.1738812,
宮城県,登米市,201,米山町西野字西小路裏103番地,米山児童館フェンス,38.6326465,141.1962723,
宮城県,登米市,202,米山町中津山字山崎51番地,masked,38.61782,141.1737761,
宮城県,登米市,203,米山町中津山字刈敷246番地,的場生活センターフェンス,38.6197848,141.1768466,
宮城県,登米市,204,米山町中津山字筒場埣293番地3,masked,38.6094683,141.1758272,
宮城県,登米市,205,米山町中津山字清水24番地1,米山幼稚園前フェンス,38.6216644,141.1653158,
宮城県,登米市,206,米山町中津山字中沢9番地1,masked,38.6238538,141.1553366,
宮城県,登米市,207,米山町中津山字粟ヶ崎82番地2,masked,38.6264364,141.153016,
宮城県,登米市,208,米山町中津山字平潟167番地,みやぎ登米農協短台店前駐車場,38.6109438,141.1636855,
宮城県,登米市,209,米山町中津山字壇ノ前88番地付近,masked,38.6197611,141.138781,
宮城県,登米市,210,米山町中津山字東千貫47番地1,千貫集会所塀,38.6459624,141.1348026,
宮城県,登米市,211,石越町北郷字遠澤地内,遠澤馬頭観世音前市道敷,38.7612115,141.1790985,
宮城県,登米市,212,石越町東郷字苦木36番地2先,第一区掲示板交差点花壇,38.7566261,141.191046,
宮城県,登米市,213,石越町北郷字長根157番地1,消防団石越支団第１分団消防ポンプ置場,38.7581012,141.1793102,
宮城県,登米市,214,石越町北郷字赤谷167番地,寺山集会所前溜池前道路沿,38.7714852,141.1742459,
宮城県,登米市,215,石越町北郷字新橋向68番地付近,第８区集会所前ガードレール先,38.7698965,141.1790612,
宮城県,登米市,216,石越町北郷字堀内前110番地後,masked,38.767762,141.1813264,
宮城県,登米市,217,石越町東郷字大根澤地内,大根の沢馬頭観世音脇県道路敷,38.7489911,141.1937466,
宮城県,登米市,218,石越町南郷字高森217番地4,佐々木理容所隣空地,38.7655819,141.1746315,
宮城県,登米市,219,石越町東郷字四方子地内,masked,38.7584483,141.2001182,
宮城県,登米市,220,石越町南郷字柳原31番地2,masked,38.7459915,141.1580719,
宮城県,登米市,221,石越町南郷字松ヶ崎前6番地1,石越第３農村公園内市道敷,38.7523369,141.1646283,
宮城県,登米市,222,石越町南郷字田畑前7番地1,第四区生活センター内,38.759313,141.1624594,
宮城県,登米市,223,石越町北郷字芦倉39番地,masked,38.7674788,141.1678613,
宮城県,登米市,224,石越町南郷字西門沖49番地,石越陽だまり公園,38.7680032,141.1583247,
