prefecture,city,number,address,name,lat,long,note
宮城県,登米市,225,石越町北郷字小谷地142番地2,個人所有畑,38.7812536,141.1592396,
宮城県,登米市,226,石越町東郷字十八引地内,十八引防火水槽付近県道敷,38.745129,141.1957197,
宮城県,登米市,227,石越町東郷字山根前4番地2付近,山根前4-2水路前フェンス,38.7398631,141.1997602,
宮城県,登米市,228,石越町東郷字新山根前92番地1,第14区コミュニティセンター,38.7385876,141.200461,
宮城県,登米市,229,南方町峯地内,おてんとさん向いゴミ集積所脇,38.6711563,141.182775,
宮城県,登米市,230,南方町雷18番地,紅忠コイルセンター㈱前市道敷,38.6709417,141.1924549,
宮城県,登米市,231,南方町宿畑63番地1,大門公民館脇,38.6663782,141.1856548,
宮城県,登米市,232,南方町細川156番地2,細川公民館前脇,38.6582372,141.1824321,
宮城県,登米市,233,南方町本郷大岳12番地1,南方老人福祉センター西側市道敷,38.6559281,141.1881688,
宮城県,登米市,234,南方町大畑地内,北大畑公民館向い市道敷,38.6581763,141.1997936,
宮城県,登米市,235,南方町山崎地内,南大畑三叉路市道道路敷,38.6485482,141.2047146,
宮城県,登米市,236,南方町新松葉表地内,大岳公民館向いゴミ集積所脇道路敷,38.6552616,141.171742,
宮城県,登米市,237,南方町梶沼71番地2内,梶沼公民館前,38.6426566,141.1850305,
宮城県,登米市,238,南方町板倉地内,板倉子ども会花壇脇,38.6753859,141.1670303,
宮城県,登米市,239,南方町沢田屋敷182番地1,沢田公民館前,38.6701714,141.1619677,
宮城県,登米市,240,南方町新青島前91番地,青島公民館前,38.6667567,141.1494807,
宮城県,登米市,241,南方町新二網地内,月見橋西側駐車場,38.6699328,141.1461552,
宮城県,登米市,242,南方町原屋敷60番地2,原公民館脇,38.6643465,141.17514,
宮城県,登米市,243,南方町松葉地内,松葉公民館入口市道路肩,38.6567645,141.1744662,
宮城県,登米市,244,南方町田中浦地内,旧砥落公民館脇,38.6477405,141.1731969,
宮城県,登米市,245,南方町大袋地内,大袋地内土手駐車場,38.6454674,141.1490112,
宮城県,登米市,246,南方町山成浦282番地1,山成公民館脇,38.6599979,141.1650708,
宮城県,登米市,247,南方町西山成前72番地4内,新高石公民館前,38.6593201,141.1549423,
宮城県,登米市,248,南方町中高石18番地1,高石公民館脇,38.6595466,141.1465859,
宮城県,登米市,249,南方町大西地内,苔下行政区ゴミ集積所隣県道敷,38.6595604,141.1377921,
宮城県,登米市,250,南方町大平10番地5,柳沢公民館向い南方柳沢農村公園,38.653788,141.1062034,
宮城県,登米市,251,南方町沼崎前地内,masked,38.6430422,141.1009404,
宮城県,登米市,252,南方町堤田38番地内,狼掛公民館前,38.6559135,141.1196919,
宮城県,登米市,253,南方町畑岡32番地1,畑岡公民館前,38.6578602,141.1156588,
宮城県,登米市,254,南方町太田17番地,南方一ノ曲農村公園フェンス,38.6407526,141.1156946,
宮城県,登米市,255,南方町長根75番地8,苔上公民館向い歩道フェンス,38.6612754,141.1311207,
宮城県,登米市,256,南方町上平貝138番地3,平貝公民館脇,38.6704173,141.1201693,
宮城県,登米市,257,津山町柳津字入土2番地,masked,38.5774573,141.3025722,
宮城県,登米市,258,津山町柳津字町8番地11,masked,38.607101,141.3005838,
宮城県,登米市,259,津山町柳津字谷木195番地2,消防津山出張所駐車場フエンス,38.609496,141.3002646,
宮城県,登米市,260,津山町柳津字本町69番地１,本町３･４丁目多目的集会所フェンス,38.6151311,141.3001341,
宮城県,登米市,261,津山町柳津字本町212番地1,宮町公民館県道側フェンス,38.6126919,141.3028439,
宮城県,登米市,262,津山町柳津字幣崎102番地1,個人所有地（畑）,38.6088168,141.3170651,
宮城県,登米市,263,津山町柳津字黄牛宇名地内,masked,38.6306938,141.3051484,
宮城県,登米市,264,津山町柳津字黄牛比良64番地1,個人所有地,38.6226864,141.2964665,
宮城県,登米市,265,津山町柳津字堂前58番地2,西下在農村公園内,38.5777985,141.2900303,
宮城県,登米市,266,津山町横山字久保172番地,長谷寺入口（現況公衆用道路敷）,38.6253644,141.3520855,
宮城県,登米市,267,津山町横山字久保58番地,masked,38.6277326,141.3482635,
宮城県,登米市,268,津山町横山字本町39番地6,旧杉の子保育所フェンス,38.6312341,141.3512992,
宮城県,登米市,269,津山町横山字本町151番地5,陸前横山駅前市道敷,38.6314795,141.354226,
宮城県,登米市,270,津山町横山字上鴻巣74番地,masked,38.6290882,141.3601569,
宮城県,登米市,271,津山町横山字上の山158番地1,masked,38.6343843,141.3597075,
宮城県,登米市,272,津山町横山字黒沢107番地,masked,38.6423523,141.3645907,
宮城県,登米市,273,津山町横山字前田沢26番地5脇,横山11区担い手センター手前右側（市道路肩）,38.6300515,141.3803831,
宮城県,登米市,274,津山町横山字野尻36番地,masked,38.6041487,141.3661287,
宮城県,登米市,275,津山町横山字寺倉地内,旧南沢分校前ガードパイプ,38.6091661,141.3622901,
