prefecture,city,number,address,name,lat,long,note
埼玉県,新座市,34-6,野火止六丁目1番,ふるさと新座館第二駐車場通線側フェンス,35.8013437,139.5626696,
埼玉県,新座市,34-7,野火止七丁目7番,野火止中ふれあい広場集会所側フェンス,35.8008518,139.5662859,
埼玉県,新座市,35-1,西堀一丁目11番,西堀一丁目児童遊園横畑,35.7758253,139.5447782,
埼玉県,新座市,35-2,西堀二丁目2番,民家前畑,35.773884,139.5436518,
埼玉県,新座市,35-3,西堀二丁目18番3号,西堀小学校入口フェンス,35.7763879,139.5390112,
埼玉県,新座市,35-4,西堀三丁目3番,バス停『西堀』横芝畑,35.776204,139.5435016,
埼玉県,新座市,35-5,西堀一丁目9番,西堀一丁目ふれあい広場東寄り,35.7742528,139.5464671,
埼玉県,新座市,35-6,西堀一丁目9番,西堀一丁目ふれあい広場西寄り,35.7733519,139.5441712,
埼玉県,新座市,35-7,西堀三丁目3番,アイ・ウォッシュ・パーク西堀駐車場横畑,35.7768481,139.5447301,
