prefecture,city,number,address,name,lat,long,note
埼玉県,新座市,1-1,野火止五丁目2番,新座駅南口公園,35.8027377,139.5578039,
埼玉県,新座市,1-2,野火止五丁目3番31号,民家ブロック塀,35.806152,139.5575919,
埼玉県,新座市,1-3,野火止五丁目4番34号,新座駅北口土地区画整理事務所ガードレール,35.8040658,139.5584222,
埼玉県,新座市,1-4,野火止五丁目11番,新座マレットゴルフ場北寄り,35.8081371,139.5585874,
埼玉県,新座市,1-5,野火止五丁目15番,野火止五丁目第4ポケットパーク南側植え込み,35.8071602,139.5617695,
埼玉県,新座市,1-6,野火止五丁目3番,(株)髙藤園駐車場フェンス,35.8044796,139.5556331,
埼玉県,新座市,1-7,野火止五丁目33番,野火止上北ふれあい公園植え込み,35.8089682,139.5597329,
埼玉県,新座市,2-1,野火止三丁目4番12号,民家隣畑,35.7930054,139.5554647,
埼玉県,新座市,2-2,野火止三丁目6番,新座野火止宿舎前畑,35.7967627,139.5590559,
埼玉県,新座市,2-3,野火止三丁目13番3号,民家ブロック塀,35.7927093,139.5515897,
埼玉県,新座市,2-4,野火止四丁目9番1号,野火止小学校正門横フェンス,35.801011,139.5575608,
埼玉県,新座市,2-5,野火止四丁目19番6号,野火止四丁目集会所フェンス,35.8026881,139.5550969,
埼玉県,新座市,2-6,菅沢一丁目1番2号,民家前フェンス,35.7969797,139.5551287,
埼玉県,新座市,2-7,菅沢二丁目1番28号,十文字学園女子大学駐車場側フェンス,35.7986505,139.5515091,
埼玉県,新座市,2-8,野火止四丁目9番1号,野火止小学校志木街道側フェンス,35.8002931,139.5577808,
埼玉県,新座市,3-1,堀ノ内二丁目9番,セブンイレブン横畑,35.7707133,139.5578344,
埼玉県,新座市,3-2,堀ノ内三丁目4番,殿山運動場フェンス,35.7754338,139.5586304,
埼玉県,新座市,3-3,堀ノ内三丁目13番,新座病院横畑,35.7729652,139.5551036,
埼玉県,新座市,3-4,堀ノ内三丁目11番1号,第六中学校北側フェンス,35.776946,139.5558374,
埼玉県,新座市,3-5,石神一丁目10番20号,石神小学校馬喰橋通り側フェンス,35.7746504,139.5522089,
埼玉県,新座市,3-6,石神五丁目2番,北原第三児童遊園フェンス,35.7734684,139.5501195,
埼玉県,新座市,3-7,石神五丁目2番,民家の駐車場,35.7728634,139.5488159,
埼玉県,新座市,4-1,馬場一丁目6番18号,民家裏側ブロック塀,35.7832696,139.5712151,
埼玉県,新座市,4-2,畑中二丁目14番,千代田橋前畑,35.7851019,139.5783893,
埼玉県,新座市,4-3,馬場二丁目12番,馬場第一公園フェンス,35.7835826,139.5755395,
埼玉県,新座市,4-4,畑中一丁目14番,畑中ふれあい遊園フェンス,35.7882443,139.5745732,
埼玉県,新座市,4-5,畑中一丁目15番58号,畑中公民館前植え込み,35.7850584,139.5728878,
埼玉県,新座市,4-6,馬場二丁目9番,調整池西側フェンス(第1),35.7830275,139.5765433,
埼玉県,新座市,4-7,馬場二丁目5番,馬場第二公園植え込み,35.7814605,139.5767455,
埼玉県,新座市,5-1,片山一丁目8番31号,片山小学校東側フェンス,35.7706653,139.5674259,
埼玉県,新座市,5-2,片山一丁目20番,紳士服コナカ駐車場隣植え込み,35.7698234,139.5649957,
埼玉県,新座市,5-3,野寺二丁目3番,大蔵児童遊園フェンス,35.7675303,139.5627932,
埼玉県,新座市,5-4,道場一丁目4番,道場一丁目児童遊園フェンス,35.7733184,139.5671039,
埼玉県,新座市,5-5,堀ノ内一丁目5番,民家前畑マンション寄り,35.7754213,139.5654468,
埼玉県,新座市,5-6,堀ノ内一丁目9番20号,(有)吉田ピー・オー・サプライフェンス,35.7771636,139.5612338,
埼玉県,新座市,5-7,道場二丁目14番12号,中央公民館フェンス,35.7696409,139.5620528,
埼玉県,新座市,6-1,栗原六丁目5番14号,栗原公園東側,35.7581511,139.5486074,
埼玉県,新座市,6-2,栗原五丁目11番,栗原五丁目自転車駐車場フェンス,35.7542369,139.5476768,
埼玉県,新座市,6-3,栗原五丁目9番,一本松児童遊園フェンス,35.7567329,139.5466736,
埼玉県,新座市,6-4,栗原六丁目2番,栗原緑地公園南側植え込み,35.7586657,139.5479129,
埼玉県,新座市,6-5,栗原六丁目5番3号,民家フェンス,35.7582664,139.5477763,
埼玉県,新座市,6-6,栗原六丁目5番22号,栗原六丁目集会所前植え込み,35.7577054,139.5483493,
埼玉県,新座市,6-7,栗原六丁目11番,ウエストヒルズ隣畑,35.7577639,139.5455829,
埼玉県,新座市,7-1,東北一丁目6番6号,民家横畑ブロックフェンス,35.8187503,139.570685,
埼玉県,新座市,7-2,東北二丁目28番,三軒屋公園・公園前自転車駐車場側フェンス,35.8202462,139.572423,
埼玉県,新座市,7-3,東北二丁目2番31号,ウイステリア前畑,35.8160464,139.5706372,
埼玉県,新座市,7-4,東北二丁目11番,民家前畑,35.816837,139.5731943,
埼玉県,新座市,7-5,東北二丁目25番,富士塚公園フェンス,35.8194976,139.573976,
埼玉県,新座市,7-6,東北二丁目28番,三軒屋公園フェンス,35.820555,139.5721601,
埼玉県,新座市,7-7,東北二丁目4番,東北公園フェンス,35.8171214,139.5715294,
埼玉県,新座市,7-8,東北二丁目38番15号,東武鉄道(株)所有地フェンス,35.8221387,139.5759783,
埼玉県,新座市,8-1,栄三丁目3番,栄公民館前畑,35.7781361,139.5822693,
埼玉県,新座市,8-2,新塚一丁目4番5号,福祉の里駐車場植え込み,35.7781211,139.5828593,
埼玉県,新座市,8-3,栄三丁目8番,栄三丁目第二児童遊園フェンス,35.7754287,139.5800174,
埼玉県,新座市,8-4,栄四丁目2番,栄四丁目商店会駐輪駐車場フェンス,35.7755397,139.5864162,
埼玉県,新座市,8-5,栄四丁目6番17号,四条児童遊園フェンス,35.7752814,139.5841208,
埼玉県,新座市,8-6,栄四丁目8番19号,民家ブロック塀,35.7766483,139.5834923,
埼玉県,新座市,8-7,新塚一丁目1番1号,栄小学校入口フェンス,35.7781581,139.5884476,
埼玉県,新座市,9-1,西堀二丁目10番3号,民家東側ブロック塀,35.7730434,139.5391368,
埼玉県,新座市,9-2,西堀二丁目10番12号,(有)新清前,35.7719193,139.5381484,
埼玉県,新座市,9-3,西堀二丁目10番,西堀二丁目児童遊園フェンス,35.7738305,139.5366465,
埼玉県,新座市,9-4,新堀一丁目5番,新堀一丁目緑地公園,35.7724714,139.5351723,
埼玉県,新座市,9-5,新堀一丁目5番9号,西堀・新堀コミュニティセンターフェンス,35.7720217,139.5360355,
埼玉県,新座市,9-6,新堀一丁目11番,新座市緑地保護区内林,35.772816,139.5325809,
埼玉県,新座市,9-7,新堀一丁目14番41号,民家ブロック塀,35.7719626,139.52982,
埼玉県,新座市,10-1,野寺一丁目1番11号,バス停『貝沼』前フェンス,35.7672283,139.5585074,
埼玉県,新座市,10-2,野寺一丁目8番,野寺公園北側フェンス,35.7658024,139.5546376,
埼玉県,新座市,10-3,野寺二丁目5番25号,野寺集会所フェンス,35.7657443,139.559388,
埼玉県,新座市,10-4,野寺二丁目8番45号,八石小学校正門横フェンス,35.7657579,139.5568409,
埼玉県,新座市,10-5,野寺二丁目8番45号,八石小学校体育館側入口フェンス,35.76534,139.5580747,
埼玉県,新座市,10-6,野寺二丁目16番,民家斜め向い畑,35.764304,139.5561766,
埼玉県,新座市,10-7,野寺二丁目17番,民家前畑,35.762842,139.5552591,
埼玉県,新座市,11-1,北野二丁目9番,北野第二公園フェンス,35.8154335,139.5618249,
埼玉県,新座市,11-2,北野二丁目15番32号,北野ふれあいの家駐車場植え込み,35.8172501,139.5637106,
埼玉県,新座市,11-3,北野二丁目17番2号,民家フェンス,35.8158975,139.5642064,
埼玉県,新座市,11-4,北野三丁目1番1号,東北小学校正門横フェンス,35.8164766,139.5683139,
埼玉県,新座市,11-5,北野三丁目8番,北野三丁目憩いの森植え込み,35.8203112,139.5685236,
埼玉県,新座市,11-6,北野三丁目18番24号,ミアヘルサオアシス新座フェンス,35.8189159,139.5651859,
埼玉県,新座市,11-7,北野二丁目12番,北野中央公園フェンス,35.8172913,139.5620588,
埼玉県,新座市,11-8,北野二丁目9番15号,北野保育園フェンス,35.8161651,139.5627427,
埼玉県,新座市,12-1,野火止一丁目1番1号,新座市役所バス停留所脇植樹帯,35.793845,139.5649935,
埼玉県,新座市,12-2,野火止一丁目1番2号,市民会館駐車場植え込み,35.7925288,139.5664849,
埼玉県,新座市,12-3,野火止一丁目14番,野火止ふれあい公園植え込み,35.7924421,139.5685122,
埼玉県,新座市,12-4,野火止一丁目20番,ひるねの森駐車場フェンス,35.7884213,139.56163,
埼玉県,新座市,12-5,野火止二丁目1番13号,民家隣畑,35.7871034,139.5669092,
埼玉県,新座市,12-6,野火止二丁目7番11号,中原・本多集会所入口フェンス,35.7881787,139.5592257,
埼玉県,新座市,12-7,畑中一丁目7番32号,民家斜め前畑,35.793448,139.5731702,
埼玉県,新座市,13-1,新座三丁目1番9号棟横,バス停『団地南』フェンス,35.8184055,139.555374,
埼玉県,新座市,13-2,新座三丁目2番9号棟横,2-9号棟入口前フェンス,35.819082,139.5581743,
埼玉県,新座市,13-3,新座三丁目2番11号棟横,新座三丁目2番12号との通路植え込み,35.8197916,139.5565926,
埼玉県,新座市,13-4,新座三丁目4番1号,新座小学校正門横フェンス,35.8199132,139.5546745,
埼玉県,新座市,13-5,新座三丁目5番,中央公園入口横(幼稚園側),35.8213172,139.5560709,
埼玉県,新座市,13-6,新座三丁目5番6号棟横,三角公園フェンス,35.8225144,139.5561798,
埼玉県,新座市,13-7,新座三丁目6番1号棟,6-1号棟入口横駐車場前,35.8239927,139.5571657,
埼玉県,新座市,14-1,新座一丁目2番,富士見ケ丘児童遊園フェンス,35.8182871,139.5587519,
埼玉県,新座市,14-2,新座一丁目5番,新座一丁目第1ポケットパークフェンス,35.8181766,139.5593645,
埼玉県,新座市,14-3,新座二丁目8番1号先,山本第1駐車場西側フェンス,35.8198701,139.5597149,
埼玉県,新座市,14-4,新座二丁目18番16号棟横,プレイロットフェンス,35.8239816,139.5581105,
埼玉県,新座市,14-5,新座二丁目14番61号,新座ふれあいの家植え込み,35.8213783,139.5593259,
埼玉県,新座市,14-6,新座三丁目3番6号棟横,丸十ベーカリー前フェンス,35.8204361,139.5583512,
埼玉県,新座市,14-7,新座三丁目3番19号,テスコエクスプレス新座店裏植え込み,35.8216567,139.5577047,
埼玉県,新座市,15-1,栄二丁目9番18号,民家隣駐車場フェンス,35.7724558,139.5757906,
埼玉県,新座市,15-2,栄五丁目2番,栄五丁目児童遊園フェンス,35.7735253,139.5813294,
埼玉県,新座市,15-3,栄五丁目2番39号,masked,35.7741214,139.5831613,
埼玉県,新座市,15-4,栄二丁目9番地,栄二丁目ふれあい公園フェンス,35.7728525,139.5769331,
埼玉県,新座市,15-5,池田三丁目4番,masked,35.7710836,139.5732671,
埼玉県,新座市,15-6,池田四丁目3186番地1,池田小学校南側入口手前畑,35.7705799,139.5759216,
埼玉県,新座市,15-7,池田五丁目2番21号,民家フェンス,35.7688743,139.5767483,
埼玉県,新座市,15-8,池田三丁目3番地,池田三丁目児童遊園,35.7725039,139.5738183,
埼玉県,新座市,16-1,石神三丁目12番,石神三丁目緑地フェンス,35.7664462,139.548959,
埼玉県,新座市,16-2,石神二丁目10番,石神二丁目第二児童遊園入口横北側,35.7685724,139.5559368,
埼玉県,新座市,16-3,石神二丁目12番40号,民家ブロック塀,35.7683896,139.5538126,
埼玉県,新座市,16-4,石神四丁目5番,石神第一児童遊園フェンス,35.7682177,139.5506846,
埼玉県,新座市,16-5,石神四丁目2番3号,民家入口横フェンス,35.7708521,139.5532402,
埼玉県,新座市,16-6,石神四丁目12番,石神四丁目第4ミニパーク横フェンス,35.7705992,139.5507436,
埼玉県,新座市,16-7,石神三丁目16番,島村商店前栗畑,35.7666325,139.5478932,
埼玉県,新座市,17-1,野寺三丁目8-17番地先,野寺三丁目児童遊園,35.7635868,139.5606615,
埼玉県,新座市,17-2,野寺五丁目1番24号,野寺小学校校庭道路横フェンス,35.7592756,139.5561975,
埼玉県,新座市,17-3,野寺四丁目8番1号,第五中学校体育館東側フェンス,35.7629198,139.5613844,
埼玉県,新座市,17-4,野寺四丁目8番1号,第五中学校体育館北側フェンス(武野通り側),35.7629416,139.5607648,
埼玉県,新座市,17-5,野寺四丁目10番6号,片山浄水場入口フェンス,35.7599932,139.5600962,
埼玉県,新座市,17-6,野寺五丁目1番24号,野寺小学校正門横フェンス,35.7601549,139.5565247,
埼玉県,新座市,17-7,野寺四丁目11番,野寺四丁目児童遊園フェンス,35.761031,139.5584567,
埼玉県,新座市,18-1,野火止六丁目11番,野火止六丁目11番19号先畑,35.8066182,139.5658099,
埼玉県,新座市,18-2,野火止六丁目19番,郵政宿舎向かい植え込み,35.8100586,139.5663713,
埼玉県,新座市,18-3,野火止六丁目22番,東野緑地西側植え込み中央,35.8088343,139.5673481,
埼玉県,新座市,18-4,野火止七丁目17番10番,第二中学校校庭道路側フェンス,35.8064296,139.5698968,
埼玉県,新座市,18-5,野火止六丁目22番12号,東野小学校西門フェンス,35.8078498,139.5667083,
埼玉県,新座市,18-6,野火止七丁目19番,野火止浄水場フェンス,35.8081607,139.5705055,
埼玉県,新座市,18-7,野火止六丁目16番,野火止六丁目第6ポケットパークフェンス,35.8062005,139.5639013,
埼玉県,新座市,19-1,野火止三丁目16番52号,県営新座野火止南団地2号棟前,35.7891048,139.5508355,
埼玉県,新座市,19-2,本多二丁目8番16号,総合運動公園入口駐輪場側植え込み,35.7868486,139.5500642,
埼玉県,新座市,19-3,本多一丁目4番26号,西堀浄水場高架水槽側フェンス,35.7796496,139.5560921,
埼玉県,新座市,19-4,本多一丁目3番,バス停『本多一丁目』前畑,35.7812043,139.5581885,
埼玉県,新座市,19-5,本多一丁目6番5号,masked,35.7776988,139.5531277,
埼玉県,新座市,19-6,本多一丁目10番,バス停『西屋敷』植え込み,35.7819492,139.5538091,
埼玉県,新座市,19-7,本多二丁目1番20号,市民総合体育館駐車場フェンス,35.7861111,139.5536907,
埼玉県,新座市,20-1,菅沢一丁目8番,菅沢一丁目児童遊園フェンス,35.7940611,139.5469097,
埼玉県,新座市,20-2,あたご三丁目2番,あたご緑地(あたご三丁目2番先),35.7946309,139.5430814,
埼玉県,新座市,20-3,あたご三丁目1番,あたご緑地(あたご三丁目1番先),35.7953117,139.5425361,
埼玉県,新座市,20-4,あたご三丁目11番,あたご第二児童遊園フェンス,35.7905404,139.5418825,
埼玉県,新座市,20-5,あたご三丁目13番,あたご児童遊園フェンス,35.7926947,139.5398627,
埼玉県,新座市,20-6,菅沢一丁目8番,(株)ヤブウチ商会物置隣畑,35.7932779,139.5478968,
埼玉県,新座市,20-7,あたご三丁目3番,あたご緑地(あたご三丁目3番先),35.7936116,139.5438575,
埼玉県,新座市,21-1,片山二丁目2番18号,民家横ぶどう園空地,35.7682114,139.5707722,
埼玉県,新座市,21-2,片山三丁目8番22号,エトワール片山Aフェンス,35.7646813,139.5689352,
埼玉県,新座市,21-3,片山二丁目12番,片山集会所横空地,35.7665289,139.5658938,
埼玉県,新座市,21-4,片山三丁目13番,サングリーンタケシノ前畑フェンス,35.7649177,139.5652198,
埼玉県,新座市,21-5,片山三丁目6番,民家横畑,35.7668584,139.5700442,
埼玉県,新座市,21-6,片山三丁目7番,新座ローンテニスクラブ横植木畑,35.7668082,139.5684683,
埼玉県,新座市,21-7,片山三丁目10番50号,サミットストア新座片山店駐車場フェンス,35.7641013,139.5670555,
埼玉県,新座市,22-1,大和田一丁目14番5号,民家ブロック塀,35.808573,139.5536557,
埼玉県,新座市,22-2,大和田一丁目22番10号,新開小学校東門フェンス,35.8112611,139.5565195,
埼玉県,新座市,22-3,大和田一丁目26番16号,大和田公民館フェンス,35.8123799,139.5544578,
埼玉県,新座市,22-4,大和田四丁目7番5号,民家ブロック塀,35.8110107,139.5510742,
埼玉県,新座市,22-5,大和田四丁目15番6号,東武バスウエスト(株)新座営業事務所フェンス,35.8147973,139.554966,
埼玉県,新座市,22-6,大和田三丁目2番,カインズ新座店舗前 砂利駐車場前,35.806236,139.5468543,
埼玉県,新座市,22-7,大和田五丁目12番25号,大和田集会所フェンス,35.8144271,139.5598244,
埼玉県,新座市,22-8,大和田一丁目23番,東裏公園フェンス,35.8103618,139.5540323,
埼玉県,新座市,23-1,栗原一丁目5番1号,栗原小学校北側フェンス,35.7632612,139.5516082,
埼玉県,新座市,23-2,"栗原一丁目1,094番地",民家北側竹林,35.765163,139.5500194,
埼玉県,新座市,23-3,栗原一丁目5番1号,栗原小学校正門東側フェンス,35.7637596,139.5509725,
埼玉県,新座市,23-4,栗原一丁目5番1号,栗原小学校グランド入口フェンス,35.763024,139.5504361,
埼玉県,新座市,23-5,栗原一丁目13番15号,民家裏ブロック塀,35.7628421,139.5483731,
埼玉県,新座市,23-6,栗原一丁目6番,栗原一丁目児童遊園北側,35.7636251,139.5497244,
埼玉県,新座市,23-7,栗原一丁目10番,栗原一丁目第2児童遊園北側,35.7646556,139.5485226,
埼玉県,新座市,24-1,新堀三丁目5番,新堀三丁目第2ポケットパーク,35.7680846,139.5215722,
埼玉県,新座市,24-2,新堀三丁目9番,中島第2ハイツ隣畑,35.7682138,139.5200347,
埼玉県,新座市,24-3,新堀三丁目1番3号,ハイグレイスB横ビニールハウス前,35.7695051,139.5238639,
埼玉県,新座市,24-4,新堀三丁目1番17号,新堀三丁目集会所フェンス,35.7704543,139.522749,
埼玉県,新座市,24-5,新堀三丁目10番26号,masked,35.7686627,139.5213527,
埼玉県,新座市,24-6,新堀三丁目9番,ジーエスパーク清瀬駐車場向側フェンス,35.7691278,139.5206033,
埼玉県,新座市,24-7,新堀三丁目11番22号,民家前畑,35.7688498,139.5224186,
埼玉県,新座市,25-1,中野一丁目10番,跡見学園女子大学裏茶畑,35.8177398,139.5422269,
埼玉県,新座市,25-2,中野二丁目13番,東邦観光バス(株)隣畑,35.81971,139.5420032,
埼玉県,新座市,25-3,中野二丁目7番 5号,民家前空地,35.8155347,139.5464557,
埼玉県,新座市,25-4,中野二丁目11番21号,跡見学園女子大学向民家フェンス,35.8181532,139.5440009,
埼玉県,新座市,25-5,中野一丁目3番13号,中野集会所前民家ブロック塀,35.814568,139.5453337,
埼玉県,新座市,26-1,畑中三丁目5番17号,民家ブロック塀,35.7942571,139.5767796,
埼玉県,新座市,26-2,畑中三丁目1番,畑中三丁目第1ポケットパークフェンス,35.7951355,139.5755144,
埼玉県,新座市,26-3,野火止八丁目12番30号,野火止八丁目第1ポケットパークフェンス,35.7974135,139.5740967,
埼玉県,新座市,26-4,野火止八丁目4番,ひかわ児童遊園フェンス,35.7967377,139.5721798,
埼玉県,新座市,26-5,野火止八丁目16番2号,民家前生け垣,35.8001079,139.5714604,
埼玉県,新座市,26-6,野火止八丁目7番28号,野火止八丁目集会所フェンス,35.7965515,139.5736296,
埼玉県,新座市,26-7,野火止八丁目15番,野火止大門公園フェンス,35.7996888,139.5691389,
埼玉県,新座市,27-1,東一丁目8番,東一丁目第3ポケットパークフェンス,35.8102451,139.5682775,
埼玉県,新座市,27-2,東一丁目7番35号,神田コーポ横駐車場フェンス,35.809129,139.5706883,
埼玉県,新座市,27-3,東二丁目1番,ヴェルドミール新座向い畑,35.8116872,139.5689945,
埼玉県,新座市,27-4,東二丁目4番,上東公園フェンス(北側),35.812237,139.5697749,
埼玉県,新座市,27-5,東二丁目9番,仲好荘向い畑,35.8123403,139.5736905,
埼玉県,新座市,27-6,東三丁目1番36号,民家隣畑,35.8140548,139.5695782,
埼玉県,新座市,27-7,東三丁目4番,バス停『東三丁目』植え込み,35.8146206,139.5712469,
埼玉県,新座市,27-8,東三丁目1番,中東公園フェンス,35.8138389,139.5698754,
埼玉県,新座市,28-1,栄一丁目2番24号,栄集会所入口,35.7763443,139.5765595,
埼玉県,新座市,28-2,栄一丁目9番,妙音沢特別緑地北側植え込み,35.7761818,139.5759071,
埼玉県,新座市,28-3,栄一丁目10番,妙音沢特別緑地南側植え込み,35.7746822,139.5746425,
埼玉県,新座市,28-4,池田一丁目1番1号,第三中学校正門横ネットフェンス,35.7756999,139.572659,
埼玉県,新座市,28-5,栄二丁目6番,サンシティ佐々木はす向い畑,35.7751192,139.5781656,
埼玉県,新座市,28-6,栄二丁目10番18号,民家裏生け垣,35.7730822,139.5750899,
埼玉県,新座市,28-7,池田一丁目1番2号,県立新座高等学校テニスコート南側フェンス,35.7743106,139.5728371,
埼玉県,新座市,29-1,栗原三丁目8番34号,栗原公民館駐車場フェンス,35.7607422,139.5507454,
埼玉県,新座市,29-2,栗原四丁目2番,民家隣畑,35.758988,139.5525141,
埼玉県,新座市,29-3,栗原三丁目7番7号,武野集会所フェンス,35.7596583,139.5519342,
埼玉県,新座市,29-4,栗原二丁目4番,栗原二丁目児童遊園東側フェンス,35.7615474,139.5548996,
埼玉県,新座市,29-5,栗原三丁目8番34号,栗原公民館前植え込み,35.7613656,139.5505968,
埼玉県,新座市,29-6,栗原四丁目3番,浅間上児童遊園東側フェンス,35.7565489,139.5533687,
埼玉県,新座市,29-7,栗原四丁目3番,浅間上児童遊園南側フェンス,35.755983,139.5530469,
埼玉県,新座市,30-1,馬場三丁目3番,馬場三丁目児童遊園地フェンス,35.7805782,139.5736637,
埼玉県,新座市,30-2,馬場三丁目7番13号,民家ブロックフェンス,35.7786134,139.5752107,
埼玉県,新座市,30-3,馬場四丁目4番24号,民家前畑,35.7796598,139.5680785,
埼玉県,新座市,30-4,馬場四丁目7番30号,(株)アイ企画倉庫斜め前畑,35.7794893,139.5696831,
埼玉県,新座市,30-5,馬場四丁目3番36号,馬場四丁目児童遊園フェンス,35.7805366,139.5673597,
埼玉県,新座市,30-6,馬場三丁目6番,第四小学校北側フェンス,35.7797003,139.57652,
埼玉県,新座市,30-7,馬場四丁目8番,馬場運動場入口西側植え込み,35.7770498,139.5687914,
埼玉県,新座市,31-1,畑中二丁目5番22号,民家東福寺入口脇ブロック塀,35.7886592,139.5774826,
埼玉県,新座市,31-2,畑中一丁目11番2号,畑中一丁目第4ポケットパークフェンス,35.7897097,139.5728373,
埼玉県,新座市,31-3,畑中一丁目8番43号,畑中一丁目第5ポケットパークフェンス,35.7927323,139.5752726,
埼玉県,新座市,31-4,畑中一丁目13番,並利駐車場フェンス,35.7886413,139.5739619,
埼玉県,新座市,31-5,畑中一丁目10番8号,畑中一丁目第1ポケットパークフェンス,35.7913386,139.5741961,
埼玉県,新座市,31-6,畑中二丁目17番19号,畑中黒目川公園,35.7912982,139.5788746,
埼玉県,新座市,31-7,畑中二丁目 6番31号,(株)並木運輸生垣,35.7881828,139.5758968,
埼玉県,新座市,32-1,新堀二丁目6番24号,民家前畑,35.7690982,139.5294385,
埼玉県,新座市,32-2,新堀二丁目7番,民家前畑,35.7712217,139.5277644,
埼玉県,新座市,32-3,新堀二丁目17番20号,新堀二丁目ミニパーク,35.770886,139.529666,
埼玉県,新座市,32-4,新堀二丁目6番1号,新堀二丁目第二児童遊園フェンス,35.7702849,139.5297445,
埼玉県,新座市,32-5,新堀二丁目7番29号,新堀ふれあいの家横畑,35.7704732,139.5277701,
埼玉県,新座市,32-6,新堀二丁目14番,新堀保育園前畑,35.7703569,139.5263966,
埼玉県,新座市,32-7,新堀二丁目3番15号,新堀二丁目ふれあい公園,35.7703821,139.5309959,
埼玉県,新座市,33-1,野火止五丁目14番,グリーンランド児童遊園フェンス,35.8080413,139.5607545,
埼玉県,新座市,33-2,野火止五丁目17番21号,野火止五丁目第2ポケットパークフェンス,35.8112703,139.5648027,
埼玉県,新座市,33-3,野火止五丁目25番,かつみ不動産(株)レンタルボックスフェンス,35.8124175,139.5613917,
埼玉県,新座市,33-4,野火止五丁目29番26号,masked,35.8125291,139.5604236,
埼玉県,新座市,33-5,野火止五丁目29番26号,masked,35.8127684,139.5603002,
埼玉県,新座市,33-6,野火止五丁目18番,野火止五丁目第6ポケットパークフェンス,35.8093643,139.5629588,
埼玉県,新座市,33-7,野火止五丁目18番,すぎのこ保育園横クリエール志木駐車場フェンス,35.8103888,139.5639458,
埼玉県,新座市,34-1,野火止六丁目4番5号,民家隣畑,35.8031768,139.5603968,
埼玉県,新座市,34-2,野火止六丁目1番48号,野火止ふるさと広場南側,35.8002565,139.5622633,
埼玉県,新座市,34-3,野火止七丁目9番11号,ほっともっと野火止七丁目店駐車場脇,35.8031755,139.5699672,
埼玉県,新座市,34-4,野火止七丁目10番,凸版印刷(株)新座中央通側フェンス,35.8038688,139.5700317,
埼玉県,新座市,34-5,野火止六丁目4番,野火止六丁目ふれあい公園東側フェンス,35.8031415,139.562218,
