prefecture,city,number,address,name,lat,long,note
埼玉県,新座市,34-3,野火止七丁目9番11号,ほっともっと野火止七丁目店駐車場脇,35.8030473,139.569845,
埼玉県,新座市,34-4,野火止七丁目10番,凸版印刷(株)新座中央通側フェンス,35.8042604,139.5709705,
埼玉県,新座市,34-5,野火止六丁目4番,野火止六丁目ふれあい公園東側フェンス,35.803259,139.5614187,
埼玉県,新座市,34-6,野火止六丁目1番,ふるさと新座館第二駐車場通線側フェンス,35.8006563,139.5620554,
埼玉県,新座市,34-7,野火止七丁目7番,野火止中ふれあい広場集会所側フェンス,35.8009997,139.5671496,
埼玉県,新座市,35-1,西堀一丁目11番,西堀一丁目児童遊園横畑,35.7768002,139.5455024,
埼玉県,新座市,35-2,西堀二丁目2番,民家前畑,35.7739754,139.5431154,
埼玉県,新座市,35-3,西堀二丁目18番3号,西堀小学校入口フェンス,35.7764353,139.5403436,
埼玉県,新座市,35-4,西堀三丁目3番,バス停『西堀』横芝畑,35.77659999999999,139.5435928,
埼玉県,新座市,35-5,西堀一丁目9番,西堀一丁目ふれあい広場東寄り,35.7739003,139.545582,
埼玉県,新座市,35-6,西堀一丁目9番,西堀一丁目ふれあい広場西寄り,35.7739003,139.545582,
埼玉県,新座市,35-7,西堀三丁目3番,アイ・ウォッシュ・パーク西堀駐車場横畑,35.77659999999999,139.5435928,
