prefecture,city,number,address,name,lat,long,note
埼玉県,新座市,1-1,野火止五丁目2番,新座駅南口公園,35.80349,139.556168,緯度経度は怪しい
埼玉県,新座市,1-2,野火止五丁目3番31号,民家ブロック塀,35.80603869999999,139.5575815,
埼玉県,新座市,1-3,野火止五丁目4番34号,新座駅北口土地区画整理事務所ガードレール,35.8041938,139.5586349,
埼玉県,新座市,1-4,野火止五丁目11番,新座マレットゴルフ場北寄り,35.807041,139.55809,緯度経度は怪しい
埼玉県,新座市,1-5,野火止五丁目15番,野火止五丁目第4ポケットパーク南側植え込み,35.807778,139.5626922,
埼玉県,新座市,1-6,野火止五丁目3番,(株)髙藤園駐車場フェンス,35.804672,139.556824,緯度経度は怪しい
埼玉県,新座市,1-7,野火止五丁目33番,野火止上北ふれあい公園植え込み,35.8091683,139.5595881,
埼玉県,新座市,2-1,野火止三丁目4番12号,民家隣畑,35.7931577,139.5556685,
埼玉県,新座市,2-2,野火止三丁目6番,新座野火止宿舎前畑,35.796299,139.558746,緯度経度は怪しい
埼玉県,新座市,2-3,野火止三丁目13番3号,民家ブロック塀,35.7925678,139.5517377,
埼玉県,新座市,2-4,野火止四丁目9番1号,野火止小学校正門横フェンス,35.8007724,139.5569179,
埼玉県,新座市,2-5,野火止四丁目19番6号,野火止四丁目集会所フェンス,35.802692,139.555084,緯度経度は怪しい
埼玉県,新座市,2-6,菅沢一丁目1番2号,民家前フェンス,35.7969503,139.5544978,
埼玉県,新座市,2-7,菅沢二丁目1番28号,十文字学園女子大学駐車場側フェンス,35.8002048,139.5508612,
埼玉県,新座市,2-8,野火止四丁目9番1号,野火止小学校志木街道側フェンス,35.8007724,139.5569179,
埼玉県,新座市,3-1,堀ノ内二丁目9番,セブンイレブン横畑,35.7713923,139.5575984,
埼玉県,新座市,3-2,堀ノ内三丁目4番,殿山運動場フェンス,35.7759125,139.5588718,
埼玉県,新座市,3-3,堀ノ内三丁目13番,新座病院横畑,35.7740533,139.5556883,
埼玉県,新座市,3-4,堀ノ内三丁目11番1号,第六中学校北側フェンス,35.7768191,139.5570022,
埼玉県,新座市,3-5,石神一丁目10番20号,石神小学校馬喰橋通り側フェンス,35.7757472,139.5519729,
埼玉県,新座市,3-6,石神五丁目2番,北原第三児童遊園フェンス,35.7734031,139.5494811,
埼玉県,新座市,3-7,石神五丁目2番,民家の駐車場,35.7734031,139.5494811,
埼玉県,新座市,4-1,馬場一丁目6番18号,民家裏側ブロック塀,35.7830573,139.5715278,
埼玉県,新座市,4-2,畑中二丁目14番,千代田橋前畑,35.7853499,139.5779762,
埼玉県,新座市,4-3,馬場二丁目12番,馬場第一公園フェンス,35.7836696,139.5755878,
埼玉県,新座市,4-4,畑中一丁目14番,畑中ふれあい遊園フェンス,None,None,緯度経度は怪しい
埼玉県,新座市,4-5,畑中一丁目15番58号,畑中公民館前植え込み,35.7852739,139.5729918,
埼玉県,新座市,4-6,馬場二丁目9番,調整池西側フェンス(第1),35.7835084,139.576782,
埼玉県,新座市,4-7,馬場二丁目5番,馬場第二公園植え込み,35.7814518,139.57718,
埼玉県,新座市,5-1,片山一丁目8番31号,片山小学校東側フェンス,35.7701299,139.5668412,
埼玉県,新座市,5-2,片山一丁目20番,紳士服コナカ駐車場隣植え込み,35.7693881,139.5639657,
埼玉県,新座市,5-3,野寺二丁目3番,大蔵児童遊園フェンス,35.76693,139.562363,緯度経度は怪しい
埼玉県,新座市,5-4,道場一丁目4番,道場一丁目児童遊園フェンス,35.7737972,139.5669108,
埼玉県,新座市,5-5,堀ノ内一丁目5番,民家前畑マンション寄り,35.7758826,139.565876,
埼玉県,新座市,5-6,堀ノ内一丁目9番20号,(有)吉田ピー・オー・サプライフェンス,35.7774448,139.5612654,
埼玉県,新座市,5-7,道場二丁目14番12号,中央公民館フェンス,35.7700197,139.5620548,
埼玉県,新座市,6-1,栗原六丁目5番14号,栗原公園東側,35.7576886,139.5485594,
埼玉県,新座市,6-2,栗原五丁目11番,栗原五丁目自転車駐車場フェンス,35.7542913,139.5482079,
埼玉県,新座市,6-3,栗原五丁目9番,一本松児童遊園フェンス,35.7564804,139.547253,
埼玉県,新座市,6-4,栗原六丁目2番,栗原緑地公園南側植え込み,35.7592055,139.5486854,
埼玉県,新座市,6-5,栗原六丁目5番3号,民家フェンス,35.7584753,139.5478396,
埼玉県,新座市,6-6,栗原六丁目5番22号,栗原六丁目集会所前植え込み,35.7577827,139.5483764,
埼玉県,新座市,6-7,栗原六丁目11番,ウエストヒルズ隣畑,35.7579685,139.5459799,
埼玉県,新座市,7-1,東北一丁目6番6号,民家横畑ブロックフェンス,35.8190327,139.5707272,
埼玉県,新座市,7-2,東北二丁目28番,三軒屋公園・公園前自転車駐車場側フェンス,35.8202984,139.572085,
埼玉県,新座市,7-3,東北二丁目2番31号,ウイステリア前畑,35.8161621,139.5702808,
埼玉県,新座市,7-4,東北二丁目11番,民家前畑,35.8172241,139.5736771,
埼玉県,新座市,7-5,東北二丁目25番,富士塚公園フェンス,35.8191975,139.574314,
埼玉県,新座市,7-6,東北二丁目28番,三軒屋公園フェンス,35.8202984,139.572085,
埼玉県,新座市,7-7,東北二丁目4番,東北公園フェンス,35.8169344,139.5713685,
埼玉県,新座市,7-8,東北二丁目38番15号,東武鉄道(株)所有地フェンス,35.8221974,139.5758764,
埼玉県,新座市,8-1,栄三丁目3番,栄公民館前畑,35.777973,139.581848,緯度経度は怪しい
埼玉県,新座市,8-2,新塚一丁目4番5号,福祉の里駐車場植え込み,35.7788638,139.5829921,
埼玉県,新座市,8-3,栄三丁目8番,栄三丁目第二児童遊園フェンス,35.7750414,139.5797277,
埼玉県,新座市,8-4,栄四丁目2番,栄四丁目商店会駐輪駐車場フェンス,35.7758683,139.5867344,
埼玉県,新座市,8-5,栄四丁目6番17号,四条児童遊園フェンス,35.7753965,139.5839277,
埼玉県,新座市,8-6,栄四丁目8番19号,民家ブロック塀,35.7769116,139.5832509,
埼玉県,新座市,8-7,新塚一丁目1番1号,栄小学校入口フェンス,35.7785063,139.5881901,
埼玉県,新座市,9-1,西堀二丁目10番3号,民家東側ブロック塀,35.7729592,139.5389124,
埼玉県,新座市,9-2,西堀二丁目10番12号,(有)新清前,35.7730621,139.5375074,
埼玉県,新座市,9-3,西堀二丁目10番,西堀二丁目児童遊園フェンス,35.7731385,139.5378642,
埼玉県,新座市,9-4,新堀一丁目5番,新堀一丁目緑地公園,35.7720514,139.5365912,
埼玉県,新座市,9-5,新堀一丁目5番9号,西堀・新堀コミュニティセンターフェンス,35.7715794,139.5359391,
埼玉県,新座市,9-6,新堀一丁目11番,新座市緑地保護区内林,35.7727377,139.5340454,
埼玉県,新座市,9-7,新堀一丁目14番41号,民家ブロック塀,35.7721027,139.5299366,
埼玉県,新座市,10-1,野寺一丁目1番11号,バス停『貝沼』前フェンス,35.7678137,139.5585668,
埼玉県,新座市,10-2,野寺一丁目8番,野寺公園北側フェンス,35.7656457,139.5541763,
埼玉県,新座市,10-3,野寺二丁目5番25号,野寺集会所フェンス,35.7658314,139.5593692,
埼玉県,新座市,10-4,野寺二丁目8番45号,八石小学校正門横フェンス,35.7647785,139.5571681,
埼玉県,新座市,10-5,野寺二丁目8番45号,八石小学校体育館側入口フェンス,35.7647785,139.5571681,
埼玉県,新座市,10-6,野寺二丁目16番,民家斜め向い畑,35.7638034,139.5561659,
埼玉県,新座市,10-7,野寺二丁目17番,民家前畑,35.7622728,139.5552108,
埼玉県,新座市,11-1,北野二丁目9番,北野第二公園フェンス,35.8158642,139.562533,
埼玉県,新座市,11-2,北野二丁目15番32号,北野ふれあいの家駐車場植え込み,35.8171393,139.5639539,
埼玉県,新座市,11-3,北野二丁目17番2号,民家フェンス,35.816037,139.5633113,
埼玉県,新座市,11-4,北野三丁目1番1号,東北小学校正門横フェンス,35.81766520000001,139.5682555,
埼玉県,新座市,11-5,北野三丁目8番,北野三丁目憩いの森植え込み,35.8200763,139.56906,
埼玉県,新座市,11-6,北野三丁目18番24号,ミアヘルサオアシス新座フェンス,35.8189776,139.5649671,
埼玉県,新座市,11-7,北野二丁目12番,北野中央公園フェンス,35.8170651,139.5612595,
埼玉県,新座市,11-8,北野二丁目9番15号,北野保育園フェンス,35.81603339999999,139.5627178,
埼玉県,新座市,12-1,野火止一丁目1番1号,新座市役所バス停留所脇植樹帯,35.7938851,139.5654937,
埼玉県,新座市,12-2,野火止一丁目1番2号,市民会館駐車場植え込み,35.7931195,139.5661511,
埼玉県,新座市,12-3,野火止一丁目14番,野火止ふれあい公園植え込み,35.793625,139.56633,緯度経度は怪しい
埼玉県,新座市,12-4,野火止一丁目20番,ひるねの森駐車場フェンス,35.78890000000001,139.5626922,
埼玉県,新座市,12-5,野火止二丁目1番13号,民家隣畑,35.7875736,139.5669319,
埼玉県,新座市,12-6,野火止二丁目7番11号,中原・本多集会所入口フェンス,35.7877218,139.5590674,
埼玉県,新座市,12-7,畑中一丁目7番32号,民家斜め前畑,35.793621,139.5733719,
埼玉県,新座市,13-1,新座三丁目1番9号棟横,バス停『団地南』フェンス,35.8184071,139.5559197,
埼玉県,新座市,13-2,新座三丁目2番9号棟横,2-9号棟入口前フェンス,35.8191703,139.5578876,
埼玉県,新座市,13-3,新座三丁目2番11号棟横,新座三丁目2番12号との通路植え込み,35.8195802,139.5569302,
埼玉県,新座市,13-4,新座三丁目4番1号,新座小学校正門横フェンス,35.8196354,139.5546943,
埼玉県,新座市,13-5,新座三丁目5番,中央公園入口横(幼稚園側),35.8224177,139.5550517,
埼玉県,新座市,13-6,新座三丁目5番6号棟横,三角公園フェンス,35.8225541,139.5563333,
埼玉県,新座市,13-7,新座三丁目6番1号棟,6-1号棟入口横駐車場前,35.8235499,139.5563531,
埼玉県,新座市,14-1,新座一丁目2番,富士見ケ丘児童遊園フェンス,35.8178043,139.5583147,
埼玉県,新座市,14-2,新座一丁目5番,新座一丁目第1ポケットパークフェンス,35.8182549,139.5594289,
埼玉県,新座市,14-3,新座二丁目8番1号先,山本第1駐車場西側フェンス,35.820198,139.559982,緯度経度は怪しい
埼玉県,新座市,14-4,新座二丁目18番16号棟横,プレイロットフェンス,35.8242841,139.5582701,
埼玉県,新座市,14-5,新座二丁目14番61号,新座ふれあいの家植え込み,35.8214734,139.5591722,
埼玉県,新座市,14-6,新座三丁目3番6号棟横,丸十ベーカリー前フェンス,35.8206153,139.5580565,
埼玉県,新座市,14-7,新座三丁目3番19号,テスコエクスプレス新座店裏植え込み,35.8216185,139.5574113,
埼玉県,新座市,15-1,栄二丁目9番18号,民家隣駐車場フェンス,35.7726257,139.5757918,
埼玉県,新座市,15-2,栄五丁目2番,栄五丁目児童遊園フェンス,35.7739388,139.581957,
埼玉県,新座市,15-3,栄五丁目2番39号,民家宅植え込み,35.7743463,139.5830724,
埼玉県,新座市,15-4,栄二丁目9番地,栄二丁目ふれあい公園フェンス,35.7728177,139.5767024,
埼玉県,新座市,15-5,池田三丁目4番,民家宅裏側畑(樹木),35.7715101,139.5724034,
埼玉県,新座市,15-6,池田四丁目3186番地1,池田小学校南側入口手前畑,35.770718,139.575607,緯度経度は怪しい
埼玉県,新座市,15-7,池田五丁目2番21号,民家フェンス,35.7690468,139.5768133,
埼玉県,新座市,15-8,池田三丁目3番地,池田三丁目児童遊園,35.7721035,139.5735179,
埼玉県,新座市,16-1,石神三丁目12番,石神三丁目緑地フェンス,35.7666943,139.5491628,
埼玉県,新座市,16-2,石神二丁目10番,石神二丁目第二児童遊園入口横北側,35.767506,139.554871,緯度経度は怪しい
埼玉県,新座市,16-3,石神二丁目12番40号,民家ブロック塀,35.76864,139.5539709,
埼玉県,新座市,16-4,石神四丁目5番,石神第一児童遊園フェンス,35.7688184,139.5512318,
埼玉県,新座市,16-5,石神四丁目2番3号,民家入口横フェンス,35.7710381,139.5531637,
埼玉県,新座市,16-6,石神四丁目12番,石神四丁目第4ミニパーク横フェンス,35.7701988,139.5507543,
埼玉県,新座市,16-7,石神三丁目16番,島村商店前栗畑,35.7674813,139.5475713,
埼玉県,新座市,17-1,野寺三丁目8-17番地先,野寺三丁目児童遊園,35.7634061,139.5608019,
埼玉県,新座市,17-2,野寺五丁目1番24号,野寺小学校校庭道路横フェンス,35.7601135,139.5563947,
埼玉県,新座市,17-3,野寺四丁目8番1号,第五中学校体育館東側フェンス,35.7622159,139.5608218,
埼玉県,新座市,17-4,野寺四丁目8番1号,第五中学校体育館北側フェンス(武野通り側),35.7622159,139.5608218,
埼玉県,新座市,17-5,野寺四丁目10番6号,片山浄水場入口フェンス,35.7601465,139.55983,
埼玉県,新座市,17-6,野寺五丁目1番24号,野寺小学校正門横フェンス,35.7601135,139.5563947,
埼玉県,新座市,17-7,野寺四丁目11番,野寺四丁目児童遊園フェンス,35.7610919,139.5575984,
埼玉県,新座市,18-1,野火止六丁目11番,野火止六丁目11番19号先畑,35.8061266,139.5660352,
埼玉県,新座市,18-2,野火止六丁目19番,郵政宿舎向かい植え込み,35.8097196,139.5660813,
埼玉県,新座市,18-3,野火止六丁目22番,東野緑地西側植え込み中央,35.8078642,139.5671496,
埼玉県,新座市,18-4,野火止七丁目17番10番,第二中学校校庭道路側フェンス,35.8070648,139.5697862,
埼玉県,新座市,18-5,野火止六丁目22番12号,東野小学校西門フェンス,35.8073712,139.566483,
埼玉県,新座市,18-6,野火止七丁目19番,野火止浄水場フェンス,35.8083434,139.5708113,
埼玉県,新座市,18-7,野火止六丁目16番,野火止六丁目第6ポケットパークフェンス,35.806942,139.563751,緯度経度は怪しい
埼玉県,新座市,19-1,野火止三丁目16番52号,県営新座野火止南団地2号棟前,35.7889009,139.5506184,
埼玉県,新座市,19-2,本多二丁目8番16号,総合運動公園入口駐輪場側植え込み,35.7830026,139.5497699,
埼玉県,新座市,19-3,本多一丁目4番26号,西堀浄水場高架水槽側フェンス,35.7794803,139.5563252,
埼玉県,新座市,19-4,本多一丁目3番,バス停『本多一丁目』前畑,35.7805472,139.5575984,
埼玉県,新座市,19-5,本多一丁目6番5号,民家宅横畑,35.7779773,139.5533208,
埼玉県,新座市,19-6,本多一丁目10番,バス停『西屋敷』植え込み,35.7806045,139.556325,
埼玉県,新座市,19-7,本多二丁目1番20号,市民総合体育館駐車場フェンス,35.7852071,139.5531877,
埼玉県,新座市,20-1,菅沢一丁目8番,菅沢一丁目児童遊園フェンス,35.7926252,139.5482079,
埼玉県,新座市,20-2,あたご三丁目2番,あたご緑地(あたご三丁目2番先),35.7941544,139.5427971,
埼玉県,新座市,20-3,あたご三丁目1番,あたご緑地(あたご三丁目1番先),35.7947548,139.5421606,
埼玉県,新座市,20-4,あたご三丁目11番,あたご第二児童遊園フェンス,35.7915303,139.5423197,
埼玉県,新座市,20-5,あたご三丁目13番,あたご児童遊園フェンス,35.7926815,139.5394084,
埼玉県,新座市,20-6,菅沢一丁目8番,(株)ヤブウチ商会物置隣畑,35.7926252,139.5482079,
埼玉県,新座市,20-7,あたご三丁目3番,あたご緑地(あたご三丁目3番先),35.7932679,139.5434337,
埼玉県,新座市,21-1,片山二丁目2番18号,民家横ぶどう園空地,35.7684247,139.5708312,
埼玉県,新座市,21-2,片山三丁目8番22号,エトワール片山Aフェンス,35.7648246,139.5689113,
埼玉県,新座市,21-3,片山二丁目12番,片山集会所横空地,35.7662329,139.5657168,
埼玉県,新座市,21-4,片山三丁目13番,サングリーンタケシノ前畑フェンス,35.7649308,139.5660352,
埼玉県,新座市,21-5,片山三丁目6番,民家横畑,35.767433,139.5708113,
埼玉県,新座市,21-6,片山三丁目7番,新座ローンテニスクラブ横植木畑,35.76598120000001,139.5696968,
埼玉県,新座市,21-7,片山三丁目10番50号,サミットストア新座片山店駐車場フェンス,35.7644106,139.567434,
埼玉県,新座市,22-1,大和田一丁目14番5号,民家ブロック塀,35.8087516,139.5539176,
埼玉県,新座市,22-2,大和田一丁目22番10号,新開小学校東門フェンス,35.81088099999999,139.5557026,
埼玉県,新座市,22-3,大和田一丁目26番16号,大和田公民館フェンス,35.8125624,139.5546558,
埼玉県,新座市,22-4,大和田四丁目7番5号,民家ブロック塀,35.8111698,139.5510591,
埼玉県,新座市,22-5,大和田四丁目15番6号,東武バスウエスト(株)新座営業事務所フェンス,35.8149717,139.5547209,
埼玉県,新座市,22-6,大和田三丁目2番,カインズ新座店舗前 砂利駐車場前,35.8077891,139.5464573,
埼玉県,新座市,22-7,大和田五丁目12番25号,大和田集会所フェンス,35.8144287,139.5596765,
埼玉県,新座市,22-8,大和田一丁目23番,東裏公園フェンス,35.8102574,139.5536192,
埼玉県,新座市,23-1,栗原一丁目5番1号,栗原小学校北側フェンス,35.7633677,139.5510989,
埼玉県,新座市,23-2,"栗原一丁目1,094番地",民家北側竹林,35.765434,139.550385,緯度経度は怪しい
埼玉県,新座市,23-3,栗原一丁目5番1号,栗原小学校正門東側フェンス,35.7633677,139.5510989,
埼玉県,新座市,23-4,栗原一丁目5番1号,栗原小学校グランド入口フェンス,35.7633677,139.5510989,
埼玉県,新座市,23-5,栗原一丁目13番15号,民家裏ブロック塀,35.7629814,139.5484267,
埼玉県,新座市,23-6,栗原一丁目6番,栗原一丁目児童遊園北側,35.7628963,139.549322,
埼玉県,新座市,23-7,栗原一丁目10番,栗原一丁目第2児童遊園北側,35.7641768,139.5478896,
埼玉県,新座市,24-1,新堀三丁目5番,新堀三丁目第2ポケットパーク,35.767464,139.519669,緯度経度は怪しい
埼玉県,新座市,24-2,新堀三丁目9番,中島第2ハイツ隣畑,35.7687883,139.5200454,
埼玉県,新座市,24-3,新堀三丁目1番3号,ハイグレイスB横ビニールハウス前,35.7698656,139.5239071,
埼玉県,新座市,24-4,新堀三丁目1番17号,新堀三丁目集会所フェンス,35.7704543,139.522749,
埼玉県,新座市,24-5,新堀三丁目10番26号,民家宅前畑,35.7691033,139.5212255,
埼玉県,新座市,24-6,新堀三丁目9番,ジーエスパーク清瀬駐車場向側フェンス,35.7687883,139.5200454,
埼玉県,新座市,24-7,新堀三丁目11番22号,民家前畑,35.7695818,139.5224063,
埼玉県,新座市,25-1,中野一丁目10番,跡見学園女子大学裏茶畑,35.819263,139.541443,緯度経度は怪しい
埼玉県,新座市,25-2,中野二丁目13番,東邦観光バス(株)隣畑,35.82012539999999,139.5423197,
埼玉県,新座市,25-3,中野二丁目7番 5号,民家前空地,35.8158172,139.5469358,
埼玉県,新座市,25-4,中野二丁目11番21号,跡見学園女子大学向民家フェンス,35.8182839,139.5442485,
埼玉県,新座市,25-5,中野一丁目3番13号,中野集会所前民家ブロック塀,35.8148149,139.545111,
埼玉県,新座市,26-1,畑中三丁目5番17号,民家ブロック塀,35.7943301,139.5766666,
埼玉県,新座市,26-2,畑中三丁目1番,畑中三丁目第1ポケットパークフェンス,35.7951921,139.5754286,
埼玉県,新座市,26-3,野火止八丁目12番30号,野火止八丁目第1ポケットパークフェンス,35.79784430000001,139.5740055,
埼玉県,新座市,26-4,野火止八丁目4番,ひかわ児童遊園フェンス,35.7961938,139.5722442,
埼玉県,新座市,26-5,野火止八丁目16番2号,民家前生け垣,35.8003317,139.5714317,
埼玉県,新座市,26-6,野火止八丁目7番28号,野火止八丁目集会所フェンス,35.7965794,139.5737361,
埼玉県,新座市,26-7,野火止八丁目15番,野火止大門公園フェンス,35.7991085,139.5701288,
埼玉県,新座市,27-1,東一丁目8番,東一丁目第3ポケットパークフェンス,35.8103526,139.56906,
埼玉県,新座市,27-2,東一丁目7番35号,神田コーポ横駐車場フェンス,35.8091105,139.5705098,
埼玉県,新座市,27-3,東二丁目1番,ヴェルドミール新座向い畑,35.8123418,139.5691247,
埼玉県,新座市,27-4,東二丁目4番,上東公園フェンス(北側),35.8118042,139.5701745,
埼玉県,新座市,27-5,東二丁目9番,仲好荘向い畑,35.81178999999999,139.5736771,
埼玉県,新座市,27-6,東三丁目1番36号,民家隣畑,35.8141625,139.5697295,
埼玉県,新座市,27-7,東三丁目4番,バス停『東三丁目』植え込み,35.814725,139.5712093,
埼玉県,新座市,27-8,東三丁目1番,中東公園フェンス,35.8143566,139.56906,
埼玉県,新座市,28-1,栄一丁目2番24号,栄集会所入口,35.776424,139.576645,緯度経度は怪しい
埼玉県,新座市,28-2,栄一丁目9番,妙音沢特別緑地北側植え込み,35.773972,139.5737,緯度経度は怪しい
埼玉県,新座市,28-3,栄一丁目10番,妙音沢特別緑地南側植え込み,35.774906,139.574554,緯度経度は怪しい
埼玉県,新座市,28-4,池田一丁目1番1号,第三中学校正門横ネットフェンス,35.7771927,139.5733886,
埼玉県,新座市,28-5,栄二丁目6番,サンシティ佐々木はす向い畑,35.7751279,139.5778169,
埼玉県,新座市,28-6,栄二丁目10番18号,民家裏生け垣,35.7734544,139.5761161,
埼玉県,新座市,28-7,池田一丁目1番2号,県立新座高等学校テニスコート南側フェンス,35.7756816,139.5741299,
埼玉県,新座市,29-1,栗原三丁目8番34号,栗原公民館駐車場フェンス,35.7611122,139.550783,
埼玉県,新座市,29-2,栗原四丁目2番,民家隣畑,35.7587181,139.5531417,
埼玉県,新座市,29-3,栗原三丁目7番7号,武野集会所フェンス,35.7597672,139.5518883,
埼玉県,新座市,29-4,栗原二丁目4番,栗原二丁目児童遊園東側フェンス,35.7612645,139.5537784,
埼玉県,新座市,29-5,栗原三丁目8番34号,栗原公民館前植え込み,35.7611122,139.550783,
埼玉県,新座市,29-6,栗原四丁目3番,浅間上児童遊園東側フェンス,35.75707999999999,139.5529825,
埼玉県,新座市,29-7,栗原四丁目3番,浅間上児童遊園南側フェンス,35.75707999999999,139.5529825,
埼玉県,新座市,30-1,馬場三丁目3番,馬場三丁目児童遊園地フェンス,35.7808872,139.5754286,
埼玉県,新座市,30-2,馬場三丁目7番13号,民家ブロックフェンス,35.7789746,139.5756077,
埼玉県,新座市,30-3,馬場四丁目4番24号,民家前畑,35.7798513,139.5683735,
埼玉県,新座市,30-4,馬場四丁目7番30号,(株)アイ企画倉庫斜め前畑,35.7791463,139.5697378,
埼玉県,新座市,30-5,馬場四丁目3番36号,馬場四丁目児童遊園フェンス,35.7809378,139.5677019,
埼玉県,新座市,30-6,馬場三丁目6番,第四小学校北側フェンス,35.7803261,139.5778109,
埼玉県,新座市,30-7,馬場四丁目8番,馬場運動場入口西側植え込み,35.7774311,139.5703892,
埼玉県,新座市,31-1,畑中二丁目5番22号,民家東福寺入口脇ブロック塀,35.7888256,139.5770096,
埼玉県,新座市,31-2,畑中一丁目11番2号,畑中一丁目第4ポケットパークフェンス,35.7899142,139.5730036,
埼玉県,新座市,31-3,畑中一丁目8番43号,畑中一丁目第5ポケットパークフェンス,35.7927305,139.5751463,
埼玉県,新座市,31-4,畑中一丁目13番,並利駐車場フェンス,35.788799,139.574814,緯度経度は怪しい
埼玉県,新座市,31-5,畑中一丁目10番8号,畑中一丁目第1ポケットパークフェンス,35.7911245,139.5738574,
埼玉県,新座市,31-6,畑中二丁目17番19号,畑中黒目川公園,35.7901373,139.5781061,
埼玉県,新座市,31-7,畑中二丁目 6番31号,(株)並木運輸生垣,35.7881828,139.5758968,
埼玉県,新座市,32-1,新堀二丁目6番24号,民家前畑,35.7698349,139.5289445,
埼玉県,新座市,32-2,新堀二丁目7番,民家前畑,35.7706167,139.52792,
埼玉県,新座市,32-3,新堀二丁目17番20号,新堀二丁目ミニパーク,35.7709818,139.529725,
埼玉県,新座市,32-4,新堀二丁目6番1号,新堀二丁目第二児童遊園フェンス,35.7701786,139.5300217,
埼玉県,新座市,32-5,新堀二丁目7番29号,新堀ふれあいの家横畑,35.7707254,139.52779,
埼玉県,新座市,32-6,新堀二丁目14番,新堀保育園前畑,35.77084869999999,139.525136,
埼玉県,新座市,32-7,新堀二丁目3番15号,新堀二丁目ふれあい公園,35.770332,139.5308832,
埼玉県,新座市,33-1,野火止五丁目14番,グリーンランド児童遊園フェンス,35.8083284,139.5615779,
埼玉県,新座市,33-2,野火止五丁目17番21号,野火止五丁目第2ポケットパークフェンス,35.8110261,139.5648015,
埼玉県,新座市,33-3,野火止五丁目25番,かつみ不動産(株)レンタルボックスフェンス,None,None,緯度経度は怪しい
埼玉県,新座市,33-4,野火止五丁目29番26号,県営新座野火止北住宅東側フェンス,35.8127021,139.5602321,
埼玉県,新座市,33-5,野火止五丁目29番26号,県営新座野火止北住宅北側フェンス,35.8127021,139.5602321,
埼玉県,新座市,33-6,野火止五丁目18番,野火止五丁目第6ポケットパークフェンス,35.8097515,139.5633289,
埼玉県,新座市,33-7,野火止五丁目18番,すぎのこ保育園横クリエール志木駐車場フェンス,35.8097515,139.5633289,
埼玉県,新座市,34-1,野火止六丁目4番5号,民家隣畑,35.80318,139.5605621,
埼玉県,新座市,34-2,野火止六丁目1番48号,野火止ふるさと広場南側,35.8005916,139.5626749,
