prefecture,city,number,address,name,lat,long,note
長野県,飯綱町,1-1,大字平出172,masked,36.724286,138.246386,
長野県,飯綱町,1-2,大字平出284,平出集落センター,36.726842,138.245652,
長野県,飯綱町,1-3,大字平出番匠入口バス停付近,町道K２－１号線道路敷,36.729049,138.245716,
長野県,飯綱町,1-4,大字平出2955-1,三本松農産物加工施設前・平井喜一朗所有地,36.736420,138.243763,
長野県,飯綱町,1-5,大字豊野4423-1,番匠公民館道向かい・廣瀬みい子氏所有地,36.729983,138.249121,
長野県,飯綱町,2-1,大字豊野1025,宮川マスミ所有地,36.738652,138.245074,
長野県,飯綱町,2-2,大字豊野南部保育園下の駐車場前,,36.740208,138.249227,
長野県,飯綱町,2-3,大字豊野フォレストヒルズ入口バス停付近,町道K２－１４号線道路敷,36.743313,138.248543,
長野県,飯綱町,2-4,大字豊野1802,masked,36.742341,138.247071,
長野県,飯綱町,2-5,大字豊野福井団地終末処理場貯水池フェンス,,36.738360,138.252792,
長野県,飯綱町,3-1,大字牟礼991,masked,36.740986,138.240723,
長野県,飯綱町,3-2,大字牟礼687-1,牟礼自動車整備工場道向かい,36.746200,138.238158,
長野県,飯綱町,3-3,大字豊野福井集落センター前,,36.743678,138.243044,
長野県,飯綱町,3-4,大字豊野牟礼駅道向かい,,36.750710,138.244794,
長野県,飯綱町,3-5,大字牟礼527-3,朝日屋旅館駐車場前,36.751111,138.241927,
長野県,飯綱町,3-6,大字牟礼坂上ごみステーション,,36.744331,138.238708,緯度経度は怪しい
長野県,飯綱町,3-7,大字牟礼ガード下付近道路敷きフェンス,,36.750914,138.238036,
長野県,飯綱町,3-8,大字牟礼飯綱病院駐車場,,36.748197,138.235989,
長野県,飯綱町,3-9,大字牟礼牟礼郵便局裏フェンス,,36.753946,138.235132,
長野県,飯綱町,3-10,大字小玉消防詰所北側線路沿いフェンス,,36.757081,138.226568,
長野県,飯綱町,3-11,大字牟礼2578-9,北澤治男所有地,36.753961,138.230431,
長野県,飯綱町,3-12,大字牟礼民会館入口,,36.740814,138.236558,
長野県,飯綱町,4-1,大字黒川1455,masked,36.746867,138.229367,
長野県,飯綱町,4-2,大字黒川1132-1,masked,36.742354,138.227294,
長野県,飯綱町,4-3,大字黒川1038-1,良松寺駐車場フェンス,36.741295,138.225261,
長野県,飯綱町,4-4,大字黒川牟礼小学校前水防倉庫横,,36.750195,138.230778,
長野県,飯綱町,4-5,大字黒川1712-3,飯島とみ子所有地,36.745935,138.222919,
長野県,飯綱町,4-6,大字古町692-3,古町ゲートボール場前,36.749481,138.215914,
長野県,飯綱町,5-1,大字袖之山523-4,masked,36.725798,138.220799,
長野県,飯綱町,5-2,大字地蔵久保地蔵久保鐘鐘楼跡,,36.716379,138.207351,
長野県,飯綱町,5-3,大字坂口坂口公民館フェンス,,36.721069,138.205982,
長野県,飯綱町,5-4,大字高坂400-2,中根喜久男所有地,36.724788,138.200099,
長野県,飯綱町,5-5,大字高坂高坂下バス停前水路敷,,36.729975,138.202372,
長野県,飯綱町,5-6,大字川上761-1,夏川公民館駐車場（上段）,36.733974,138.207025,
長野県,飯綱町,5-7,大字川上いいづなコネクトW.E.S.T（旧牟礼西小学校）前フェンス,,36.736638,138.214185,
長野県,飯綱町,5-8,大字川上1152-8,野村上戸谷商店上水路フェンス,36.735168,138.212114,
長野県,飯綱町,5-9,大字川上北川消防コミュニティセンター横県道敷,,36.739622,138.208787,
長野県,飯綱町,5-10,大字柳里880-3,金井達也所有地,36.746655,138.209016,
長野県,飯綱町,5-11,大字柳里316-1,中宿公民館前,36.741477,138.214213,
長野県,飯綱町,6-1,大字川上2755-41,外山邦廣所有地・直売所横,36.739674,138.185556,
長野県,飯綱町,6-2,大字川上白樺地区集積所横（町道M1-15号線道路敷）,,36.751667,138.190526,
長野県,飯綱町,6-3,大字川上むれ温泉天狗の館道向かい,,36.747548,138.196235,
長野県,飯綱町,6-4,大字川上つつじヶ原管理センター入口,,36.732508,138.179229,
長野県,飯綱町,7-1,大字芋川旧三水庁舎跡地,,36.766556,138.249979,
長野県,飯綱町,7-2,大字芋川1487,masked,36.769895,138.254296,
長野県,飯綱町,7-3,大字芋川4072,中村バス停前（松野宗敏所有地）,36.773360,138.257241,
長野県,飯綱町,7-4,大字芋川御所ノ入バス停横,,36.779833,138.256036,
長野県,飯綱町,7-5,大字芋川10-1,masked,36.765286,138.247235,
長野県,飯綱町,7-6,大字芋川1516-1,田中公会堂横,36.770031,138.255830,
長野県,飯綱町,8-1,大字芋川溝口バス停横,,36.795492,138.260235,
長野県,飯綱町,8-2,大字芋川若宮バス停道向い,,36.787636,138.259931,
長野県,飯綱町,8-3,大字芋川堀越入口（県道沿い）,,36.801054,138.259914,
長野県,飯綱町,9-1,大字普光寺普光寺公民館前,,36.759715,138.241608,
長野県,飯綱町,9-2,大字普光寺1191-3,普光寺西部公会堂付近町道沿い,36.759768,138.236495,
長野県,飯綱町,9-3,大字普光寺489-1,masked,36.760287,138.244426,
長野県,飯綱町,9-4,大字普光寺信濃交通内,,36.753419,138.240893,
長野県,飯綱町,9-5,大字普光寺鳥居川消防署道向かい町道フェンス,,36.753333,138.238811,
長野県,飯綱町,9-6,大字普光寺農協配送センター横,,36.761845,138.245537,
長野県,飯綱町,9-7,大字普光寺822-1,masked,36.755364,138.240795,
長野県,飯綱町,10-1,大字川谷風坂公会堂付近,,36.742255,138.266150,
長野県,飯綱町,10-2,大字倉井北部高校入口バス停横,,36.754649,138.247091,
長野県,飯綱町,10-3,大字倉井2688-2,masked,36.757014,138.254500,
長野県,飯綱町,10-4,大字倉井747-8,泉屋バス停横（原初男所有地）,36.758457,138.259888,
長野県,飯綱町,10-5,大字倉井一ツ家入口三叉路,,36.751730,138.268400,
長野県,飯綱町,10-6,大字倉井2811-1,masked,36.752559,138.259348,
長野県,飯綱町,10-7,大字倉井3862,東原生活公会堂,36.748927,138.264271,
長野県,飯綱町,10-8,大字倉井3602-5,大原生活公会堂,36.746673,138.260192,
長野県,飯綱町,10-9,大字倉井4539-2,大久保集会所,36.741778,138.269841,
長野県,飯綱町,10-10,大字倉井2750-1,倉井消防コミュニティセンター第七分団器具置場道向かい,36.753535,138.254735,
長野県,飯綱町,11-1,大字赤塩赤東コミュニティ消防センター前,,36.763496,138.277361,
長野県,飯綱町,11-2,大字赤塩601-1,上赤塩信号交差点付近（大川友一所有地）,36.752736,138.275546,
長野県,飯綱町,11-3,大字赤塩5925-3,上赤塩公会堂前,36.755191,138.277431,
長野県,飯綱町,11-4,大字赤塩5689-1,毛見バス停横（大川孝一所有地）,36.761078,138.276586,
長野県,飯綱町,11-5,大字赤塩2452-1,黒岩商店横,36.765629,138.276726,
長野県,飯綱町,11-6,大字赤塩下赤塩公会堂下,,36.765663,138.282400,
長野県,飯綱町,11-7,大字赤塩いいづなコネクトEAST（旧三水第二小）入口バス停,,36.763794,138.280155,
長野県,飯綱町,11-8,大字東柏原68-イ,東柏原公会堂前,36.775579,138.278329,
長野県,飯綱町,11-9,大字東柏原奈良本バス停横,,36.776019,138.291647,
長野県,飯綱町,11-10,大字赤塩扇平団地三叉路,,36.746126,138.276739,
