prefecture,city,number,address,name,lat,long,note
愛知県,扶桑町,1,扶桑町大字高雄字中郷379番地,masked,35.36076,136.930115,
愛知県,扶桑町,2,扶桑町大字高雄字郷東249番地,北新田児童遊園,35.362492,136.933777,
愛知県,扶桑町,3,扶桑町大字高雄字米ノ山140番地,木津用水第１自転車駐車場,35.367519,136.927841,
愛知県,扶桑町,4,扶桑町大字高雄字羽根西38番地,羽根西児童遊園,35.366127,136.923767,
愛知県,扶桑町,5,扶桑町大字高雄字北羽根37番地2,羽根公民館,35.364468,136.925262,
愛知県,扶桑町,6,扶桑町大字高雄字米ノ山222番地,masked,35.366016,136.925781,
愛知県,扶桑町,7,扶桑町大字高雄字北海道61番地,高雄小学校,35.363781,136.924606,
愛知県,扶桑町,8,扶桑町大字高雄字北東川307番地,東川北児童遊園,35.359669,136.926102,
愛知県,扶桑町,9,扶桑町大字高雄字北東川102番地,高雄保育園 ,35.360641,136.922806,
愛知県,扶桑町,10,扶桑町大字高雄字南東川161番地,masked,35.35778,136.922867,
愛知県,扶桑町,11,扶桑町大字高雄字中海道223番地,高雄公園,35.362751,136.919403,
愛知県,扶桑町,12,扶桑町大字高雄字北東川73番地,高雄学習等供用施設,35.360973,136.921646,
愛知県,扶桑町,13,扶桑町大字高雄字下山230番地,masked,35.360668,136.91748,
愛知県,扶桑町,14,扶桑町大字高雄字下山330番地,高雄団地公民館,35.361225,136.919037,
愛知県,扶桑町,15,扶桑町大字高木字白山前667番地,高木東公民館,35.355331,136.911331,
愛知県,扶桑町,16,扶桑町大字高雄字下山121番地,大淵児童遊園,35.359726,136.916779,
愛知県,扶桑町,17,扶桑町大字高雄字天道330番地,扶桑町役場,35.359329,136.913208,
愛知県,扶桑町,18,扶桑町大字高雄字下山91番地,扶桑駅西ロータリー内,35.359913,136.916153,
愛知県,扶桑町,19,扶桑町大字高雄字福塚146番地,福塚公民館向い側,35.361626,136.913345,
愛知県,扶桑町,20,扶桑町大字高木字1278番地,旧地蔵寺,35.359074,136.909821,
愛知県,扶桑町,21,扶桑町大字高雄字福塚10番地,扶桑北中学校,35.363987,136.910812,
愛知県,扶桑町,22,扶桑町大字高雄字中屋敷37番地1,南新田北児童遊園,35.356037,136.923996,
愛知県,扶桑町,23,扶桑町大字高雄字南屋敷205番地,高雄南保育園,35.35379,136.921005,
愛知県,扶桑町,24,扶桑町大字高雄字薬師堂81番地1,薬師堂児童遊園,35.358643,136.919708,
愛知県,扶桑町,25,扶桑町大字高雄字定松郷150番地1,南定松児童遊園,35.354977,136.919296,
愛知県,扶桑町,26,扶桑町大字高雄字定松郷58番地,扶桑東小学校,35.357025,136.917511,
愛知県,扶桑町,27,扶桑町大字柏森字平塚371番地,扶桑町総合体育館,35.351898,136.916733,
愛知県,扶桑町,28,扶桑町大字柏森字平塚202番地,平塚児童遊園,35.353142,136.91304,
愛知県,扶桑町,29,扶桑町大字高雄字宮島112番地,masked,35.363171,136.917725,
愛知県,扶桑町,30,扶桑町大字高雄字伊勢帰218番地,masked,35.365124,136.91835,
愛知県,扶桑町,31,扶桑町大字高雄字堂子276番地,高雄西学習等供用施設,35.364983,136.915085,
愛知県,扶桑町,32,扶桑町大字高雄字福塚43番地,扶桑町いこいの家,35.363777,136.912643,
愛知県,扶桑町,33,扶桑町大字高雄字伊勢帰149番地,masked,35.367195,136.918213,
愛知県,扶桑町,34,扶桑町大字高雄字扶桑台347番地,南入口ロータリー内,35.367905,136.913315,
愛知県,扶桑町,35,扶桑町大字高雄字扶桑台100番地,扶桑台第２児童遊園,35.369781,136.915878,
愛知県,扶桑町,36,扶桑町大字南山名字安戸93番地,安戸児童遊園,35.367863,136.909286,
愛知県,扶桑町,37,扶桑町大字南山名字安戸132番地,masked,35.369061,136.911499,
愛知県,扶桑町,38,扶桑町大字南山名字別レ塚53番地1,masked,35.372246,136.913574,
愛知県,扶桑町,39,扶桑町大字山那字屋敷地617番地1,山那神社西児童遊園,35.372456,136.91188,
愛知県,扶桑町,40,扶桑町大字南山名字山神前79番地,山名学習等供用施設,35.371082,136.909775,
愛知県,扶桑町,41,扶桑町大字南山名字山神前60番地,山那児童遊園,35.370266,136.908112,
愛知県,扶桑町,42,扶桑町大字山那字大持838番地5,つくし学園,35.371517,136.906235,
愛知県,扶桑町,43,扶桑町大字小淵1180番地,masked,35.37392,136.90271,
愛知県,扶桑町,44,扶桑町大字小淵1231番地,神明社前,35.374252,136.90213,
愛知県,扶桑町,45,扶桑町大字南山名字本郷185番地,山名西学習等供用施設,35.369251,136.902985,
愛知県,扶桑町,46,扶桑町大字南山名字宮西135番地,山名保育園,35.368572,136.905762,
愛知県,扶桑町,47,扶桑町大字南山名字馬場45番地1,masked,35.364582,136.90712,
愛知県,扶桑町,48,扶桑町大字南山名字仲畑119番地,丹羽消防署扶桑出張所,35.36409,136.902802,
愛知県,扶桑町,49,扶桑町大字南山名字名護根103番地,中日ﾊﾞｯﾃｨﾝｸﾞｾﾝﾀｰ前,35.364227,136.898148,
愛知県,扶桑町,50,扶桑町大字斎藤字北屋敷102番地,斎藤北児童遊園 ,35.35939,136.903229,
愛知県,扶桑町,51,扶桑町大字斎藤字旭414番地,斎藤南児童遊園  ,35.348984,136.896454,
愛知県,扶桑町,52,扶桑町大字斎藤字榎230番地,扶桑町総合福祉センター,35.354294,136.900406,
愛知県,扶桑町,53,扶桑町大字斎藤字山神102番地,斎藤学習等供用施設,35.357021,136.899277,
愛知県,扶桑町,54,扶桑町大字斎藤字境山20番地1,青山工業株式会社,35.352875,136.893524,
愛知県,扶桑町,55,扶桑町大字斎藤字榎80番地,緑ヶ丘児童遊園,35.353226,136.897583,
愛知県,扶桑町,56,扶桑町大字斎藤字旭62番地,masked,35.349373,136.894363,
愛知県,扶桑町,57,扶桑町大字柏森字中島31番地,マンションクレスト中島方 ,35.346436,136.895599,
愛知県,扶桑町,58,扶桑町大字柏森字中島293番地1,柏森南保育園 ,35.344601,136.895203,
愛知県,扶桑町,59,扶桑町大字柏森字郷前21番地,masked,35.343773,136.898209,
愛知県,扶桑町,60,扶桑町大字柏森字天神2番地,柏森駅北ロータリー内,35.344688,136.900208,
愛知県,扶桑町,61,扶桑町大字柏森字西屋敷40番地,柏森西児童遊園,35.348354,136.897995,
愛知県,扶桑町,62,扶桑町大字柏森字天神115番地2,柏森駅南ロータリー内,35.344688,136.900208,
愛知県,扶桑町,63,扶桑町大字柏森字乙西屋敷68番地1,柏森中央学習等供用施設,35.348007,136.899963,
愛知県,扶桑町,64,扶桑町大字柏森字御字神154番地2,masked,35.347553,136.906769,
愛知県,扶桑町,65,扶桑町大字柏森字中屋敷97番地,masked,35.348682,136.903214,
愛知県,扶桑町,66,扶桑町大字柏森字丙寺裏40番地,柏森小学校 ,35.351315,136.90361,
愛知県,扶桑町,67,扶桑町大字柏森字辻田473番地,柏森学習等供用施設,35.352596,136.905899,
愛知県,扶桑町,68,扶桑町大字柏森字中切466番地,柏森東児童遊園,35.350895,136.906876,
愛知県,扶桑町,69,扶桑町大字柏森字辻田670番地,扶桑中学校,35.354317,136.909058,
愛知県,扶桑町,70,扶桑町大字柏森字花立80番地8,masked,35.349365,136.912796,
