prefecture,city,number,address,name,lat,long,note
愛知県,新城市,1,新城市字井道42-1,東新町公民館南側畑,34.8988961,137.5111659,緯度経度は怪しい
愛知県,新城市,2,新城市字二本松45-3,菅沼建具店東側駐車場,34.9014779,137.5098298,緯度経度は怪しい
愛知県,新城市,3,新城市字東沖野20-12,新城市社会福祉協議会駐車場北側,34.9025046,137.5085428,緯度経度は怪しい
愛知県,新城市,4,新城市字中野17,（一社）新城建設業協会事務所フェンス（北側）,34.9006827,137.5062375,緯度経度は怪しい
愛知県,新城市,5,新城市字石名号20-1,新城設楽総合庁舎ネットフェンス（西側）,34.9017405,137.5044055,緯度経度は怪しい
愛知県,新城市,6,新城市字桜渕中野合併地,新城有教館高校体育館北側ネットフェンス,34.896237,137.5060649,緯度経度は怪しい
愛知県,新城市,7,新城市字札木40-4,小西測量事務所西側ライオンズクラブ啓発塔横,34.8994869,137.5005718,緯度経度は怪しい
愛知県,新城市,8,新城市字東入船124-1,市役所本庁舎前交差点北東,34.8995745,137.497849,
愛知県,新城市,9,新城市字八幡11-2,名古屋法務局新城支局ネットフェンス(南側),34.8977226,137.4932086,緯度経度は怪しい
愛知県,新城市,10,新城市字裏野1-1,新城税務署駐輪場前ネットフェンス(西側),34.9025218,137.4975854,緯度経度は怪しい
愛知県,新城市,11,新城市城北2丁目7-1,城北東部公園ネットフェンス（西側）,34.9063375,137.4973033,緯度経度は怪しい
愛知県,新城市,12,新城市字町並52,愛知銀行新城支店駐車場ネットフェンス,34.899257,137.4952263,緯度経度は怪しい
愛知県,新城市,13,新城市字宮ノ西29-2,JR新城駅舎南東側コンクリート柵,34.9010921,137.4932787,緯度経度は怪しい
愛知県,新城市,14,新城市字宮ノ後68-3,ピアゴ新城店ネットフェンス（東側）,34.9034856,137.4950996,緯度経度は怪しい
愛知県,新城市,15,新城市片山390-1,masked,34.9203347,137.4870496,緯度経度は怪しい
愛知県,新城市,16,新城市徳定383,masked,34.9127147,137.4882954,緯度経度は怪しい
愛知県,新城市,17,新城市豊栄813-1,山公民館敷地,34.9061957,137.4772571,緯度経度は怪しい
愛知県,新城市,18,新城市豊栄1232,臼子公民館前敷地,34.9098543,137.4660296,緯度経度は怪しい
愛知県,新城市,19,新城市杉山字荒井19-1,萬福寺駐車場（南側道沿い）,34.9032612,137.4856234,緯度経度は怪しい
愛知県,新城市,20,新城市杉山字大東56-3,masked,34.900199,137.4886738,緯度経度は怪しい
愛知県,新城市,21,新城市杉山字前野4-1,千郷小学校ネットフェンス（東側：正門南バス停付近）,34.89661410000001,137.483319,緯度経度は怪しい
愛知県,新城市,22,新城市石田字池田309-2,石田公民館敷地(南側),34.8939098,137.4901161,緯度経度は怪しい
愛知県,新城市,23,新城市豊栄411-1,masked,34.9159659,137.4637499,緯度経度は怪しい
愛知県,新城市,24,"新城市豊栄226,227合併地",旧諏訪公民館横駐車場,34.8953181,137.4738849,緯度経度は怪しい
愛知県,新城市,25,新城市豊栄253-3,諏訪神社下駐車場土手,34.9159659,137.4637499,緯度経度は怪しい
愛知県,新城市,26,"新城市稲木33,34",稲木公民館ネットフェンス（西側）,34.9014776,137.4563943,緯度経度は怪しい
愛知県,新城市,27,新城市野田字西町屋敷128-3,野田忠魂碑前公園ネットフェンス（東側）,34.8920071,137.4765108,緯度経度は怪しい
愛知県,新城市,28,新城市野田字東浄悦1-1,JR野田城駅舎西側コンクリート柵,34.889672,137.4778535,緯度経度は怪しい
愛知県,新城市,29,新城市野田字上市場26-2,masked,34.8885252,137.4721236,緯度経度は怪しい
愛知県,新城市,30,新城市野田字西町屋敷98,masked,34.8909745,137.4762886,緯度経度は怪しい
愛知県,新城市,31,新城市野田字西郷31-1,津島神社境内地信号側,34.8834986,137.4790775,緯度経度は怪しい
愛知県,新城市,32,新城市豊島字北88-1,鈴木氏敷地,34.8782222,137.4668151,緯度経度は怪しい
愛知県,新城市,33,新城市豊島字馬渡11-2,千郷西こども園ネットフェンス（北側）,34.8808271,137.4667002,緯度経度は怪しい
愛知県,新城市,34,新城市川田字下側100,川田公民館ネットフェンス,34.8771738,137.4578413,緯度経度は怪しい
愛知県,新城市,35,新城市川田字山田平22-3,川田山田平交差点（南西側）,34.882983,137.459459,緯度経度は怪しい
愛知県,新城市,36,新城市川田字本宮道109-1,㈱新城家具販売ネットフェンス(西側),34.8866298,137.4540465,緯度経度は怪しい
愛知県,新城市,37,新城市市場台3丁目4-21,市場台北公園西側空地北側,34.8867913,137.4689247,緯度経度は怪しい
愛知県,新城市,38,"新城市野田字専徳48,49合併地",masked,34.885977,137.473316,緯度経度は怪しい
愛知県,新城市,39,新城市野田字上市場26-2,西部福祉会館北側ネットフェンス,34.8885252,137.4721236,緯度経度は怪しい
愛知県,新城市,40,新城市平井字中田6-1,JA愛知東やすらぎホールしんしろネットフェンス（西側）,34.9062979,137.5019028,緯度経度は怪しい
愛知県,新城市,41,新城市上平井１,上平井公民館前敷地,34.9115278,137.5013057,緯度経度は怪しい
愛知県,新城市,42,新城市平井字東原30,masked,34.9073838,137.5078607,緯度経度は怪しい
愛知県,新城市,43,新城市平井字新栄43,平井公民館フェンス(南東側),34.9082361,137.5042923,緯度経度は怪しい
愛知県,新城市,44,新城市矢部字広見100,旧新城東高校正門西側ネットフェンス（R１５１沿）,34.9138746,137.5080036,緯度経度は怪しい
愛知県,新城市,45,新城市富沢字安楽寺251-1,富沢公民館広場(北側),34.9070282,137.5140412,緯度経度は怪しい
愛知県,新城市,46,新城市矢部字上ノ川15-2,矢部公民館ネットフェンス（東側）,34.9170005,137.5075987,緯度経度は怪しい
愛知県,新城市,47,新城市富永字安京25,川上公会堂西側,34.9212984,137.5149616,緯度経度は怪しい
愛知県,新城市,48,新城市竹広字宮川162-2,東郷中学校正門南側土手,34.9168335,137.5263146,緯度経度は怪しい
愛知県,新城市,49,"新城市大宮字大ノ木6-10,12-11",大宮構造改善センター敷地,34.9232011,137.5197173,緯度経度は怪しい
愛知県,新城市,50,新城市牛倉字北下67,masked,34.9243548,137.5168024,緯度経度は怪しい
愛知県,新城市,51,新城市須長字石岸32-1,須長公民館ネットフェンス（西側）,34.9289021,137.5262821,緯度経度は怪しい
愛知県,新城市,52,新城市八束穂字甲田912-1,八束穂公民館敷地（東側植栽前）,34.9216582,137.5349078,緯度経度は怪しい
愛知県,新城市,53,新城市八束穂字天王1041-2,東郷中こども園ネットフェンス（南東側）,34.9216582,137.5349078,緯度経度は怪しい
愛知県,新城市,54,新城市竹広492-2,竹広交差点南西角,34.9168335,137.5263146,緯度経度は怪しい
愛知県,新城市,55,新城市川路字連吾25,川路公民館ネットフェンス,34.9117679,137.5237776,緯度経度は怪しい
愛知県,新城市,56,新城市八束穂175-1,masked,34.9216582,137.5349078,緯度経度は怪しい
愛知県,新城市,57,新城市浅谷字又谷8番地1,浅谷区民広場（浅谷公民館東隣）,34.9378181,137.534294,緯度経度は怪しい
愛知県,新城市,58,新城市横川字宮ノ前432,滝川氏所有山林市道沿い,34.9373467,137.5536335,緯度経度は怪しい
愛知県,新城市,59,新城市横川字入り124-2,横川公民館ネットフェンス（西側）,34.9506408,137.5496422,緯度経度は怪しい
愛知県,新城市,60,新城市出沢字的場田45-2,消防詰所横駐車場,34.9413282,137.5352147,緯度経度は怪しい
愛知県,新城市,61,新城市大海字黒瀬1-1,大海交差点ネットフェンス,34.9310039,137.5527124,緯度経度は怪しい
愛知県,新城市,62,新城市大海字黒瀬23-7,東郷東こども園ネットフェンス（西側）,34.93198880000001,137.5537106,緯度経度は怪しい
愛知県,新城市,63,新城市有海字作神54,向和リース㈱新城営業所ネットフェンス,34.924882,137.5515792,緯度経度は怪しい
愛知県,新城市,64,新城市有海字稲場5-4,有海ふれあい広場ネットフェンス（西側）,34.9197869,137.5536335,緯度経度は怪しい
愛知県,新城市,65,新城市緑が丘4丁目104,緑が丘第４公園ネットフェンス（北側）,34.9281378,137.5493352,緯度経度は怪しい
愛知県,新城市,66,新城市市川字西ノ久保34-1,市川公民館南東側駐車場用地,34.9079558,137.5603887,緯度経度は怪しい
愛知県,新城市,67,"新城市市川字宮ノ前27,27-2",旧市川小学校跡地ネットフェンス（北側）,34.9015676,137.49415,緯度経度は怪しい
愛知県,新城市,68,新城市日吉字中貝津29-1,舟渡公会堂前（県道沿）,34.9042213,137.5266215,緯度経度は怪しい
愛知県,新城市,69,新城市日吉字原57-9,塩沢構造改善センター前(県道沿い）,34.90289730000001,137.5326284,緯度経度は怪しい
愛知県,新城市,70,新城市日吉字小袋13,舟着小学校ネットフェンス(郵便局前),34.9026533,137.5235668,緯度経度は怪しい
愛知県,新城市,71,新城市日吉字下畑81,鳥原児童館前角ネットフェンス（交差点付近）,34.8991773,137.5220156,緯度経度は怪しい
愛知県,新城市,72,新城市日吉字青木林54-1,農業集落排水吉川処理場フェンス（東側）,34.8909706,137.5402203,緯度経度は怪しい
愛知県,新城市,73,新城市吉川字津舞羅47-1,朝日屋道路向かい側空地（三角地県道沿い）,34.883412,137.5527124,緯度経度は怪しい
愛知県,新城市,74,新城市吉川字広正27-1,吉川上組公会堂フェンス,34.8822404,137.5556626,緯度経度は怪しい
愛知県,新城市,75,新城市小畑字宮ノ前5-1,果樹農協出荷所前,34.8649907,137.5416485,緯度経度は怪しい
愛知県,新城市,76,新城市中宇利字坂44-11,中宇利集落センター南西側土手,34.8600018,137.5345834,緯度経度は怪しい
愛知県,新城市,77,新城市中宇利字曽根川北7-2,masked,34.8547864,137.5274534,緯度経度は怪しい
愛知県,新城市,78,新城市富岡字凡38-1,中村バス停横畑（県道南側）,34.8583752,137.5207912,緯度経度は怪しい
愛知県,新城市,79,新城市富岡字不動平19-4,不動平集会所前,34.8538485,137.5161888,緯度経度は怪しい
愛知県,新城市,80,新城市富岡字大廻り8-2,富岡ふるさと会館（富岡公民館）ネットフェンス（県道沿）,34.8512984,137.5029975,緯度経度は怪しい
愛知県,新城市,81,新城市富岡字屋敷64-2,masked,34.8540925,137.5081069,緯度経度は怪しい
愛知県,新城市,82,新城市富岡字フケ9-1,元富岡西部公民館東側敷地,34.8453253,137.4924353,緯度経度は怪しい
愛知県,新城市,83,新城市富岡字半ノ木15-1,八名小学校ブロック塀（R３０１沿）,34.8618422,137.5056846,緯度経度は怪しい
愛知県,新城市,84,新城市一鍬田字清水野11-65,東清水野公園ネットフェンス,34.8676239,137.5012035,緯度経度は怪しい
愛知県,新城市,85,新城市黒田字萩平野108-1,JA愛知東農協緑茶加工用施設北側畑,34.8673869,137.5048379,緯度経度は怪しい
愛知県,新城市,86,新城市黒田字頼実2-5,黒田区民広場ネットフェンス（南側）,34.8715262,137.5171093,緯度経度は怪しい
愛知県,新城市,87,新城市黒田字草場48-14,新城南部工業用地,34.8752397,137.507292,緯度経度は怪しい
愛知県,新城市,88,新城市一鍬田字北畑21,masked,34.8798296,137.4845774,緯度経度は怪しい
愛知県,新城市,89,新城市一鍬田字仮塚1-18,masked,34.8738106,137.4885253,緯度経度は怪しい
愛知県,新城市,90,新城市一鍬田字九五41-2,一鍬田公民館ネットフェンス,34.8746075,137.4837431,緯度経度は怪しい
愛知県,新城市,91,"新城市八名井字中上屋敷2-2,2-3,2,3-2,4",八名井多目的集会施設ネットフェンス（北側）,34.8675195,137.4636159,緯度経度は怪しい
愛知県,新城市,92,新城市八名井字下タ屋敷15-1,八名井下組倉庫横空地,34.8677688,137.4616045,緯度経度は怪しい
愛知県,新城市,93,新城市庭野字切場18,大脇集会所敷地,34.8829139,137.5064273,緯度経度は怪しい
愛知県,新城市,94,新城市庭野字原川27-1,masked,34.8916252,137.500896,緯度経度は怪しい
愛知県,新城市,95,新城市庭野字川大田33,庭野小学校ネットフェンス（正門右側）,34.8896705,137.4974503,緯度経度は怪しい
愛知県,新城市,96,新城市庭野字八名井田19-1,桜淵いこいの広場（県道沿）,34.8939043,137.5050081,緯度経度は怪しい
愛知県,新城市,97,新城市庭野字萩野30-1,masked,34.891602,137.495943,緯度経度は怪しい
愛知県,新城市,98,新城市庭野字香ヶ崎40,庭野神社ブロック塀（バス待合所横）,34.8890708,137.4976299,緯度経度は怪しい
愛知県,新城市,99,新城市庭野字上ノ平57-1,三河建設工業(株)入口右側雑地,34.8842461,137.4897771,緯度経度は怪しい
愛知県,新城市,100,新城市長篠字内貝津14,西公会堂前道路向かい側の畑,34.9270334,137.557318,緯度経度は怪しい
愛知県,新城市,101,新城市長篠字久保畑7-2,masked,34.9293441,137.5669912,緯度経度は怪しい
愛知県,新城市,102,新城市長篠字向林3-6,ローソン長篠店東空地（市有地職員駐車場）,34.9333598,137.5720587,緯度経度は怪しい
愛知県,新城市,103,新城市長篠字下り筬63-1,味工房津つ井亭駐車場,34.933377,137.5751755,緯度経度は怪しい
愛知県,新城市,104,新城市長篠字日焼9-2,児童館たんぽぽ道路側フェンス,34.9376704,137.5761961,緯度経度は怪しい
愛知県,新城市,105,新城市富保字広畑6-1,吉村老人憩の家前の畑,34.9426198,137.5659163,緯度経度は怪しい
愛知県,新城市,106,新城市乗本字長筋79-4,元法務局鳳来出張所前,34.9305914,137.574376,緯度経度は怪しい
愛知県,新城市,107,新城市乗本字新井貝津69-1,消防詰所横の空地,34.9228713,137.5634595,緯度経度は怪しい
愛知県,新城市,108,新城市乗本字板屋草蓮10-4,masked,34.9212969,137.581581,緯度経度は怪しい
愛知県,新城市,109,新城市豊岡字中杉上30-1,湯谷駐車場（湯谷大橋付近、県道439号標識東側）,34.9669202,137.6120023,緯度経度は怪しい
愛知県,新城市,110,新城市豊岡字滝上12-1,湯谷温泉駅前,34.9713887,137.6138097,緯度経度は怪しい
愛知県,新城市,111,新城市豊岡字田ノ嶋31-1,ゆ～ゆ～ありいな第2駐車場ネットフェンス,34.9798771,137.6098507,緯度経度は怪しい
愛知県,新城市,112,新城市能登瀬字大道西92,能登瀬公民館前,34.9779759,137.6157593,緯度経度は怪しい
愛知県,新城市,113,新城市能登瀬壱輪8-1,東部高齢者生きがいセンター前（ゆ～ゆ～ありいな駐車場フェンス）,34.976197,137.6162741,緯度経度は怪しい
愛知県,新城市,114,新城市能登瀬字上ノ段55-19,美谷野原駐車場（入口向かって右側国道沿い）,34.9861663,137.616033,緯度経度は怪しい
愛知県,新城市,115,新城市豊岡字ドウデイ2-441,JR三河槙原駅東広場東屋横,34.9892903,137.6208944,緯度経度は怪しい
愛知県,新城市,116,新城市名越字広貝津1,名越公民館前,34.98718400000001,137.6249137,緯度経度は怪しい
愛知県,新城市,117,新城市富栄字上貝津33,寺林公民館前ガードレール,34.9455779,137.5981915,緯度経度は怪しい
愛知県,新城市,118,新城市富栄字上ノ田5-1,masked,34.938389,137.5885702,緯度経度は怪しい
愛知県,新城市,119,新城市下吉田字小河内96-1,阿寺公民館道路向かい側の畑,34.9344979,137.6375206,緯度経度は怪しい
愛知県,新城市,120,新城市大野字久羅下42-1,中央集会所前(バス停留所）,34.9493301,137.6040112,緯度経度は怪しい
愛知県,新城市,121,新城市大野字上野52-5,ＮＴＴ中継所フェンス,34.9510822,137.6058358,緯度経度は怪しい
愛知県,新城市,122,新城市大野字柿田13-1,菅原神社麓敷地,34.9545672,137.6129245,緯度経度は怪しい
愛知県,新城市,123,新城市井代字大貝津51-4,井代公民館国道側横空地,34.9010717,137.4932241,緯度経度は怪しい
愛知県,新城市,124,新城市睦平字田口28-1,睦平老人憩の家前,34.9482734,137.6148304,緯度経度は怪しい
愛知県,新城市,125,新城市細川字大沢31,細川会館敷地,34.95618109999999,137.6281804,緯度経度は怪しい
愛知県,新城市,126,新城市巣山字ハマイバ53-14,巣山老人憩の家敷地生垣,34.9536725,137.6492079,緯度経度は怪しい
愛知県,新城市,127,新城市巣山字西山61-13,巣山農業集落排水施設フェンス,34.9617509,137.6535143,緯度経度は怪しい
愛知県,新城市,128,新城市七郷一色字西六田沢58-13,桐山橋市道入口,34.9588384,137.6732055,緯度経度は怪しい
愛知県,新城市,129,新城市七郷一色字西貝津38-4,七郷一色コミュニティプラザの道路向かい側,34.9654186,137.6713592,緯度経度は怪しい
愛知県,新城市,130,新城市玖老勢字小屋上66,吉村住設第２倉庫前廃物置場,34.9699281,137.5530194,緯度経度は怪しい
愛知県,新城市,131,新城市玖老勢字追分下4-2,JA愛知東農協鳳来寺支店駐車場門谷側空地,34.9822302,137.5586715,緯度経度は怪しい
愛知県,新城市,132,新城市玖老勢字野林13,玖老勢コミュニティプラザ向かって左側フェンス,34.9872477,137.5603887,緯度経度は怪しい
愛知県,新城市,133,新城市玖老勢字前9-1,masked,34.9891728,137.5599281,緯度経度は怪しい
愛知県,新城市,134,新城市門谷字万寿3-20,新城市消防署鳳来出張所左側フェンス,34.9623805,137.5724698,緯度経度は怪しい
愛知県,新城市,135,新城市門谷字宮ノ前14-3,masked,34.9010864,137.4949043,緯度経度は怪しい
愛知県,新城市,136,新城市門谷字笠川16-12,笠川駐車場トイレ横休憩所南東,34.9663248,137.5729802,緯度経度は怪しい
愛知県,新城市,137,新城市副川字萩平3－1,masked,35.0097028,137.557318,緯度経度は怪しい
愛知県,新城市,138,新城市副川字千部平35番地2,NTT鉄塔前,35.0175881,137.5585463,緯度経度は怪しい
愛知県,新城市,139,新城市海老字野辺38-11,旧海老保育園敷地内（木柵内側）,35.0239679,137.5571857,緯度経度は怪しい
愛知県,新城市,140,新城市海老字千原田5-1,海老構造改善センター横フェンス,35.0203342,137.555607,緯度経度は怪しい
愛知県,新城市,141,新城市連合字栗ノ木7-11,市道須山線入口右側残地,35.0344143,137.5404327,緯度経度は怪しい
愛知県,新城市,142,新城市海老字紙屋22-1-1,川売公会堂向かい畑法面,35.0235834,137.5751725,緯度経度は怪しい
愛知県,新城市,143,新城市連合字真菰25-1,丸地商店敷地内フェンス,35.04305009999999,137.5605777,緯度経度は怪しい
愛知県,新城市,144,新城市四谷字前田3-2,旧連合小学校裏口入口フェンス,35.0517637,137.5742088,緯度経度は怪しい
愛知県,新城市,145,新城市四谷字久保貝津564-5,大代旧バス転換所,34.9049637,137.4998535,緯度経度は怪しい
愛知県,新城市,146,新城市連合字仲曽根14-1,方瀬登り口土手,35.0436553,137.557318,緯度経度は怪しい
愛知県,新城市,147,新城市只持字小松ノ12-3,masked,34.9857859,137.5349069,緯度経度は怪しい
愛知県,新城市,148,新城市布里字小松ヶ根35-1,masked,34.9877352,137.5198289,緯度経度は怪しい
愛知県,新城市,149,新城市只持字中貝津11-1,旧JA愛知東農協布里出張所駐車場敷地フェンス,34.992891,137.5184863,緯度経度は怪しい
愛知県,新城市,150,新城市只持字中貝津76-1,masked,34.9946957,137.5210981,緯度経度は怪しい
愛知県,新城市,151,新城市愛郷字久保貝津20-13,源氏増圧ポンプ場北側水路フェンス,35.0099538,137.5194105,緯度経度は怪しい
愛知県,新城市,152,新城市一色字棒川21-1,masked,34.9934515,137.5109732,緯度経度は怪しい
愛知県,新城市,153,新城市塩瀬字中平18-5,塩瀬公民館道路向かい側休耕田,34.9813809,137.4987033,緯度経度は怪しい
愛知県,新城市,154,新城市愛郷字山ノ神戸9-1,masked,35.0159265,137.4974765,緯度経度は怪しい
愛知県,新城市,155,新城市愛郷字小貝津11-3,masked,35.027692,137.5011571,緯度経度は怪しい
愛知県,新城市,156,新城市愛郷字中嶋15-8先,愛郷公民館入口三差路突き当たり,35.0302983,137.5131208,緯度経度は怪しい
愛知県,新城市,157,新城市愛郷字川元8-1,大輪バス停横の空地,35.0358451,137.5260078,緯度経度は怪しい
愛知県,新城市,158,新城市下吉田字明双73-7,高野明双側下り口の市道脇,34.9153589,137.6073919,緯度経度は怪しい
愛知県,新城市,159,新城市下吉田字紺屋平144,masked,34.9071194,137.6080066,緯度経度は怪しい
愛知県,新城市,160,新城市下吉田字北新戸131-1,masked,34.9011275,137.6178428,緯度経度は怪しい
愛知県,新城市,161,新城市下吉田字南山王42-3,「山王」下道路端,34.896135,137.623184,緯度経度は怪しい
愛知県,新城市,162,新城市上吉田字山本1-1,上吉田消防詰所左横,34.9016731,137.6011144,緯度経度は怪しい
愛知県,新城市,163,新城市下吉田字五反田148-1,五反田地内信号南東側空地,34.9037985,137.6055478,緯度経度は怪しい
愛知県,新城市,164,新城市竹ノ輪字浜井場650-3,東竹ノ輪集会所敷地(水道管注意）,34.8936302,137.5871108,緯度経度は怪しい
愛知県,新城市,165,新城市竹ノ輪字橋本337-1,竹ノ輪公民館前,34.8896968,137.5827205,緯度経度は怪しい
愛知県,新城市,166,新城市黄柳野字登ノ元1038-1,多利野橋南西側空地（旧道寄り）,34.8799443,137.5895687,緯度経度は怪しい
愛知県,新城市,167,新城市黄柳野字向ヒ田773-3,多利野ポンプ場道路側フェンス,34.87735560000001,137.5893575,緯度経度は怪しい
愛知県,新城市,168,新城市黄柳野字池田684-15,旧黄柳野小学校前駐車場（避難所看板横）,34.8746859,137.579271,緯度経度は怪しい
愛知県,新城市,169,黄柳野字丸渕322-2,masked,34.8674282,137.5735945,緯度経度は怪しい
愛知県,新城市,170,新城市名号字丹野204,消防団詰所横空地東側畑,34.9977816,137.6608977,緯度経度は怪しい
愛知県,新城市,171,新城市名号字ハマイバ63-1,石雲寺前駐車場フェンス,34.9934872,137.6535143,緯度経度は怪しい
愛知県,新城市,172,新城市川合字小西14-7,masked,35.0002745,137.6632374,緯度経度は怪しい
愛知県,新城市,173,新城市川合字コシ75-1,鳳来東小学校南側フェンス,35.0029997,137.665115,緯度経度は怪しい
愛知県,新城市,174,新城市川合字中貝津72-3先,masked,35.003664,137.6673589,緯度経度は怪しい
愛知県,新城市,175,新城市川合字上貝津3-2,浅井平防火水槽横の空地,35.0097055,137.6688975,緯度経度は怪しい
愛知県,新城市,176,新城市池場字上貝津3-1,消防倉庫右側畑,35.0226196,137.6944434,緯度経度は怪しい
愛知県,新城市,177,新城市作手守義字小滝25-5,masked,35.0531326,137.4980157,緯度経度は怪しい
愛知県,新城市,178,新城市作手守義字前田107,小田防火水槽横,35.05675799999999,137.4805339,緯度経度は怪しい
愛知県,新城市,179,新城市作手守義字郷下2-1,旧市営バス車庫横,35.0510128,137.4824502,緯度経度は怪しい
愛知県,新城市,180,新城市作手菅沼字落合17-1,河合氏畑,35.0483087,137.4545556,緯度経度は怪しい
愛知県,新城市,181,新城市作手菅沼字経蔵130,愛知東農協北部支所横,35.0349399,137.4622174,緯度経度は怪しい
愛知県,新城市,182,新城市作手木和田字ハマイバ15-2,上木和田市道辻,35.0249262,137.4768547,緯度経度は怪しい
愛知県,新城市,183,新城市作手善夫字カイツダ35,善夫バス停横農業用貯水槽前,35.0260735,137.4514912,緯度経度は怪しい
愛知県,新城市,184,新城市作手黒瀬字井戸上3-1,masked,35.0104394,137.4378566,緯度経度は怪しい
愛知県,新城市,185,新城市作手中河内字日面53-1,中河内老人憩の家横,34.9967759,137.400648,緯度経度は怪しい
愛知県,新城市,186,新城市作手田原字朴橋15-54,旧作手小学校北校舎入口横,34.9903231,137.4275948,緯度経度は怪しい
愛知県,新城市,187,新城市作手岩波字上貝津8-5,吉祥院前,34.986723,137.4533298,緯度経度は怪しい
愛知県,新城市,188,新城市作手高里字縄手下24-4,新城市商工会作手支所建物横（R301沿）,34.9757696,137.4252675,緯度経度は怪しい
愛知県,新城市,189,新城市作手鴨ヶ谷字前仏方17-2,原田商店前辻,34.9715568,137.4358654,緯度経度は怪しい
