prefecture,city,number,address,name,lat,long,note
愛知県,新城市,190,新城市作手清岳字ムカイ田15-5,丸利建設（株）倉庫前,34.96093949999999,137.4195017,緯度経度は怪しい
愛知県,新城市,191,新城市作手白鳥字八名川8-4,masked,34.961067,137.4291646,緯度経度は怪しい
愛知県,新城市,192,新城市作手白鳥字宮前22-2,masked,34.9550342,137.4195,緯度経度は怪しい
愛知県,新城市,193,新城市作手保永字桑原14-1,戸津呂法輪寺入口左側,34.9280402,137.4392352,緯度経度は怪しい
愛知県,新城市,194,新城市作手保永字水上48,和田児童遊園前,34.9260034,137.4410734,緯度経度は怪しい
愛知県,新城市,195,新城市作手保永字東当8－5,見代公民館横の畑,34.9373957,137.4478141,緯度経度は怪しい
愛知県,新城市,196,新城市作手高松字柿平8-1,作手農村環境改善センター入口,34.950824,137.4527169,緯度経度は怪しい
愛知県,新城市,197,新城市作手高松字小林平1-1,masked,34.9565965,137.4628304,緯度経度は怪しい
愛知県,新城市,198,新城市作手高松字東畑38-3,新島川橋横,34.963273,137.4665086,緯度経度は怪しい
愛知県,新城市,199,新城市作手大和田字溝下33-1,大和田集会所前,34.9786554,137.47674,緯度経度は怪しい
愛知県,新城市,200,新城市作手田代字田代貝津　赤道,田代消防詰所横,34.946601,137.4704935,緯度経度は怪しい
