prefecture,city,number,address,name,lat,long,note
北海道,登別市,幌別小学校,中央町6丁目11番地,登別市役所前,42.41293,141.10606,位置確認済み
北海道,登別市,幌別小学校,中央町6丁目19番地1,幌別児童館横,42.41303,141.10761,位置確認済み
北海道,登別市,幌別小学校,中央町2丁目20番地7,幌別駅西口階段横,42.41022,141.10764,位置確認済み
北海道,登別市,幌別小学校,中央町４丁目,らいば公園前,42.4106,141.10458,位置確認済み
北海道,登別市,鉄南ふれあいセンター,幌別町3丁目17番地1,鉄南ふれあいセンター前,42.41122,141.11077,位置確認済み
北海道,登別市,鉄南ふれあいセンター,幌別町8丁目16番地1,旧幌別東小学校校門横,42.41622,141.11778,位置確認済み
北海道,登別市,緑寿の家,桜木町2丁目15番地18,桜木の家入口,42.40475,141.09033,位置確認済み
北海道,登別市,緑寿の家,緑町1丁目2番地4,緑寿の家前,42.39938,141.09171,位置確認済み
北海道,登別市,ねむの木の家,新川町3丁目6番地2,ねむの木の家,42.4079896,141.0949785,位置確認済み
北海道,登別市,ねむの木の家,新川町4丁目47番地１地先,道営新川団地入口,42.41099,141.0952,位置確認済み
北海道,登別市,ねむの木の家,新川町4丁目1番地4地先,かえで公園前,42.41019,141.09115,位置確認済み
北海道,登別市,富士会館,富士町3丁目17番地1,富士3丁目広場前,42.40979,141.09871,位置確認済み
北海道,登別市,富士会館,富士町7丁目2番地1,富士会館前,42.4148137,141.0985721,位置確認済み
北海道,登別市,富士会館,富士町7丁目11番地1,老人福祉センター横,42.413127,141.0964907,位置確認済み
北海道,登別市,富士会館,富士町7丁目33番地1,市民会館駐車場前,42.4138696,141.0941304,位置確認済み
北海道,登別市,幌別中学校,千歳町3丁目1番地8,旧労働福祉センター駐車場前,42.4156889,141.1103297,位置確認済み
北海道,登別市,幌別中学校,千歳町4丁目10番地7,ニナルカの里向,42.4194749,141.1149424,位置確認済み
北海道,登別市,幌別中学校,千歳町97番地25,岡志別の森運動公園前,42.4247734,141.1169787,位置確認済み
北海道,登別市,幌別中学校,札内町184番地3,日本工学院北海道専門学校前,42.4512323,141.111339,位置確認済み
北海道,登別市,幌別中学校,常盤町3丁目26番地1,緑ヶ丘団地２号棟前,	42.4190233,141.1081312,位置確認済み
北海道,登別市,富浦会館,富浦町1丁目46番地3,富浦会館前,42.4439315,141.1592748,位置確認済み
北海道,登別市,登別中学校,登別東町2丁目5番地52,旧登別公民館前,42.4522146,141.1772883,位置確認済み
北海道,登別市,登別中学校,登別本町1丁目1番地1,登別中学校プール横,42.4513932,141.1752981,位置確認済み
北海道,登別市,登別中学校,登別本町3丁目25番地2,登別小学校前,42.4489306,141.1690295,位置確認済み
北海道,登別市,登別中学校,登別東町3丁目6番地7,旧登別市婦人センター前,42.4553805,141.1794243,位置確認済み
北海道,登別市,登別中学校,登別東町4丁目19番地2,登別児童館前,42.4530376,141.1747694,位置確認済み
北海道,登別市,登別中学校,登別東町5丁目13番地6,翠の家前,	42.4542818,141.1717748,位置確認済み
北海道,登別市,登別中学校,登別東町5丁目37番地1,道営登別東町団地前,42.4565939,141.1700868,位置確認済み
北海道,登別市,白樺の家,中登別町170番地35,登別石水亭社員住宅横,42.4715154,141.1580164,位置確認済み
北海道,登別市,白樺の家,中登別町152番地3,白樺の家横,42.4728354,141.160964,位置確認済み
北海道,登別市,白樺の家,中登別町141番地43,三愛病院バス停横,42.466315,141.1667418,位置確認済み
北海道,登別市,泉和園,上登別町42番地1021,ポロシリバス停横,42.4933071,141.1313795,位置確認済み
北海道,登別市,泉和園,中登別町無番地,紅葉谷入口バス停横,42.475989,141.1471065,位置確認済み
北海道,登別市,泉和園,登別温泉町17番地2,泉和園向,42.4910802,141.1445076,位置確認済み
北海道,登別市,泉和園,登別温泉町無番地,登別温泉交番向,42.4943732,141.1426384,位置確認済み
北海道,登別市,泉和園,カルルス町11番地1,カルルス温泉,42.5190175,141.1068334,位置確認済み
北海道,登別市,富岸小学校,富岸町1丁目1番地6,若山町3丁目バス停横,42.3858408,141.0721509,位置確認済み
北海道,登別市,富岸小学校,富岸町2丁目17番地4,富岸小学校前,42.3841487,141.0687284,位置確認済み
北海道,登別市,富岸小学校,新生町4丁目20番地1,あおぞら公園前,42.38251,141.06445,位置確認済み
北海道,登別市,富岸小学校,新生町4丁目3番地,なかよし公園前,42.37909,141.06407,位置確認済み
北海道,登別市,富岸小学校,富岸町2丁目34番地1,いなほ公園前,42.387208,141.0669355,位置確認済み
北海道,登別市,富浜児童館,栄町4丁目24番地3,栄楽園横,42.3781271,141.0719218,
北海道,登別市,富浜児童館,栄町2丁目18番地4,富浜児童館前,42.3717081,141.0653221,位置確認済み
北海道,登別市,富浜児童館,栄町4丁目8番地1,富浜ひろば前,42.3747081,141.068409,位置確認済み
北海道,登別市,鷲別コミュニティセンター,鷲別町2丁目32番地7,恵愛病院向,42.3569539,141.0475374,緯度経度は怪しい
北海道,登別市,鷲別コミュニティセンター,鷲別町3丁目12番地13,鉄原アパート前,42.3583882,141.0484311,
北海道,登別市,鷲別コミュニティセンター,鷲別町3丁目3番地4,鷲別支所前,42.3610705,141.048482,緯度経度は怪しい
北海道,登別市,鷲別コミュニティセンター,鷲別町3丁目45番地5,道営鷲別団地前,42.358357,141.051212,
北海道,登別市,旭ケ丘三恵園,美園町4丁目8番地8,旭ケ丘三恵園前,42.3643728,141.0457419,
北海道,登別市,旭ケ丘三恵園,美園町3丁目無番地,光和園入口,42.36442419999999,141.0411654,
北海道,登別市,新生集会所,新生町2丁目17番地3,新生集会所前,42.3790514,141.069111,
北海道,登別市,新生集会所,若山町2丁目39番地1,ひまわり公園前,42.3898728,141.0788842,
北海道,登別市,幌別西小学校,片倉町4丁目,片倉町4丁目広場,42.4128069,141.0848019,
北海道,登別市,幌別西小学校,片倉町5丁目35番地1,幌別西小学校屋外運動場角,42.4161118,141.0866297,
北海道,登別市,常盤会館,常盤町2丁目35番地1,常盤会館向,42.4172852,141.1057131,位置確認済み
北海道,登別市,常盤会館,常盤町5丁目38番地2,masked,42.4229551,141.0987751,緯度経度は怪しい
北海道,登別市,鷲別小学校,鷲別町4丁目36番地37,恵和園横,42.3616929,141.0508757,
北海道,登別市,鷲別小学校,鷲別町4丁目36番地21,鷲別小学校前,42.36098459999999,141.0529923,緯度経度は怪しい
北海道,登別市,鷲別小学校,栄町1丁目4番地1,楡の木公園横,42.3659537,141.0587112,
北海道,登別市,鷲別小学校,栄町2丁目6番地6,旧栄町保育所前,42.367408,141.0612071,
北海道,登別市,若草小学校,若草町3丁目,若草1号公園,42.3685045,141.0513024,
北海道,登別市,若草小学校,美園町2丁目4番地13,みその園前,42.3622166,141.045552,
北海道,登別市,若草小学校,若草町1丁目1番地2,若草小学校前,42.365257,141.0506728,
北海道,登別市,こぶしの家,柏木町4丁目24番地42,こぶしの家前,42.4211843,141.0970659,緯度経度は怪しい
北海道,登別市,こぶしの家,柏木町1丁目22番地1,柏木団地5号棟横,42.4175401,141.0982642,
北海道,登別市,こぶしの家,柏木町1丁目36番地41,もみじ公園前,42.4178575,141.1005656,
北海道,登別市,若草つどいセンター,若草町4丁目4番地,めばえ公園前,42.3735199,141.0582129,緯度経度は怪しい
北海道,登別市,若草つどいセンター,若草町4丁目21番地1,若草つどいセンター前,42.3719016,141.0571068,
北海道,登別市,若草つどいセンター,若草町2丁目32番地,めぐみ公園横,42.3700591,141.0583564,緯度経度は怪しい
北海道,登別市,美園児童センター,美園町5丁目36番地4,美園児童センター横,42.3686458,141.0387251,
北海道,登別市,美園児童センター,美園町5丁目10番地6,美園5丁目広場,42.3662742,141.0410823,
北海道,登別市,千代の台集会所,新生町1丁目13番地21,新生虹の家前,42.3740539,141.064488,
北海道,登別市,千代の台集会所,新生町1丁目24番地,ことぶき公園前,42.3751091,141.0645262,
北海道,登別市,千代の台集会所,新生町3丁目13番地1,もみの木こども園前,42.3761966,141.0610537,
北海道,登別市,千代の台集会所,新生町5丁目23番地21,希望の家下,42.3767053,141.0582065,
北海道,登別市,すずらんの家,幸町5丁目27番地4,すずらんの家,42.4351506,141.1405422,
北海道,登別市,若山の家,若山町2丁目38番地3,若山営業所駐車場横,42.38985419999999,141.076572,緯度経度は怪しい
北海道,登別市,若山の家,若山町1丁目15番地1,アカシヤ団地入口,42.392429,141.0844204,位置確認済み
北海道,登別市,若山の家,大和町2丁目27番地17,和幸園前,42.3850803,141.078517,
北海道,登別市,桜木集会所,桜木町4丁目1番地1,桜木公園前,42.4050618,141.0866071,位置確認済み
北海道,登別市,桜木集会所,桜木町4丁目1番地1,桜木団地6号棟横,42.4044953,141.0865315,
