prefecture,city,number,address,name,lat,long,note
埼玉県,日高市,1-1,大字横手706番地2先,武蔵横手駅東側,35.8849413,139.2813842,
埼玉県,日高市,1-2,大字横手15番地2先,祥雲橋,35.8790673,139.2957435,
埼玉県,日高市,1-3,大字台350番地4先,瀧不動北交差点付近,35.8785692,139.3073034,
埼玉県,日高市,1-4,大字台291番地2先,高麗駅東踏切,35.8817935,139.3056718,
埼玉県,日高市,1-5,大字高麗本郷192番地7,高麗本郷交差点北東,35.8860828,139.3095296,
埼玉県,日高市,1-6,大字台61番地1先,鹿台橋交差点西側から秩父方面100m,35.8854528,139.3057104,
埼玉県,日高市,1-7,大字高麗本郷698番地1,国道299号線久保交差点から秩父方面200m,35.8838271,139.2984052,
埼玉県,日高市,1-8,大字高麗本郷196番地1先,県道15号線「阿里山カフェ前信号」北方向20m,35.8865292,139.3078579,
埼玉県,日高市,1-9,大字高麗本郷239番地8,巾着田駐車場,35.8859719,139.3112113,
埼玉県,日高市,2-1,大字梅原5番地1,旧高麗小学校東側,35.8857671,139.3149359,
埼玉県,日高市,2-2,大字梅原47番地1,JAいるま野旧高麗支店前,35.8861119,139.3166709,
埼玉県,日高市,2-3,大字栗坪105番地1,岡村記念クリニック向側,35.8875151,139.3182249,
埼玉県,日高市,2-4,大字栗坪239番地1,諏訪大明神前,35.8874256,139.3194601,
埼玉県,日高市,2-5,大字栗坪274番地3,比留間病院入口,35.8883748,139.3206527,
埼玉県,日高市,2-6,大字梅原294番地2,高麗学童保育室フェンス西側,35.883537,139.318588,緯度経度は怪しい
埼玉県,日高市,2-7,大字栗坪355番地2,獅子岩橋南側フェンス,35.8922208,139.323575,
埼玉県,日高市,2-8,大字高岡121番地先,下高岡公会堂南側,35.8934562,139.3192448,
埼玉県,日高市,3-1,大字野々宮15番地10,消防団第2分団詰所,35.8947474,139.3280557,
埼玉県,日高市,3-2,大字新堀822番地4,高麗神社前,35.8973421,139.3244512,
埼玉県,日高市,3-3,大字新堀363番地3,清水塗装店西側,35.9003468,139.3296943,
埼玉県,日高市,3-4,大字新堀592番地,稲野辺神社,35.9051246,139.3282545,
埼玉県,日高市,3-5,大字楡木193番地,市総合福祉センタ-西側三角地,35.889149,139.3282838,
埼玉県,日高市,3-6,大字猿田60番地1先,JAいるま野あぐれっしゅ日高中央駐車場北側,35.8900759,139.3311541,
埼玉県,日高市,3-7,大字猿田202番地2,かに沢の広場南側フェンス,35.8883777,139.3341837,
埼玉県,日高市,4-1,大字田波目773番地1,田波目交差点南側,35.9209594,139.3462077,
埼玉県,日高市,4-2,大字北平沢512番地3先,ハ-ト薬局南側,35.9153798,139.3262904,
埼玉県,日高市,4-3,大字北平沢769番地3,北平沢交差点西側Y字路南,35.9129946,139.3271333,
埼玉県,日高市,4-4,大字南平沢1276番地先,ちびっ子広場南側,35.9158801,139.3360527,
埼玉県,日高市,4-5,大字南平沢620番地1,南平沢交差点北側,35.910926,139.3326909,
埼玉県,日高市,4-6,大字南平沢203番地2,内田貴金属工芸前,35.9050267,139.3341054,
埼玉県,日高市,4-7,大字南平沢1010番地,日高市文化体育館,35.9083109,139.3382749,
埼玉県,日高市,4-8,大字南平沢1020番地,市役所内駐車場西側,35.907511,139.3387532,
埼玉県,日高市,5-1,高麗川一丁目15番地,高麗川駅前広場,35.896149,139.337555,緯度経度は怪しい
埼玉県,日高市,5-2,高麗川一丁目5番地34先,高麗川駅線路西側フェンス,35.8977604,139.3371331,
埼玉県,日高市,5-3,高麗川一丁目13番地7,かにや高麗川店北側,35.9003947,139.3347776,
埼玉県,日高市,5-4,高麗川二丁目28番地9,小僧寿し西側,35.8949312,139.3344869,
埼玉県,日高市,5-5,大字上鹿山350番地3,県道262号線上鹿山交差点から狭山方向200m,35.8888652,139.3412845,
埼玉県,日高市,5-6,高麗川二丁目24番地,高麗川2丁目西公園入口フェンス,35.8933087,139.3358851,
埼玉県,日高市,5-7,大字上鹿山507番地2,飯能寄居線道路用地,35.8853804,139.3380457,
埼玉県,日高市,6-1,大字原宿704番地2,新宿区公会堂,35.9112587,139.3486793,
埼玉県,日高市,6-2,大字原宿174番地35,原宿区公会堂,35.9037409,139.3441406,
埼玉県,日高市,6-3,大字原宿357番地1,コ-ポ山岸駐車場東側,35.90063,139.3426701,
埼玉県,日高市,6-4,大字原宿153番地1,高麗川中学校東側,35.9025377,139.3416828,
埼玉県,日高市,6-5,大字原宿251番地,上ノ台公園,35.8983717,139.3372116,
埼玉県,日高市,6-6,大字下鹿山354番地85先,下鹿山区公会堂前,35.8960889,139.3541964,
埼玉県,日高市,6-7,大字鹿山575番地1,旧KOスポ-ツ店東側,35.9010856,139.3505285,
埼玉県,日高市,7-1,大字鹿山318番地9,ヤオコ-高麗川店西側100m,35.8952582,139.3407506,
埼玉県,日高市,7-2,大字鹿山255番地4,明婦地蔵公園わき緑地,35.8970955,139.3450707,
埼玉県,日高市,7-3,大字鹿山300番地6,生涯学習センタ-南側,35.8967662,139.3416262,
埼玉県,日高市,7-4,大字鹿山370番地20先,生涯学習センタ-北側,35.8978698,139.3417817,
埼玉県,日高市,7-5,大字鹿山427番地1,駒井建設(株)資材置場北側,35.9003593,139.3458502,
埼玉県,日高市,7-6,大字鹿山75番地2,鹿山児童公園,35.8984957,139.3479482,
埼玉県,日高市,7-7,大字下鹿山61番地1,県営日高鹿山団地,35.8982507,139.3494932,
埼玉県,日高市,8-1,大字駒寺野新田128番地1,駒寺集落センタ-,35.9189083,139.3605667,
埼玉県,日高市,8-2,大字旭ヶ丘509番地2,旭ヶ丘公会堂,35.9126098,139.3639503,
埼玉県,日高市,8-3,大字旭ヶ丘806番地,県立日高高等学校,35.9074667,139.3679442,
埼玉県,日高市,8-4,大字旭ヶ丘997番地2,高萩北公民館,35.9099381,139.3727011,
埼玉県,日高市,8-5,大字森戸新田88番地1,ベイシア電器西側,35.9160616,139.3706123,
埼玉県,日高市,8-6,大字高萩1700番地42,相原中央公園,35.9052526,139.3760134,
埼玉県,日高市,8-7,大字森戸新田78番地1先,(有)コイズミ・エネオス石油給油所西側,35.9144303,139.3768413,
埼玉県,日高市,8-8,大字森戸新田8番地2,有限会社サンメタル北東,35.9222843,139.3715499,
埼玉県,日高市,9-1,大字高萩286番地2,別所公会堂前,35.9036346,139.3665463,
埼玉県,日高市,9-2,武蔵高萩一丁目1番1,武蔵高萩駅北臨時(第1)自転車駐車場,35.9021506,139.3714738,
埼玉県,日高市,9-3,大字高萩624番地1先,武蔵高萩駅西側駐車場,35.901497,139.3711478,
埼玉県,日高市,9-4,大字高萩25番地,旧国道407号線有限会社水村商店北側,35.9039957,139.3748596,
埼玉県,日高市,9-5,大字高萩460番地,高萩第三区公会堂,35.9008955,139.3692014,
埼玉県,日高市,9-6,大字女影380番地,女影時計台,35.8970828,139.3658541,
埼玉県,日高市,9-7,大字女影1841番地1,十一屋東側畑,35.8996944,139.363762,
埼玉県,日高市,10-1,大字高萩794番地1,高萩小学校北側,35.8980414,139.373139,
埼玉県,日高市,10-2,大字高萩123番地先,高萩交差点東側,35.9017181,139.3762296,
埼玉県,日高市,10-3,大字高萩701番地37,天神公園フェンス,35.8967255,139.3713715,
埼玉県,日高市,10-4,大字女影626番地1,上之條公会堂東側,35.8915453,139.363073,
埼玉県,日高市,10-5,大字女影1296番地1,姥田公会堂東側,35.8886511,139.3556524,
埼玉県,日高市,10-6,大字中沢625番地,向郷公会堂,35.8833755,139.3627533,
埼玉県,日高市,10-7,大字高萩1500番地,日高総合公園駐車場側フェンス,35.8992417,139.3810789,
埼玉県,日高市,10-8,大字高萩1154番地付近,高萩橋,35.9012258,139.3760227,
埼玉県,日高市,11-1,大字大谷沢255番地2,国道407号線大谷沢交差点西側,35.8830423,139.3771603,
埼玉県,日高市,11-2,大字大谷沢373番地1,農村広場東側,35.8867772,139.3825259,
埼玉県,日高市,11-3,大字田木104番地4,田木区公会堂,35.8766339,139.3778823,
埼玉県,日高市,11-4,大字高富37番地1,高富集落センタ-,35.876786,139.3859351,
埼玉県,日高市,11-5,大字馬引沢194番地1,馬引沢公会堂,35.8742853,139.3711631,
埼玉県,日高市,11-6,大字中沢191番地1,JAいるま野高萩南農産物直売所北側,35.8803383,139.3774584,
埼玉県,日高市,11-7,大字中沢124番地,正法寺敷地東側フェンス付近,35.8854762,139.373677,
埼玉県,日高市,11-8,大字下大谷沢399番地1,下大谷沢公会堂東側100m総合公園通り沿い,35.8952454,139.3911959,
埼玉県,日高市,12-1,大字高萩2306番地7先,セイムス日高高萩店東側,35.9081498,139.3734545,
埼玉県,日高市,12-2,大字高萩2235番地3,国道407号バイパス交差点,35.9073185,139.375789,
埼玉県,日高市,12-3,大字高萩2631番地41,六ツ塚公園,35.9093289,139.3782284,
埼玉県,日高市,12-4,大字高萩2305番地1,(株)丸美屋フ-ズ包装事業部西側,35.9098512,139.37552,
埼玉県,日高市,12-5,大字高萩2636番地,稲荷久保甲稲荷神社前道路東へ100m,35.9110224,139.378018,
埼玉県,日高市,12-6,大字高萩2645番地8,ちびっこ広場,35.9121153,139.3812748,
埼玉県,日高市,12-7,高萩東二丁目127番地1,日高団地ロ-タリ-,35.9106623,139.3826223,
埼玉県,日高市,13-1,大字高萩2244番地,木原ピアノ教室東側,35.9068731,139.377283,
埼玉県,日高市,13-2,大字高萩2168番地63,中北谷公園,35.907956,139.3821912,
埼玉県,日高市,13-3,大字高萩2169番地3,日高台区公会堂,35.9074182,139.3818016,
埼玉県,日高市,13-4,大字高萩2096番地25,かどっこ公園西側遊水池,35.9074032,139.3862191,
埼玉県,日高市,13-5,大字高萩2096番地25,かどっこ公園,35.9073641,139.3869997,
埼玉県,日高市,13-6,大字高萩2034番地,下高萩区ごみ集積場付近,35.9076486,139.3915325,
埼玉県,日高市,13-7,大字高萩1851番地3,浄化センタ-入口,35.9040654,139.3856031,
埼玉県,日高市,14-1,大字下鹿山494番地5,こま川団地第二折返し場フェンス,35.8923241,139.3515472,
埼玉県,日高市,14-2,大字中鹿山537番地5,野口駐車場前,35.8904456,139.3484258,
埼玉県,日高市,14-3,大字中鹿山523番地3,高根小中学校,35.8870725,139.3471014,
埼玉県,日高市,14-4,大字下鹿山530番地7,高根公園,35.8864234,139.3497524,
埼玉県,日高市,14-5,大字中鹿山452番地4,こま川団地1街区4号棟西側,35.8876649,139.3447724,
埼玉県,日高市,14-6,大字下鹿山514番地14,高根の池公園南側,35.8899184,139.3498669,
埼玉県,日高市,14-7,大字下鹿山527番地,こま川団地内商店駐車場入口,35.8879778,139.3481738,
埼玉県,日高市,15-1,大字中鹿山221番地1,有限会社ホットハ-ツ西の水路前,35.8917841,139.3455934,
埼玉県,日高市,15-2,大字中鹿山265番地1先,大字中鹿山243番地東側,35.8939148,139.3463069,
埼玉県,日高市,15-3,大字下鹿山498番地1先,プラスワン前法面,35.8930093,139.3525226,
埼玉県,日高市,15-4,大字中鹿山81番地1,高麗川南公民館フェンス,35.8930067,139.3431168,
埼玉県,日高市,15-5,大字中鹿山533番地5先,愛宕公園東側フェンス,35.8888883,139.3449178,
埼玉県,日高市,15-6,大字下鹿山494番地5,こま川団地2街区10号棟北側,35.892146,139.3489025,
埼玉県,日高市,15-7,大字中鹿山471番地44先,大字中鹿山471番地44西側,35.8853063,139.3443464,
埼玉県,日高市,16-1,武蔵台一丁目264番地12,入口公園,35.8808299,139.2996947,
埼玉県,日高市,16-2,武蔵台一丁目47番1号先,こま武蔵台自治会館南側フェンス,35.8796857,139.2988815,
埼玉県,日高市,16-3,武蔵台一丁目214番地29,中の田公園,35.8786251,139.3020751,
埼玉県,日高市,16-4,武蔵台一丁目220番地5,高麗駅前,35.8812355,139.3041095,
埼玉県,日高市,16-5,武蔵台一丁目344番地4,こま武蔵台ショッピングセンタ-北側,35.8803475,139.302114,
埼玉県,日高市,16-6,武蔵台一丁目311番地8,第一遊水池,35.8796998,139.3006227,
埼玉県,日高市,16-7,武蔵台一丁目214番地29,中の田公園,35.8784458,139.3037461,
埼玉県,日高市,17-1,武蔵台三丁目389番地29,三王塚公園,35.8756671,139.3013826,
埼玉県,日高市,17-2,武蔵台三丁目311番地310,七曲り公園,35.8760844,139.3007014,
埼玉県,日高市,17-3,武蔵台二丁目568番地86,岩の本公園,35.8763579,139.3032638,
埼玉県,日高市,17-4,武蔵台五丁目535番地182,大寉巣公園,35.8718401,139.3043635,
埼玉県,日高市,17-5,武蔵台五丁目393番地122,武蔵台減圧場,35.8726964,139.3027488,
埼玉県,日高市,17-6,武蔵台四丁目400番地19,赤坂公園,35.8741637,139.3006044,
埼玉県,日高市,17-7,武蔵台七丁目105番地10,榎田緑地,35.8769338,139.2972326,
埼玉県,日高市,18-1,横手一丁目16番地2先,横手台自治会館南駐車場,35.8725559,139.2891815,
埼玉県,日高市,18-2,横手二丁目1番地20,なかよし公園,35.8711046,139.2855606,
埼玉県,日高市,18-3,横手二丁目16番地4,国際興業バス折返し場,35.8725347,139.2841766,
埼玉県,日高市,18-4,横手二丁目16番地17,バスケット公園,35.8744169,139.285228,
埼玉県,日高市,18-5,横手一丁目1000番地3,横手台グラウンド,35.8709779,139.2900559,
埼玉県,日高市,18-6,横手一丁目15番地9,峯両谷公園,35.8738599,139.2894283,
埼玉県,日高市,18-7,横手一丁目36番地5,どかん公園前道路東方向120m,35.8768853,139.287717,
