prefecture,city,number,address,name,lat,long
東京都,板橋区,1_1,板橋1丁目4番13先,歩道,35.746146,139.7155812
東京都,板橋区,1_2,板橋1丁目1番,谷端川児童遊園,35.7456173,139.7183444
東京都,板橋区,1_3,板橋1丁目39番1号,南板橋公園（西）,35.7476538,139.7145638
東京都,板橋区,1_4,板橋4丁目9番13号,板橋第四小学校（西）,35.7499298,139.7165513
東京都,板橋区,1_5,板橋4丁目9番13号,板橋第四小学校（東）,35.7499298,139.7165513
東京都,板橋区,1_6,板橋4丁目14番1号,都立北園高校（西）,35.7504481,139.7158798
東京都,板橋区,1_7,板橋4丁目25番12号,masked,35.7506293,139.7185481
東京都,板橋区,1_8,板橋4丁目49番3号,板橋第五中学校（北）,35.7524346,139.7196774
東京都,板橋区,1_9,板橋4丁目55番21号,板谷公園（西）,35.7531224,139.7172567
東京都,板橋区,2_1,板橋2丁目4番,下板橋駅油庫・信号扱所（裏）,35.746214,139.712519
東京都,板橋区,2_2,板橋2丁目21番1号,かないくぼ保育園,35.7481624,139.7092694
東京都,板橋区,2_3,板橋2丁目42番1号,日本郵便株式会社板橋支店,35.7492028,139.7137159
東京都,板橋区,2_4,板橋2丁目52番1号,板橋第二小学校（北）,35.748825,139.711154
東京都,板橋区,2_5,板橋2丁目52番1号,板橋第二小学校（西）,35.748825,139.711154
東京都,板橋区,2_6,板橋2丁目52番3号,板橋第二公園（南）,35.7488042,139.7107635
東京都,板橋区,2_7,板橋2丁目62番1号,四ツ又公園（北）,35.7502663,139.7100564
東京都,板橋区,2_8,板橋3丁目28番6号,不動通り児童遊園（南）,35.7504475,139.7146735
東京都,板橋区,3_1,板橋3丁目50番1号,東板橋公園（東）,35.7537474,139.7134049
東京都,板橋区,3_2,加賀1丁目10番5号,植村記念加賀スポーツセンター,35.7537554,139.715662
東京都,板橋区,3_3,加賀1丁目16番1号,加賀第二公園（北）,35.7552743,139.7181599
東京都,板橋区,3_4,加賀1丁目18番1号,東京家政大学（南）,35.7561729,139.7186815
東京都,板橋区,3_5,加賀2丁目2番1号,金沢小学校（東）,35.7552207,139.7151874
東京都,板橋区,3_6,加賀2丁目19番,加賀中学校（南）,35.7601558,139.7161897
東京都,板橋区,3_7,加賀2丁目19番,加賀中学校（西）,35.7601558,139.7161897
東京都,板橋区,3_8,仲宿28番5号,文殊院,35.7559503,139.7097546
東京都,板橋区,3_9,仲宿44番,仲宿ふれあい広場,35.7538644,139.709806
東京都,板橋区,4_1,氷川町23番1号,都営氷川町アパート,35.7552485,139.7047733
東京都,板橋区,4_2,氷川町13番1号,板橋第一小学校（南）,35.7537453,139.7069036
東京都,板橋区,4_3,氷川町13番1号,板橋第一小学校（東）,35.7537453,139.7069036
東京都,板橋区,4_4,氷川町22番3号,板橋第三中学校（南）,35.7549963,139.706006
東京都,板橋区,4_5,氷川町22番3号,板橋第三中学校（北）,35.7549963,139.706006
東京都,板橋区,4_6,氷川町22番3号,板橋第三中学校（東）,35.7549963,139.706006
東京都,板橋区,4_7,氷川町22番3号,板橋第三中学校（西）,35.7549963,139.706006
東京都,板橋区,4_8,氷川町24番2号,氷川児童館（南）,35.7543878,139.7051383
東京都,板橋区,5_1,大山東町8番7号,大山東児童館,35.74751,139.7062447
東京都,板橋区,5_2,大山東町14番2号,大山東町児童遊園（西）,35.7477694,139.7053377
東京都,板橋区,5_3,大山東町50番1号,板橋第一中学校（北）,35.7504946,139.7048989
東京都,板橋区,5_4,大山東町50番1号,板橋第一中学校（西）,35.7504946,139.7048989
東京都,板橋区,5_5,栄町35番1号,大山公園（東）,35.7506565,139.7018272
東京都,板橋区,5_6,栄町35番1号,大山公園（西）,35.7506565,139.7018272
東京都,板橋区,5_7,栄町35番2号,健康長寿医療センター（北）,35.7517813,139.7032638
東京都,板橋区,5_8,大山東町51番1号,板橋区立文化会館,35.7495086,139.7046088
東京都,板橋区,6_1,大山金井町12番8号,大山金井町児童遊園,35.7459405,139.7074609
東京都,板橋区,6_2,大山金井町24番1号,masked,35.7467133,139.7065645
東京都,板橋区,6_3,大山金井町31番1号,板橋第七小学校（西）,35.7455342,139.7047721
東京都,板橋区,6_4,大山金井町31番1号,板橋第七小学校（北）,35.7455342,139.7047721
東京都,板橋区,6_5,大山金井町31番1号,板橋第七小学校（南）,35.7455342,139.7047721
東京都,板橋区,6_6,熊野町11番2号,熊野神社,35.7418511,139.7065445
東京都,板橋区,6_7,熊野町23番5号,熊野町公園（北）,35.7438549,139.7068692
東京都,板橋区,6_8,熊野町34番1号,masked,35.7430558,139.7050186
東京都,板橋区,7_1,中丸町19番1号,板橋第五小学校（東）,35.7415651,139.7053876
東京都,板橋区,7_2,中丸町19番1号,板橋第五小学校（西）,35.7415651,139.7053876
東京都,板橋区,7_3,中丸町19番1号,板橋第五小学校（南）,35.7415651,139.7053876
東京都,板橋区,7_4,中丸町19番1号,板橋第五小学校（北）,35.7415651,139.7053876
東京都,板橋区,7_5,中丸町19番1号,板橋第五小学校（東）,35.7415651,139.7053876
東京都,板橋区,7_6,中丸町43番,中丸なかよし児童遊園（西）,35.7430174,139.7027846
東京都,板橋区,7_7,南町22番2号,中丸児童遊園（北）,35.7390908,139.7030155
東京都,板橋区,7_8,南町56番1号,東京都住宅供給公社南町住宅,35.7429968,139.6995203
東京都,板橋区,8_1,大山町4番1号,大山駅（東口）,35.7482093,139.702645
東京都,板橋区,8_2,大山町13番1号,板橋第六小学校（南）,35.7473479,139.7007701
東京都,板橋区,8_3,大山町13番1号,板橋第六小学校（東）,35.7473479,139.7007701
東京都,板橋区,8_4,大山町13番1号,板橋第六小学校（北‐東より）,35.7473479,139.7007701
東京都,板橋区,8_5,大山町13番1号,板橋第六小学校（北‐西より）,35.7473479,139.7007701
東京都,板橋区,8_6,大山町29番6号,瑞法寺,35.74806,139.6993341
東京都,板橋区,8_7,大山町44番4号,私立大山保育園,35.7501244,139.6982771
東京都,板橋区,9_1,大山西町19番,板橋公園予定地,35.7461826,139.6964023
東京都,板橋区,9_2,大山西町21番21号,板橋交通公園（東）,35.7453335,139.6946473
東京都,板橋区,9_3,大山西町21番21号,板橋交通公園（北）,35.7453335,139.6946473
東京都,板橋区,9_4,幸町3番1号,みなみ児童遊園（南）,35.7452204,139.7002906
東京都,板橋区,9_5,大谷口上町43番1号,板橋第十小学校（南）,35.7470968,139.6923235
東京都,板橋区,9_6,幸町26番1号,板橋第二中学校（東）,35.7458239,139.6972457
東京都,板橋区,9_7,幸町26番1号,板橋第二中学校（西）,35.7458239,139.6972457
東京都,板橋区,9_8,幸町46番,幸町４６番遊び場（南）,35.7438804,139.6958439
東京都,板橋区,10_1,赤塚新町3丁目13番先,歩道,35.7716934,139.6373986
東京都,板橋区,10_2,赤塚新町3丁目14番先,歩道,35.7720091,139.636761
東京都,板橋区,10_3,赤塚新町3丁目31番1号,赤塚新町小学校（西）,35.7690004,139.636669
東京都,板橋区,10_4,赤塚新町3丁目31番1号,赤塚新町小学校（南）,35.7690004,139.636669
東京都,板橋区,10_5,赤塚新町3丁目32番1号,光が丘パークタウン１号棟北側駐車場,35.7701399,139.6365212
東京都,板橋区,10_6,赤塚新町3丁目32番11号,ゆりの木保育園前,35.769306,139.6386214
東京都,板橋区,10_7,赤塚新町3丁目35番1号,赤塚新町公園（南）,35.770108,139.638828
東京都,板橋区,11_1,栄町1番3号,大山公園（東）,35.7546808,139.7042407
東京都,板橋区,11_2,栄町6番1号,板橋第九小学校（南）,35.7546798,139.7042631
東京都,板橋区,11_3,栄町14番1号,中根橋小学校（北）,35.7555071,139.7009474
東京都,板橋区,11_4,栄町14番1号,中根橋小学校（南）,35.7555071,139.7009474
東京都,板橋区,11_5,栄町27番3号,(公財)東京都保健医療公社豊島病院職員住宅,35.7525801,139.7020592
東京都,板橋区,11_6,栄町33番1号,(公財)東京都保健医療公社豊島病院駐輪場,35.7527665,139.7009785
東京都,板橋区,11_7,栄町33番1号,(公財)東京都保健医療公社豊島病院（北）,35.7527665,139.7009785
東京都,板橋区,11_8,中板橋24番3号,中板橋駅北口自転車駐車場,35.7562126,139.6951359
東京都,板橋区,12_1,仲町20番5号,仲町ふれあい館,35.7511479,139.6964087
東京都,板橋区,12_2,仲町1番4号,(医)明芳会(福)明東会　クローバーのさと(北),35.7529926,139.6976937
東京都,板橋区,12_3,弥生町16番1号,三葉児童遊園,35.7530307,139.6947271
東京都,板橋区,12_4,弥生町19番1号,弥生小学校（西）,35.7537305,139.6945782
東京都,板橋区,12_5,弥生町19番1号,弥生小学校（北）,35.7537305,139.6945782
東京都,板橋区,12_6,弥生町19番1号,弥生小学校（東）,35.7537305,139.6945782
東京都,板橋区,12_7,弥生町59番10号,masked,35.7548296,139.6923261
東京都,板橋区,12_8,弥生町73番1号,弥生公園（南）,35.7524681,139.6929721
東京都,板橋区,13_1,大谷口上町30番1号,日本大学医学部附属板橋病院（東）,35.7490948,139.6921481
東京都,板橋区,13_2,大谷口上町30番1号,日本大学医学部附属板橋病院（西）,35.7490948,139.6921481
東京都,板橋区,13_3,大谷口上町43番1号,板橋第十小学校（東）,35.7470968,139.6923235
東京都,板橋区,13_4,大谷口上町50番3号,大谷口上町公園（東）,35.7473555,139.6915351
東京都,板橋区,13_5,大谷口1丁目54番1号,都立板橋高等学校（南）,35.7411141,139.688565
東京都,板橋区,13_6,大谷口1丁目54番1号,都立板橋高等学校（西）,35.7411141,139.688565
東京都,板橋区,13_7,大谷口2丁目8番,旧大谷口幼稚園（北）,35.7461262,139.6884254
東京都,板橋区,13_8,向原3丁目1番12号,上板橋第二中学校（東）,35.7436631,139.6861716
東京都,板橋区,14_1,大谷口北町21番1号,大谷口小学校（西）,35.7510648,139.6899509
東京都,板橋区,14_2,大谷口北町21番1号,大谷口小学校（北）,35.7510648,139.6899509
東京都,板橋区,14_3,大谷口北町31-10,都営大谷口北町第２アパート10号棟,35.7499092,139.6884496
東京都,板橋区,14_4,大谷口北町31-10,都営大谷口北町第２アパート9号棟,35.7499092,139.6884496
東京都,板橋区,14_5,大谷口北町39番1号,私立かごめ幼稚園,35.7514801,139.6885351
東京都,板橋区,14_6,大谷口北町48番7号,masked,35.7534201,139.6896852
東京都,板橋区,14_7,大谷口北町51番先,大谷口北町排水機所,35.7518322,139.6881861
東京都,板橋区,14_8,大谷口北町21番21号,大谷口児童遊園,35.7505442,139.6909829
東京都,板橋区,15_1,向原1丁目14番,小竹向原自転車駐車場,35.7417395,139.6836198
東京都,板橋区,15_2,向原1丁目18番5号,向原保育園,35.7425105,139.6848106
東京都,板橋区,15_3,向原1丁目18番10号,向原児童遊園（西）,35.7427086,139.6849159
東京都,板橋区,15_4,向原2丁目29番1号,向原公園（東）,35.7401902,139.6813268
東京都,板橋区,15_5,向原2丁目34番1号,向原小学校（西）,35.7414471,139.681591
東京都,板橋区,15_6,向原2丁目34番1号,向原小学校（南）,35.7414471,139.681591
東京都,板橋区,15_7,向原3丁目7番,コーシャハイム向原ガーデンコート,35.7458113,139.6844373
東京都,板橋区,15_8,向原3丁目7番1号,コーシャハイム向原4号棟,35.7459547,139.6844573
東京都,板橋区,16_1,小茂根1丁目2番1号,上板橋第一中学校（小茂根校舎）（西）,35.7477984,139.681262
東京都,板橋区,16_2,小茂根1丁目2番1号,上板橋第一中学校（小茂根校舎）（北）,35.7477984,139.681262
東京都,板橋区,16_3,小茂根1丁目17番1号,小茂根一丁目児童遊園（東）,35.7456841,139.6794925
東京都,板橋区,16_4,小茂根2丁目15番1号,小茂根二丁目公園（南）,35.7495762,139.6820446
東京都,板橋区,16_5,小茂根3丁目12番,小茂根福祉園,35.7504561,139.6785355
東京都,板橋区,16_6,小茂根4丁目16番,小茂根四丁目１６番遊び場（西）,35.7495885,139.6757343
東京都,板橋区,16_7,小茂根4丁目16番1号,小茂根四丁目公園（東）,35.7492402,139.6758589
東京都,板橋区,16_8,小茂根5丁目2番17号,茂呂山公園（西）,35.7505561,139.6775313
東京都,板橋区,16_9,小茂根5丁目18番1号,都立大山高等学校（東）,35.7534939,139.6747798
東京都,板橋区,17_1,稲荷台15番先,稲荷台第二児童遊園,35.7626376,139.712918
東京都,板橋区,17_2,稲荷台22番4号,東京電力(株)稲荷台変電所,35.7622756,139.7103246
東京都,板橋区,17_3,稲荷台23番1号,加賀小学校（南）,35.7614807,139.7104127
東京都,板橋区,17_4,稲荷台23番1号,加賀小学校（西）,35.7614807,139.7104127
東京都,板橋区,17_5,稲荷台27番1号,私立帝京学園（北）,35.7604991,139.7111625
東京都,板橋区,17_6,稲荷台27番1号,私立帝京学園（南）,35.7604991,139.7111625
東京都,板橋区,17_7,本町8番1号,都営板橋本町アパート１号棟,35.76062,139.7090514
東京都,板橋区,17_8,本町24番1号,いたばし総合ボランティアセンター,35.7596015,139.7083159
東京都,板橋区,18_1,富士見町3番1号,旧板橋第四中学校（南）,35.7606628,139.7005159
東京都,板橋区,18_2,富士見町3番1号,富士見地域センター,35.7606628,139.7005159
東京都,板橋区,18_3,富士見町13番6号,私立平和保育園,35.7617941,139.6988092
東京都,板橋区,18_4,富士見町24番9号,富士見西児童遊園,35.7589783,139.695445
東京都,板橋区,18_5,富士見町27番3号,都営板橋富士見町アパート旧３号棟,35.7596952,139.6967475
東京都,板橋区,18_6,富士見町28番1号,都立北豊島工業高等学校（西）,35.7608667,139.6971698
東京都,板橋区,18_7,富士見町28番1号,都立北豊島工業高等学校（南）,35.7608667,139.6971698
東京都,板橋区,19_1,大和町2番先,氷川つり堀公園,35.7564218,139.706088
東京都,板橋区,19_2,大和町36番4号,板橋保育園,35.7594325,139.7050283
東京都,板橋区,19_3,氷川町23番5号,板橋区土木部水防倉庫,35.755592,139.705238
東京都,板橋区,19_4,双葉町18番1号,都営双葉町第２アパート（東）,35.7576088,139.6990748
東京都,板橋区,19_5,双葉町18番3号,都営双葉町第２アパート（西）,35.7576347,139.6985319
東京都,板橋区,19_6,双葉町18番23号,双葉町ひだまり公園（南）,35.7578114,139.6989552
東京都,板橋区,19_7,双葉町42番1号,板橋第八小学校（北）,35.7595941,139.7001113
東京都,板橋区,19_8,双葉町42番1号,板橋第八小学校（南）,35.7595941,139.7001113
東京都,板橋区,20_1,常盤台1丁目1番,ときわ台駅前,35.7589847,139.6899409
東京都,板橋区,20_2,常盤台1丁目6番1号,常盤台小学校（西）,35.7598224,139.6911945
東京都,板橋区,20_3,常盤台1丁目6番1号,常盤台小学校（南）,35.7598224,139.6911945
東京都,板橋区,20_4,常盤台1丁目13番1号,常盤台公園（西）,35.760028,139.6915044
東京都,板橋区,20_5,常盤台1丁目13番1号,常盤台公園（北）,35.760028,139.6915044
東京都,板橋区,20_6,常盤台1丁目28番19号,常盤台一丁目児童遊園（南）,35.7618394,139.6916958
東京都,板橋区,20_7,常盤台2丁目20番20号,常盤台北口公園（東）,35.7625797,139.6876134
東京都,板橋区,20_8,常盤台2丁目25番11号,masked,35.7626844,139.6897016
東京都,板橋区,21_1,南常盤台1丁目1番1号,上板橋第一中学校（東）,35.757118,139.6921467
東京都,板橋区,21_2,南常盤台1丁目1番1号,上板橋第一中学校（西）,35.757118,139.6921467
東京都,板橋区,21_3,南常盤台1丁目1番1号,上板橋第一中学校（北）,35.757118,139.6921467
東京都,板橋区,21_4,南常盤台1丁目26番20号,向屋敷公園（北）,35.7579126,139.6906588
東京都,板橋区,21_5,南常盤台2丁目4番10号,ときわ台駅南口自転車駐車場,35.758494,139.6872638
東京都,板橋区,21_6,南常盤台2丁目8番6号,南ときわ台公園（東）,35.7566159,139.6863566
東京都,板橋区,21_7,南常盤台2丁目8番6号,南ときわ台公園（西）,35.7566159,139.6863566
東京都,板橋区,21_8,南常盤台2丁目10番6号,区営南常盤台二丁目アパート集会所,35.7570654,139.685215
東京都,板橋区,22_1,東新町1丁目27番8号,緑ケ丘第一公園（北）,35.7569617,139.6811972
東京都,板橋区,22_2,東新町2丁目14番8号,masked,35.7555611,139.6822582
東京都,板橋区,22_3,東新町2丁目14番8号,masked,35.7555611,139.6822582
東京都,板橋区,22_4,東新町2丁目30番23号,安養院（東）,35.7547261,139.6801804
東京都,板橋区,22_5,東新町2丁目43番5号,東新保育園,35.7525996,139.6805692
東京都,板橋区,22_6,東山町47番3号,上板橋小学校（西）,35.7546656,139.6866606
東京都,板橋区,22_7,東山町47番3号,上板橋小学校（北）,35.7546656,139.6866606
東京都,板橋区,22_8,東山町52番8号,東山公園（西）,35.7559758,139.6856611
東京都,板橋区,23_1,東新町2丁目29番1号,桜川小学校（北）,35.7541942,139.6781467
東京都,板橋区,23_2,東新町2丁目29番1号,桜川小学校（西）,35.7541942,139.6781467
東京都,板橋区,23_3,桜川1丁目2番1号,桜川中学校（西）,35.7560823,139.6765091
東京都,板橋区,23_4,桜川2丁目3番,桜川二丁目３番遊び場（南）,35.7574605,139.6765418
東京都,板橋区,23_5,桜川2丁目18番1号,緑ケ丘第二公園（南）,35.7586737,139.6785388
東京都,板橋区,23_6,桜川3丁目9番1号,緑ケ丘第三公園（北）,35.7608337,139.6727916
東京都,板橋区,23_7,桜川3丁目18番,桜川三丁目１８番遊び場（北）,35.7601474,139.6757443
東京都,板橋区,24_1,上板橋1丁目3番1号,上板橋第四小学校（西）,35.7614542,139.6783461
東京都,板橋区,24_2,上板橋1丁目3番1号,上板橋第四小学校（東）,35.7614542,139.6783461
東京都,板橋区,24_3,上板橋2丁目3番8号,上板橋保育園,35.7618316,139.6737905
東京都,板橋区,24_4,上板橋2丁目36番7号,上板橋駅（北）,35.7634687,139.6763885
東京都,板橋区,24_5,上板橋2丁目36番7号,上板橋駅（西）,35.7634687,139.6763885
東京都,板橋区,24_6,上板橋2丁目36番7号,上板橋駅（東）,35.7634687,139.6763885
東京都,板橋区,24_7,上板橋2丁目38番3号,七軒家公園（南）,35.7633577,139.6741793
東京都,板橋区,24_8,上板橋2丁目51番,上板富士公園（南）,35.765175,139.6708002
東京都,板橋区,25_1,常盤台3丁目15番,水久保公園（北）,35.7611639,139.6846766
東京都,板橋区,25_2,常盤台3丁目21番2号,ときわ台保育園,35.7622414,139.6841283
東京都,板橋区,25_3,常盤台3丁目30番1号,上板橋第三中学校（西）,35.7630307,139.6821742
東京都,板橋区,25_4,常盤台3丁目30番1号,上板橋第三中学校（南）,35.7630307,139.6821742
東京都,板橋区,25_5,常盤台4丁目3番1号,平和公園（南）,35.7634714,139.6814485
東京都,板橋区,25_6,常盤台4丁目3番1号,平和公園（北）,35.7634714,139.6814485
東京都,板橋区,25_7,常盤台4丁目14番1号,歩道（教育科学館西側）,35.7634202,139.679631
東京都,板橋区,26_1,清水町47番3号,masked,35.7645921,139.7053613
東京都,板橋区,26_2,清水町62番,国際興業株式会社赤羽営業所（西）,35.7665033,139.7068537
東京都,板橋区,26_3,清水町83番1号,志村第三小学校（南）,35.7668925,139.7057428
東京都,板橋区,26_4,清水町83番1号,志村第三小学校（北）,35.7668925,139.7057428
東京都,板橋区,26_5,清水町91番,都営板橋清水町アパート１号棟（西）,35.765228,139.7088485
東京都,板橋区,26_6,蓮沼町1番6号,蓮沼児童遊園（南）,35.7681572,139.7060459
東京都,板橋区,26_7,蓮沼町27番4号,本蓮沼公園（北）,35.769631,139.7043005
東京都,板橋区,26_8,蓮沼町27番4号,本蓮沼公園（南）,35.769631,139.7043005
東京都,板橋区,27_1,泉町5番,本蓮沼駅前いずみ公園内,35.7678187,139.7024655
東京都,板橋区,27_2,泉町16番16号,清水地域センター,35.7664411,139.7021367
東京都,板橋区,27_3,泉町17番1号,志村第一小学校（西）,35.7661361,139.7023558
東京都,板橋区,27_4,泉町17番1号,志村第一小学校（南）,35.7661361,139.7023558
東京都,板橋区,27_5,宮本町58番58号,宮本児童遊園,35.7649588,139.7015879
東京都,板橋区,27_6,大原町33番1号,志村第一中学校（東）,35.7668565,139.6969458
東京都,板橋区,27_7,宮本町54番1号,清水稲荷神社,35.7643131,139.7026056
東京都,板橋区,27_8,宮本町58番2号,都営宮本町アパート２号棟,35.7649073,139.7016613
東京都,板橋区,28_1,前野町1丁目7番3号,富士見街道にぎわい広場（南）,35.7635871,139.6956844
東京都,板橋区,28_2,前野町1丁目10番1号,富士見台小学校（東）,35.7634674,139.6952755
東京都,板橋区,28_3,前野町1丁目10番1号,富士見台小学校（西）,35.7634674,139.6952755
東京都,板橋区,28_4,前野町1丁目20番1号,公社前野町第二住宅（東）,35.765311,139.6959636
東京都,板橋区,28_5,前野町1丁目20番1号,公社前野町第二住宅（北）,35.765311,139.6959636
東京都,板橋区,28_6,前野町1丁目39番2号,都営前野町一丁目アパート２号棟,35.765809,139.694639
東京都,板橋区,28_7,前野町1丁目41番1号,都営前野町一丁目アパート１号棟,35.7655852,139.6939404
東京都,板橋区,28_8,前野町1丁目48番,けやきの公園前,35.7644467,139.692324
東京都,板橋区,29_1,前野町2丁目24番14号,前野第二児童遊園（南）,35.765323,139.6873415
東京都,板橋区,29_2,前野町3丁目19番2号,都営前野町三丁目アパート二号棟,35.7687177,139.6906788
東京都,板橋区,29_3,前野町4丁目6番1号,エコポリスセンター入口前,35.769162,139.6887858
東京都,板橋区,29_4,前野町6丁目2番4号,前野町六丁目児童遊園（南）,35.7638804,139.685554
東京都,板橋区,29_5,前野町6丁目10番9号,西前野公園（東）,35.7644634,139.6837993
東京都,板橋区,29_6,前野町6丁目40番1号,前野小学校（西）,35.7683613,139.6876643
東京都,板橋区,29_7,前野町6丁目40番1号,前野小学校（東）,35.7683613,139.6876643
東京都,板橋区,29_8,前野町6丁目53番,西前野児童遊園（西）,35.7681331,139.6841981
東京都,板橋区,30_1,大原町5番18号,大原生涯学習センター,35.7697013,139.7001318
東京都,板橋区,30_2,大原町27番1号,大原第二公園（南）,35.7682742,139.6980776
東京都,板橋区,30_3,大原町33番1号,志村第一中学校（南）,35.7668565,139.6969458
東京都,板橋区,30_4,志村1丁目7番1号,志村第二小学校（南）,35.7719134,139.6978881
東京都,板橋区,30_5,志村1丁目7番1号,志村第二小学校（西）,35.7719134,139.6978881
東京都,板橋区,30_6,志村1丁目21番8号,志村第三公園（北）,35.7745974,139.6922542
東京都,板橋区,30_7,前野町4丁目59番1号,見次公園（北東）,35.7733641,139.69351
東京都,板橋区,30_8,前野町4丁目59番1号,見次公園（東）,35.7733641,139.69351
東京都,板橋区,31_1,蓮沼町69番1号,蓮沼公園（南東）,35.7721306,139.7038817
東京都,板橋区,31_2,蓮沼町79番3号,masked,35.7719646,139.7018066
東京都,板橋区,31_3,小豆沢1丁目4番,中原公園前（西）,35.7737365,139.7015081
東京都,板橋区,31_4,小豆沢1丁目8番4号,masked,35.773074,139.6997993
東京都,板橋区,31_5,小豆沢1丁目20番13号,東原公園（北）,35.7748896,139.7025054
東京都,板橋区,31_6,小豆沢1丁目21番1号,志村第二中学校（西）,35.7755242,139.7031038
東京都,板橋区,31_7,小豆沢1丁目21番1号,志村第二中学校（南）,35.7755242,139.7031038
東京都,板橋区,31_8,小豆沢1丁目21番1号,志村第二中学校（北）,35.7755242,139.7031038
東京都,板橋区,32_1,東坂下1丁目6番,東坂下一丁目児童遊園入口,35.7808992,139.6922542
東京都,板橋区,32_2,小豆沢3丁目1番1号,小豆沢公園（小豆沢公園前交差点付近）,35.7784333,139.6983277
東京都,板橋区,32_3,小豆沢3丁目1番1号,小豆沢公園（パークファミリア側）,35.7784333,139.6983277
東京都,板橋区,32_4,小豆沢3丁目8番,小豆沢公園（野球場側）,35.778311,139.6963225
東京都,板橋区,32_5,小豆沢3丁目8番,小豆沢公園（小豆沢墓苑側）,35.778311,139.6963225
東京都,板橋区,32_6,小豆沢4丁目13番1号,志村第四小学校（東）,35.7806229,139.7018472
東京都,板橋区,32_7,小豆沢4丁目13番1号,志村第四小学校（北）,35.7806229,139.7018472
東京都,板橋区,32_8,小豆沢4丁目20番,小豆沢公園キャッチボール広場（北）,35.7810172,139.6989552
東京都,板橋区,33_1,志村2丁目4番,東京都営交通協力会駐車場,35.7777186,139.6928923
東京都,板橋区,33_2,志村2丁目5番,清水坂,35.7777583,139.6923675
東京都,板橋区,33_3,志村2丁目16番3号,志村小学校（南）,35.775239,139.6865892
東京都,板橋区,33_4,志村2丁目17番1号,志村城山公園（北東）,35.7769065,139.6874483
東京都,板橋区,33_5,志村2丁目17番1号,志村城山公園（北）,35.7769065,139.6874483
東京都,板橋区,33_6,志村2丁目17番1号,志村城山公園（南）,35.7769065,139.6874483
東京都,板橋区,33_7,前野町4丁目40番10号,前野町四丁目第四アパート,35.7740747,139.6868164
