prefecture,city,number,address,name,lat,long
宮城県,富谷市,01-01,富谷市富谷新町１６－１先,熊野神社北側旧国道ガードパイプ,38.3992126,140.8852305
宮城県,富谷市,01-02,富谷市富谷新町１０６,佐忠西側歩道,38.3989619,140.8872076
宮城県,富谷市,01-03,富谷市富谷西沢１３,富谷中央公民館南側フェンス,38.4011761,140.8901343
宮城県,富谷市,01-04,富谷市富谷清水仲１３５－３,masked,38.3972365,140.8944718
宮城県,富谷市,01-05,富谷市穀田立石４３－２　隣,masked,38.3912978,140.8961721
宮城県,富谷市,01-06,富谷市富谷坂松田３０,富谷市役所前,38.3999043,140.8953202
宮城県,富谷市,01-07,富谷市ひより台一丁目１２３,ひより台一丁目南公園北側フェンス,38.4034684,140.8840639
宮城県,富谷市,01-08,富谷市ひより台ニ丁目４２ー１,ひより台ニ丁目会館北側フェンス,38.4044279,140.8879412
宮城県,富谷市,01-09,富谷市ひより台一丁目１１９,ひより台一丁目調整池西側緑地,38.4009628,140.8830855
宮城県,富谷市,02-01,富谷市太子堂一丁目１９,太子堂ゲートボール場北西側,38.4135777,140.8930749
宮城県,富谷市,02-02,富谷市太子堂一丁目１番先,宮交バス停『三ノ関（上り）』北側緑地帯,38.4108729,140.890056
宮城県,富谷市,02-03,富谷市太子堂一丁目１７番内,太子堂一丁目公園北西側フェンス,38.4125358,140.8926225
宮城県,富谷市,02-04,富谷市三ノ関膳部沢下１１　先,masked,38.4154888,140.8956555
宮城県,富谷市,03-01,富谷市一ノ関コウスノ２ー５,masked,38.4106465,140.8839937
宮城県,富谷市,03-02,富谷市二ノ関相良３０番２,二ノ関会館前フェンス,38.4177985,140.8813035
宮城県,富谷市,03-03,富谷市三ノ関西沖２６ー１０,（有）ショーカイ自動車販売北側,38.4218051,140.8889335
宮城県,富谷市,03-04,富谷市志戸田切添３,志戸田会館前,38.4256843,140.8885426
宮城県,富谷市,04-01,富谷市大童上八幡１０６ー５,masked,38.3939431,140.9166734
宮城県,富谷市,04-02,富谷市今泉鶴巻５１　先,masked,38.4002367,140.9210862
宮城県,富谷市,04-03,富谷市今泉新上中田５２,masked,38.3936691,140.9239727
宮城県,富谷市,04-04,富谷市今泉八幡下５７－１,今泉会館東側ポンプ車小屋地内,38.3950586,140.9260341
宮城県,富谷市,04-05,富谷市大亀新袋４１,市民バス停『間渡橋』南側ガードパイプ,38.3810108,140.9253854
宮城県,富谷市,05-01,富谷市石積十文字３－７,石積会館南西側,38.3681315,140.9167795
宮城県,富谷市,05-02,富谷市明石祭田４－１,masked,38.3520111,140.9108615
宮城県,富谷市,05-03,富谷市明石下寺前２－２　先,旧明石消防ポンプ置場東側,38.358937,140.9034867
宮城県,富谷市,05-04,富谷市西成田郷田一番９４,西成田コミュニティセンター前,38.3857507,140.9063744
宮城県,富谷市,05-05,富谷市西成田榎町８２,masked,38.3769158,140.9048533
宮城県,富谷市,06-01,富谷市東向陽台二丁目１０番１０号,東向陽台第一会館東側柵,38.3388642,140.9041889
宮城県,富谷市,06-02,富谷市東向陽台一丁目１６番５号先,宮交バス停『東向陽台一丁目』南側緑地帯,38.3409183,140.9036122
宮城県,富谷市,06-03,富谷市東向陽台三丁目１３番１５号,東向陽台第二会館南側,38.3429396,140.8954481
宮城県,富谷市,06-04,富谷市明石台一丁目１,東向陽台公民館西側フェンス,38.3414283,140.9010399
宮城県,富谷市,06-05,富谷市明石台一丁目３０－２,masked,38.3423006,140.9008191
宮城県,富谷市,06-06,富谷市明石台一丁目３７－１３,東向陽台小学校西側角フェンス,38.3470566,140.8963116
宮城県,富谷市,06-07,富谷市明石台ニ丁目９－２,東向陽台サニーハイツ会館北側,38.3491291,140.8905066
宮城県,富谷市,06-08,富谷市明石台七丁目２－１,とみや子育て支援センター北東角法面,38.3468722,140.8999244
宮城県,富谷市,06-09,富谷市明石台八丁目２９－２,明石台八丁目第二公園東側,38.3427349,140.9027536
宮城県,富谷市,06-10,富谷市明石台十丁目１２,明石台１０丁目第２公園東側,38.350196,140.9019594
宮城県,富谷市,06-11,富谷市明石台十丁目２２－１,明石台第十会館西側,38.3476718,140.9027896
宮城県,富谷市,07-01,富谷市富ケ丘一丁目７番,富ケ丘一丁目第２公園東側柵,38.3622135,140.8704186
宮城県,富谷市,07-02,富谷市富ケ丘一丁目２０番,富谷消防署入口付近,38.3618165,140.8728621
宮城県,富谷市,07-03,富谷市富ケ丘二丁目３２番,富ケ丘二丁目第３公園東側柵,38.3633089,140.8644795
宮城県,富谷市,07-04,富谷市富ケ丘三丁目１番２８号,富ケ丘公民館前,38.3660703,140.8645935
宮城県,富谷市,07-05,富谷市富ケ丘三丁目２１番,富ケ丘三丁目第２公園東側フェンス,38.3697287,140.8623726
宮城県,富谷市,07-06,富谷市富ケ丘四丁目６番,富ケ丘四丁目第１公園北側フェンス,38.3668219,140.8668219
宮城県,富谷市,07-07,富谷市上桜木一丁目３２,上桜木一丁目第３公園北東柵,38.359245,140.8768866
宮城県,富谷市,08-01,富谷市鷹乃杜二丁目１番,鷹乃杜団地南入口東側歩道ガードパイプ,38.3653576,140.872556
宮城県,富谷市,08-02,富谷市鷹乃杜一丁目４番先,鷹乃杜一丁目公園西側入口,38.3633844,140.8711995
宮城県,富谷市,08-03,富谷市鷹乃杜二丁目２２番,鷹乃杜第二会館向法面,38.3676701,140.8689641
宮城県,富谷市,08-04,富谷市鷹乃杜二丁目２１番,鷹乃杜二丁目公園南側法面,38.3672286,140.8691388
宮城県,富谷市,08-05,富谷市鷹乃杜三丁目２８番,鷹乃杜三丁目公園東側柵,38.3682468,140.8706019
宮城県,富谷市,08-06,富谷市鷹乃杜四丁目３番,masked,38.3689555,140.873662
宮城県,富谷市,09-01,富谷市あけの平一丁目１－４,あけの平団地北入口北側,38.3826633,140.8745511
宮城県,富谷市,09-02,富谷市あけの平二丁目５－９,あけの平二丁目公園南側柵,38.3776164,140.876851
宮城県,富谷市,09-03,富谷市あけの平二丁目２２－１４,あけの平公民館北側フェンス,38.378359,140.878551
宮城県,富谷市,09-04,富谷市あけの平三丁目６－９,あけの平三丁目公園南側柵,38.3750191,140.8790004
宮城県,富谷市,09-05,富谷市あけの平二丁目３７－４,あけの平団地南入口南側歩道ガードパイプ,38.3776164,140.876851
宮城県,富谷市,09-06,富谷市とちの木一丁目２番,とちの木一丁目調整池東側,38.3892992,140.8814116
宮城県,富谷市,09-07,富谷市大清水二丁目５３,オートヒルズ入口南側交差点緑地,38.3677445,140.8775086
宮城県,富谷市,09-08,富谷市大清水一丁目３ー３,大清水一丁目第１公園西側柵,38.3728011,140.8785157
宮城県,富谷市,10-01,富谷市日吉台一丁目３９,masked,38.3729178,140.8649839
宮城県,富谷市,10-02,富谷市日吉台一丁目２４－１,日吉台公園東側柵,38.3720639,140.8636212
宮城県,富谷市,10-03,富谷市日吉台二丁目２２－１６,日吉台二丁目公園西側柵,38.3772506,140.8643145
宮城県,富谷市,10-04,富谷市日吉台三丁目７－９,日吉台三丁目公園北側柵,38.3795088,140.8671141
宮城県,富谷市,10-05,富谷市日吉台三丁目９－３,市民バス停『日吉台銀行前』、南側フェンス,38.3795088,140.8671141
宮城県,富谷市,10-06,富谷市日吉台三丁目１９－２,日吉台中学校北西側フェンス,38.3817039,140.8668045
宮城県,富谷市,10-07,富谷市杜乃橋一丁目１１－６,杜乃橋一丁目公園東側柵,38.3841183,140.871476
宮城県,富谷市,10-08,富谷市杜乃橋二丁目３１,杜乃橋公園南西角緑地,38.3876678,140.8732016
宮城県,富谷市,11-01,富谷市成田一丁目１－１,成田公民館入口北側,38.364367,140.890373
宮城県,富谷市,11-02,富谷市成田四丁目１５－１,成田四丁目第１公園,38.3610031,140.8958462
宮城県,富谷市,11-03,富谷市成田七丁目７－５,成田七丁目会館前,38.3590638,140.8972175
宮城県,富谷市,11-04,富谷市成田三丁目１－１,成田小学校南角法面,38.3672981,140.8938931
宮城県,富谷市,11-05,富谷市成田三丁目３７,宮交バス停『成田東公園前（上り）』北側ガードパイプ,38.3670694,140.8966616
宮城県,富谷市,11-06,富谷市成田三丁目３４－１,市民バス停『成田中学校』北側,38.3662609,140.9014994
宮城県,富谷市,11-07,富谷市成田六丁目２７－２,成田六丁目第２公園南側空地,38.3641316,140.9037567
宮城県,富谷市,11-08,富谷市成田九丁目４,成田西公園バスケットボール場前,38.3579592,140.8866998
宮城県,富谷市,12-01,富谷市明石台三丁目１４－２,明石台三丁目公園北側,38.3486928,140.8879521
宮城県,富谷市,12-02,富谷市明石台五丁目１０,明石台五丁目公園西側,38.3527674,140.8909952
宮城県,富谷市,12-03,富谷市明石台五丁目４５,明石台小学校南側法面,38.3554209,140.8909768
宮城県,富谷市,12-04,富谷市明石台四丁目５－２,明石台四丁目第１公園,38.3504635,140.884446
宮城県,富谷市,12-05,富谷市明石台四丁目８－２,明石台四丁目第２公園,38.3504635,140.884446
宮城県,富谷市,12-06,富谷市明石台六丁目２７,明石台六丁目広場,38.348874,140.894216
宮城県,富谷市,12-07,富谷市明石台九丁目２０－２,明石台九丁目会館南側,38.3520317,140.8983111
宮城県,富谷市,12-08,富谷市明石台九丁目４２,明石台九丁目交差点北東歩道脇,38.3516312,140.9004304
