prefecture,city,number,address,name,lat,long,note
千葉県,銚子市,1-1,犬吠埼10222番地の1 高神小学校校庭県道側門左側（敷地内フェンス）,高神小学校校庭県道側門左側（敷地内フェンス）,35.7019709,140.8570733,
千葉県,銚子市,1-2,長崎町10759番地 長崎町青年館（敷地内）,長崎町青年館（敷地内）,35.6970955,140.8623593,
千葉県,銚子市,1-3,外川町1丁目10630番地 銚子電鉄外川駅（橘内）,銚子電鉄外川駅（橘内）,35.6992953,140.8570319,
千葉県,銚子市,1-4,外川町4丁目10357番地の1 外川児童遊園北側法面（法面）,外川児童遊園北側法面（法面）,35.7012977,140.8556954,
千葉県,銚子市,1-5,外川町2丁目11036番地先 千葉交通バス停（外川漁業会）脇（県道沿い）,千葉交通バス停（外川漁業会）脇（県道沿い）,35.697240, 140.854926,
千葉県,銚子市,1-6,高神町857番地 長谷川 栄豊方 高福寺薬師堂山門左側（コンクリート塀）,長谷川 栄豊方 高福寺薬師堂山門左側（コンクリート塀）,35.7110387,140.8503726,
千葉県,銚子市,1-7,masked,masked,35.71008,140.8485924,
千葉県,銚子市,1-8,潮見町5番地3 銚子市犬若青年館前（敷地内ブロック塀前）,銚子市犬若青年館前（敷地内ブロック塀前）,35.6987813,140.8471971,
千葉県,銚子市,2-1,小畑新町8060番地の1 小畑新町営住宅南側（敷地内フェンス）,小畑新町営住宅南側（敷地内フェンス）,35.7185711,140.8589241,
千葉県,銚子市,2-2,masked,masked,35.7212606,140.8633178,
千葉県,銚子市,2-3,海鹿島町5447番地 海鹿島遊園（敷地内）,あしか島遊園（敷地内）,35.724355, 140.865173,
千葉県,銚子市,2-4,榊町5124番地 榊町市営住宅B棟東側（敷地内）,榊町市営住宅B棟東側（敷地内）,35.7251382,140.8551959,
千葉県,銚子市,2-5,榊町5023番地 稲荷神社西側（土手下）,稲荷神社西側（土手下）,35.7224852,140.8513531,
千葉県,銚子市,2-6,小畑新町7756番地 市民センター東側（敷地内）,市民センター東側（敷地内）,35.7208478,140.8566518,
千葉県,銚子市,2-7,海鹿島町5226番地の70 海鹿島町西青年館（敷地内フェンス）,海鹿島町西青年館（敷地内フェンス）,35.7245116,140.858616,
千葉県,銚子市,3-1,植松町6202番地 植松町青年館跡地（敷地内）,植松町青年館跡地（敷地内）,35.7343824,140.8531596,
千葉県,銚子市,3-2,明神町1丁目1番地 銚子市立第一中学校体育館北側（敷地内）,銚子市立第一中学校体育館北側（敷地内）,35.7349141,140.8555765,
千葉県,銚子市,3-3,明神町1丁目1番地 銚子市立第一中学校東側門脇（敷地内）,銚子市立第一中学校東側門脇（敷地内）,35.7349141,140.8555765,
千葉県,銚子市,3-4,明神町1丁目37番地 銚子市第三保育所東側（コンクリート塀）,銚子市第三保育所東側（コンクリート塀）,35.734099,140.8570045,
千葉県,銚子市,3-5,川口町2丁目6385番地の267 ボートタワー駐車場（敷地内）,ボートタワー駐車場（敷地内）,35.7409881,140.8628751,
千葉県,銚子市,3-6,masked,masked,35.7394413,140.8545948,
千葉県,銚子市,3-7,川口町1丁目2053番地 銚子市漁業協同組合第2卸売市場駐車場（ガードレール）,銚子市漁業協同組合第2卸売市場駐車場（ガードレール）,35.7420092,140.8637622,
千葉県,銚子市,4-1,後飯町6番地の19 後飯町公園内中央警察派出所西側（敷地内）,後飯町公園内中央警察派出所西側（敷地内）,35.7311109,140.8443325,
千葉県,銚子市,4-2,清水町2894番地 銚子市立清水小学校正門右側（フェンス）,銚子市立清水小学校正門右側（フェンス）,35.731443,140.847986,
千葉県,銚子市,4-3,masked,masked,35.7283783,140.8484715,
千葉県,銚子市,4-4,masked,masked,35.73001989999999,140.8502353,
千葉県,銚子市,4-5,masked,masked,35.738573,140.844982,
千葉県,銚子市,4-6,通町1895番地 根徳商店（ブロック塀）,根徳商店（ブロック塀）,35.7361689,140.8482031,
千葉県,銚子市,4-7,幸町2丁目41番地 佐野長不動産 貸家（ブロック塀）,佐野長不動産 貸家（ブロック塀）,35.7334083,140.8506636,
千葉県,銚子市,5-1,新地町1468番地の20 銚子市漁業協同組合魚市場駐車場東側(漁港区域内カードレール),銚子市漁業協同組合魚市場駐車場東側(漁港区域内カードレール),35.7345288,140.8409487,
千葉県,銚子市,5-2,和田町1番地の1 東部児童遊園南西側(フェンス),東部児童遊園南西側(フェンス),35.7342297,140.8442206,
千葉県,銚子市,5-3,陣屋町5番地の1 陣屋町公園西側バス停前(敷地内),陣屋町公園西側バス停前(敷地内),35.7303308,140.8377703,
千葉県,銚子市,5-4,前宿町1140番地 銚子市体育館西側(敷地内),銚子市体育館西側(敷地内),35.7284215,140.8434646,
千葉県,銚子市,5-5,前宿町63番地 銚子市立市立病院駐車場西側(フェンス),銚子市立市立病院駐車場西側(フェンス),35.726002,140.84382,
千葉県,銚子市,5-6,南小川町2948番地の1 川福寺南東側旧消防庫隣(敷地内),川福寺南東側旧消防庫隣(敷地内),35.7240611,140.835541,
千葉県,銚子市,5-7,南小川町943番地 千葉県立銚子高等学校体育館南側(フェンス),千葉県立銚子高等学校体育館南側(フェンス),35.723047,140.8373725,
千葉県,銚子市,6-1,新生町1丁目1番地の1 新生公園北側(敷地内),新生公園北側(敷地内),35.73473,140.8365288,
千葉県,銚子市,6-2,新生町2丁目11番地の1 中央みどり公園(敷地内),中央みどり公園(敷地内),35.7310349,140.8350968,
千葉県,銚子市,6-3,末広町3番地の1 末広町広場南側(敷地内),末広町広場南側(敷地内),35.732243,140.8304381,
千葉県,銚子市,6-4,西芝町15番地 JR銚子駅前タクシープール(植込み),JR銚子駅前タクシープール(植込み),35.732164,140.8279557,
千葉県,銚子市,6-5,東芝町8番地の5 銚子市立双葉小学校正門脇駐車場(植込み),銚子市立双葉小学校正門脇駐車場(植込み),35.7298094,140.8309755,
千葉県,銚子市,6-6,栄町4丁目1505番地 威徳寺北側(ブロック塀),威徳寺北側(ブロック塀),35.7273015,140.8281693,
千葉県,銚子市,6-7,名洗町2154番地の2 千葉交通バス停(名洗入口)脇(空地),千葉交通バス停(名洗入口)脇(空地),35.7115583,140.8365288,
千葉県,銚子市,7-1,春日町287番地 銚子市立春日小学校東側駐車場入口(フェンス),銚子市立春日小学校東側駐車場入口(フェンス),35.725196,140.822488,
千葉県,銚子市,7-2,春日町340番地の1 武末田橋東側(急地内),武末田橋東側(急地内),35.724243, 140.821335,
千葉県,銚子市,7-3,清川町4丁目6番地 清川町第一公園テニスコート西側(敷地内),清川町第一公園テニスコート西側(敷地内),35.7257882,140.8192625,
千葉県,銚子市,7-4,春日町2555番地の2 市営住宅尾永井団地 A棟南東側(敷地内),市営住宅尾永井団地 A棟南東側(敷地内),35.7236288,140.8147712,
千葉県,銚子市,7-5,春日町2102番地の3 市営住宅三崎団地児童遊園西側(敷地内),市営住宅三崎団地児童遊園西側(敷地内),35.7208451,140.8109154,
千葉県,銚子市,7-6,三崎町2丁目2136番地 三崎新田バス停脇(空地),三崎新田バス停脇(空地),35.718401,140.800628,
千葉県,銚子市,7-7,三崎町1丁目180番地 銚子市三崎町青年館前(フェンス),銚子市三崎町青年館前(フェンス),35.718848,140.8096122,
千葉県,銚子市,7-8,春日町1076番地の3 市営住宅大谷津団地児童遊園東側(敷地内),市営住宅大谷津団地児童遊園東側(敷地内),35.717953, 140.814852,
千葉県,銚子市,8-1,masked,masked,35.7242992,140.8120799,
千葉県,銚子市,8-2,春日台町9番地の3 丸池・平和公園南側(敷地内),丸池・平和公園南側(敷地内),35.7256436,140.8094427,
千葉県,銚子市,8-3,春日台町19番地の5 春日台町青年館(敷地内),春日台町青年館(敷地内),35.7269949,140.8101809,
千葉県,銚子市,8-4,masked,masked,35.723965,140.8107623,
千葉県,銚子市,8-5,春日町2689番地 市立銚子高校正門東側(敷地内),市立銚子高校正門東側(敷地内),35.7221174,140.8169014,
千葉県,銚子市,8-6,上野町194番地の2 上野町公園南側(敷地内),上野町公園南側(敷地内),35.724092,140.8023463,
千葉県,銚子市,8-7,上野町317番地 上野町第二青年館西側(敷地内),上野町第二青年館西側(敷地内),35.721018,140.8008561,
千葉県,銚子市,9-1,唐子町31番地の2 銚子市立銚子中学校 体育館入口右側(木槽),銚子市立銚子中学校 体育館入口右側(木槽),35.7324203,140.8229006,
千葉県,銚子市,9-2,三軒町17番地の1 三軒町公園北側 横断歩道の東側(フェンス),三軒町公園北側 横断歩道の東側(フェンス),35.7317167,140.8238343,
千葉県,銚子市,9-3,唐子町22番地の1 唐子町公園北側(敷地内),唐子町公園北側(敷地内),35.734426,140.8228441,
千葉県,銚子市,9-4,若宮町1番地の1 銚子市役所南側駐車場(敷地内),銚子市役所南側駐車場(敷地内),35.73464999999999,140.8267661,
千葉県,銚子市,9-5,唐子町31番地の2 銚子市立銚子中学校東側(構),銚子市立銚子中学校東側(構),35.7324203,140.8229006,
千葉県,銚子市,9-6,若宮町1番地の1 銚子市役所北側駐車場東側(敷地内),銚子市役所北側駐車場東側(敷地内),35.73464999999999,140.8267661,
千葉県,銚子市,9-7,清川町4丁目6番地の1 清川町第一公園東側(フェンス),清川町第一公園東側(フェンス),35.7257882,140.8192625,
千葉県,銚子市,10-1,本城町2丁目33番地の6 本城橋北側（フェンス前敷地内）,本城橋北側（フェンス前敷地内）,35.7366354,140.8146391,
千葉県,銚子市,10-2,本城町4丁目543番地 天御中神社東側（敷地内）,天御中神社東側（敷地内）,35.7352579,140.8066098,
千葉県,銚子市,10-3,松本町3丁目955番地 熊野神社東側（敷地内）,熊野神社東側（敷地内）,35.7361349,140.8176758,
千葉県,銚子市,10-4,本城町5丁目1496番地 銚子市水道局（フェンス前）,銚子市水道局（フェンス前）,35.730501,140.8059611,
千葉県,銚子市,10-5,本城町4丁目226番地 銚子市立本城小学校 グラウンド東側（敷地内）,銚子市立本城小学校 グラウンド東側（敷地内）,35.7337688,140.8118547,
千葉県,銚子市,10-6,松本町2丁目829番地 松本町公園 南側（フェンス）,松本町公園 南側（フェンス）,35.7317278,140.8167864,
千葉県,銚子市,10-7,本城町6丁目1376番地の1 県営住宅本城団地入口（敷地内）,県営住宅本城団地入口（敷地内）,35.7288046,140.8035452,
千葉県,銚子市,11-1,長塚町1丁目1番地の14 銚子商業高等学校海洋校舎東隣（空地）,銚子商業高等学校海洋校舎東隣（空地）,35.740222,140.807678,
千葉県,銚子市,11-2,長塚町1丁目371番地の2 椎名住宅南側（空地）,椎名住宅南側（空地）,35.7386355,140.8075878,
千葉県,銚子市,11-3,masked,masked,35.7432044,140.8016511,
千葉県,銚子市,11-4,長塚町3丁目620番地 銚子市立銚子西中学校東側（フェンス）,銚子市立銚子西中学校東側（フェンス）,35.7384768,140.8004444,
千葉県,銚子市,11-5,長塚町3丁目620番地 銚子市立銚子西中学校南側（フェンス）,銚子市立銚子西中学校南側（フェンス）,35.7384768,140.8004444,
千葉県,銚子市,11-6,長塚町3丁目653番地 銚子大洋自動車教習所北側（フェンス）,銚子大洋自動車教習所北側（フェンス）,35.7400884,140.796657,
千葉県,銚子市,11-7,長塚町4丁目1151番地の1 長塚町市営住宅入口（フェンス）,長塚町市営住宅入口（フェンス）,35.7327728,140.799661,
千葉県,銚子市,12-1,松岸町3丁目262番地の2 ＪＲ松岸駅構内西側（コンクリートフェンス）,ＪＲ松岸駅構内西側（コンクリートフェンス）,35.739537,140.7952774,
千葉県,銚子市,12-2,松岸町4丁目762番地の1 旧岩盤浴バーディー 斜め前（カーポートレール）,旧岩盤浴バーディー 斜め前（カーポートレール）,35.7388241,140.792757,
千葉県,銚子市,12-3,masked,ミヤザキステップ前（敷地内）,35.7374,140.7715421,
千葉県,銚子市,12-4,赤塚町23番地の1 赤塚町集荷倉庫（敷地内）,赤塚町集荷倉庫（敷地内）,35.7413524,140.7682945,
千葉県,銚子市,12-5,masked,masked,35.752246, 140.776340,
千葉県,銚子市,12-6,松岸町2丁目188番地の1 海上地区コミュニティセンター入口西側（ブロック塀）,海上地区コミュニティセンター入口西側（ブロック塀）,35.7438375,140.7924193,
千葉県,銚子市,12-7,masked,masked,35.748405,140.7922697,
千葉県,銚子市,12-8,垣根町17丁目168番地 銚子市立海上小学校校門前（金網フェンス）,銚子市立海上小学校校門前（金網フェンス）,35.74653199999999,140.792868,
千葉県,銚子市,13-1,芦崎町876番地の1 銚子市芦崎高齢者いこいセンター北側（ブロック塀）,銚子市芦崎高齢者いこいセンター北側（ブロック塀）,35.754275,140.7736634,
千葉県,銚子市,13-2,masked,masked,35.7491742,140.7615859,
千葉県,銚子市,13-3,masked,masked,35.7536081,140.7601966,
千葉県,銚子市,13-4,船木町140番地 銚子市立船木小学校正門北側（敷地内土手）,銚子市立船木小学校正門北側（敷地内土手）,35.7588067,140.7659164,
千葉県,銚子市,13-5,masked,masked,35.7645929,140.7631597,
千葉県,銚子市,13-6,masked,masked,35.7598795,140.7686396,
千葉県,銚子市,13-7,芦崎町148番地 西部集会所（敷地内地面）,西部集会所（敷地内地面）,35.7591919,140.7705069,
千葉県,銚子市,13-8,masked,masked,35.7577479,140.772551,
千葉県,銚子市,13-9,masked,masked,35.7463574,140.7677819,
千葉県,銚子市,14-1,野尻町61番地の1 (有)園山水産北側（コンクリート塀）,(有)園山水産北側（コンクリート塀）,35.767417,140.7599937,
千葉県,銚子市,14-2,野尻町145番地の4 ＪＲ椎柴駅西側（敷地内）,ＪＲ椎柴駅西側（敷地内）,35.7652159,140.7592489,
千葉県,銚子市,14-3,野尻町35番地の1 新宮大神山門右側（土手下道路沿い）,新宮大神山門右側（土手下道路沿い）,35.7677263,140.7581523,
千葉県,銚子市,14-4,小船町1丁目513番地 大杉神社北側防火水槽前（敷地内）,大杉神社北側防火水槽前（敷地内）,35.767537, 140.752155,
千葉県,銚子市,14-5,塚本町421番地 塚本町青年前館（敷地内北側フェンス）,塚本町青年前館（敷地内北側フェンス）,35.7718696,140.7470167,
千葉県,銚子市,14-6,野尻町1600番地 銚子スポーツタウン入口左側（歩道上）,銚子スポーツタウン入口左側（歩道上）,35.7619702,140.7484151,
千葉県,銚子市,14-7,長山町2188番地の2 旧床枝ストアー西側（生垣前）,旧床枝ストアー西側（生垣前）,35.7625262,140.71694,
千葉県,銚子市,14-8,猿田町624番地の35 ＪＲ猿田駅駐在所東側（敷地内）,ＪＲ猿田駅駐在所東側（敷地内）,35.7471853,140.7376199,
千葉県,銚子市,14-9,猿田町994番地の1 猿田地区コミュニティ広場（敷地内フェンス）,猿田地区コミュニティ広場（敷地内フェンス）,35.7453683,140.7326844,
千葉県,銚子市,15-1,森戸町616番地 (株)丸豊運輸向側（田の法面）,(株)丸豊運輸向側（田の法面）,35.7830316,140.7299919,
千葉県,銚子市,15-2,森戸町312番地の2 旧自動精米所向側（花壇）,旧自動精米所向側（花壇）,35.78686160000001,140.7251683,
千葉県,銚子市,15-3,笹本町431番地 銚子市旧笹本町青年館（空地）前（敷地内）,銚子市旧笹本町青年館（空地）前（敷地内）,35.791124,140.720409,
千葉県,銚子市,15-4,笹本町360番地 銚子市立豊里小学校正門東側（敷地内）,銚子市立豊里小学校正門東側（敷地内）,35.793718,140.718564,
千葉県,銚子市,15-5,桜井町40番地の1 桜井町青年館敷地消防庫南側（敷地内）,桜井町青年館敷地消防庫南側（敷地内）,35.7963152,140.7193778,
千葉県,銚子市,15-6,宮原町416番地 宮原町青年館向側貯水槽隣（道路上）,宮原町青年館向側貯水槽隣（道路上）,35.8051812,140.7126499,
千葉県,銚子市,15-7,masked,masked,35.800165, 140.706176,
千葉県,銚子市,15-8,masked,masked,35.7875181,140.7112181,
千葉県,銚子市,15-9,豊里台1丁目1044番地の14 豊里台緑ケ丘公園南西側（敷地内）,豊里台緑ケ丘公園南西側（敷地内）,35.78891, 140.70822,
千葉県,銚子市,16-1,三崎町3丁目30番地の2 三崎町子どもの遊び場西側（フェンス）,三崎町子どもの遊び場西側（フェンス）,35.7087074,140.7825621,
千葉県,銚子市,16-2,小浜町1753番地 銚子電鉄ぬれ煎餅駅北側（フェンス）,銚子電鉄ぬれ煎餅駅北側（フェンス）,35.7119293,140.7758705,
千葉県,銚子市,16-3,masked,masked,35.7134489,140.7688832,
千葉県,銚子市,16-4,小浜町2756番地の1 小浜町第三町内会青年館西側（フェンス）,小浜町第三町内会青年館西側（フェンス）,35.715461,140.7691267,
千葉県,銚子市,16-5,小浜町2644番地の10 細井化学工業(株)小浜工場駐車場（フェンス）,細井化学工業(株)小浜工場駐車場（フェンス）,35.721648,140.772184,
千葉県,銚子市,16-6,常世田町136番地 常世田薬師バス停東側（道路路）,常世田薬師バス停東側（道路路）,35.713568, 140.758355,
千葉県,銚子市,16-7,八木町1020番地 東光院入口左側（道路路）,東光院入口左側（道路路）,35.70821, 140.74932,
千葉県,銚子市,16-8,八木町1763番地 旧豊岡農村婦人の家東側（フェンス）,旧豊岡農村婦人の家東側（フェンス）,35.7091169,140.7452774,
千葉県,銚子市,16-9,masked,masked,35.7111238,140.7450488,
