prefecture,city,number,address,name,lat,long,note
神奈川県,川崎市,12,幸区中幸町4丁目31番地,南河原中学校南側 フェンス,35.5333046,139.6929875,
神奈川県,川崎市,13,幸区柳町42番地,柳町公園西側,35.5294094,139.689223,緯度経度は怪しい
神奈川県,川崎市,14,幸区柳町10番地,南幸町歩道橋脇駐車場 フェンス,35.531376,139.6878743,
神奈川県,川崎市,15,幸区南幸町2丁目38番地1,諏訪公園東側,35.5346757,139.6911175,
神奈川県,川崎市,16,幸区堀川町72番地1,ラゾーナ川崎プラザ 平面駐車場 西の入口脇 植込み,35.5329594,139.6959237,
神奈川県,川崎市,17,幸区堀川町72番地1,川崎駅西口郵便局前 植え込み,35.5329594,139.6959237,
神奈川県,川崎市,18,幸区南幸町1丁目11番地,南河原老人いこいの家 フェンス,35.5351953,139.6906946,
神奈川県,川崎市,19,幸区南幸町3丁目149番地2,南部学校給食センター 植込み,35.5355231,139.6861778,
神奈川県,川崎市,20,幸区南幸町3丁目62番地,masked,35.5328183,139.6871247,
神奈川県,川崎市,21,幸区南幸町3丁目126番地1,地方卸売市場南部市場　西門ブロック堀,35.5341376,139.6851555,
神奈川県,川崎市,22,幸区都町74番地2,南河原公園南側,35.5375512,139.6892929,
神奈川県,川崎市,23,幸区都町74番地2,南河原公園北側　植込み,35.5375512,139.6892929,
神奈川県,川崎市,24,幸区都町18番地,南河原小学校正門東側　フェンス,35.5367185,139.6895421,
神奈川県,川崎市,25,幸区都町74番地2,南河原公園西側　フェンス,35.5375512,139.6892929,
神奈川県,川崎市,26,幸区河原町1番地,河原町団地１２号棟北側　フェンス,35.5402347,139.6943247,
神奈川県,川崎市,27,幸区河原町1番地,河原町体育館東側　フェンス,35.5402347,139.6943247,
神奈川県,川崎市,28,幸区河原町1番地,河原町体育館北側　フェンス,35.5402347,139.6943247,
神奈川県,川崎市,29,幸区河原町1番地,河原町団地１３号棟東側　フェンス,35.5402347,139.6943247,
神奈川県,川崎市,30,幸区河原町1番地,河原町保育園　正門フェンス,35.5402347,139.6943247,
神奈川県,川崎市,31,幸区河原町1番地,河原町団地３号棟東側　フェンス,35.5402347,139.6943247,
神奈川県,川崎市,32,幸区河原町1番地,河原町団地１号棟西側　植込み,35.5402347,139.6943247,
神奈川県,川崎市,33,幸区戸手4丁目9番3号,川崎戸手４丁目駐車場　フェンス,35.5403403,139.6974493,
神奈川県,川崎市,34,幸区戸手4丁目4番2号,戸手ポンプ場　フェンス,35.5433255,139.6956848,
神奈川県,川崎市,35,幸区戸手4丁目7番,戸手多摩川公園南側　フェンス,35.5414971,139.6960832,
神奈川県,川崎市,36,幸区戸手3丁目2番1号,戸手町公園　西側フェンス (位置情報が見つかりませんでした),35.54561169999999,139.6941687,
神奈川県,川崎市,37,幸区戸手4丁目2番1号,御幸中学校　西側フェンス,35.5440372,139.6932815,
神奈川県,川崎市,38,幸区戸手4丁目2番1号,御幸中学校　北側正門　フェンス,35.5440372,139.6932815,
神奈川県,川崎市,39,幸区戸手4丁目4番3号,戸手東公園　フェンス,35.5428292,139.6954803,
神奈川県,川崎市,40,幸区遠藤町1番地,御幸小学校　東側フェンス,35.5433612,139.6919585,
神奈川県,川崎市,41,幸区小向町21番20号,masked,35.5462841,139.6964469,
神奈川県,川崎市,42,幸区小向町17番1号,小向第6公園南側,35.5470737,139.6958439,
神奈川県,川崎市,43,幸区小向仲野町15番2号先,小向仲野町緑道,35.5491299,139.6968153,
神奈川県,川崎市,44,幸区小向仲野町14番19号先,小向仲野町緑道,35.5498576,139.695445,
神奈川県,川崎市,45,幸区小向仲野町13番7号,小向第1公園東側,35.5506638,139.6958439,
神奈川県,川崎市,46,幸区小向仲野町5番2号,小向第2公園　東側フェンス (位置情報が見つかりませんでした),35.5525392,139.6964023,
神奈川県,川崎市,47,幸区小向仲野町5番1号,川崎総合科学高等学校南門東側フェンス,35.5523241,139.6958291,
神奈川県,川崎市,48,幸区神明町2丁目56番地2先,さいわい緑道,35.5367765,139.6864017,
神奈川県,川崎市,49,幸区戸手本町2丁目395番地,神明神社　ブロック塀,35.5391031,139.6875991,
神奈川県,川崎市,50,幸区戸手本町2丁目420番地,つくし保育園　西側フェンス,35.5413514,139.6864133,
神奈川県,川崎市,51,幸区戸手本町1丁目165番地,戸手小学校南側植込み,35.5423642,139.6853626,
神奈川県,川崎市,52,幸区戸手本町1丁目165番地,戸手小学校北側フェンス,35.5423642,139.6853626,
神奈川県,川崎市,53,幸区戸手本町1丁目150番地,市立幸高校　東側グランド門フェンス,35.54210370000001,139.6865469,
神奈川県,川崎市,54,幸区戸手本町2丁目434番地,市立幸高校テニスコート　南側フェンス,35.5408025,139.687873,
神奈川県,川崎市,55,幸区戸手本町1丁目11番地1,幸区役所ゆめ広場南側　植込み,35.5443698,139.6869122,
神奈川県,川崎市,56,幸区小向西町4丁目15番地,小向第3公園　南側,35.5463933,139.6898313,
神奈川県,川崎市,57,幸区小向西町4丁目30番地,西御幸小学校　北側フェンス,35.5462026,139.6886579,
神奈川県,川崎市,58,幸区小向西町4丁目81番地,小向第5公園　南側,35.5464274,139.6872798,
神奈川県,川崎市,59,幸区小向西町3丁目50番地1,小向第4公園　北側,35.5479194,139.6874279,
神奈川県,川崎市,60,幸区小向東芝町1番地,株式会社東芝　小向事業所　南側フェンス,35.5510439,139.6884031,緯度経度は怪しい
神奈川県,川崎市,61,幸区小向西町3丁目28番地,八幡神社　北側石棚,35.5475303,139.6895241,
神奈川県,川崎市,62,幸区小向西町1丁目65番地,小向第7公園　東側,35.5478263,139.6914565,
神奈川県,川崎市,63,幸区東古市場1番地,御幸公園　南東側入口フェンス,35.552601,139.6931117,
神奈川県,川崎市,64,幸区東古市場71番地,古市場ポンプ場　フェンス,35.553641,139.6901399,
神奈川県,川崎市,65,幸区東古市場83番地,東古市場第1公園　南側,35.5527844,139.6889721,
神奈川県,川崎市,66,幸区東古市場116番地,市営古市場住宅北側　植込み,35.5511842,139.6877564,
神奈川県,川崎市,67,幸区古市場1丁目45番地,古市場第2公園　南側植込み,35.5534655,139.6847564,
神奈川県,川崎市,68,幸区古市場1丁目1番地,古市場小学校正門植込み,35.5554074,139.686037,
神奈川県,川崎市,69,幸区古市場2丁目116番地,古市場第3公園　北側植込み,35.5550564,139.6815661,
神奈川県,川崎市,70,幸区古市場2丁目84番地,古市場第5公園　南側,35.5550564,139.6815661,
神奈川県,川崎市,71,幸区古市場1丁目64番地,古市場第6公園　西側植込み,35.5534655,139.6847564,緯度経度は怪しい
神奈川県,川崎市,72,幸区下平間50番地,下平間公園　北側,35.5522211,139.6788126,
神奈川県,川崎市,73,幸区下平間1番地2,鹿島田グリーンハイツ　フェンス,35.5540811,139.6754625,
神奈川県,川崎市,74,幸区下平間68番地1,下平間稲荷公園　西側フェンス,35.5528926,139.6760952,
神奈川県,川崎市,75,幸区下平間68番地1,市営下平間耐火住宅1号棟,35.5528926,139.6760952,
神奈川県,川崎市,76,幸区下平間175番地,下平間小学校　正門フェンス (位置情報が見つかりませんでした),35.5510983,139.68029,
神奈川県,川崎市,77,幸区下平間214番地1,フロール川崎下平間3番館前植込み,35.5503139,139.681287,
神奈川県,川崎市,78,幸区下平間347番地,ＮＴＴ東日本　神奈川支店横駐車場フェンス,35.5493426,139.6851614,
神奈川県,川崎市,79,幸区下平間175番地,下平間小学校校庭側フェンス (位置情報が見つかりませんでした),35.5510983,139.68029,
神奈川県,川崎市,80,幸区古川町83番地,川崎市消防局幸公会　フェンス,35.5450983,139.6828031,
神奈川県,川崎市,81,幸区塚越4丁目314番地3,塚越４丁目公園　西側フェンス,35.54065569999999,139.6829287,
神奈川県,川崎市,82,幸区塚越4丁目363番地20,塚越第３公園　北側,35.5414007,139.6799411,
神奈川県,川崎市,83,幸区塚越4丁目345番地15,塚越こかげ公園北側　フェンス,35.5420311,139.6815561,
神奈川県,川崎市,84,幸区古川町159番地4,古川町さくら公園西側　フェンス,35.5470159,139.6815661,緯度経度は怪しい
神奈川県,川崎市,85,幸区塚越2丁目207番地,塚越沼ノ上公園南側　フェンス,35.5450762,139.680523,
神奈川県,川崎市,86,幸区古川町70番地,古川小学校　グラウンド東側フェンス,35.5470159,139.6815661,
神奈川県,川崎市,87,幸区古川町70番地,古川小学校　校舎東側フェンス,35.5470159,139.6815661,
神奈川県,川崎市,88,幸区塚越1丁目60番地,塚越中学校　正門フェンス,35.5482339,139.6779723,
神奈川県,川崎市,89,幸区新塚越201,鹿島田駅周辺自転車等駐車場第２施設前　植樹帯,35.5506084,139.6764658,
神奈川県,川崎市,90,幸区塚越1丁目60番地,塚越中学校　西門体育館側フェンス,35.5482339,139.6779723,
神奈川県,川崎市,91,幸区新塚越1番地7,町田堀ふれあい公園　植込み,35.5491965,139.6769605,
神奈川県,川崎市,92,幸区塚越1丁目64番地,御嶽神社　石棚,35.54608959999999,139.6793928,
神奈川県,川崎市,93,幸区塚越3丁目406番地1,塚越３丁目さくらの公園植込み,35.5423017,139.6783572,
神奈川県,川崎市,94,幸区塚越3丁目406番地1,塚越３丁目さくらの公園フェンス,35.5423017,139.6783572,
神奈川県,川崎市,95,幸区塚越1丁目60番地,塚越第２公園　東側,35.5482339,139.6779723,
神奈川県,川崎市,96,幸区東小倉21番,（株）石橋不動産管理駐車場　フェンス,35.5436106,139.6763025,
神奈川県,川崎市,97,幸区東小倉6番30号,東小倉こども公園　フェンス,35.5452348,139.6760232,
神奈川県,川崎市,98,幸区東小倉1番1号,東小倉小学校　西側グランド入口フェンス,35.5465713,139.6751163,
神奈川県,川崎市,99,幸区小倉1番地1,パークシティサウスパーク出口　植込み,35.546896,139.6700028,緯度経度は怪しい
神奈川県,川崎市,100,幸区小倉1番地1,パークシティ東小倉小学校裏門外　植込み,35.546896,139.6700028,緯度経度は怪しい
神奈川県,川崎市,101,幸区鹿島田1丁目1-1,鹿島田駅周辺自転車等駐車場第1施設前　植樹帯,35.5504346,139.6754694,
神奈川県,川崎市,102,幸区小倉1番地1,パークシティ東三番街　北道路側植込み,35.546896,139.6700028,緯度経度は怪しい
神奈川県,川崎市,103,幸区小倉1番地1,パークシティ西三番街C棟西側ごみ置場脇　植込み,35.546896,139.6700028,緯度経度は怪しい
神奈川県,川崎市,104,幸区鹿島田3丁目20番2号,梶アパート　ブロック塀,35.557608,139.6697536,
神奈川県,川崎市,105,幸区鹿島田1丁目11番8号先,福禄不動産（有）駐車場　フェンス,35.5518113,139.6741276,
神奈川県,川崎市,106,幸区鹿島田3丁目19番51号,masked,35.557372,139.6703567,
神奈川県,川崎市,107,幸区鹿島田1丁目10番37号,鹿島田駅周辺自転車等駐車場第3施設　フェンス,35.5512977,139.6747076,
神奈川県,川崎市,108,幸区鹿島田2丁目22番44号,鹿島田幼稚園　フェンス,35.5529519,139.6718798,
神奈川県,川崎市,109,幸区鹿島田2丁目12番,二ケ領用水東側フェンス,35.556877,139.6721558,
神奈川県,川崎市,110,幸区鹿島田3丁目10番,二ケ領用水東側フェンス,35.5600704,139.6692054,
神奈川県,川崎市,111,幸区鹿島田2丁目21番,鹿島田２丁目公園　東側入口フェンス,35.5536944,139.6719166,
神奈川県,川崎市,112,幸区北加瀬3丁目1番,三菱ふそうトラック・バス（株）　駐車場フェンス,35.5568634,139.6635443,
神奈川県,川崎市,113,幸区矢上4番1号,渋川ポンプ場　フェンス,35.5553843,139.6586941,
神奈川県,川崎市,114,幸区北加瀬2丁目3番1号,日吉中学校北側　フェンス,35.5535424,139.6620719,
神奈川県,川崎市,115,幸区北加瀬2丁目3番1号,日吉中学校　グラウンド東側　フェンス,35.5535424,139.6620719,
神奈川県,川崎市,116,幸区北加瀬3丁目3番,北加瀬原町公園　西側フェンス,35.5559446,139.6625078,
神奈川県,川崎市,117,幸区北加瀬1丁目11番5号,北加瀬つつじ公園　フェンス,35.5517369,139.6654056,
神奈川県,川崎市,118,幸区新川崎4,新川崎駅周辺自転車等駐車場第5施設　フェンス,35.5442288,139.6706009,緯度経度は怪しい
神奈川県,川崎市,119,幸区北加瀬1丁目37番1号,日吉小学校　東側フェンス (位置情報が見つかりませんでした),35.54827909999999,139.668836,
神奈川県,川崎市,120,幸区北加瀬2丁目3番1号,日吉中学校　校舎東側　フェンス,35.5535424,139.6620719,
神奈川県,川崎市,121,幸区小倉1丁目4番,三井のリパーク川崎小倉1丁目第3駐車場,35.5453874,139.6692852,
神奈川県,川崎市,122,幸区小倉2丁目6番4号,小倉北住宅4号棟入口脇フェンス,35.5439531,139.667738,
神奈川県,川崎市,123,幸区小倉2丁目21番33号,masked,35.541583,139.6666513,
神奈川県,川崎市,124,幸区小倉2丁目24番2号,正蔵寺駐車場横ブロック塀,35.5409943,139.6681727,
神奈川県,川崎市,125,幸区小倉2丁目11番21号,小倉北公園　南側フェンス,35.5422347,139.668434,
神奈川県,川崎市,126,幸区小倉5丁目32番6号,小倉八雲公園北側フェンス,35.5379802,139.6640077,
神奈川県,川崎市,127,幸区小倉5丁目17番9号,小倉西公園　西側植え込み,35.5378188,139.6652087,
神奈川県,川崎市,128,幸区小倉2丁目20番1号,小倉小学校正門フェンス (位置情報が見つかりませんでした),35.5413897,139.6654977,
神奈川県,川崎市,129,幸区南加瀬3丁目12番8号,みなみかせ保育園　フェンス,35.5441153,139.664687,
神奈川県,川崎市,130,幸区南加瀬1丁目7番17号,日吉出張所正面入口植込み,35.54670249999999,139.6683323,
神奈川県,川崎市,131,幸区南加瀬3丁目4番8号,夢見ヶ崎保育園　フェンス,35.5451389,139.6648882,
神奈川県,川崎市,132,幸区南加瀬2丁目19番4号,南加瀬五反公園北側フェンス,35.5460702,139.6637013,
神奈川県,川崎市,133,幸区南加瀬2丁目13番1号,夢見ヶ崎小学校　北側フェンス,35.5475124,139.6629364,
神奈川県,川崎市,134,幸区南加瀬2丁目13番1号,夢見ヶ崎小学校　正門フェンス,35.5475124,139.6629364,
神奈川県,川崎市,135,幸区南加瀬3丁目10番1号,南加瀬中学校　正門フェンス,35.5444206,139.6634148,
神奈川県,川崎市,136,幸区南加瀬3丁目10番1号,南加瀬中学校南側　フェンス,35.5444206,139.6634148,
神奈川県,川崎市,137,幸区南加瀬4丁目24番1号,南加瀬小学校東側フェンス,35.5437058,139.6602057,
神奈川県,川崎市,138,幸区南加瀬4丁目37番,南加瀬下町公園　南側フェンス,35.5416374,139.657804,
神奈川県,川崎市,139,幸区南加瀬4丁目35番2号,南加瀬第2住宅　南側フェンス,35.5421967,139.6593219,
神奈川県,川崎市,140,幸区南加瀬4丁目24番1号,南加瀬小学校西側フェンス,35.5437058,139.6602057,
神奈川県,川崎市,141,幸区南加瀬4丁目40番22号,加瀬水処理センター 東側フェンス,35.5429721,139.6559634,
神奈川県,川崎市,142,幸区南加瀬5丁目38番3号,南加瀬辻公園 南側フェンス,35.5398735,139.6556586,
神奈川県,川崎市,143,幸区南加瀬5丁目24番17号,masked,35.5403437,139.6588155,
神奈川県,川崎市,144,幸区南加瀬5丁目5番43号,masked,35.5395984,139.6610448,
神奈川県,川崎市,145,幸区小倉4丁目8番1号,市営小倉第3住宅 南側フェンス (位置情報が見つかりませんでした),35.5381389,139.6684425,
神奈川県,川崎市,146,幸区小倉4丁目8番4号,小倉中公園 東側フェンス,35.5388895,139.6681731,
神奈川県,川崎市,147,幸区小倉4丁目12番22号,小倉下町公園 南側フェンス,35.5382982,139.6726777,
神奈川県,川崎市,148,幸区小倉4丁目17番1号,東小倉公園 西側正面ポール,35.5376817,139.6713755,
神奈川県,川崎市,149,幸区小倉4丁目21番6号,小倉かつら公園 北側フェンス,35.5373159,139.6699231,
神奈川県,川崎市,150,幸区小倉4丁目26番2号,小倉南住宅北側 プレイロットA,35.536501,139.6689715,
神奈川県,川崎市,151,幸区小倉4丁目28番3号,小倉アベリア公園北側 入口植込み,35.5355417,139.6689463,
神奈川県,川崎市,152,幸区小倉4丁目28番3号,小倉アベリア公園西側 入口フェンス,35.5355417,139.6689463,
神奈川県,川崎市,1,高津区久地4丁目25番,久地駅周辺自転車等駐車場前柵,35.6100736,139.5946976,
神奈川県,川崎市,2,高津区宇奈根637番地,宇奈根まちかど公園フェンス (位置情報が見つかりませんでした),35.613163,139.601019,
神奈川県,川崎市,3,高津区久地3丁目4番,久地梅林公園植え込み,35.6097892,139.6068037,
神奈川県,川崎市,4,高津区久地4丁目21番,駐車場フェンス,35.6100353,139.5924678,
神奈川県,川崎市,5,高津区久地4丁目2番1号,久地小学校フェンス,35.6108789,139.6006724,
神奈川県,川崎市,6,高津区久地4丁目2番1号,久地小学校フェンス,35.6108789,139.6006724,
神奈川県,川崎市,7,高津区久地3丁目16番,日本経済新聞工場前ガードレール,35.6091286,139.6040955,
神奈川県,川崎市,8,高津区久地3丁目16番,駐輪場雨水流出抑制施設フェンス,35.6091286,139.6040955,
神奈川県,川崎市,9,高津区久地1丁目5番18号,masked,35.6063796,139.6082667,
神奈川県,川崎市,10,高津区久地1丁目24番,ニヶ領用水フェンス,35.6062291,139.6070426,
神奈川県,川崎市,11,高津区久地2丁目22番,masked,35.6088687,139.6080782,
神奈川県,川崎市,12,高津区久地1丁目10番1号,西高津中学校校門フェンス,35.6074309,139.6098387,
神奈川県,川崎市,13,高津区久地2丁目2番,多摩沿線道路下植え込み,35.6103258,139.6166815,
神奈川県,川崎市,14,高津区溝口6丁目20番13号,masked,35.6086589,139.6110612,
神奈川県,川崎市,15,高津区久地1丁目21番1号,masked,35.6074176,139.6075782,
神奈川県,川崎市,16,高津区溝口6丁目2番,ライオンズマンション高津対面ガードレール,35.6096239,139.6163629,
神奈川県,川崎市,17,高津区溝口3丁目12番,ニヶ領用水大石橋際フェンス,35.6032633,139.6121407,
神奈川県,川崎市,18,高津区溝口1丁目2番,キラリデッキ２階自由通路,35.5995405,139.6112644,
神奈川県,川崎市,19,高津区溝口1丁目4番,みずほ信託銀行溝ノ口支店前鉄パイプ,35.5990347,139.6128577,
神奈川県,川崎市,20,高津区溝口4丁目19番1号,高津小学校植え込み,35.6051215,139.6139252,
神奈川県,川崎市,21,高津区溝口4丁目19番1号,高津小学校フェンス,35.6051215,139.6139252,
神奈川県,川崎市,22,高津区溝口3丁目10番8号,溝口南公園フェンス,35.6032935,139.6143346,
神奈川県,川崎市,23,高津区溝口1丁目18番,ニヶ領用水フェンス,35.6010065,139.6143713,
神奈川県,川崎市,24,高津区溝口5丁目15番2号,溝口北公園前ガードレール,35.6074993,139.6142916,
神奈川県,川崎市,25,高津区溝口5丁目13番,トナミ運輸(株)川崎支店ガードレール,35.6082692,139.6162035,
神奈川県,川崎市,26,高津区二子3丁目15番1号,高津スポーツセンター駐輪場フェンス,35.6033713,139.6222076,
神奈川県,川崎市,27,高津区二子3丁目15番1号,高津スポーツセンター西側入口フェンス,35.6033713,139.6222076,
神奈川県,川崎市,28,高津区二子6丁目12番,ナイスパークハイツ溝の口前ニヶ領用水フェンス,35.5991546,139.6224178,
神奈川県,川崎市,29,高津区二子1丁目16番1号,溝口公園フェンス,35.6073974,139.6179562,
神奈川県,川崎市,30,高津区二子5丁目15番,ニヶ領用水二子新生橋際フェンス,35.6007401,139.6192309,
神奈川県,川崎市,31,高津区二子4丁目11番1号,市営二子住宅フェンス (位置情報が見つかりませんでした),35.602486,139.6204061,
神奈川県,川崎市,32,高津区二子3丁目6番35号,二子居村公園フェンス (位置情報が見つかりませんでした),35.6048899,139.6210006,
神奈川県,川崎市,33,高津区二子1丁目4番2号,二子神社,35.6085634,139.6218022,
神奈川県,川崎市,34,高津区二子3丁目15番1号,高津スポーツセンター駐車場入口横フェンス,35.6033713,139.6222076,
神奈川県,川崎市,35,高津区諏訪3丁目1番,果樹園フェンス,35.6035552,139.6233739,
神奈川県,川崎市,36,高津区諏訪1丁目7番,個人所有駐車場フェンス,35.606086,139.6236379,
神奈川県,川崎市,37,高津区北見方2丁目6番,東高津公園フェンス,35.6007802,139.6289515,
神奈川県,川崎市,38,高津区瀬田12番,諏訪歩道橋脇フェンス,35.6061194,139.6260033,
神奈川県,川崎市,39,高津区北見方1丁目21番,ニヶ領用水フェンス,35.5989051,139.6246488,
神奈川県,川崎市,40,高津区北見方2丁目5番1号,東高津小学校フェンス (位置情報が見つかりませんでした),35.6016779,139.6275522,
神奈川県,川崎市,41,高津区北見方1丁目16番,ニヶ領用水フェンス,35.5990159,139.6275969,
神奈川県,川崎市,42,高津区北見方2丁目14番7号,白髭神社裏の柵,35.6005067,139.6303659,
神奈川県,川崎市,43,高津区北見方3丁目5番,ニヶ領用水フェンス,35.5967768,139.6309437,
神奈川県,川崎市,44,高津区下野毛3丁目9番20号,下野毛3丁目つつじ公園,35.5933599,139.6386737,
神奈川県,川崎市,45,高津区下野毛1丁目5番2号,県営リバーサイド下野毛2号棟前フェンス,35.5982791,139.6361567,
神奈川県,川崎市,46,高津区下野毛3丁目6番,日本通運㈱神奈川東支店駐車場フェンス,35.5944097,139.6377174,
神奈川県,川崎市,47,高津区下野毛3丁目7番,日本レーベル印刷㈱所有駐車場フェンス (位置情報が見つかりませんでした),35.5931339,139.6373986,
神奈川県,川崎市,48,高津区下野毛2丁目8番3号,下野毛2丁目公園フェンス (位置情報が見つかりませんでした),35.596414,139.6374733,
神奈川県,川崎市,49,高津区下野毛1丁目3番,下野毛1丁目公園フェンス,35.5974555,139.6366415,
神奈川県,川崎市,50,高津区下野毛1丁目3番2号,東高津老人いこいの家フェンス,35.5974357,139.6366891,
神奈川県,川崎市,51,高津区下作延5丁目19番1号,下作延小学校フェンス（西側）,35.602943,139.60082,
神奈川県,川崎市,52,高津区下作延5丁目19番1号,下作延小学校フェンス（南側）,35.602943,139.60082,
神奈川県,川崎市,53,高津区下作延6丁目16番,市営日向住宅植え込み,35.6055922,139.5985203,
神奈川県,川崎市,54,高津区下作延6丁目29番,下作延北ノ谷公園前ガードレール,35.608995,139.5962904,
神奈川県,川崎市,55,高津区下作延5丁目8番,市営下作延中住宅フェンス,35.59966259999999,139.6003521,
神奈川県,川崎市,56,高津区下作延6丁目6番,路川石材工業所対面個人所有駐車場フェンス,35.6038796,139.6013875,
神奈川県,川崎市,57,高津区下作延7丁目15番,津田山公園,35.6055154,139.6024229,
神奈川県,川崎市,58,高津区下作延5丁目4番,個人所有畑フェンス,35.6007646,139.6013078,
神奈川県,川崎市,59,高津区下作延4丁目1番,国道246号線高架下自転車置き場前ガードレール (位置情報が見つかりませんでした),35.6010932,139.6049717,
神奈川県,川崎市,60,高津区下作延4丁目23番1号,つり具上州屋溝口店フェンス,35.5980278,139.6037997,
神奈川県,川崎市,61,高津区下作延2丁目26番1号,恵楽園フェンス,35.5971836,139.6056144,
神奈川県,川崎市,62,高津区下作延7丁目27番,円福寺裏ガードレール,35.6045045,139.6056089,
神奈川県,川崎市,63,高津区下作延7丁目1番,国道２４６号線高架下下作延中央公園,35.6016668,139.6049717,
神奈川県,川崎市,64,高津区下作延2丁目8番1号,高津区役所前植え込み,35.5995612,139.6080924,
神奈川県,川崎市,65,高津区下作延4丁目8番,上之橋横駐車場フェンス,35.6002843,139.6025762,
神奈川県,川崎市,66,高津区下作延2丁目8番,高津区役所横ホーム駐車場脇道路フェンス,35.5992934,139.6077744,
神奈川県,川崎市,67,高津区久本1丁目3番,旧川崎看護専門学校車両置場対面道路斜面,35.5979102,139.6093526,
神奈川県,川崎市,68,高津区久本1丁目1番,田園都市線高架下ガードレール,35.5993181,139.6092076,
神奈川県,川崎市,69,高津区久本1丁目8番,市営バス市民プラザ線折り返し所自転車置場ガードレール,35.59705720000001,139.6122204,
神奈川県,川崎市,70,高津区久本3丁目6番,パークシティ溝の口プレイロット植え込み (位置情報が見つかりませんでした),35.6028333,139.6161934,緯度経度は怪しい
