prefecture,city,number,address,name,lat,long,note
神奈川県,川崎市,1,中原区小杉町2丁目295番地3,こすぎ公園広場ゾーンフェンス,35.5799588,139.6562476,
神奈川県,川崎市,2,中原区小杉町3丁目245番地,中原区役所守衛室側入口フェンス,35.5759903,139.6559525,
神奈川県,川崎市,3,中原区新丸子東3丁目1303番地,東急線武蔵小杉駅バスロータリー鉄柵,35.5744179,139.6611525,
神奈川県,川崎市,4,中原区小杉町1丁目529番地,ツリーベル武蔵小杉前鉄柵,35.5800237,139.6590098,
神奈川県,川崎市,5,中原区小杉町2丁目235番地8,小杉町2丁目公園フェンス,35.5769585,139.6557698,
神奈川県,川崎市,6,中原区小杉町3丁目245番地,中原区役所植込み,35.5759903,139.6559525,
神奈川県,川崎市,7,中原区新丸子東3丁目1135番地1,グランツリー前道路鉄柵,35.5738018,139.6606458,
神奈川県,川崎市,8,中原区新丸子東3丁目1302番地,ららテラス　武蔵小杉前道路鉄柵,35.5751645,139.6599276,
神奈川県,川崎市,9,中原区小杉町2丁目284番地,大西学園前鉄柵,35.5784559,139.6570262,
神奈川県,川崎市,10,中原区市ノ坪223番地10,市ノ坪中村通公園鉄柵,35.5700594,139.6594583,
神奈川県,川崎市,11,中原区市ノ坪54番地,市ノ坪神社鉄柵,35.57286089999999,139.6577291,
神奈川県,川崎市,12,中原区今井南町10番58号,東住吉幼稚園ブロック塀,35.5734316,139.654095,
神奈川県,川崎市,13,中原区市ノ坪124番地,市ノ坪西公園鉄柵,35.5705731,139.6585714,
神奈川県,川崎市,14,中原区今井南町2番1号,大乗院ブロック塀,35.5757546,139.6544906,
神奈川県,川崎市,15,中原区市ノ坪131番地,田辺自転車商会横道路鉄柵,35.5662575,139.6637038,緯度経度は怪しい
神奈川県,川崎市,16,中原区今井南町34番26号,今井南町四季の広場内植込み,35.5699775,139.6552993,
神奈川県,川崎市,17,中原区今井南町4番26号,渋川沿いフェンス,35.5743867,139.653005,
神奈川県,川崎市,18,中原区今井西町14番,今井西町けやき公園フェンス,35.5747626,139.6495135,
神奈川県,川崎市,19,中原区今井仲町14番14号,今井公園植込み,35.57327009999999,139.6511775,
神奈川県,川崎市,20,中原区今井仲町7番1号,今井中学校北側植込み,35.5753119,139.6503355,
神奈川県,川崎市,21,中原区今井西町3番18号,今井小学校裏門フェンス,35.5769758,139.6494636,
神奈川県,川崎市,22,中原区今井西町3番18号,今井小学校正門横フェンス,35.5769758,139.6494636,
神奈川県,川崎市,23,中原区今井仲町7番1号,今井中学校正門側植込み,35.5753119,139.6503355,
神奈川県,川崎市,24,中原区今井西町3番18号,今井小学校西側フェンス,35.5769758,139.6494636,
神奈川県,川崎市,25,中原区今井上町7番,今井上町緑道植込み,35.5776084,139.6524429,
神奈川県,川崎市,26,中原区小杉御殿町2丁目47番地,UR都市機構小杉御殿団地2号棟北側植込み,35.5787446,139.6545554,
神奈川県,川崎市,27,中原区小杉御殿町2丁目44番地,（株）GIANT前道路鉄柵,35.5776543,139.6540588,
神奈川県,川崎市,28,中原区小杉御殿町1丁目950番地,中原小学校正門横鉄柵,35.5835722,139.6509202,
神奈川県,川崎市,29,中原区小杉御殿町1丁目1010番地,小杉神社石柵,35.5839215,139.6515221,
神奈川県,川崎市,30,中原区小杉御殿町2丁目82番地9,上小田中三号橋南側鉄柵,35.5810693,139.6509682,
神奈川県,川崎市,31,中原区小杉御殿町1丁目693番地,道路鉄柵,35.5851265,139.6541392,
神奈川県,川崎市,32,中原区小杉御殿町2丁目47番地,UR都市機構小杉御殿団地1号棟横フェンス,35.5787446,139.6545554,
神奈川県,川崎市,33,中原区小杉御殿町1丁目950番地,中原小学校北側フェンス,35.5835722,139.6509202,
神奈川県,川崎市,34,中原区等々力1番,等々力緑地フィッシングコーナー北側植込み,35.5856891,139.6502088,
神奈川県,川崎市,35,中原区等々力1番,等々力緑地ふるさとの森脇植込み,35.5856891,139.6502088,
神奈川県,川崎市,36,中原区小杉陣屋町2丁目19番1号,西丸子小学校正門横鉄柵 (位置情報が見つかりませんでした),35.5873251,139.6562256,
神奈川県,川崎市,37,中原区小杉陣屋町2丁目19番1号,西丸子小学校東側鉄柵 (位置情報が見つかりませんでした),35.5873251,139.6562256,
神奈川県,川崎市,38,中原区小杉陣屋町2丁目14番1号,住宅大谷石塀,35.5865054,139.6568648,
神奈川県,川崎市,39,中原区小杉陣屋町2丁目9番,小杉陣屋町中公園,35.5847482,139.6559704,
神奈川県,川崎市,40,中原区小杉陣屋町2丁目2番22号,中原街道南側鉄柵,35.5831234,139.6564695,
神奈川県,川崎市,41,中原区小杉陣屋町1丁目33番4号,小杉陣屋町公園南側鉄柵,35.5870768,139.6576695,
神奈川県,川崎市,42,中原区小杉陣屋町1丁目33番4号,小杉陣屋町公園北西側鉄柵,35.5870768,139.6576695,
神奈川県,川崎市,43,中原区上丸子天神町77番地,住宅ブロック塀,35.5864532,139.6610827,緯度経度は怪しい
神奈川県,川崎市,44,中原区小杉陣屋町1丁目24番1号,中原中学校グラウンド側鉄柵,35.5860063,139.6595431,
神奈川県,川崎市,45,中原区小杉陣屋町1丁目32番1号,成就院ブロック塀,35.587172,139.6581628,
神奈川県,川崎市,46,中原区丸子通2丁目708番地3,丸子通公園植込み,35.5826864,139.6602986,
神奈川県,川崎市,47,中原区小杉陣屋町1丁目24番1号,中原中学校正門脇鉄柵,35.5860063,139.6595431,
神奈川県,川崎市,48,中原区小杉陣屋町1丁目11番8号,中原街道北側鉄柵,35.5833696,139.657226,
神奈川県,川崎市,49,中原区新丸子町964番地3,新丸子公園フェンス,35.5791151,139.6612837,
神奈川県,川崎市,50,中原区新丸子東2丁目980番地,京浜伏見稲荷神社石柵 (位置情報が見つかりませんでした),35.57897,139.6621385,
神奈川県,川崎市,51,中原区丸子通1丁目612番地9,綱島街道東側歩道植込み,35.5827783,139.6642841,
神奈川県,川崎市,52,中原区丸子通1丁目651番地1,綱島街道東横線側歩道植込み,35.5824232,139.6636639,
神奈川県,川崎市,53,中原区上丸子山王町1丁目1555番地,日枝神社石柵,35.5788519,139.6678307,
神奈川県,川崎市,54,中原区新丸子東2丁目890番地7,エクレール武蔵小杉前道路鉄柵,35.577837,139.6637237,
神奈川県,川崎市,55,中原区上丸子八幡町815番地,上丸子小学校西門側フェンス,35.5827213,139.667531,緯度経度は怪しい
神奈川県,川崎市,56,中原区新丸子東2丁目926番地先,綱島街道高架下道路鉄柵,35.5769533,139.6627968,
神奈川県,川崎市,57,中原区上丸子山王町2丁目1356番地,上丸子住宅D棟北側フェンス,35.5771133,139.668129,
神奈川県,川崎市,58,中原区上丸子八幡町815番地,上丸子小学校JR線路側フェンス,35.5827213,139.667531,緯度経度は怪しい
神奈川県,川崎市,59,中原区下沼部1709番地1,下沼部公園金網,35.575119,139.6670446,
神奈川県,川崎市,60,中原区下沼部1745番地,三社宮石柵,35.5739774,139.6684562,
神奈川県,川崎市,61,中原区中丸子439番地,中丸子緑道,35.5701859,139.6715184,
神奈川県,川崎市,62,中原区下沼部1955番地,下沼部小学校正門鉄柵,35.5725827,139.6694446,
神奈川県,川崎市,63,中原区下沼部1894番地2,エスペランサ武蔵小杉前道路鉄柵,35.5715406,139.6695501,
神奈川県,川崎市,64,中原区中丸子358番地,南武沿線道路沿い鉄柵 (位置情報が見つかりませんでした),35.5680866,139.6700101,
神奈川県,川崎市,65,中原区下沼部1753番地18,向河原駅前広場公園前歩道植え込み,35.5726973,139.6648915,
神奈川県,川崎市,66,中原区下沼部1955番地,下沼部小学校交番側鉄柵,35.5725827,139.6694446,
神奈川県,川崎市,67,中原区市ノ坪440番地12,市ノ坪公園フェンス,35.5655744,139.6668426,
神奈川県,川崎市,68,中原区中丸子258番地,中丸子第1公園鉄柵,35.5683785,139.6671522,
神奈川県,川崎市,69,中原区中丸子562番地,玉川中学校グラウンド脇鉄柵,35.56638420000001,139.6673017,
神奈川県,川崎市,70,中原区中丸子562番地,玉川中学校正門鉄柵,35.56638420000001,139.6673017,
神奈川県,川崎市,71,中原区中丸子301番地13,中丸子第2公園鉄柵,35.5658458,139.668418,
神奈川県,川崎市,72,中原区中丸子562番地,玉川中学校南側鉄柵,35.56638420000001,139.6673017,
神奈川県,川崎市,73,中原区市ノ坪710番地,住宅展示場前植込み,35.5627089,139.6694373,
神奈川県,川崎市,74,中原区中丸子13番地4,中丸子まるっこ公園フェンス,35.5717872,139.6628984,
神奈川県,川崎市,75,中原区北谷町95番地45,北谷町公園フェンス,35.5638145,139.6714553,
神奈川県,川崎市,76,中原区中丸子592番地12,南部沿線道路沿い鉄柵,35.5644703,139.6715378,
神奈川県,川崎市,77,中原区北谷町32番地,玉川小学校プール横鉄柵,35.5621622,139.6726518,
神奈川県,川崎市,78,中原区北谷町32番地,玉川小学校南武沿線道路側鉄柵,35.5621622,139.6726518,
神奈川県,川崎市,79,中原区中丸子719番地1,中丸子公園フェンス,35.5679896,139.6694446,緯度経度は怪しい
神奈川県,川崎市,80,中原区上平間2110番地,丸子ポンプ場鉄柵,35.5640318,139.6757829,
神奈川県,川崎市,81,中原区上平間235番地,住宅ブロック塀,35.56248,139.6745274,
神奈川県,川崎市,82,中原区上平間293番地,八幡神社石柵,35.562494,139.6751473,
神奈川県,川崎市,83,中原区上平間370番地,住宅ブロック塀,35.5618968,139.6769605,
神奈川県,川崎市,84,中原区上平間1368番地,平間中学校裏門脇フェンス,35.5595802,139.6771,緯度経度は怪しい
神奈川県,川崎市,85,中原区上平間1298番地,平間公園植込み,35.5578381,139.6774112,
神奈川県,川崎市,86,中原区上平間1402番地124,上平間公園鉄柵,35.5592895,139.6767112,
神奈川県,川崎市,87,中原区上平間1368番地,平間中学校正門脇フェンス,35.5595802,139.6771,緯度経度は怪しい
神奈川県,川崎市,88,中原区上平間433番地,住宅ブロック塀 (位置情報が見つかりませんでした),35.5600267,139.6794246,
神奈川県,川崎市,89,中原区上平間585番地,下河原小学校体育館横フェンス,35.5579936,139.6808583,
神奈川県,川崎市,90,中原区上平間1221番地,住宅ブロック塀,35.5558165,139.6775892,
神奈川県,川崎市,91,中原区上平間1152番地,県営上平間ハイム　プレイロッド花壇,35.556078,139.6785762,
神奈川県,川崎市,92,中原区上平間1480番地,平間小学校東門脇金網,35.5575977,139.6762976,
神奈川県,川崎市,93,中原区上平間1700番地305,上平間第3町会会館前ブロック塀,35.5594626,139.6738103,
神奈川県,川崎市,94,中原区上平間1700番地7,県立川崎工科高校正門横フェンス,35.5565971,139.6737902,
神奈川県,川崎市,95,中原区上平間177番地,住宅生け垣,35.5608364,139.6738182,
神奈川県,川崎市,96,中原区上平間1700番地7,県立川崎工科高校西側フェンス,35.5565971,139.6737902,
神奈川県,川崎市,97,中原区苅宿25番1号,苅宿小学校給食搬入門フェンス,35.5627622,139.6628293,
神奈川県,川崎市,98,中原区西加瀬20番,武蔵小杉特定目的会社管理フェンス,35.559491,139.6611525,
神奈川県,川崎市,99,中原区苅宿19番17号,苅宿町会館横鉄柵,35.563364,139.661883,
神奈川県,川崎市,100,中原区苅宿25番1号,苅宿小学校東門フェンス,35.5627622,139.6628293,
神奈川県,川崎市,101,中原区苅宿36番20号,苅宿市営住宅フェンス,35.5617477,139.6629782,
神奈川県,川崎市,102,中原区苅宿42番3号,中原消防署苅宿出張所フェンス,35.5597425,139.6624729,
神奈川県,川崎市,103,中原区西加瀬5番3号,西加瀬北公園フェンス,35.5624909,139.6593982,
神奈川県,川崎市,104,中原区西加瀬13番5号,八幡橋付近渋川沿いフェンス,35.5604671,139.6579176,
神奈川県,川崎市,105,中原区木月住吉町1番11号,東住吉小学校裏門フェンス,35.5694248,139.6579236,
神奈川県,川崎市,106,中原区木月住吉町27番1号,住吉中学校正門フェンス,35.5656935,139.6620992,
神奈川県,川崎市,107,中原区木月2丁目6番,元住吉駅交差点鉄柵,35.5646969,139.6558907,
神奈川県,川崎市,108,中原区木月住吉町33番1号,中原平和公園彫刻広場前植込み,35.5687865,139.6589521,
神奈川県,川崎市,109,中原区木月住吉町33番1号,中原平和公園冒険広場入り口フェンス,35.5687865,139.6589521,
神奈川県,川崎市,110,中原区木月住吉町33番1号,中原平和公園歩道橋横鉄柵,35.5687865,139.6589521,
神奈川県,川崎市,111,中原区木月住吉町24番1号,木月住吉南公園フェンス,35.5641642,139.6612865,
神奈川県,川崎市,112,中原区木月住吉町16番36号先,渋川沿いフェンス,35.5623522,139.6579606,
神奈川県,川崎市,113,中原区木月2丁目22番先,渋川沿いフェンス,35.563072,139.6568474,
神奈川県,川崎市,114,中原区木月4丁目14番4号,木月八幡公園鉄柵,35.5601831,139.655909,
神奈川県,川崎市,115,中原区木月4丁目14番6号,木月耐火市営住宅フェンス,35.5597734,139.6560479,
神奈川県,川崎市,116,中原区木月4丁目25番6号,木月下町公園鉄柵,35.5587999,139.655697,
神奈川県,川崎市,117,中原区木月4丁目49番2号,木月諏訪公園鉄柵 (位置情報が見つかりませんでした),35.5569509,139.657391,
神奈川県,川崎市,118,中原区木月4丁目53番1号,木月小学校通用門脇フェンス,35.557067,139.6547846,
神奈川県,川崎市,119,中原区木月4丁目53番1号,木月小学校体育館横鉄柵,35.557067,139.6547846,
神奈川県,川崎市,120,中原区木月4丁目35番1号,財務省木月住宅内ガードレール,35.55789360000001,139.6522548,
神奈川県,川崎市,121,中原区木月3丁目37番,高架下道路鉄柵,35.561547,139.6512671,
神奈川県,川崎市,122,中原区木月3丁目34番5号,パーク・ホームズ前道路鉄柵,35.5615347,139.6504866,
神奈川県,川崎市,123,中原区木月1丁目13番,渋川沿い鉄柵,35.5670303,139.654376,
神奈川県,川崎市,124,中原区木月祇園町17番1号,住吉小学校正門鉄柵,35.568838,139.6533659,緯度経度は怪しい
神奈川県,川崎市,125,中原区木月祇園町17番6号,住吉こども文化センター金網,35.5690668,139.6529285,緯度経度は怪しい
神奈川県,川崎市,126,中原区木月3丁目45番1号,天王森ポンプ場フェンス,35.55993309999999,139.6486372,
神奈川県,川崎市,127,中原区木月3丁目36番,元住吉駅自転車等駐輪場フェンス,35.5626337,139.6525426,
神奈川県,川崎市,128,中原区木月3丁目13番10号,木月公園植込み,35.5643508,139.6492838,
神奈川県,川崎市,129,中原区井田中ノ町29番1号,井田小学校正門脇フェンス,35.5637117,139.6453387,
神奈川県,川崎市,130,中原区井田2丁目27番,井田病院前道路鉄柵,35.5600597,139.6404271,
神奈川県,川崎市,131,中原区井田中ノ町29番1号,井田小学校南門脇フェンス,35.5637117,139.6453387,
神奈川県,川崎市,132,中原区井田1丁目33番,尻手黒川道路ライフ前道路鉄柵,35.5645022,139.6413038,
神奈川県,川崎市,133,中原区井田1丁目28番1号,井田公園北西側フェンス,35.5624395,139.6420518,
神奈川県,川崎市,134,中原区井田1丁目35番1号,江川ポンプ場フェンス,35.5645155,139.6401665,
神奈川県,川崎市,135,中原区井田3丁目40番26号,井田こもれび公園植込み,35.561618,139.6341312,
神奈川県,川崎市,136,中原区井田中ノ町35番17号,住吉西公園西側植込み,35.5648104,139.6478025,
神奈川県,川崎市,137,中原区井田中ノ町13番23号,井田神社裏石柱,35.5667316,139.6428779,
神奈川県,川崎市,138,中原区木月大町1番24号,木月大町公園フェンス,35.5722614,139.647447,
神奈川県,川崎市,139,中原区木月祇園町16番10号,海上幕僚監部元住吉宿舎公園フェンス,35.5679273,139.6524134,緯度経度は怪しい
神奈川県,川崎市,140,中原区木月大町6番,渋川沿いフェンス,35.5714648,139.6509483,
神奈川県,川崎市,141,中原区木月大町10番,渋川沿いフェンス,35.5697301,139.652702,
神奈川県,川崎市,142,中原区木月祇園町2番2号,川崎市国際交流センター駐車場植込み,35.5683102,139.6485999,緯度経度は怪しい
神奈川県,川崎市,143,中原区木月祇園町2番2号,川崎市国際交流センター植込み,35.5683102,139.6485999,緯度経度は怪しい
神奈川県,川崎市,144,中原区木月祇園町2番2号,川崎市国際交流センター植込み,35.5683102,139.6485999,緯度経度は怪しい
神奈川県,川崎市,145,中原区木月大町4番,道路鉄柵,35.571685,139.649354,
神奈川県,川崎市,146,中原区下新城1丁目14番1号,県立新城高等学校テニスコート側フェンス,35.5802828,139.6316153,
神奈川県,川崎市,147,中原区下新城3丁目1番31号,下新城まちかど公園フェンス,35.5817328,139.6311229,
神奈川県,川崎市,148,中原区下新城1丁目15番1号,新城小学校正門脇フェンス,35.581641,139.632307,
神奈川県,川崎市,149,中原区下新城1丁目15番1号,新城小学校東門脇フェンス,35.581641,139.632307,
神奈川県,川崎市,150,中原区下新城1丁目2番4号,新城こども文化センターフェンス,35.5803121,139.634174,
神奈川県,川崎市,151,中原区新城中町4番14号,新城神社石柵,35.5843153,139.633411,
神奈川県,川崎市,152,中原区新城3丁目14番1号,新城公園フェンス,35.5843042,139.629699,
神奈川県,川崎市,153,中原区新城3丁目2番,新城駅南口駅前植込み,35.5864546,139.6300671,
神奈川県,川崎市,154,中原区下新城1丁目14番1号,県立新城高等学校東側フェンス,35.5802828,139.6316153,
神奈川県,川崎市,155,中原区宮内3丁目24番15号,（株）コマツ宮内寮フェンス,35.59259660000001,139.6459157,
神奈川県,川崎市,156,中原区宮内4丁目19番,住宅ブロック塀,35.5881773,139.6450498,
神奈川県,川崎市,157,中原区宮内4丁目22番1号,宮内公園鉄柵,35.5891625,139.643107,
神奈川県,川崎市,158,中原区宮内4丁目9番4号,宮内春日公園フェンス,35.5851491,139.6453686,
神奈川県,川崎市,159,中原区宮内1丁目21番31号,中部下水道事務所鉄柵,35.5921421,139.6389648,
神奈川県,川崎市,160,中原区宮内2丁目9番28号,住宅ブロック塀,35.5894226,139.6412618,
神奈川県,川崎市,161,中原区宮内2丁目4番1号,宮内小学校正門万年塀,35.5889525,139.6418905,
神奈川県,川崎市,162,中原区宮内4丁目2番,等々力緑地正面広場石垣,35.584453,139.6479193,
神奈川県,川崎市,163,中原区宮内4丁目13番1号,宮内中学校正門脇鉄柵,35.5851928,139.6460013,
神奈川県,川崎市,164,中原区上小田中1丁目2番40号,上小田中北公園フェンス,35.5908361,139.6348229,
神奈川県,川崎市,165,中原区上小田中1丁目11番40号,グランドール前ガードレール,35.5938435,139.6316651,
神奈川県,川崎市,166,中原区上新城1丁目13番,上新城ふれあい公園フェンス,35.591942,139.6285531,
神奈川県,川崎市,167,中原区上新城1丁目3番17号,住宅ブロック塀,35.5897258,139.6296188,
神奈川県,川崎市,168,中原区上小田中3丁目29番19号,上小田中西公園鉄柵,35.5895374,139.630711,
神奈川県,川崎市,169,中原区上小田中1丁目27番1号,大谷戸小学校東側フェンス,35.5912825,139.6322892,
神奈川県,川崎市,170,中原区上小田中3丁目29番19号,上小田中西公園鉄柵,35.5895374,139.630711,
神奈川県,川崎市,171,中原区上小田中1丁目27番1号,大谷戸小学校正門脇フェンス,35.5912825,139.6322892,
神奈川県,川崎市,172,中原区上小田中2丁目10番,上小田中第五公園,35.5903561,139.6354859,
神奈川県,川崎市,173,中原区上小田中3丁目10番5号,市立ろう学校グラウンド脇フェンス,35.5853505,139.637864,
神奈川県,川崎市,174,中原区上小田中3丁目21番7号,住宅フェンス,35.5863666,139.6338201,
神奈川県,川崎市,175,中原区上小田中3丁目7番1号,中原消防署小田中出張所,35.5840427,139.6368287,
神奈川県,川崎市,176,中原区上小田中3丁目10番5号,市立ろう学校正門脇万年塀,35.5853505,139.637864,
神奈川県,川崎市,177,中原区上小田中2丁目24番1号,大戸こども文化センター金網,35.5867701,139.6372424,
神奈川県,川崎市,178,中原区上小田中2丁目14番40号,住宅ブロック塀,35.5897754,139.6357155,
神奈川県,川崎市,179,中原区上小田中3丁目3番,上小田中高架下公園南武線沿側フェンス,35.5843507,139.6354461,
神奈川県,川崎市,180,中原区上小田中2丁目13番12号,市営上小田中住宅植込み,35.58897779999999,139.6371253,
神奈川県,川崎市,181,中原区上小田中4丁目1番1号,（株）ケアネット植込み,35.5825539,139.6422613,緯度経度は怪しい
神奈川県,川崎市,182,中原区上小田中6丁目43番1号,神明神社ブロック塀,35.5836182,139.6432565,
神奈川県,川崎市,183,中原区上小田中6丁目33番,上小田中耐火市営住宅４号棟南側鉄柵,35.5837449,139.644731,
神奈川県,川崎市,184,中原区上小田中6丁目33番,上小田中耐火市営住宅２号棟西側鉄柵,35.5837449,139.644731,
神奈川県,川崎市,185,中原区上小田中4丁目2番,武蔵中原駅前道路鉄柵,35.5814494,139.640985,
神奈川県,川崎市,186,中原区上小田中6丁目27番,駐車場フェンス,35.581199,139.645949,
神奈川県,川崎市,187,中原区上小田中4丁目1番,富士通（株）前道路鉄柵,35.5838274,139.6422602,
神奈川県,川崎市,188,中原区下小田中1丁目4番1号,大戸小学校西門脇フェンス,35.5805695,139.6387326,
神奈川県,川崎市,189,中原区上小田中5丁目13番,ＪＲ・鎌倉車両センター中原支所事務所前フェンス,35.5839157,139.6351672,
神奈川県,川崎市,190,中原区下小田中1丁目4番1号,大戸小学校正門脇フェンス,35.5805695,139.6387326,
神奈川県,川崎市,191,中原区下小田中1丁目20番7号,ヴィラ鹿島前道路鉄柵,35.579147,139.6379304,
神奈川県,川崎市,192,中原区下小田中1丁目2番6号,駐車場フェンス,35.5803298,139.6402079,
神奈川県,川崎市,193,中原区上小田中5丁目4番4号,上小田中南公園北側フェンス,35.5820416,139.6383549,
神奈川県,川崎市,194,中原区上小田中5丁目2番2号,歩道植込み,35.5805211,139.6411801,
神奈川県,川崎市,195,中原区下小田中1丁目17番3号,住宅ブロック塀,35.5790549,139.6357772,
神奈川県,川崎市,196,中原区下小田中4丁目4番17号,下小田中保育園フェンス,35.5774777,139.6389955,
神奈川県,川崎市,197,中原区下小田中2丁目9番1号,中原区役所道路公園センター東門脇鉄柵,35.5778087,139.6407822,
神奈川県,川崎市,198,中原区下小田中2丁目9番1号,中原区役所道路公園センター西門脇鉄柵,35.5778087,139.6407822,
神奈川県,川崎市,199,中原区下小田中4丁目20番28号,武蔵中原ガーデンハウス前道路鉄柵,35.57524370000001,139.6368826,
神奈川県,川崎市,200,中原区下小田中2丁目17番1号,西中原中学校裏門脇鉄柵,35.5790747,139.6439887,
神奈川県,川崎市,201,中原区上小田中7丁目20番5号,泉澤寺石柵,35.5824196,139.6495533,
神奈川県,川崎市,202,中原区下小田中2丁目33番12号,住宅ブロック塀,35.5757562,139.6407282,
神奈川県,川崎市,203,中原区下小田中4丁目15番17号,菜園前フェンス,35.575942,139.6381237,
神奈川県,川崎市,204,中原区下小田中2丁目17番,下小田中北島公園フェンス,35.5779874,139.6436151,
神奈川県,川崎市,205,中原区下小田中3丁目9番10号,駐車場ブロック塀,35.5742656,139.6451096,
神奈川県,川崎市,206,中原区下小田中3丁目31番1号,フェニックスコート前道路鉄柵,35.5729299,139.6399653,
神奈川県,川崎市,207,中原区下小田中3丁目35番1号,下小田中小学校正門脇フェンス,35.5714654,139.6405765,
神奈川県,川崎市,208,中原区下小田中3丁目35番1号,下小田中小学校体育館側フェンス,35.5714654,139.6405765,
神奈川県,川崎市,209,中原区下小田中6丁目20番27号,菜園前フェンス,35.5718218,139.6365778,
神奈川県,川崎市,210,中原区下小田中5丁目13番8号,住宅ブロック塀,35.5732815,139.6343694,
神奈川県,川崎市,211,中原区下小田中5丁目3番,コート朝比奈壱番館前鉄柵,35.5762293,139.6338921,
神奈川県,川崎市,212,中原区下小田中3丁目29番,アスク下小田中保育園前道路鉄柵,35.5720464,139.642579,
神奈川県,川崎市,213,中原区下小田中5丁目1番,道路鉄柵,35.5764552,139.6351672,
神奈川県,川崎市,214,中原区井田杉山町14番8号,菜園前フェンス,35.569476,139.6416483,
神奈川県,川崎市,215,中原区井田三舞町8番,歩道植込み,35.5702382,139.6473613,
神奈川県,川崎市,216,中原区井田杉山町11番1号,井田中学校裏門脇植込み,35.5692729,139.6435201,
