prefecture,city,number,address,name,lat,long,note
神奈川県,川崎市,24,川崎区中島3丁目3番1号,市立川崎高等学校北側フェンス (位置情報が見つかりませんでした),35.5279347,139.7143344,
神奈川県,川崎市,25,川崎区小川町5番地13,まいばすけっと川崎チネチッタ通り店前歩道植込み,35.527932,139.6968727,
神奈川県,川崎市,26,川崎区南町6番地1,南町公園北側フェンス,35.5262329,139.6991657,
神奈川県,川崎市,27,川崎区日進町34番地4,八丁畷駅駅前駐輪場第1施設,35.5227066,139.6928684,
神奈川県,川崎市,28,川崎区元木2丁目6番18号,日輸工業(株)京浜支店ブロック塀,35.5223581,139.6971151,
神奈川県,川崎市,29,川崎区日進町20番地1,川崎小学校正門右側フェンス,35.5247152,139.6951426,
神奈川県,川崎市,30,川崎区日進町20番地1,川崎小学校西側フェンス,35.5247152,139.6951426,
神奈川県,川崎市,31,川崎区日進町8番地14,上並木公園南東側植込み,35.5258902,139.6938549,
神奈川県,川崎市,32,川崎区南町9番地13,ローソン川崎南町店前歩道植込み,35.5250937,139.6966726,
神奈川県,川崎市,33,川崎区日進町23番地,日進町中央公園北西側フェンス,35.5230514,139.6947535,
神奈川県,川崎市,34,川崎区下並木30番地2,川崎サイトシティ公開空地前ガードレール,35.5232414,139.6910286,
神奈川県,川崎市,35,川崎区池田1丁目13番,池田町公園西側フェンス,35.52231039999999,139.6919351,
神奈川県,川崎市,36,川崎区下並木50番地,川崎中学校正門右側フェンス,35.522689,139.6894728,
神奈川県,川崎市,37,川崎区下並木50番地,川崎中学校北側フェンス,35.522689,139.6894728,
神奈川県,川崎市,38,川崎区池田1丁目5番1,池田西公園東側フェンス,35.521018,139.6897347,
神奈川県,川崎市,39,川崎区池田1丁目9番12号,エース池田前ガードレール,35.52147679999999,139.6913485,
神奈川県,川崎市,40,川崎区堤根37番地,昭和薬品工業(株)入口左側コンクリート塀,35.5257859,139.6912671,
神奈川県,川崎市,41,川崎区池田2丁目6番18号,masked,35.5213121,139.6923866,
神奈川県,川崎市,42,川崎区京町1丁目1番4号,京町小学校北側フェンス,35.5190552,139.6923115,
神奈川県,川崎市,43,川崎区京町1丁目1番4号,京町小学校東側フェンス,35.5190552,139.6923115,
神奈川県,川崎市,44,川崎区京町1丁目12番,京町第3公園南側フェンス,35.5178104,139.6928923,
神奈川県,川崎市,45,川崎区渡田山王町22番6号,県立川崎高等学校南側左端植込み,35.5172795,139.6971203,
神奈川県,川崎市,46,川崎区渡田山王町22番6号,県立川崎高等学校正門左側フェンス,35.5172795,139.6971203,
神奈川県,川崎市,47,川崎区渡田山王町25番,渡田山王町第2公園西側フェンス,35.5176876,139.6983169,
神奈川県,川崎市,48,川崎区渡田山王町13番,渡田山王町公園北側植込み,35.5191869,139.6970405,
神奈川県,川崎市,49,川崎区渡田新町1丁目5番,渡田新町公園北側植込み左端,35.5225405,139.6989552,
神奈川県,川崎市,50,川崎区渡田新町1丁目5番,渡田新町公園西側植込み中央,35.5225405,139.6989552,
神奈川県,川崎市,51,川崎区渡田新町3丁目4番,新町児童公園北側鉄柵,35.5200707,139.6981474,
神奈川県,川崎市,52,川崎区渡田新町3丁目15番1号,新町小学校東側フェンス,35.5181802,139.700732,
神奈川県,川崎市,53,川崎区渡田新町3丁目15番1号,新町小学校北側フェンス,35.5181802,139.700732,
神奈川県,川崎市,54,川崎区渡田3丁目6番,向町公園南側植込み中央,35.52028680000001,139.7046197,
神奈川県,川崎市,55,川崎区渡田4丁目5番,新町小学校入口交差点付近緑地帯植込み,35.518202,139.7024655,
神奈川県,川崎市,56,川崎区渡田4丁目12番,天飛公園西側フェンス,35.5173423,139.7053377,
神奈川県,川崎市,57,川崎区渡田向町11番1号,渡田中学校正門右側フェンス,35.5206393,139.7018747,
神奈川県,川崎市,58,川崎区渡田向町11番1号,渡田中学校南門左側フェンス,35.5206393,139.7018747,
神奈川県,川崎市,59,川崎区渡田向町8番16号,㈱昭和電機製作所ブロック塀,35.5231213,139.7029076,
神奈川県,川崎市,60,川崎区貝塚1丁目8番,貝塚公園南側石柵 (位置情報が見つかりませんでした),35.5241389,139.7015081,
神奈川県,川崎市,61,川崎区貝塚2丁目17番,渡田第２公園北側鉄柵,35.5237914,139.7056569,
神奈川県,川崎市,62,川崎区渡田向町11番1号,渡田中学校北門右側フェンス,35.5206393,139.7018747,
神奈川県,川崎市,63,川崎区貝塚2丁目2番4号,晴レル家前歩道植込み,35.5250642,139.7057665,
神奈川県,川崎市,64,川崎区渡田向町24番6号,ファミールカテナ前ガードレール,35.5223131,139.7048749,
神奈川県,川崎市,65,川崎区渡田1丁目15番5号,渡田こども文化センター入口左側フェンス,35.522839,139.7086823,
神奈川県,川崎市,66,川崎区渡田東町3番10号,masked,35.51900699999999,139.7070009,
神奈川県,川崎市,67,川崎区渡田東町5番,渡田第１公園南側石柵,35.5178783,139.7068537,
神奈川県,川崎市,68,川崎区大島上町10番11号,masked,35.5198129,139.7084803,
神奈川県,川崎市,69,川崎区渡田1丁目20番1号,田島小学校西側フェンス,35.5220516,139.7083083,
神奈川県,川崎市,70,川崎区渡田1丁目20番1号,田島小学校東側フェンス,35.5220516,139.7083083,
神奈川県,川崎市,71,川崎区大島上町6番,田島公園南側石柵,35.521145,139.709806,
神奈川県,川崎市,72,川崎区大島上町22番12号,川崎ベアーズ前歩道植込み,35.5192463,139.7101736,
神奈川県,川崎市,73,川崎区大島2丁目9番,大島第４公園東側フェンス,35.5214681,139.7149129,
神奈川県,川崎市,74,川崎区大島2丁目1番,セレモニア川崎会堂立体駐車場前歩道植込み,35.5220334,139.712918,
神奈川県,川崎市,75,川崎区大島1丁目25番10号,道路公園センター入口左側フェンス (位置情報が見つかりませんでした),35.5261165,139.7131025,
神奈川県,川崎市,76,川崎区大島4丁目5番2号,リブレ川崎前歩道植込み,35.5256995,139.7137758,
神奈川県,川崎市,77,川崎区大島4丁目17番1号,向小学校南側右フェンス,35.5242732,139.7153651,
神奈川県,川崎市,78,川崎区大島4丁目17番1号,向小学校西側フェンス,35.5242732,139.7153651,
神奈川県,川崎市,79,川崎区大島1丁目28番15号,ガスト川崎大島店前歩道植込み,35.5237886,139.7128817,
神奈川県,川崎市,80,川崎区大島5丁目9番,大島第１公園東側植込み,35.5246939,139.7165089,
神奈川県,川崎市,81,川崎区大島5丁目25番1号,東大島小学校南側フェンス,35.5236597,139.7199106,
神奈川県,川崎市,82,川崎区大島5丁目25番1号,東大島小学校西側フェンス,35.5236597,139.7199106,
神奈川県,川崎市,83,川崎区大島3丁目33番3号,和泉荘前歩道植込み,35.5205356,139.7198008,
神奈川県,川崎市,84,川崎区大島3丁目31番,大島第３公園東側フェンス,35.5211597,139.7189828,
神奈川県,川崎市,85,川崎区大島3丁目16番13号,川崎信用金庫大島支店南側ガードレール (位置情報が見つかりませんでした),35.5192665,139.7171895,
神奈川県,川崎市,86,川崎区大島5丁目23番,大島第２公園南側石柵,35.5228041,139.7191424,
神奈川県,川崎市,87,川崎区京町2丁目9番2号,コスモ川崎京町前ガードレール,35.5158936,139.6957242,
神奈川県,川崎市,88,川崎区小田1丁目22番,小田一丁目中央公園北側フェンス,35.5159094,139.7001518,
神奈川県,川崎市,89,川崎区小田2丁目14番7号,日枝大神社北側石柵,35.5145943,139.7005534,
神奈川県,川崎市,90,川崎区小田2丁目8番9号,masked,35.5139492,139.6981855,
神奈川県,川崎市,91,川崎区小田2丁目4番19号,安楽亭前ガードレール,35.5138196,139.6970006,
神奈川県,川崎市,92,川崎区京町2丁目24番8号,京町雨水滞水池管理棟北側フェンス,35.5127968,139.6958378,
神奈川県,川崎市,93,川崎区小田2丁目21番7号,田島中学校東側フェンス,35.51268410000001,139.698248,
神奈川県,川崎市,94,川崎区小田2丁目21番7号,田島中学校北側フェンス,35.51268410000001,139.698248,
神奈川県,川崎市,95,川崎区小田5丁目11番20号,東小田小学校西側フェンス,35.513108,139.7066243,
神奈川県,川崎市,96,川崎区小田5丁目14番1号,東小田保育園北側フェンス,35.5115742,139.7069193,
神奈川県,川崎市,97,川崎区小田7丁目3番1号,川崎市南部防災センター西側植込み,35.509372,139.7103198,
神奈川県,川崎市,98,川崎区小田6丁目11番4号,masked,35.509877,139.7056131,
神奈川県,川崎市,99,川崎区小田5丁目25番8号,小田双葉幼稚園東側ブロック塀,35.5099717,139.7040169,
神奈川県,川崎市,100,川崎区小田5丁目13番,東小田公園東側石柵,35.5118125,139.707492,
神奈川県,川崎市,101,川崎区小田7丁目2番,小田7丁目公園西側フェンス,35.5085162,139.7080506,
神奈川県,川崎市,102,川崎区京町3丁目10番1号,京町ももたろう公園南側フェンス,35.5098798,139.6968539,
神奈川県,川崎市,103,川崎区小田4丁目20番,小田公園北側フェンス,35.5104248,139.6984765,
神奈川県,川崎市,104,川崎区小田3丁目17番15号,又村商店（燃料）ブロック塀,35.5123521,139.7027021,
神奈川県,川崎市,105,川崎区小田4丁目12番24号,小田小学校東側植込み (位置情報が見つかりませんでした),35.5113768,139.7022919,
神奈川県,川崎市,106,川崎区小田4丁目12番24号,小田小学校西側植込み (位置情報が見つかりませんでした),35.5113768,139.7022919,
神奈川県,川崎市,107,川崎区小田4丁目20番,小田公園南側フェンス,35.5104248,139.6984765,
神奈川県,川崎市,108,川崎区小田4丁目20番,小田公園西側入口右側植込み,35.5104248,139.6984765,
神奈川県,川崎市,109,川崎区京町3丁目12番1号,京町耐火B市営住宅東側フェンス,35.5102189,139.6976012,
神奈川県,川崎市,110,川崎区浅田4丁目13番,浅田町公園西側植込み,35.5040958,139.6993541,
神奈川県,川崎市,111,川崎区浅田3丁目1番,ライフ京町店前交差点ガードレール,35.5088358,139.6989252,
神奈川県,川崎市,112,川崎区浅田3丁目15番17号,浅田市営住宅東側フェンス左端,35.5061771,139.6986098,
神奈川県,川崎市,113,川崎区浅田4丁目6番,浅田なかよし公園南側フェンス,35.5051036,139.7022262,
神奈川県,川崎市,114,川崎区浅田3丁目19番1号,ローソン川崎浅田三丁目店裏側フェンス,35.5061104,139.7010131,
神奈川県,川崎市,115,川崎区浅田2丁目11番21号,浅田小学校南側フェンス,35.5070958,139.7029841,
神奈川県,川崎市,116,川崎区浅田3丁目10番11号,アンシャンテ西側ガードレール,35.5074148,139.7002047,
神奈川県,川崎市,117,川崎区浅田3丁目7番10号,浅田こども文化センター正面フェンス,35.5085231,139.7009895,
神奈川県,川崎市,118,川崎区浅田1丁目8番11号,エンゼルハイム川崎第3前植込み,35.5064354,139.7054554,
神奈川県,川崎市,119,川崎区小田栄1丁目1番,masked,35.5169247,139.7021464,
神奈川県,川崎市,120,川崎区田島町20番23号,田島こども文化センター正面フェンス,35.5156808,139.7115415,
神奈川県,川崎市,121,川崎区小田栄1丁目14番10号,masked,35.5164015,139.7066998,
神奈川県,川崎市,122,川崎区小田栄2丁目2番,田島町歩道橋下ガードレール,35.51479339999999,139.7096374,
神奈川県,川崎市,123,川崎区田島町14番1号,渡田小学校西側フェンス,35.51576110000001,139.709589,
神奈川県,川崎市,124,川崎区田島町3番3号,田島市営住宅北側フェンス,35.5177392,139.7115914,
神奈川県,川崎市,125,川崎区田島町15番,田島ふれあい公園西側植込み,35.5165161,139.7104443,
神奈川県,川崎市,126,川崎区小田栄2丁目1番,小田栄２丁目公園入口右側植込み,35.514419,139.710644,
神奈川県,川崎市,127,川崎区鋼管通2丁目17番1号,鋼管通第１公園北側植込み,35.5152826,139.7157907,
神奈川県,川崎市,128,川崎区浜町2丁目19番18号,masked,35.51385,139.7185886,
神奈川県,川崎市,129,川崎区浜町2丁目16番1号,浜町第３公園東側植込み,35.5138707,139.7174666,
神奈川県,川崎市,130,川崎区鋼管通1丁目8番,東渡田第二公園北側植込み,35.5186167,139.7122796,
神奈川県,川崎市,131,川崎区鋼管通4丁目5番1号,鋼管通三丁目バス停脇ガードレール,35.5135693,139.7127484,
神奈川県,川崎市,132,川崎区鋼管通3丁目12番,姥ヶ森公園西側植込み (位置情報が見つかりませんでした),35.5142192,139.713317,
神奈川県,川崎市,133,川崎区浜町2丁目11番22号,臨港中学校西側バス停前フェンス,35.5144021,139.7158682,
神奈川県,川崎市,134,川崎区浜町2丁目11番22号,臨港中学校北側フェンス,35.5144021,139.7158682,
神奈川県,川崎市,135,川崎区浜町1丁目5番1号,大島小学校西側フェンス,35.5172595,139.7168483,
神奈川県,川崎市,136,川崎区浜町1丁目5番1号,大島小学校北側ブロック塀,35.5172595,139.7168483,
神奈川県,川崎市,137,川崎区浜町1丁目18番3号,曹洞宗観音寺東側フェンス,35.5153275,139.7179315,
神奈川県,川崎市,138,川崎区浜町4丁目13番,東天閣駐車場入口右側ブロック塀,35.5166276,139.7220155,
神奈川県,川崎市,139,川崎区追分町7番,大島第５公園東側鉄柵,35.5192973,139.7152321,
神奈川県,川崎市,140,川崎区扇町10番5号,川崎荷役Ｎ－１倉庫前歩道ガードレール,35.4999566,139.7218464,
神奈川県,川崎市,141,川崎区浜町4丁目3番,浜川崎公園南側鉄柵,35.5151184,139.7212972,
神奈川県,川崎市,142,川崎区浜町4丁目17番11号,大島ポンプ場北側万年塀,35.5167948,139.723098,
神奈川県,川崎市,143,川崎区桜本1丁目2番,桜川緑地前歩道ガードレール,35.5187579,139.7203395,
神奈川県,川崎市,144,川崎区桜本1丁目16番,桜川公園北側フェンス,35.5192473,139.7242502,
神奈川県,川崎市,145,川崎区桜本1丁目14番,桜川公園南側入口左側鉄柵,35.5181052,139.7233723,
神奈川県,川崎市,146,川崎区池上町9番,産業道路桜橋架道橋植込み,35.5178029,139.7251281,
神奈川県,川崎市,147,川崎区桜本2丁目39番1号,桜本市営住宅北側フェンス,35.5219368,139.7265579,
神奈川県,川崎市,148,川崎区桜本1丁目9番15号,さくら小学校北門植込み,35.520454,139.7232725,
神奈川県,川崎市,149,川崎区桜本1丁目9番15号,さくら小学校西側フェンス,35.520454,139.7232725,
神奈川県,川崎市,150,川崎区桜本1丁目9番15号,さくら小学校東側フェンス,35.520454,139.7232725,
神奈川県,川崎市,151,川崎区藤崎3丁目2番1号,藤崎小学校正門左側フェンス,35.5255273,139.7255571,
神奈川県,川崎市,152,川崎区観音1丁目10番,観音町第2公園北側フェンス,35.5259457,139.7260859,
神奈川県,川崎市,153,川崎区観音1丁目2番7号,masked,35.5288622,139.7248695,
神奈川県,川崎市,154,川崎区観音1丁目16番15号,masked,35.5283674,139.727782,
神奈川県,川崎市,155,川崎区観音2丁目22番10号,masked,35.5291534,139.7307962,
神奈川県,川崎市,156,川崎区観音2丁目5番22号,masked,35.5276983,139.7283432,
神奈川県,川崎市,157,川崎区観音2丁目16番,観音町公園南側石柵,35.5260458,139.7293694,
神奈川県,川崎市,158,川崎区池上新町1丁目2番11-1号,masked,35.5241715,139.7273729,
神奈川県,川崎市,159,川崎区池上新町2丁目23番,冥加公園東側フェンス,35.5252864,139.7314337,
神奈川県,川崎市,160,川崎区池上新町2丁目17番21号,masked,35.5227325,139.7306854,
神奈川県,川崎市,161,川崎区池上新町2丁目13番5号,masked,35.5245379,139.7294083,
神奈川県,川崎市,162,川崎区池上新町2丁目23番,冥加公園北側ガードレール,35.5252864,139.7314337,
神奈川県,川崎市,163,川崎区池上新町1丁目4番,中留公園西側植込み,35.5229774,139.7280015,
神奈川県,川崎市,164,川崎区池上新町1丁目2番4号,桜本中学校西門コンクリート塀右端,35.5231958,139.7276723,
神奈川県,川崎市,165,川崎区藤崎2丁目11番,藤崎けやき公園南側フェンス,35.5261013,139.7200203,
神奈川県,川崎市,166,川崎区藤崎3丁目2番1号,藤崎小学校西側フェンス,35.5255273,139.7255571,
神奈川県,川崎市,167,川崎区藤崎2丁目19番1号,川中島中学校東側フェンス,35.5269968,139.7222549,
神奈川県,川崎市,168,川崎区藤崎2丁目6番,藤崎第三公園北側植込み,35.5277288,139.7190626,
神奈川県,川崎市,169,川崎区藤崎4丁目2番,藤崎第４公園南側植込み,35.5243772,139.7200203,
神奈川県,川崎市,170,川崎区藤崎2丁目19番1号,川中島中学校西側フェンス,35.5269968,139.7222549,
神奈川県,川崎市,171,川崎区藤崎3丁目7番1号,臨港消防署藤崎出張所西側フェンス,35.5292284,139.7232526,
神奈川県,川崎市,172,川崎区藤崎1丁目7番1号,藤崎保育園南側フェンス,35.5306601,139.7191624,
神奈川県,川崎市,173,川崎区伊勢町12番,伊勢町第一公園西側植込み,35.5313698,139.720978,
神奈川県,川崎市,174,川崎区伊勢町21番,伊勢町第二公園西側植込み (位置情報が見つかりませんでした),35.5323053,139.7231328,
神奈川県,川崎市,175,川崎区川中島1丁目9番9号,masked,35.5322609,139.7253077,
神奈川県,川崎市,176,川崎区川中島2丁目4番19号,川中島小学校東側フェンス,35.5310968,139.7258333,
神奈川県,川崎市,177,川崎区川中島1丁目27番13号,masked,35.5313418,139.7292514,
神奈川県,川崎市,178,川崎区川中島2丁目4番19号,川中島小学校北側フェンス,35.5310968,139.7258333,
神奈川県,川崎市,179,川崎区大師駅前2丁目13番16号,若宮八幡宮東側石塀,35.5349544,139.7249486,
神奈川県,川崎市,180,川崎区大師駅前2丁目6番1,大師西町公園北側鉄柵,35.5346207,139.7242502,
神奈川県,川崎市,181,川崎区台町26番7号,大師支所仮庁舎正面右側フェンス,35.5319622,139.7339802,
神奈川県,川崎市,182,川崎区昭和2丁目15番11号,グランネクスト川崎前歩道植込み,35.5296274,139.7382904,
神奈川県,川崎市,183,川崎区大師公園1番,大師公園南側倉庫脇植込み,35.532883,139.732439,
神奈川県,川崎市,184,川崎区東門前2丁目6番1号,大師小学校西側フェンス,35.5333532,139.7355203,
神奈川県,川崎市,185,川崎区東門前2丁目6番1号,大師小学校北側フェンス,35.5333532,139.7355203,
神奈川県,川崎市,186,川崎区東門前1丁目7番,東門前公園南側鉄柵,35.5363665,139.7325513,
神奈川県,川崎市,187,川崎区大師本町12番12号,masked,35.5360839,139.7307886,
神奈川県,川崎市,188,川崎区大師公園1番,大師公園くじら広場（砂場）前植込み,35.532883,139.732439,
神奈川県,川崎市,189,川崎区中瀬2丁目14番14,中瀬2丁目公園南側フェンス,35.5377289,139.7289593,
神奈川県,川崎市,190,川崎区中瀬3丁目5番,中瀬公園南側植込み,35.5382721,139.7295979,
神奈川県,川崎市,191,川崎区中瀬2丁目9番先,中瀬緑地西側鉄柵,35.5372172,139.7276822,
神奈川県,川崎市,192,川崎区東門前3丁目4番6号,東門前小学校正門右側植込み (位置情報が見つかりませんでした),35.5358279,139.7350508,
神奈川県,川崎市,193,川崎区東門前3丁目4番6号,東門前小学校東側フェンス (位置情報が見つかりませんでした),35.5358279,139.7350508,
神奈川県,川崎市,194,川崎区中瀬3丁目20番20号,ホームズ川崎大師店西側フェンス,35.5377426,139.7331487,
神奈川県,川崎市,195,川崎区東門前3丁目5番1号,masked,35.5366992,139.7350486,
神奈川県,川崎市,196,川崎区中瀬3丁目20番20号,ホームズ川崎大師店東側フェンス,35.5377426,139.7331487,
神奈川県,川崎市,197,川崎区大師河原2丁目1番7号,大師中学校西側フェンス,35.5350312,139.7383188,
神奈川県,川崎市,198,川崎区日ノ出2丁目17番3号,出来野公園北側フェンス,35.5328301,139.7459631,
神奈川県,川崎市,199,川崎区田町2丁目4番14号,田町ふれあい公園南側ガードレール,35.5339669,139.7436989,
神奈川県,川崎市,200,川崎区日ノ出2丁目11番,日ノ出公園北側フェンス,35.5308492,139.7438872,
神奈川県,川崎市,201,川崎区日ノ出1丁目10番1号,三進工業㈱北側ブロック塀,35.5319586,139.7415142,
神奈川県,川崎市,202,川崎区出来野8番,出来野第一公園北側植込み,35.5345513,139.7402148,
神奈川県,川崎市,203,川崎区大師河原2丁目1番7号,大師中学校南側フェンス,35.5350312,139.7383188,
神奈川県,川崎市,204,川崎区出来野1番15号,（有）たいき所有駐車場東側フェンス,35.5328996,139.7396647,
神奈川県,川崎市,205,川崎区四谷上町24番1号,南大師中学校正門右側フェンス,35.5286295,139.737291,
神奈川県,川崎市,206,川崎区四谷上町7番11号,セブンイレブン前歩道植込み,35.5295881,139.7352866,
神奈川県,川崎市,207,川崎区四谷上町29番9,駐車場前歩道植込み,35.5251182,139.7344242,
神奈川県,川崎市,208,川崎区四谷上町22番,四谷上町けやき公園北側フェンス,35.5267814,139.7353451,
神奈川県,川崎市,209,川崎区四谷上町24番1号,南大師中学校南門左側フェンス,35.5286295,139.737291,
神奈川県,川崎市,210,川崎区四谷上町20番8号,masked,35.5260712,139.7336489,
神奈川県,川崎市,211,川崎区四谷上町23番8,四谷上町公園北西側鉄柵,35.5278355,139.7359879,
神奈川県,川崎市,212,川崎区塩浜2丁目15番,北ノ崎公園東側入口鉄柵,35.522791,139.7375803,
神奈川県,川崎市,213,川崎区塩浜2丁目7番10号,塩浜町内会事務所前ブロック塀,35.5235087,139.7399553,
神奈川県,川崎市,214,川崎区四谷下町15番,四谷ゆめ公園東側植込み,35.5253119,139.7383121,
神奈川県,川崎市,215,川崎区四谷下町15番,四谷ゆめ公園北側植込み,35.5253119,139.7383121,
神奈川県,川崎市,216,川崎区四谷下町4番1号,四谷小学校南側フェンス,35.526849,139.7373336,
神奈川県,川崎市,217,川崎区四谷下町4番1号,四谷小学校北側フェンス,35.526849,139.7373336,
神奈川県,川崎市,218,川崎区塩浜1丁目4番,塩浜町公園西側植込み,35.5280288,139.739177,
神奈川県,川崎市,219,川崎区塩浜1丁目11番16号,masked,35.5276223,139.7412134,
神奈川県,川崎市,220,川崎区塩浜1丁目14番14号,Ｋブランシェ塩浜前歩道ガードレール (位置情報が見つかりませんでした),35.5293455,139.7421508,
神奈川県,川崎市,221,川崎区江川1丁目7番,江川ふれあい公園北側石柵,35.5361102,139.7442864,
神奈川県,川崎市,222,川崎区殿町1丁目12番11号,masked,35.5395909,139.7434282,
神奈川県,川崎市,223,川崎区殿町1丁目7番9号,masked,35.5384472,139.7430263,
神奈川県,川崎市,224,川崎区殿町1丁目17番19号,殿町小学校南側フェンス,35.5380142,139.7463723,
神奈川県,川崎市,225,川崎区殿町1丁目18番12号,殿町小学校プール南側フェンス,35.5382054,139.7453943,
神奈川県,川崎市,226,川崎区江川2丁目8番14号,かわさき双輪荘南側フェンス,35.5363509,139.7466817,
神奈川県,川崎市,227,川崎区殿町1丁目20番,殿町１丁目公園西側鉄柵,35.5390487,139.7458832,
神奈川県,川崎市,228,川崎区殿町3丁目2番,殿町第３公園西側フェンス,35.5392661,139.7494762,
神奈川県,川崎市,229,川崎区江川2丁目10番,江川はなみずき公園西側フェンス,35.53599210000001,139.7474002,
神奈川県,川崎市,1,幸区中幸町2丁目17番地,幸町小学校北側 フェンス,35.538322,139.6940026,
神奈川県,川崎市,2,幸区中幸町2丁目17番地,幸町小学校表西門東側 フェンス,35.538322,139.6940026,
神奈川県,川崎市,3,幸区中幸町2丁目17番地,幸町小学校表東門西側 フェンス,35.538322,139.6940026,
神奈川県,川崎市,4,幸区幸町2丁目567番地,多摩川見晴らし公園 植込み,35.537991,139.6992652,
神奈川県,川崎市,5,幸区幸町3丁目9番地,幸町公園東側 フェンス,35.5366122,139.6971303,
神奈川県,川崎市,6,幸区幸町4丁目6番地,masked,35.5357243,139.6969308,
神奈川県,川崎市,7,幸区幸町1丁目773番地,ディアフォルム幸町 フェンス,35.5355695,139.6895421,緯度経度は怪しい
神奈川県,川崎市,8,幸区幸町1丁目750番地1,ソリッドスクエア 植込み,35.5355695,139.6895421,緯度経度は怪しい
神奈川県,川崎市,9,幸区幸町1丁目776,堀川町公園 植込み (位置情報が見つかりませんでした),35.5344579,139.698344,
神奈川県,川崎市,10,幸区中幸町3丁目26番地1,フロール川崎中幸町 フェンス,35.532922,139.6937056,
神奈川県,川崎市,11,幸区中幸町4丁目31番地,南河原中学校東側 フェンス,35.5333046,139.6929875,
