prefecture,city,number,address,name,lat,long
神奈川県,鎌倉市,256,岡本1100番地,玉縄中学校正門横フェンス,35.347687,139.519745
神奈川県,鎌倉市,257,植木135番地1,玉縄幼稚園・龍寶寺駐車場フェンス,35.350594,139.518417
神奈川県,鎌倉市,258,植木598番地5,相模陣あひる公園胎転落防止柵,35.348469,139.514694
神奈川県,鎌倉市,259,岡本1324番地,masked,35.344467,139.517517
神奈川県,鎌倉市,260,岡本1500番地,岡本外耕地公園,35.344467,139.517517
神奈川県,鎌倉市,261,植木624-1,相模陣あんず公園,35.348209,139.516022
神奈川県,鎌倉市,262,植木676番地1,グリーンズ湘南・鎌倉塀,35.347492,139.512085
神奈川県,鎌倉市,263,岡本1500番地29,岡本むくげ公園柵,35.344467,139.517517
神奈川県,鎌倉市,264,岡本1500番地30,岡本けやき公園柵,35.344467,139.517517
神奈川県,鎌倉市,265,玉縄一丁目860番地,玉縄小学校フェンス,35.351021,139.523438
神奈川県,鎌倉市,266,台一丁目2番,柏尾川転落防止柵,35.328094,139.897125
神奈川県,鎌倉市,267,台一丁目2番25号,台調整池管理棟植込み,35.351215,139.529449
神奈川県,鎌倉市,268,玉縄一丁目4番地,たまなわ児童遊園フェンス,35.352116,139.523987
神奈川県,鎌倉市,269,玉縄一丁目860番地,玉縄小学校体育館横フェンス,35.351021,139.523438
神奈川県,鎌倉市,270,玉縄一丁目14番地6,やまかストアー玉縄店フェンス,35.349979,139.522049
神奈川県,鎌倉市,271,岡本二丁目16番3号,玉縄行政センター前,35.621971,139.615326
神奈川県,鎌倉市,272,岡本一丁目120番地65,戸部みつばち公園フェンス,33.540588,130.450867
神奈川県,鎌倉市,273,玉縄二丁目13番地1,城山児童遊園フェンス,35.357613,139.520889
神奈川県,鎌倉市,274,玉縄二丁目7番地,やと池児童遊園フェンス,35.356419,139.523651
神奈川県,鎌倉市,275,玉縄一丁目2番地1,玉縄青少年会館フェンス,35.35355,139.524216
神奈川県,鎌倉市,276,玉縄五丁目21番地1,玉縄1－2号緑地フェンス,35.359348,139.521286
神奈川県,鎌倉市,277,玉縄五丁目26番地,山百合児童遊園フェンス,35.360973,139.521545
神奈川県,鎌倉市,278,玉縄五丁目9番地1,玉縄すこやかセンター柵,35.359154,139.519974
神奈川県,鎌倉市,279,城廻396番地,masked,35.355293,139.510056
神奈川県,鎌倉市,280,城廻516番地3,関谷中継室フェンス,35.356998,139.506989
神奈川県,鎌倉市,281,城廻100番地77,打越東公園フェンス,35.356525,139.511368
神奈川県,鎌倉市,282,関谷468番地1,関谷小学校正門脇フェンス,35.360764,139.512741
神奈川県,鎌倉市,283,関谷351番地27,下坪かえる公園脇,35.35961985,139.5177626
神奈川県,鎌倉市,284,城廻481番地3,中村公園フェンス,35.355789,139.505417
神奈川県,鎌倉市,285,関谷633番地22,石原谷戸とび公園脇,35.361504,139.509735
